"screen_name","id","from_name","date","datetime","message","type","link","domain","likes_count","comments_count","shares_count","love_count","haha_count","wow_count","sad_count","angry_count"
"congressmanpittenger","376142742468386_1199712706778048","Congressman Robert Pittenger","2017-01-03","2017-01-03 11:30:00","My top priorities for 2017 include health care reform and tax reform.  Recently, I sat down with TWC News NC to discuss our House Republican plan to repeal and replace Obamacare, as well as my expectations for working with President-elect Trump in a unified Republican government.","video","https://www.facebook.com/CongressmanPittenger/videos/1199712706778048/",NA,19,13,0,0,0,0,0,0
"congressmanpittenger","376142742468386_1199738493442136","Congressman Robert Pittenger","2017-01-04","2017-01-04 11:30:00","Liberal media outlets went into a frenzy when President-elect Trump dared take a phone call from the President of Taiwan.  Do they think America's actions should be dictated by China?  Have they ignored China's increasingly aggressive behavior?  Recently, TWC News NC asked me about the ""controversial"" phone call, as well as my thoughts on immigration reform.","video","https://www.facebook.com/CongressmanPittenger/videos/1199738493442136/",NA,14,7,0,0,0,0,0,0
"congressmanpittenger","376142742468386_1199807756768543","Congressman Robert Pittenger","2017-01-03","2017-01-03 00:14:20","Happy New Year!  Tonight I'm back in Washington, receiving my first briefing of 2017 and preparing to be sworn in for my third term on Tuesday.","photo","https://www.facebook.com/CongressmanPittenger/photos/a.406945429388117.95715.376142742468386/1199807756768543/?type=3",NA,112,20,2,2,0,0,0,0
"congressmanpittenger","376142742468386_1200476783368307","Congressman Robert Pittenger","2017-01-03","2017-01-03 22:22:36","This afternoon, I was sworn in for my third term.  My number one priority is providing outstanding constituent service.  My expert staff helped nearly 3,000 local residents cut through federal red tape last term, and we are excited to now serve all of Union, Anson, Richmond, Scotland, Robeson, Bladen, and Cumberland (as well as continuing with our friends in south Charlotte, Matthews, and Mint Hill) as part of the new 9th Congressional District.  In Washington, my priorities are health care reform, tax reform, rolling back unnecessary regulations which have killed job growth, and strengthening our efforts to defeat radical Islamic terrorism.","photo","https://www.facebook.com/CongressmanPittenger/photos/a.406945429388117.95715.376142742468386/1200476783368307/?type=3",NA,104,13,7,3,0,0,1,0
"congressmanpittenger","376142742468386_1200989263317059","Congressman Robert Pittenger","2017-01-04","2017-01-04 16:06:07","WE'VE MOVED!  My Charlotte regional office has moved to 5970 Fairview Rd., Suite 430, between Park South Dr. and Piedmont Row.  Our new office is easier to find, offers better parking, and provides more functional space for meetings with constituents.  My Charlotte phone number remains 704-362-1060.  You're welcome to stop by and say ""hey!""","photo","https://www.facebook.com/CongressmanPittenger/photos/a.406945429388117.95715.376142742468386/1200989263317059/?type=3",NA,23,5,7,2,0,0,0,0
"congressmanpittenger","376142742468386_1201224329960219","Congressman Robert Pittenger","2017-01-04","2017-01-04 22:42:17","Right now, I'm preparing for my 6 p.m. interview with MSNBC Ayman Mohyeldin to discuss House Republican plans to repeal and replace Obamacare.  Join us for the conversation!","photo","https://www.facebook.com/CongressmanPittenger/photos/a.406945429388117.95715.376142742468386/1201224329960219/?type=3",NA,43,23,2,0,0,0,0,0
"congressmanpittenger","376142742468386_1201771169905535","Congressman Robert Pittenger","2017-01-05","2017-01-05 16:11:43","Last night, MSNBC asked if I was ""at all concerned"" by Democrats saying they're not going to help Republicans come up with an alternative for Obamacare.  Frankly, we don't want their help!  The Democrats ""help"" is socialized medicine, where the federal government dictates and every American is forced into a ""one size fits all"" plan.  The American people want choices, and House Republicans are working to replace Obamacare with truly affordable health care based on freedom of choice.","video","https://www.facebook.com/CongressmanPittenger/videos/1201771169905535/",NA,53,19,3,3,0,0,0,1
"congressmanpittenger","376142742468386_1201796123236373","Congressman Robert Pittenger","2017-01-05","2017-01-05 21:00:00","HELLO UNION COUNTY!  My new Monroe Regional Office is now open in beautiful downtown Monroe at 100 West Jefferson St., Suite 1A, directly across the street from the Old Union County Courthouse.  We are located in Old City Hall, and I've assigned two staff members with a combined 20 years of experience to assist local residents with issues involving federal red tape.  Regular office hours will be Monday through Thursday, though you may want to call ahead, as staff will on occasion be out of the office at community meetings.  My Monroe phone number is 704-917-9573.  We hope you come visit! Union County NC Chamber of Commerce Union County Sheriff's Office, Monroe, NC Monroe, North Carolina Monroe NC Historic Neighborhoods","photo","https://www.facebook.com/CongressmanPittenger/photos/a.406945429388117.95715.376142742468386/1201796123236373/?type=3",NA,27,2,8,1,0,0,0,0
"congressmanpittenger","376142742468386_1205109779571674","Congressman Robert Pittenger","2017-01-09","2017-01-09 22:43:41","No Governor of North Carolina has the legal authority to submit a Medicaid expansion plan to the federal government . . . but that doesn't seem to matter to Governor Cooper.  Today, Congressman Richard Hudson and I wrote the Centers for Medicare & Medicaid Services to alert them to North Carolina law and urge them to reject Governor Cooper's proposed Obamacare expansion.  Our letter was co-signed by seven additional Members of Congress, and you can read it here:  http://bit.ly/2j1jlCD","photo","https://www.facebook.com/CongressmanPittenger/photos/a.406945429388117.95715.376142742468386/1205109779571674/?type=3",NA,128,25,67,5,0,0,0,2
"congressmanpittenger","376142742468386_1205731002842885","Congressman Robert Pittenger","2017-01-10","2017-01-10 19:39:52","HELLO FAYETTEVILLE!  My Fayetteville Regional Office is now open at 225 Ray Ave., Suite 100, in the Economic & Business Development Office near Festival Park.  This is a temporary location until flood damage is repaired at the Post Office building.  My Fayetteville phone number is 910-303-0669.  My staff and I are committed to serving you, including assistance with issues involving Social Security, Medicare, Medicaid, IRS, passports, small business, USDA, FEMA, and other federal agencies.  We hope to see you soon!  Fayetteville, North Carolina Downtown Fayetteville The Fayetteville Observer Fayetteville VA Medical Center Fayetteville Technical Community College Fayetteville State University Fayetteville Police Department","photo","https://www.facebook.com/CongressmanPittenger/photos/a.406945429388117.95715.376142742468386/1205731002842885/?type=3",NA,9,1,6,0,0,0,0,0
"congressmanpittenger","376142742468386_1206411052774880","Congressman Robert Pittenger","2017-01-11","2017-01-11 17:25:05","My team and I are committed to serving Rockingham and Richmond County.  We are excited to announce regular, weekly office hours, each Wednesday from 9:30 a.m. through noon at Rockingham City Hall.  Need help with Social Security, Medicare, Medicaid, Veterans benefits, IRS, passports, USDA, and other federal agencies?  Stop by on Wednesday mornings, or call 704-917-9573 anytime and we'll make more convenient arrangements.    Richmond County Chamber of Commerce Richmond County, NC","photo","https://www.facebook.com/CongressmanPittenger/photos/a.406945429388117.95715.376142742468386/1206411052774880/?type=3",NA,10,1,1,0,0,0,0,0
"congressmanpittenger","376142742468386_1206423426106976","Congressman Robert Pittenger","2017-01-12","2017-01-12 11:30:00","Officer Dean Lauber of Charlotte-Mecklenburg Police Department is an outstanding example of the brave, dedicated, and servant-hearted law enforcement officers who sacrificially serve and protect our communities every day.  Thank you, Officer Lauber, for going above and beyond the call of duty, and thank you to all the law enforcement officers of North Carolina's 9th Congressional District for your outstanding work.","link","http://www.charlotteobserver.com/news/local/article125818294.html","charlotteobserver.com",33,1,2,1,0,0,0,0
"congressmanpittenger","376142742468386_1206646476084671","Congressman Robert Pittenger","2017-01-11","2017-01-11 23:07:43","Americans are tired of big government, one-size-fits-all policies killing jobs, limiting our health care choices, and weakening our national defense.  To help develop common sense legislative solutions to these issues, Representative Mark Walker has appointed me to another term on the Steering Committee of the conservative Republican Study Committee, where we will develop solutions to reform health care, support job growth, and restore fiscal sanity in Washington.","link","http://pittenger.house.gov/media-center/press-releases/pittenger-re-appointed-to-conservative-leadership-committee","pittenger.house.gov",25,12,2,0,0,0,0,1
"congressmanpittenger","376142742468386_1207353249347327","Congressman Robert Pittenger","2017-01-12","2017-01-12 18:30:50","In November, the American people spoke loud and clear in favor of a new direction for our country.  My House Republicans colleagues and I have been preparing, and we are ready to deliver on a pro-growth, America-first agenda in the first 100 days, including repealing and replacing Obamacare, defunding Planned Parenthood, making the tax code simpler and fairer for all Americans, and strengthening efforts to defeat radical Islamic terrorism.  Recently, The Richmond County Daily Journal published my op-ed on ""A Historically Productive First 100 Days.""  Click the link below to read more.","link","http://yourdailyjournal.com/opinion/columns/59476/a-historically-productive-first-100-days","yourdailyjournal.com",24,19,1,0,0,0,0,3
"congressmanpittenger","376142742468386_1211357022280283","Congressman Robert Pittenger","2017-01-17","2017-01-17 14:17:03","Currently in the studio WIXE The Mighty 93.1FM and 1190AM! I'll be out and about all across the district today, so stay tuned for more updates!","photo","https://www.facebook.com/CongressmanPittenger/photos/a.406945429388117.95715.376142742468386/1211357022280283/?type=3",NA,16,0,0,0,0,0,0,0
"congressmanpittenger","376142742468386_1211385528944099","Congressman Robert Pittenger","2017-01-17","2017-01-17 15:12:40","Just arrived at our new office in downtown Monroe, across the street from the Old Union County Courthouse. Stop by and see us 100 West Jefferson St., Suite 1A or give us a call at 704-917-9573!","photo","https://www.facebook.com/CongressmanPittenger/photos/a.406945429388117.95715.376142742468386/1211385528944099/?type=3",NA,18,2,0,0,0,0,0,0
"congressmanpittenger","376142742468386_1211425892273396","Congressman Robert Pittenger","2017-01-17","2017-01-17 16:28:09","Just wrapped up a meeting with the Union County Weekly at our new Monroe office. Next stop Rockingham!","photo","https://www.facebook.com/CongressmanPittenger/photos/a.406945429388117.95715.376142742468386/1211425892273396/?type=3",NA,3,0,4,0,0,0,0,0
"congressmanpittenger","376142742468386_1211499898932662","Congressman Robert Pittenger","2017-01-17","2017-01-17 18:18:56","Earlier today I joined WIXE The Mighty 93.1FM and 1190AM for a substantive discussion on the incoming Trump Administration and our priorities for the 115th Congress.   Click the link below to listen:","video","https://www.youtube.com/watch?v=a6co_wGc7i4&feature=youtu.be",NA,5,3,0,0,0,0,0,0
"congressmanpittenger","376142742468386_1211510262264959","Congressman Robert Pittenger","2017-01-17","2017-01-17 21:30:00","With Terry Ward at the legendary WAYN in Rockingham, recording interview that will air tomorrow at 8:10 AM. Be sure to tune in!","photo","https://www.facebook.com/CongressmanPittenger/photos/a.406945429388117.95715.376142742468386/1211510262264959/?type=3",NA,5,1,0,0,0,0,0,0
"congressmanpittenger","376142742468386_1211558685593450","Congressman Robert Pittenger","2017-01-17","2017-01-17 19:59:52","On live with Sandy Callan on WLNC 95.1 in Laurinburg. Tune in now to listen!","photo","https://www.facebook.com/CongressmanPittenger/photos/a.406945429388117.95715.376142742468386/1211558685593450/?type=3",NA,5,4,4,0,0,0,0,0
"congressmanpittenger","376142742468386_1212205075528811","Congressman Robert Pittenger","2017-01-18","2017-01-18 15:16:45","And the District tour continues today, currently meeting with The Fayetteville Observer","photo","https://www.facebook.com/CongressmanPittenger/photos/a.406945429388117.95715.376142742468386/1212205075528811/?type=3",NA,3,0,0,0,0,0,0,0
"congressmanpittenger","376142742468386_1213286905420628","Congressman Robert Pittenger","2017-01-19","2017-01-19 17:36:44","The Democrat boycott of President Trump's inauguration is disingenuous.  They are looking for excuses instead of looking inward at the failed policies rejected by the American people.  This morning, I joined TWC News NC to discuss the boycott.  My interview airs every hour through 4:30 p.m.","photo","https://www.facebook.com/CongressmanPittenger/photos/a.406945429388117.95715.376142742468386/1213286905420628/?type=3",NA,14,6,3,0,0,0,0,4
"congressmanpittenger","376142742468386_1213359675413351","Congressman Robert Pittenger","2017-01-20","2017-01-20 01:00:01","On your way to work tomorrow, catch my interview with WBT Bo Thompson scheduled to air Friday at 7:50 a.m.  We discussed the inauguration of President Donald Trump and my disappointment in Democrats skipping out on one of the hallmarks of our democracy.","photo","https://www.facebook.com/CongressmanPittenger/photos/a.406945429388117.95715.376142742468386/1213359675413351/?type=3",NA,5,6,0,0,0,0,0,0
"congressmanpittenger","376142742468386_1213368278745824","Congressman Robert Pittenger","2017-01-20","2017-01-20 11:00:00","Today we inaugurate the 45th President of the United States.  Many Democrats will miss out, choosing to boycott and politicize this glorious display of freedom, liberty, and opportunity.  To be there for this peaceful transfer of power is so special, and is a great moment for America.  Yesterday, I spoke with TWC News NC about my hopes for President Trump and his inaugural address.  Click below to watch.","video","https://www.facebook.com/CongressmanPittenger/videos/1213368278745824/",NA,23,6,0,0,0,0,0,2
"congressmanpittenger","376142742468386_1213403012075684","Congressman Robert Pittenger","2017-01-19","2017-01-19 21:08:00","Today I was honored to welcome Sgt. Michael and Sarah Verardo to Washington for the inauguration.  The freedom to vote and the peaceful transfer of power is due to the sacrifices of warriors like Sgt. Verardo, who lost his left leg in Afghanistan.  Michael and Sarah continue to advocate on behalf of Wounded Warriors, for which we are deeply grateful.","photo","https://www.facebook.com/CongressmanPittenger/photos/a.406945429388117.95715.376142742468386/1213403012075684/?type=3",NA,51,1,2,4,0,0,0,0
"congressmanpittenger","376142742468386_1213411182074867","Congressman Robert Pittenger","2017-01-21","2017-01-21 21:00:01","One of the great privileges of my life is knowing and learning from David Chadwick of Forest Hill South Park.  Tomorrow morning, I'll join Dr. Chadwick on WBT to discuss the inauguration, my expectations for President Trump's first 100 days, and my efforts to repeal and replace Obamacare, jump start the economy, and protect Americans from radical Islamist terrorism.  Join us on 1110 AM/99.3 FM WBT on Sunday morning from 8-9 a.m.","photo","https://www.facebook.com/CongressmanPittenger/photos/a.406945429388117.95715.376142742468386/1213411182074867/?type=3",NA,12,14,0,0,0,0,1,0
"congressmanpittenger","376142742468386_1213427525406566","Congressman Robert Pittenger","2017-01-21","2017-01-21 12:00:36","Hey Wadesboro, North Carolina!  On Wednesday, I enjoyed a visit to downtown and stopped by the Anson Record for an interview that will run in Wednesday's paper.  We are in the process of finalizing regular Congressional office hours for Anson County, and will have details to announce soon.","photo","https://www.facebook.com/CongressmanPittenger/photos/a.406945429388117.95715.376142742468386/1213427525406566/?type=3",NA,9,4,1,0,0,0,0,0
"congressmanpittenger","376142742468386_1213437012072284","Congressman Robert Pittenger","2017-01-22","2017-01-22 13:02:18","Too many Americans get log-jammed with federal bureaucracy.  If you live in North Carolina's 9th Congressional District, my team and I are available to help you cut through red tape.  Learn more about my constituent service and my commitment to serving every community in the 9th District in this article from the The Richmond County Daily Journal.","link","https://yourdailyjournal.com/news/60687/rep-pittenger-visits-rockingham-introduces-staffer","yourdailyjournal.com",16,6,1,0,0,0,0,0
"congressmanpittenger","376142742468386_1213879442028041","Congressman Robert Pittenger","2017-01-20","2017-01-20 13:42:26","My office has a limited amount of unclaimed Inauguration Tickets. If you are a constituent of the 9th District in Washington D.C. for the celebration please call our office at 202-225-1976 if you would like to pick up a ticket this morning before events kicks off. We will accommodate as many requests as possible on a first come first serve basis.","status",NA,NA,24,13,8,2,13,0,0,0
"congressmanpittenger","376142742468386_1213948442021141","Congressman Robert Pittenger","2017-01-20","2017-01-20 15:45:02","We are on our way to the Inaugural platform to witness another peaceful transfer of power!  Regrettably, this is not the norm in many parts of the world.  In fact, at this moment in Gambia, peacekeeping troops are advancing toward the capital to remove the former president, who will not cede power to Gambia's democratically elected president.  We are so blessed to live in America.  Please don't forget that.","photo","https://www.facebook.com/CongressmanPittenger/photos/a.406945429388117.95715.376142742468386/1213948442021141/?type=3",NA,78,20,7,4,0,0,0,0
"congressmanpittenger","376142742468386_1214030332012952","Congressman Robert Pittenger","2017-01-20","2017-01-20 17:48:52","Today we celebrated another peaceful transfer of power.  Regrettably, this is not the norm in much of the world.  Right now in Gambia, peacekeeping troops are advancing on the capital to forcibly remove the previous president who will not cede power to Gambia’s democratically elected leader.  Tens of thousands have fled for safety.  We are so blessed to live in these United States.  Today we celebrated the inauguration of the 45th President in our Constitutional Republic.  Yes, views are starkly different within our nation, yet I believe we will experience a sea change to restore freedom and remove the burden of big government, which has yielded the weakest economic recovery since World War Two.  May we all work, hope, and pray for the best for all Americans, and may God continue to bless our great nation.","photo","https://www.facebook.com/CongressmanPittenger/photos/a.406945429388117.95715.376142742468386/1214030332012952/?type=3",NA,85,5,7,6,0,0,0,0
"congressmanpittenger","376142742468386_1214855501930435","Congressman Robert Pittenger","2017-01-21","2017-01-21 15:51:14","Had a great time taking students from Providence High School (North Carolina) Charlotte-Mecklenburg Schools on a tour of the Capitol this morning. We even had a chance to take in the view from the Presidential Inauguration stage!","photo","https://www.facebook.com/CongressmanPittenger/photos/a.509595992456393.1073741835.376142742468386/1214853751930610/?type=3",NA,47,2,2,0,0,1,0,0
"congressmanpittenger","376142742468386_1217066691709316","Congressman Robert Pittenger","2017-01-23","2017-01-23 21:04:11","Did you suffer property damage due to Hurricane Matthew?  Today is the filing deadline for FEMA applications related to Hurricane Matthew physical property damage.  If you still need assistance, please contact my office at 704-362-1060.  (The filing deadline for ""economic injury"" related to Hurricane Matthew is July 10th).","photo","https://www.facebook.com/CongressmanPittenger/photos/a.406945429388117.95715.376142742468386/1217066691709316/?type=3",NA,1,0,2,0,0,0,0,0
"congressmanpittenger","376142742468386_1217885178294134","Congressman Robert Pittenger","2017-01-24","2017-01-24 14:54:45","Laurinburg, North Carolina is such a beautiful town, and today, I am honored to launch regular Congressional office hours at the Scotland County Economic Development Office (16800-A U.S. Highway 401 Bypass).  Staff will be available every other Tuesday from 9 a.m. through noon to assist with Social Security, Medicare, Medicaid, Veterans benefits, FEMA, agriculture, small business, passports, and whatever other federal red tape you need help with.  Questions?  Call us at 910-303-0669.  The Laurinburg Exchange Laurinburg After Five WLNC AM 1300 Scotland County NC. Republican Party Scotland County Schools Scotland County, NC","photo","https://www.facebook.com/CongressmanPittenger/photos/a.406945429388117.95715.376142742468386/1217885178294134/?type=3",NA,4,1,2,0,0,0,0,0
"congressmanpittenger","376142742468386_1217961938286458","Congressman Robert Pittenger","2017-01-25","2017-01-25 11:30:01","There is one word which characterizes President Trump and his Administration:  results.  President Trump is a businessman.  He will take all the flak if at the end of the day, he has delivered results by improving our economy and securing America.  Hear more of my thoughts on President Trump in my recent interview with Bo Thompson on WBT.","link","http://wbt.com/bo-talks-congressman-pittenger-attending-trumps-inauguration/","bt.com",34,24,0,2,0,0,1,4
"congressmanpittenger","376142742468386_1218015224947796","Congressman Robert Pittenger","2017-01-24","2017-01-24 18:07:58","Ruth Samuelson infused her faith in God in all aspects of her family, political, personal, and civic life.  Because of her vibrant faith and commitment to focusing on what truly matters, Ruth was known as a thoughtful mediator throughout her tenure in the North Carolina House . . . someone who approached tense partisan issues with grace, yet never backed away from her convictions.   Today, I addressed the U.S. House of Representatives in memory of Ruth Samuelson.  Click below to watch the speech.","video","https://www.facebook.com/CongressmanPittenger/videos/1218015224947796/",NA,127,3,54,14,0,0,9,0
"congressmanpittenger","376142742468386_1218214474927871","Congressman Robert Pittenger","2017-01-24","2017-01-24 22:16:44","The 1975 Hyde Amendment prohibits taxpayer funding for abortion and is estimated to have saved 2 million lives.  However, Obamacare ignores the Hyde Amendment and uses your tax dollars to subsidize insurance policies which offer abortion services.  Today, I helped pass the No Taxpayer Funding for Abortion Act (H.R. 7), which will make the Hyde Amendment government-wide policy and ensure future federal programs don't support abortion.  As an original co-sponsor of this legislation, I was honored to work with Congressman Chris Smith to introduce this bill and urge our colleagues to vote yes.  Earlier today, I spoke during formal House debate in support of H.R. 7.  Click below to watch.","video","https://www.facebook.com/CongressmanPittenger/videos/1218214474927871/",NA,104,29,24,13,0,1,0,7
"congressmanpittenger","376142742468386_1219388064810512","Congressman Robert Pittenger","2017-01-25","2017-01-25 19:31:22","Apparently, the past eight years were not long enough for the Obama Administration to waste taxpayer dollars and promote failed Middle East policies.  In the final hours of his Administration, President Obama felt compelled to continue his rudderless foreign policies by sending over $200 million to Palestine.  We should recognize that a substantial amount of this funding will likely end up supporting violence and other terrorist efforts by Hamas.  While I am disappointed by his decision, I am grateful that we are moving forward with a new Administration that will dramatically improve America’s strategic posture around the globe.","link","http://www.foxnews.com/politics/2017/01/25/state-department-reviewing-obama-admins-last-minute-decision-to-send-palestinians-221m.html","foxnews.com",44,20,7,0,0,2,1,18
"congressmanpittenger","376142742468386_1221474404601878","Congressman Robert Pittenger","2017-01-27","2017-01-27 20:39:31","Little babies should not be discarded at the whim of someone who does not value another person's life.  Today at The March for Life, I was inspired by meeting a group of 60 students from Charlotte Christian School who traveled to Washington to stand for life.  During our conversation, I explained that the moral clarity of protecting human life will be significantly advanced with our pro-life Republican Congress, President Trump, and the majority sentiment of the American people to not provide taxpayer funding for abortions.","photo","https://www.facebook.com/CongressmanPittenger/photos/a.406945429388117.95715.376142742468386/1221474404601878/?type=3",NA,188,27,35,16,0,1,0,2
