"screen_name","id","from_name","date","datetime","message","type","link","domain","likes_count","comments_count","shares_count","love_count","haha_count","wow_count","sad_count","angry_count"
"CongressmanJodyHice","651078621667264_1126290347479420","Congressman Jody Hice","2017-03-23","2017-03-23 15:39:38","It is vitally important that we have someone with experience and know-how at the helm of the Department of Agriculture. Sonny Perdue has that expertise to lead the way. #gapol","video","https://www.facebook.com/FoxBusiness/videos/10155189116135238/",NA,31,6,0,0,0,0,0,1
"CongressmanJodyHice","651078621667264_1126518590789929","Congressman Jody Hice","2017-03-23","2017-03-23 22:07:59","Wishing everyone a happy National Puppy Day! Meet my favorite pup, Reagan. Thanks for being a man’s best friend!","photo","https://www.facebook.com/CongressmanJodyHice/photos/a.657903340984792.1073741828.651078621667264/1126518590789929/?type=3",NA,201,29,3,19,0,0,0,0
"CongressmanJodyHice","651078621667264_1127151640726624","Congressman Jody Hice","2017-03-24","2017-03-24 17:29:36","My offices are experiencing a higher than normal volume of calls, but I still want to hear from you! Please email me your thoughts: https://hice.house.gov/contact/","link","https://hice.house.gov/contact/","hice.house.gov",87,216,14,3,0,0,0,2
"CongressmanJodyHice","651078621667264_1129110333864088","Congressman Jody Hice","2017-03-26","2017-03-26 23:05:45","Today is a sad day for Georgia. Rest In Peace, Jon Richards. You will be sorely missed, friend. Lifting the Richards family up in prayer.","link","http://bit.ly/2nU4JHt","bit.ly",25,4,1,3,0,0,18,0
"CongressmanJodyHice","651078621667264_1130547370387051","Congressman Jody Hice","2017-03-28","2017-03-28 13:05:49","In coordination with Senators Johnny Isakson and David Perdue and the Georgia Congressional Delegation, I would like to invite 10th District students to a statewide Military Academy Day to familiarize themselves with the application and nomination process. This event, which is the largest in the Nation of its kind, will take place on Saturday, April 29, 2017, from 10:00-11:30 AM at Dobbins Air Reserve Base located at 1408 Dobbins Place, Marietta, GA 30069. Guests should arrive as early as 9:00 AM to clear security and to visit information tables.  Representatives from all five service academies will give presentations regarding their requirements and expectations for admittance. I encourage all students in grades 8 – 12 who are interested in attending one of America’s service academies to come to this free event. To learn more and register, please click on the link below.","link","http://hice.house.gov/news/documentsingle.aspx?DocumentID=1189","hice.house.gov",37,3,3,0,0,0,0,0
"CongressmanJodyHice","651078621667264_1130797303695391","Congressman Jody Hice","2017-03-28","2017-03-28 19:48:29","The damaging energy mandates from the last eight years have hindered America’s energy independence for far too long. President Trump’s new executive order is the first step toward eradicating regulatory barriers while delivering an all-of-the-above energy strategy that stimulates innovation, development, and security.   It is vital to our national and fiscal security that we restore economic freedom by utilizing cutting edge technology to unleash affordable, reliable, and clean supplies of energy. I applaud President Trump for his dedication to prioritizing energy independence and a bustling economy for the benefit of all Americans.","status",NA,NA,101,66,9,5,0,1,7,20
"CongressmanJodyHice","651078621667264_1130842697024185","Congressman Jody Hice","2017-03-28","2017-03-28 21:37:00","Far too often, sanctuary city policies needlessly jeopardize public safety by refusing to cooperate with federal immigration authorities. As a compassionate Nation, we welcome those who would wish to come to our great Nation – as long as they do so legally. Yesterday, Attorney General Sessions and the Trump Administration took major strides toward enforcing the law of the land and protecting American communities.   By stripping federal funding from cities that refuse to comply with the rule of law, we reject their policy of furthering illegal activity. Now more than ever before, it is important that we enforce our immigration laws and prioritize the safety and security of Americans. I fully support Attorney General Sessions and the Trump administration in their efforts to protect our borders and put an end to sanctuary cities.  Simply put, while we are a Nation of immigrants, we are also a Nation of laws.","link","http://www.foxnews.com/politics/2017/03/27/sessions-takes-aim-at-dangerous-sanctuary-cities-warns-on-funding.html","foxnews.com",89,24,5,9,0,2,0,4
"CongressmanJodyHice","651078621667264_1131366436971811","Congressman Jody Hice","2017-03-29","2017-03-29 14:33:11","The deadline for an exciting opportunity for students is right around the corner so be sure to not miss out!   The 2017 Congressional Art Competition is a nationwide competition which gives students in grades 9 – 12 the chance to compete for the honor of having their artwork displayed in our Nation’s Capitol for one year. The winner will also be awarded a trip to Washington, D.C. to attend a reception honoring other student winners from across the Nation.  For complete details on this year's competition, including information about how to submit a piece of artwork, please click on the link below!   If you know any students that might be interested in participating in this year's competition, please share details with them! All entries must be submitted to one of my District offices by Thursday, April 6th.","link","http://hice.house.gov/constituent-services/arts-competition.htm","hice.house.gov",6,2,0,0,0,0,0,0
"CongressmanJodyHice","651078621667264_1131594360282352","Congressman Jody Hice","2017-03-29","2017-03-29 21:27:32","Today, hundreds of Georgians will come together with a heavy heart to celebrate the life and legacy of Jon Richards. He was a Georgia treasure, brilliant political journalist, and selfless mentor. I pray and grieve for the family and friends of Jon during this incredibly difficult time.  For those who didn't know him, Jon grew up in Cincinnati, Ohio and later moved to Lawrenceville, Georgia where he became active in various Gwinnett County civic, social, and political organizations. He was well-respected on both sides of the political aisle, serving with endless passion as editor-in-chief of GeorgiaPol.com. Most notably, however, it was Jon’s devotion to mentoring high school and college students interested in politics that left a lasting impact on society.   Jon was known by the Gwinnett community as someone who lived life to its fullest and made the most of every day. His leadership was unmatched and cannot be overstated.   Until we meet again, my friend, may God hold you in the palm of His hands. Please join me by taking a moment of silence to honor the life and legacy of Jon Richards, a man who will be sorely missed by so many.","photo","https://www.facebook.com/CongressmanJodyHice/photos/a.657903340984792.1073741828.651078621667264/1131594360282352/?type=3",NA,34,2,0,1,0,0,6,0
"CongressmanJodyHice","651078621667264_1132163403558781","Congressman Jody Hice","2017-03-30","2017-03-30 14:24:58","Great meeting with folks from the Georgia Association of Elementary and Middle School Principals, Georgia 4-H, Alzheimer’s Association, Georgia Life Alliance Lawyers, MG John Morrison, Commanding General of the Cyber Center of Excellence at Fort Gordon, UGA College Republicans, and the National Association of Community Health Centers this week.   No matter the issue, my doors in Washington and my District offices are always open to meet with organizations and constituents.","photo","https://www.facebook.com/CongressmanJodyHice/photos/a.657903340984792.1073741828.651078621667264/1132153303559791/?type=3",NA,37,8,2,0,0,0,0,0
"CongressmanJodyHice","651078621667264_1132236780218110","Congressman Jody Hice","2017-03-30","2017-03-30 16:21:41","I honored Jon Richards, a Georgia treasure and brilliant political journalist, on the House Floor this morning. You are sorely missed, my friend. I’m grateful to know that, through Christ, we will be able to meet again. #gapol","video","https://www.facebook.com/CongressmanJodyHice/videos/1132236780218110/",NA,60,5,7,1,0,0,0,0
"CongressmanJodyHice","651078621667264_1133229226785532","Congressman Jody Hice","2017-03-31","2017-03-31 17:18:49","Friends, if you are traveling into Atlanta, please be safe and plan your route accordingly to avoid the I-85 bridge collapse area.  I want to thank our first responders, law enforcement officers, and Governor Deal for swiftly addressing this situation.","link","http://www.dot.ga.gov/AboutGeorgia/Pages/GDOTAnnouncementDetails.aspx?postID=153","dot.ga.gov",78,13,22,0,0,0,0,0
"CongressmanJodyHice","651078621667264_1136378773137244","Congressman Jody Hice","2017-04-03","2017-04-03 18:31:12","BASEBALL IS BACK! Celebrating #OpeningDay by cheering on the Atlanta Braves from Washington! #ChopOn #GoBraves","photo","https://www.facebook.com/CongressmanJodyHice/photos/a.657903340984792.1073741828.651078621667264/1136378773137244/?type=3",NA,71,4,0,2,0,0,0,1
"CongressmanJodyHice","651078621667264_1137123099729478","Congressman Jody Hice","2017-04-04","2017-04-04 14:39:58","Tonight, Tuesday, April 4, 2017, I’ll be hosting a Telephone Town Hall at approximately 6:15 p.m. These forums are a modern way to bring a town hall directly to the homes of my constituents, where we can discuss issues facing Congress, including health care, the economy, and taxes. I value the opportunity to hear from 10th District residents, and I look forward to speaking with many of you this evening. To RSVP, please click on the link below.","link","https://hice.house.gov/forms/form/?ID=9","hice.house.gov",23,21,4,1,0,0,0,1
"CongressmanJodyHice","651078621667264_1137415019700286","Congressman Jody Hice","2017-04-04","2017-04-04 20:56:28",NA,"video","https://www.facebook.com/CongressmanJodyHice/videos/1137415019700286/",NA,57,21,0,2,0,0,0,3
"CongressmanJodyHice","651078621667264_1138160332959088","Congressman Jody Hice","2017-04-05","2017-04-05 18:02:30","A big thank you to Boy Scout Troop 64 from Social Circle for visiting me earlier this week! I hope you had a great trip to Washington! #GA10","photo","https://www.facebook.com/CongressmanJodyHice/photos/a.657903340984792.1073741828.651078621667264/1138160042959117/?type=3",NA,80,9,3,3,0,1,0,1
"CongressmanJodyHice","651078621667264_1139669589474829","Congressman Jody Hice","2017-04-06","2017-04-06 20:44:40","The Obama Administration's naive trust of Assad with chemical weapons similar to its naive trust of Iran with nuclear weapons. #SyriaGasAttack","photo","https://www.facebook.com/CongressmanJodyHice/photos/a.657903340984792.1073741828.651078621667264/1139669589474829/?type=3",NA,51,38,17,2,5,1,0,18
"CongressmanJodyHice","651078621667264_1139743856134069","Congressman Jody Hice","2017-04-06","2017-04-06 22:36:43","Great being at Vice President Pence's residence at the Naval Observatory last night!","photo","https://www.facebook.com/CongressmanJodyHice/photos/a.657903340984792.1073741828.651078621667264/1139743856134069/?type=3",NA,469,23,9,25,2,1,0,2
"CongressmanJodyHice","651078621667264_1140887189353069","Congressman Jody Hice","2017-04-07","2017-04-07 16:44:44","My heart aches at the horrific images that came out of Syria earlier this week. I stand with the President and commend his swift and decisive action. I have the deepest appreciation for our brave men and women in uniform for their efforts and execution which make it possible for the United States to send a strong message to Assad and the international community that his actions are unacceptable. Moving forward, it is critically important that the Administration engage with Congress and clearly communicate its strategy for the region with the American people.","link","http://hice.house.gov/news/documentsingle.aspx?DocumentID=1198","hice.house.gov",161,29,7,15,0,0,1,5
"CongressmanJodyHice","651078621667264_1140930399348748","Congressman Jody Hice","2017-04-07","2017-04-07 17:43:18","By confirming Judge Gorsuch as our next Associate Justice to the Supreme Court, the Senate fulfilled one of its most vital Constitutional tasks. Judge Gorsuch is a principled and well-respected jurist who understands that his duty is to interpret the law, not to change it to advance his own personal agenda. I want to commend President Trump for keeping his promise to the American people by nominating a judge in the mold of the late Justice Antonin Scalia. Throughout this process, Judge Gorsuch has distinguished himself as a thoughtful and balanced jurist, and I congratulate him on his confirmation to the highest court in the land. Today is a victory for our Nation and the rule of law.","link","http://www.foxnews.com/politics/2017/04/07/gorsuch-confirmed-to-supreme-court.html","foxnews.com",356,54,39,30,0,0,2,33
"CongressmanJodyHice","651078621667264_1143826545725800","Congressman Jody Hice","2017-04-09","2017-04-09 18:43:00","Wishing everyone a happy and blessed Palm Sunday as we mark the beginning of this Holy Week. Hosanna in the highest heaven! Matthew 21:9","status",NA,NA,95,7,4,5,0,1,0,3
"CongressmanJodyHice","651078621667264_1145443212230800","Congressman Jody Hice","2017-04-10","2017-04-10 21:47:48","Wishing all of our Jewish friends and families here and around the world a blessed and happy Passover! #ChagSameach","photo","https://www.facebook.com/CongressmanJodyHice/photos/a.657903340984792.1073741828.651078621667264/1145443212230800/?type=3",NA,57,8,7,3,0,0,0,0
"CongressmanJodyHice","651078621667264_1148214435287011","Congressman Jody Hice","2017-04-12","2017-04-12 18:07:05","Great meeting with folks in Walton County today! Thanks for having me. #GA10","photo","https://www.facebook.com/CongressmanJodyHice/photos/a.657903340984792.1073741828.651078621667264/1148214435287011/?type=3",NA,47,8,2,0,0,0,1,1
"CongressmanJodyHice","651078621667264_1148270321948089","Congressman Jody Hice","2017-04-12","2017-04-12 19:09:55","Honored to nominate Alexa for an appointment to the United States Naval Academy! Proud to have another future officer of the Navy in #GA10. Keep up the great work!","photo","https://www.facebook.com/GeorgeWaltonAcademy/photos/a.189322504425134.47231.111424915548227/1584610071563030/?type=3",NA,88,7,0,4,0,0,0,0
"CongressmanJodyHice","651078621667264_1149559601819161","Congressman Jody Hice","2017-04-13","2017-04-13 21:26:49","Promoting economic development in the 10th District is vital to ensuring that Georgia remains the best place to do business.   Newton County has built a thriving community that offers not only new job opportunities, but real career choices. I applaud the hard work and dedication of our community leaders, who have helped make Newton County a place where people are encouraged to settle down and build a long-term future with their friends and family.","link","http://hice.house.gov/news/documentsingle.aspx?DocumentID=1204","hice.house.gov",42,82,2,3,0,0,0,1
"CongressmanJodyHice","651078621667264_1150165095091945","Congressman Jody Hice","2017-04-14","2017-04-14 13:58:27","Without His suffering, his execution, and subsequent resurrection there would be no Christianity. Today, we commemorate the crucifixion and death of Jesus Christ as the ultimate sacrifice for our sins. Dee Dee and I wish you and your family a blessed #GoodFriday and a happy #Easter weekend!  “But God demonstrates His own love toward us, in that while we were still sinners, Christ died for us.” Romans 5:8","photo","https://www.facebook.com/CongressmanJodyHice/photos/a.657903340984792.1073741828.651078621667264/1150165095091945/?type=3",NA,72,14,1,8,0,0,0,0
"CongressmanJodyHice","651078621667264_1150326745075780","Congressman Jody Hice","2017-04-14","2017-04-14 17:27:16","LIFE IS WINNING IN AMERICA! Earlier this week, President Donald J. Trump signed H.J. Res. 43 into law, overturning President Obama’s last minute, parting gift to the abortion industry. The resolution ensures that states are not forced to fund an abortion business, like Planned Parenthood, with federal taxpayer dollars.  Putting these decisions back at the state level will give communities the option to spend Title X money on comprehensive health care clinics that better serve women and girls. I was proud to vote for this measure in February, and I’m grateful to have a President that is willing to sign critical pro-life measures into law.","link","http://www.washingtontimes.com/news/2017/apr/13/donald-trump-gives-states-power-cut-planned-parent/","washingtontimes.com",227,53,25,25,0,2,3,44
"CongressmanJodyHice","651078621667264_1151820214926433","Congressman Jody Hice","2017-04-16","2017-04-16 13:12:05","‪He is RISEN! Dee Dee and I wish you and your family a blessed and Happy Easter!‬","photo","https://www.facebook.com/CongressmanJodyHice/photos/a.657903340984792.1073741828.651078621667264/1151820214926433/?type=3",NA,87,12,0,9,1,0,0,0
"CongressmanJodyHice","651078621667264_1152836048158183","Congressman Jody Hice","2017-04-17","2017-04-17 20:07:24","I'm excited to present the submissions for the 2017 Congressional Art Contest. This photo album will host the People’s Choice Award. I'll award one point for each “like” and two points for each “share,” and the photo with the most points wins! Voting closes at 3pm on April 28th.","photo","https://www.facebook.com/CongressmanJodyHice/photos/a.1152817628160025.1073741835.651078621667264/1152818178159970/?type=3",NA,60,10,113,3,0,0,0,0
"CongressmanJodyHice","651078621667264_1153428134765641","Congressman Jody Hice","2017-04-18","2017-04-18 13:43:35","Friends in the 6th District of Georgia, I encourage you to exercise your civic duty and go VOTE TODAY in the special election!   Find your polling place at the link below.","link","https://www.mvp.sos.ga.gov/MVP/mvp.do","mvp.sos.ga.gov",79,18,16,3,0,0,0,0
"CongressmanJodyHice","651078621667264_1153648041410317","Congressman Jody Hice","2017-04-18","2017-04-18 19:56:46","It's #TaxDay, and I'm renewing my call for IRS Commissioner JohnKoskinen's removal. For too long, the IRS has operated using fear and intimidation, putting the needs and desires of Washington before the American taxpayer.   I signed a letter with my House colleagues asking President Trump to remove Koskinen from his position of leadership and have him replaced with someone worthy of our trust and dedicated to putting taxpayers first.   Share if you agree.","photo","https://www.facebook.com/Oversight/photos/a.138899332516.121878.55005857516/10154503619172517/?type=3",NA,131,46,0,5,5,1,0,2
"CongressmanJodyHice","651078621667264_1154429701332151","Congressman Jody Hice","2017-04-19","2017-04-19 15:01:19","Honored to nominate Will Caldwell for an appointment to West Point - The U.S. Military Academy. Thank you for stepping up to the plate in service to this great nation. We are all so proud of you.","video","https://www.facebook.com/CongressmanJodyHice/videos/1154429701332151/",NA,167,16,19,13,0,0,0,0
"CongressmanJodyHice","651078621667264_1156359291139192","Congressman Jody Hice","2017-04-21","2017-04-21 18:21:25","Glad to have the opportunity to tour Dura-Line's plant in Sandersville earlier this week. Since 1995, they've been making plastic pipes used in telecom projects and gas distribution right here in Washington County! It was a pleasure meeting with you all and keep up the good work!","photo","https://www.facebook.com/CongressmanJodyHice/photos/a.657903340984792.1073741828.651078621667264/1156347791140342/?type=3",NA,56,69,3,3,0,0,0,0
"CongressmanJodyHice","651078621667264_1157220864386368","Congressman Jody Hice","2017-04-22","2017-04-22 21:33:33","Dee Dee and I are truly grateful for our men and women in uniform. We had a wonderful time at today's Law Enforcement Appreciation Event in Greensboro. #BackTheBlue","photo","https://www.facebook.com/CongressmanJodyHice/photos/a.669936796448113.1073741829.651078621667264/1157219931053128/?type=3",NA,134,6,8,12,0,1,0,0
"CongressmanJodyHice","651078621667264_1159176097524178","Congressman Jody Hice","2017-04-24","2017-04-24 23:49:43","Congratulations to my fellow Georgian Sonny Perdue on his confirmation as the Secretary of the U.S. Department of Agriculture! No one is more qualified to lead our agriculture community. #GA10","photo","https://www.facebook.com/CongressmanJodyHice/photos/a.657903340984792.1073741828.651078621667264/1159176097524178/?type=3",NA,258,15,22,19,0,2,1,8
"CongressmanJodyHice","651078621667264_1160022390772882","Congressman Jody Hice","2017-04-25","2017-04-25 12:43:05","By now, many of you have seen just how talented Georgia’s 10th District high school artists are. If you haven’t already, please take a look at the submissions for the 2017 Congressional Art Competition and vote on your favorite piece for the People’s Choice Award!  Every “like” earns one point and a “share” earns two points for each piece of art. Voting closes at 3:00 p.m. on Friday, April 28th, and the winning piece of artwork will be hung in my Monroe District Office!  Additionally, I hope you will join me this Saturday from 10:00 a.m. to noon for our 2017 Congressional Art Competition Celebration, starting with an artwork scavenger hunt and ending with the announcement of the winners of both the Congressional Art Competition and People’s Choice Award. The event will begin at 10:00 a.m. at the Monroe-Walton Center for the Arts, located at 205 South Broad Street.","photo","https://www.facebook.com/CongressmanJodyHice/photos/a.1152817628160025.1073741835.651078621667264/1152818178159970/?type=3",NA,41,5,0,0,0,0,0,0
"CongressmanJodyHice","651078621667264_1160120927429695","Congressman Jody Hice","2017-04-25","2017-04-25 15:01:31","Congratulations to Georgia Military College Prep School's Class of 2017 for their accolades. To date, 16 students have been awarded military appointments, academic, athletic, or fine arts scholarships.   Without question, GMC Prep has some of the best students in the country, and I could not be more proud of these young leaders.","photo","https://www.facebook.com/CongressmanJodyHice/photos/a.657903340984792.1073741828.651078621667264/1160120927429695/?type=3",NA,41,2,1,5,0,0,0,0
"CongressmanJodyHice","651078621667264_1160329794075475","Congressman Jody Hice","2017-04-25","2017-04-25 22:02:07","Friends, did you receive this week's e-newsletter?   Keep track of my work on your behalf and stay in the know about what's happening in the District and Washington by signing up for my weekly updates here: https://hice.house.gov/forms/form/?ID=5","link","http://hice.house.gov/news/email/show.aspx?ID=B7Q2LUGK6RNRI","hice.house.gov",15,7,0,0,0,0,0,0
"CongressmanJodyHice","651078621667264_1160901514018303","Congressman Jody Hice","2017-04-26","2017-04-26 17:57:02","Our farmers are the bread and butter of our economy. Grateful to receive the Friend Of Farm Bureau Award from the Georgia Farm Bureau today for my work on behalf of agriculture and rural communities. Thank you! #GeorgiaGrown","photo","https://www.facebook.com/CongressmanJodyHice/photos/a.657903340984792.1073741828.651078621667264/1160901514018303/?type=3",NA,43,5,2,3,0,0,0,0
"CongressmanJodyHice","651078621667264_1161092190665902","Congressman Jody Hice","2017-04-27","2017-04-27 00:23:55","What a special group of students! Enjoyed meeting 8th grade students from Prince Avenue Christian School today in Washington.","photo","https://www.facebook.com/CongressmanJodyHice/photos/a.657903340984792.1073741828.651078621667264/1161092190665902/?type=3",NA,151,14,10,12,0,0,0,0
"CongressmanJodyHice","651078621667264_1161568027284985","Congressman Jody Hice","2017-04-27","2017-04-27 16:39:06","Almost one third of Americans are affected by Alzheimer’s disease. My mother was among the many Americans who suffered from this debilitating disease, so I understand the pain of caregivers and their families. Thankfully, there are organizations, like the Alzheimer’s Association, that offer Alzheimer’s care, support, and research.  If you’d like helpful information about caring for a loved one with Alzheimer’s or other forms of dementia, I invite you to join me at the Warren County Senior Center where I will share my story and look forward to hearing yours.  What: Coffee and Conversation with Congressman Hice Who: U.S. Representative Jody Hice and the Alzheimer’s Association When: 10:30 am – 11:30 am on Thursday, May 11, 2017 Where: Warren County Senior Citizen Center - 48 Warren Street, Warrenton, GA 30828  For more information, please call 706-564-1286.  Coffee and light refreshments will be served.  Registration is not required.","link","https://hice.house.gov/news/documentsingle.aspx?DocumentID=1246","hice.house.gov",47,14,8,2,0,0,0,0
