"screen_name","id","from_name","date","datetime","message","type","link","domain","likes_count","comments_count","shares_count","love_count","haha_count","wow_count","sad_count","angry_count"
"congressmanpittenger","376142742468386_1257103971038921","Congressman Robert Pittenger","2017-03-07","2017-03-07 01:02:06","With skyrocketing premiums and insurers fleeing the market, Obamacare is collapsing under its own weight. As Republicans have promised for the past seven years, The American Health Care Act will create more choices, lower costs, and give hardworking American families control of their own health care again.   Furthermore, this bill maintains protections for Americans with pre-existing conditions, allows young adults to stay on their parents’ plan, and ensures a stable transition period while eliminating the onerous government mandates.  As we proceed through a transparent legislative process, I look forward to hearing from constituents and working with a unified Republican government to deliver market driven health care to the American people.","link","https://housegop.leadpages.co/healthcare/","housegop.leadpages.co",32,31,5,1,0,0,0,14
"congressmanpittenger","376142742468386_1257839390965379","Congressman Robert Pittenger","2017-03-07","2017-03-07 19:14:16","President Obama knew about ZTE for four years and incredibly chose to suspend sanctions.  President Trump has been in office two months, and already ZTE has pled guilty and agreed to a substantial fine.  This is genuine accountability on behalf of hardworking Americans.  ZTE is just one example of questionable communist Chinese trade practices which unfairly undermine America’s economy and basic human rights.  China does not play by our rules, and we must be vigilant against potential national security risks associated with Chinese investments that may be controlled or heavily influenced by China’s communist leadership.","link","http://www.reuters.com/article/us-usa-china-zte-idUSKBN16E1X1","reuters.com",14,9,0,0,0,0,0,0
"congressmanpittenger","376142742468386_1260011134081538","Congressman Robert Pittenger","2017-03-09","2017-03-09 16:06:09","This is #SevereWeatherAwarenessWeek in North Carolina, yet Charlotte remains the largest city in the U.S. without local NWS Doppler radar.  As WBTV News meteorologist Al Conklin explains, by the time radar beams reach Charlotte, they often shoot over top of the storms due to the curvature of the earth, meaning meteorologists lack consistent and reliable data on severe weather.  Yesterday, I introduced legislation to fix the ""radar gap"" in Charlotte.  Learn more in this report from WBTV.","video","https://www.facebook.com/CongressmanPittenger/videos/1260011134081538/",NA,6,3,0,1,0,0,0,0
"congressmanpittenger","376142742468386_1260065397409445","Congressman Robert Pittenger","2017-03-09","2017-03-09 21:00:10","In February, I took part in a Congressional delegation to Egypt, meeting for the 4th time with President Sisi to discuss efforts to counter the Muslim Brotherhood and other radical Islamic terrorists.  We also met with Coptic Orthodox Pope Tawadros II and Rev. Dr. Andrea Zaki Stephanous, President of the Protestant Churches of Egypt.  Both leaders expressed profound appreciation for President Sisi’s unprecedented support of the Egyptian Christian minority.   As Muslim Brotherhood, ISIS, Hamas, and other radical Islamic terror organizations spread hate and work to obliterate diversity, President Sisi is demonstrating a path forward for the Middle East, celebrating our religious differences and standing up for minorities.  My hope is that President Sisi will be invited to address a Joint Session of Congress to explain his vision and needs.  President Sisi needs U.S. support in his battle against extremism.","photo","https://www.facebook.com/CongressmanPittenger/photos/a.406945429388117.95715.376142742468386/1260065127409472/?type=3",NA,4,6,0,0,0,0,1,0
"congressmanpittenger","376142742468386_1260286067387378","Congressman Robert Pittenger","2017-03-10","2017-03-10 00:00:00","Today, I met an outstanding Eagle Scout from Lumberton, North Carolina! When Hurricane Matthew struck, Ron King and his family were left with no electricity or television. Yet as a 14 year old, his first thought was to text a Scout leader to ask how he could help bring glory to God in this disaster. He and his fellow Scouts served 2,000 meals per day at a Red Cross shelter, putting in more than 1,000 hours of combined community service.   Ron told President Donald J. Trump at the White House he would like to become President to make a difference for our country. On behalf of Congress and the citizens of Lumberton, we are proud of Ron and look forward to witnessing the great things God has planned for this tremendous young man.","photo","https://www.facebook.com/CongressmanPittenger/photos/a.406945429388117.95715.376142742468386/1260276817388303/?type=3",NA,40,2,3,5,0,0,0,0
"congressmanpittenger","376142742468386_1261180820631236","Congressman Robert Pittenger","2017-03-10","2017-03-10 17:18:07","This morning, I was horrified to learn of Commissioner Sturdivant’s serious crash.  Through her service on the Anson County Commission, her active volunteer efforts with Anson County Schools, and her countless, quiet acts of kindness, Ms. Sturdivant has made a huge impact on our community.  We are praying for a speedy and full recovery.","link","http://www.wsoctv.com/news/local/deadly-crash-shuts-down-highway-74-ramp-officials-say/501097557","wsoctv.com",5,1,0,0,0,1,4,0
"congressmanpittenger","376142742468386_1261285947287390","Congressman Robert Pittenger","2017-03-13","2017-03-13 10:30:00","Thank you to Michael Wessel, an influential Commissioner on the U.S.-China Economic and Security Review Commission, for your ongoing support of our efforts to hold China accountable for actions to undermine the U.S. economy, national security, and human rights.  ZTE broke the law by selling embargoed equipment to Iran, which could be used to violate human rights.  Through our bipartisan efforts and the leadership of President Donald J. Trump, ZTE agreed to pay a record-breaking billion dollar fine.  This is a win, but we must continue to watch ZTE and other Chinese state-owned/state-influenced firms very carefully.","photo","https://www.facebook.com/CongressmanPittenger/photos/a.406945429388117.95715.376142742468386/1261285947287390/?type=3",NA,3,3,1,0,0,0,0,0
"congressmanpittenger","376142742468386_1261290637286921","Congressman Robert Pittenger","2017-03-10","2017-03-10 19:20:36","Lumberton has previously benefited from special USDA grant and loan programs to help spark economic development in rural communities.  Yet a small increase in Lumberton’s population means they no longer qualify.  This week, I testified before a U.S. House subcommittee to request flexibility with the grant requirements.  As I told my colleagues, I believe it is common sense to create necessary flexibility when making these important determinations, and not prevent critical funding from reaching those truly in need as a result of arbitrary population metrics.","video","https://www.facebook.com/CongressmanPittenger/videos/1261290637286921/",NA,17,4,5,1,0,0,0,0
"congressmanpittenger","376142742468386_1264358300313488","Congressman Robert Pittenger","2017-03-13","2017-03-13 15:31:10","Meeting and taking questions from AP Government students at Lumberton High School. What a treat to see the bright future leaders of our country!","photo","https://www.facebook.com/CongressmanPittenger/photos/a.406945429388117.95715.376142742468386/1264358300313488/?type=3",NA,11,12,0,1,0,0,0,0
"congressmanpittenger","376142742468386_1264659760283342","Congressman Robert Pittenger","2017-03-13","2017-03-13 21:41:42","This is how you drain the swamp! Our federal bureaucracy is overdue for a thorough review to eliminate duplicative agencies, clarify responsibilities, and slash government waste.","link","http://www.cnbc.com/2017/03/13/trump-to-sign-executive-order-aiming-to-see-where-money-is-being-wasted-in-government-spicer-says.html","cnbc.com",56,25,5,5,2,1,1,8
"congressmanpittenger","376142742468386_1265402763542375","Congressman Robert Pittenger","2017-03-14","2017-03-14 17:36:22","Did you know the American Health Care Act includes the most significant reforms to Medicaid in 50 years?  This is in addition to the easy-to-understand system of refundable tax credits to make health insurance more affordable for all Americans, protections for those with pre-existing conditions, and abolishing President Obama's one-size-fits-all vision for your personal healthcare.  Learn more in my column for South Charlotte Weekly.","link","http://thecharlotteweekly.com/opinion/2017/03/repairing-americas-healthcare-system/","thecharlotteweekly.com",16,42,2,2,1,0,1,16
"congressmanpittenger","376142742468386_1266157970133521","Congressman Robert Pittenger","2017-03-15","2017-03-15 14:36:54","Last night I joined our friends at Shalom Park to express solidarity and outrage at the hate crimes perpetrated against the Jewish community.  As expressed to them; I came as a humble follower of Jesus Christ and as their Representative in the U.S. Congress to stand with them.","photo","https://www.facebook.com/CongressmanPittenger/photos/a.406945429388117.95715.376142742468386/1266157970133521/?type=3",NA,16,5,0,1,0,0,0,0
"congressmanpittenger","376142742468386_1266481943434457","Congressman Robert Pittenger","2017-03-15","2017-03-15 21:52:58","Today I had the honor of meeting with high school students from Monroe’s Shining Light Baptist Academy.  Meeting with students from the 9th Congressional District is always a highlight of my day, and I thoroughly enjoyed discussing their goals and answering questions about Congress.  The future is bright for these young leaders.","photo","https://www.facebook.com/CongressmanPittenger/photos/a.406945429388117.95715.376142742468386/1266481943434457/?type=3",NA,8,6,5,0,0,0,0,0
"congressmanpittenger","376142742468386_1270921019657216","Congressman Robert Pittenger","2017-03-21","2017-03-21 10:32:01","Did you know the federal government gives states a financial incentive to provide better treatment for able-bodied adults on Medicaid than for the elderly, disabled, children, and pregnant mothers?  Under President Obama’s Medicaid expansion, the federal government covers at least 90 percent of Medicaid costs for able-bodied adults, but only 57 percent for those Americans most in need.   The House Republicans' American Health Care Act corrects this unfair treatment by scaling back Obamacare’s misguided Medicaid expansion, gives states a common sense budget targeted to helping those truly in need, and provides states with incentives to fight Medicaid fraud and abuse.  Learn more in the column I wrote for Sunday’s The Robesonian.","link","http://robesonian.com/opinion/97142/time-for-medicaid-to-be-fixed","robesonian.com",30,22,7,1,0,0,0,2
"congressmanpittenger","376142742468386_1270994422983209","Congressman Robert Pittenger","2017-03-20","2017-03-20 21:00:00","On Saturday, @MSNBC asked me about the CBO report which some are using to attack health care reform.  My response?  On pages 25 and 26 of that report, CBO states there are so many variables that the outcomes could be substantially different from their projections.  The reality is that Obamacare is in a death spiral, and many of those covered under Obamacare find the insurance useless because they can’t afford the high deductibles.  Our objective is common sense healthcare reform that folks can actually afford to use.  Leaving hardworking Americans stuck with the status quo is not acceptable.  Click below for my full interview.","video","https://www.facebook.com/CongressmanPittenger/videos/1270994422983209/",NA,13,25,4,2,0,0,0,2
"congressmanpittenger","376142742468386_1271847516231233","Congressman Robert Pittenger","2017-03-21","2017-03-21 15:29:01","As a pro-life leader in Congress, on Monday I spent an hour at the White House with Vice President Mike Pence reviewing legislative procedures to preserve pro-life issues in the American Health Care Act and ensure that your tax dollars are not used for abortions.","photo","https://www.facebook.com/CongressmanPittenger/photos/a.406945429388117.95715.376142742468386/1271847516231233/?type=3",NA,69,56,4,8,1,0,0,14
"congressmanpittenger","376142742468386_1272144839534834","Congressman Robert Pittenger","2017-03-21","2017-03-21 21:01:10","Today I had the privilege of meeting with Dr. Ashley Sumrall, a Neuro-oncologist and medical oncologist from a Charlotte practice.  She shared her personal opinions on the American Health Care Act from the perspective of a physician who deals with patients who can’t afford their current insurance, or their current insurance doesn’t cover necessary medical care.  Her analysis?  This healthcare bill isn’t perfect, but the tax credits and coverage provisions will help more patients. These are Dr. Sumrall's personal opinions and not reflective of where she works.","video","https://www.facebook.com/CongressmanPittenger/videos/1272144839534834/",NA,77,46,20,9,0,0,0,1
"congressmanpittenger","376142742468386_1273018259447492","Congressman Robert Pittenger","2017-03-22","2017-03-22 17:51:24","The American Health Care Act includes vital Medicaid reforms conservatives have championed for decades.  We replace Medicaid’s blank check to states with common sense per capita or block grant allotments, providing for those in need while giving states an incentive to fight waste, fraud, and abuse.  This is our opportunity to bring accountability to Medicaid.  Earlier today, I shared this challenge with my House colleagues.  Click below to watch.","video","https://www.facebook.com/CongressmanPittenger/videos/1273018259447492/",NA,10,49,2,0,0,0,3,10
"congressmanpittenger","376142742468386_1274039326012052","Congressman Robert Pittenger","2017-03-23","2017-03-23 15:00:28","A vote against the American Health Care Act is a vote for the continuation of Obamacare.  It’s that simple.  Do you support conservative reform which takes health care from the government and returns it to the people?  Do you support the most significant reforms to Medicaid in 50 years?  Or do you want to remain stuck in the Obamacare death spiral?  We are responsible for governing.  Hear more in my interview this morning with WBT Bo Thompson.","link","http://wbt.com/congressman-pittenger-london-attack-replacing-obamacare/","bt.com",36,84,5,1,0,0,1,22
"congressmanpittenger","376142742468386_1275237315892253","Congressman Robert Pittenger","2017-03-24","2017-03-24 21:07:27","Speaker Ryan has been magnanimous throughout this very difficult process, and he made the right decision in pulling the bill.  We do not have adequate votes to pass.  If the vote had failed, we could not bring it up again under the special Senate rules requiring only a majority vote, instead of 60 votes.  Hopefully, cooler heads will prevail for those who insisted the legislation contain 100 percent of their views.  Our great conservative icon, Ronald Reagan, understood government by consensus, often commenting that he would gladly accept 80 percent and declare victory.  We need a more considerate and thoughtful commitment to governing if we are to be successful.","status",NA,NA,55,67,3,1,7,1,1,5
"congressmanpittenger","376142742468386_1278170368932281","Congressman Robert Pittenger","2017-03-27","2017-03-27 15:08:59","We need to take a lesson from Ronald Reagan, our great conservative president.  Ronald Reagan's governance was based on the 80 percent rule.  If he could get 80 percent of any bill, he would declare victory and know he had achieved his objective.  We can't go into any consideration of legislation and anticipate we should get 100 percent of what we want.  This was my message Saturday on Fox News.  Click below for the full interview.","video","https://www.facebook.com/CongressmanPittenger/videos/1278170368932281/",NA,13,21,1,0,0,0,0,5
"congressmanpittenger","376142742468386_1278238875592097","Congressman Robert Pittenger","2017-03-28","2017-03-28 10:30:00","The Consumer Financial Protection Bureau (CFPB) has a fatal flaw:  no accountability.  The agency which determines your choices for checking accounts, the fees on your mortgage or car loan, or what types of credit card offers you receive is led by a single director who is accountable to no one.  Not even the President can fire the director, except for an “egregious act.”  With no oversight, CFPB bureaucrats are free to dream up whatever big government regulations they want.   Read my weekly column in The Robesonian to learn more about the CFPB’s problems, and the common sense solutions I’m fighting for in the House Committee on Financial Services.","link","http://robesonian.com/opinion/97383/cfpb-strangling-economy","robesonian.com",19,19,1,0,0,3,0,7
"congressmanpittenger","376142742468386_1279284422154209","Congressman Robert Pittenger","2017-03-28","2017-03-28 15:30:00","Hardworking Americans deserve good paying jobs.  Small business owners who risk everything to create jobs and economic growth deserve our support.  Recently, the U.S. Chamber of Commerce honored me with their ""Spirit of Enterprise"" award in recognition of my legislative efforts to support job growth, improve job training programs, and help small businesses succeed in growing our economy.","photo","https://www.facebook.com/CongressmanPittenger/photos/a.406945429388117.95715.376142742468386/1279284422154209/?type=3",NA,11,6,2,0,0,0,0,0
"congressmanpittenger","376142742468386_1280434048705913","Congressman Robert Pittenger","2017-03-29","2017-03-29 20:24:05","Local veterans waiting an average of 84 days before being seen by a doctor?  Today, I participated in a meeting with senior VA management and Members of North Carolina’s Congressional delegation, asking questions about widespread reports of poor treatment at VA facilities.  Senior management concurred with my efforts of reforming the civil service code to allow incompetent VA employees to be fired.","photo","https://www.facebook.com/CongressmanPittenger/photos/a.406945429388117.95715.376142742468386/1280434048705913/?type=3",NA,19,16,4,0,0,0,1,0
"congressmanpittenger","376142742468386_1281394928609825","Congressman Robert Pittenger","2017-03-30","2017-03-30 22:32:00","Next stop, President Trump’s desk! As a cosponsor of this pro-life legislation, I am thrilled to see it advance through the Senate. This resolution repeals President Obama’s last minute regulations and allows individual states to defund Planned Parenthood’s Title X funding, a big win in our fight to protect life!","link","http://www.foxnews.com/politics/2017/03/30/pence-breaks-senate-tie-on-planned-parenthood-funding-bill.html","foxnews.com",80,37,10,10,0,0,0,29
"congressmanpittenger","376142742468386_1282014638547854","Congressman Robert Pittenger","2017-03-31","2017-03-31 15:33:21","Major health care insurer Anthem, which lost $374 million on its Obamacare health plans last year, looks likely to exit the Obamacare markets in 2018. Republicans need to pull together and work with President Trump to repeal and replace Obamacare with patient centered, free market oriented solutions.  Already, in 95 out of 100 counties, North Carolinians only have one option on the Obamacare exchanges. Nationwide, 1/3 of all counties only have one option. Aetna’s CEO has said the markets are in a “death spiral,” and Humana has already announced they are exiting the market for 2018. Obamacare is collapsing under its own weight.","link","https://www.bloomberg.com/news/articles/2017-03-30/anthem-likely-to-retreat-from-obamacare-for-2018-analysts-say","bloomberg.com",17,42,7,1,0,1,1,5
"congressmanpittenger","376142742468386_1287557584660226","Congressman Robert Pittenger","2017-04-05","2017-04-05 11:22:54","As Charlotte prepares for possible severe weather today, President Donald J. Trump is preparing to sign legislation I sponsored to improve severe weather radar coverage in the Charlotte region.  Incredibly, Charlotte is the largest metropolitan area in the United States without local National Weather Service Doppler radar, which is a problem left unresolved for over 25 years.  Because of weak radar coverage and inadequate data, the National Weather Service has actually missed tornadoes in our area.  Thanks to my legislation, which unanimously passed the U.S. House yesterday, the Commerce Department will now begin a 180 day study of the radar coverage gap, to be followed in 90 days by a plan of action.  Thank you to Senator Richard Burr and Chairman Congressman Lamar Smith of the House Committee on Science, Space, and Technology for their full support of this critical issue.","video","https://www.facebook.com/CongressmanPittenger/videos/1287557584660226/",NA,75,14,5,4,0,0,0,0
"congressmanpittenger","376142742468386_1287835324632452","Congressman Robert Pittenger","2017-04-05","2017-04-05 16:26:24","Representatives from the Military Officers Association of America (MOAA) came by my Washington office today to discuss the harmful impacts of defense sequestration, as well as ways in which Congress can better serve our veterans.","photo","https://www.facebook.com/CongressmanPittenger/photos/a.406945429388117.95715.376142742468386/1287835324632452/?type=3",NA,15,5,5,1,0,0,0,0
"congressmanpittenger","376142742468386_1290308244385160","Congressman Robert Pittenger","2017-04-07","2017-04-07 16:42:36","Our Founding Fathers would salute the Senate’s approval of Neil Gorsuch as Associate Justice of the Supreme Court.  Judge Gorsuch will uphold the Constitution and the freedoms and liberties it has preserved over our history.","photo","https://www.facebook.com/CongressmanPittenger/photos/a.406945429388117.95715.376142742468386/1290308244385160/?type=3",NA,129,46,7,11,1,0,1,21
"congressmanpittenger","376142742468386_1294076587341659","Congressman Robert Pittenger","2017-04-10","2017-04-10 18:09:32","Congratulations to William McGirt Golf for finishing in the top 25 in his first appearance at The Masters Tournament.  On Saturday, my grandson and I watched Mr. McGirt tee off on the first hole.  He is a true gentleman and continues to make Robeson County proud through his hard work and humility.","link","http://robesonian.com/news/97882/mcgirt-im-taking-nothing-but-positives-away-from-this-week","robesonian.com",19,2,0,0,0,0,0,0
"congressmanpittenger","376142742468386_1294085617340756","Congressman Robert Pittenger","2017-04-10","2017-04-10 20:30:00","Today, I wrote Coptic Orthodox Pope Tawadros II to express support following the Palm Sunday terrorist attacks.  Once again, radical Islamic terrorists are seeking to divide Egypt and obliterate diversity.  Earlier this year, Pope Tawadros explained to me that Egyptian President Sisi had offered unprecedented support for Egypt’s persecuted Christians.  As our leaders respond to this heinous act, I am grateful that President Sisi was recently able to meet with President Trump, and hope he will be invited to address a Joint Session of Congress to explain his vision and needs in his battle against Islamic jihad.","photo","https://www.facebook.com/CongressmanPittenger/photos/a.406945429388117.95715.376142742468386/1294085617340756/?type=3",NA,10,3,2,1,0,0,0,0
"congressmanpittenger","376142742468386_1294219343994050","Congressman Robert Pittenger","2017-04-10","2017-04-10 22:30:00","On Wednesday, I’ll be available for one-on-one, drop-in meetings at my downtown Monroe office from 10:30 a.m. through 12:30 p.m.  If you’d like to chat, please join me at Old City Hall (100 West Jefferson, Suite 1A).  Meetings will be first-come, first-served, and to be fair to all there will be a 10-15 minute limit on each meeting, subject to availability.  No appointments, no agenda, just honest dialogue.","photo","https://www.facebook.com/CongressmanPittenger/photos/a.406945429388117.95715.376142742468386/1294219343994050/?type=3",NA,18,15,36,0,2,0,0,0
"congressmanpittenger","376142742468386_1295282833887701","Congressman Robert Pittenger","2017-04-16","2017-04-16 10:00:00","“Jesus told her, “I am the resurrection and the life.  Anyone who believes in me will live, even after dying.  Everyone who lives in me and believes in me will never ever die.” – John 11: 26-26 (NLT)","photo","https://www.facebook.com/CongressmanPittenger/photos/a.406945429388117.95715.376142742468386/1295282833887701/?type=3",NA,110,26,6,14,0,0,0,3
"congressmanpittenger","376142742468386_1295284533887531","Congressman Robert Pittenger","2017-04-13","2017-04-13 14:00:01","""You see, at just the right time, when we were still powerless, Christ died for the ungodly.  Very rarely will anyone die for a righteous person, though for a good person someone might possibly dare to die.  But God demonstrates his own love for us in this:  While we were still sinners, Christ died for us."" - Romans 5: 6-8 (NIV)","photo","https://www.facebook.com/CongressmanPittenger/photos/a.406945429388117.95715.376142742468386/1295284533887531/?type=3",NA,47,17,8,13,0,0,0,1
"congressmanpittenger","376142742468386_1296180227131295","Congressman Robert Pittenger","2017-04-12","2017-04-12 13:19:56","Right now I'm live on Monroe's WIXE The Mighty 93.1FM and 1190AM, chatting with Archie and Shane about current issues, including local students appointed to U.S. Service Academies and our efforts to secure better severe weather radar coverage for Mecklenburg and Union.  Listen live at www.wixe.com.","link","http://www.wixe.com/","wixe.com",5,4,0,0,0,0,0,0
