"screen_name","id","from_name","date","datetime","message","type","link","domain","likes_count","comments_count","shares_count","love_count","haha_count","wow_count","sad_count","angry_count"
"CongressmanJodyHice","651078621667264_1214861951955592","Congressman Jody Hice","2017-06-28","2017-06-28 14:37:00","Enjoyed meeting and speaking with Rotarians in Social Circle earlier this week to discuss the latest from Washington. Thanks for having me! #GA10","photo","https://www.facebook.com/CongressmanJodyHice/photos/a.657903340984792.1073741828.651078621667264/1214861138622340/?type=3",NA,66,14,3,3,0,0,0,3
"CongressmanJodyHice","651078621667264_1216341821807605","Congressman Jody Hice","2017-06-29","2017-06-29 20:40:12","With so many talented and creative students in our high schools across Georgia’s 10th Congressional District, I am always in awe of the incredible artwork they create.    This year’s winning work of art is no different, and I want to congratulate Emma on her achievements as a gifted young artist. Hundreds of thousands of people visit Washington, D.C. each year, and I am proud to have her drawing represent our part of Georgia as it hangs in the U.S. Capitol for the next year.","link","https://hice.house.gov/news/documentsingle.aspx?DocumentID=1378","hice.house.gov",31,1,1,1,0,0,0,0
"CongressmanJodyHice","651078621667264_1216383988470055","Congressman Jody Hice","2017-06-29","2017-06-29 21:46:14","Rampant illegal immigration is one of the many problems that I came to Washington to address. Sanctuary cities provide asylum for repeat-offender criminal illegal aliens who dangerously roam our communities without fear of deportation. These policies obstruct federal law, needlessly endanger public safety, and have led to the untimely deaths of many innocent Americans.   Today, the House took major strides toward enforcing the law of the land and protecting American communities with the passage of the No Sanctuary for Criminals Act and Kate’s Law. As we have seen, there are real public safety risks and tragic consequences that arise when misguided cities refuse to enforce federal law.   America is built upon the hard work of immigrants who came before us, and we encourage those who wish to follow in their footsteps to come – but to come legally. Simply put, we have the duty to ensure that those new arrivals are not here to harm our citizens, and I will never waver from my firm commitment to defend our border and enforce the rule of law.","link","https://hice.house.gov/news/documentsingle.aspx?DocumentID=1379","hice.house.gov",206,63,22,20,0,0,0,23
"CongressmanJodyHice","651078621667264_1220732024701918","Congressman Jody Hice","2017-07-04","2017-07-04 13:31:46","Happy Independence Day! Celebrating America's heritage and the roots of life, liberty, and the pursuit of happiness with some of my favorite patriots!   As we gather this July 4th, I encourage you to take time to thank our veterans and all those who defend our nation at home and abroad for their service and sacrifice.","photo","https://www.facebook.com/CongressmanJodyHice/photos/a.669936796448113.1073741829.651078621667264/1220730394702081/?type=3",NA,382,39,2,34,0,0,0,0
"CongressmanJodyHice","651078621667264_1222042347904219","Congressman Jody Hice","2017-07-05","2017-07-05 23:58:30","Proud to join Herschel Walker yesterday in Wrightsville as the UGA legend and hometown hero was honored during a street dedication ceremony. #GoDawgs #GA10","photo","https://www.facebook.com/CongressmanJodyHice/photos/a.669936796448113.1073741829.651078621667264/1222042187904235/?type=3",NA,98,3,2,5,0,1,0,0
"CongressmanJodyHice","651078621667264_1222604837847970","Congressman Jody Hice","2017-07-06","2017-07-06 15:26:14","Happy Birthday, W! Sending warm wishes and blessings to our 43rd President, George W. Bush. #43turns71","photo","https://www.facebook.com/TheBushCenter/photos/a.163934106984504.32985.142236929154222/1634928873218346/?type=3",NA,82,10,0,2,1,1,0,1
"CongressmanJodyHice","651078621667264_1223000531141734","Congressman Jody Hice","2017-07-07","2017-07-07 01:04:21","The road to recovery is never easy. Our friend Congressman Steve Scalise and his family continue to need our prayers. #TeamScalise #ScaliseStrong","status",NA,NA,89,21,7,5,0,1,15,0
"CongressmanJodyHice","651078621667264_1223566727751781","Congressman Jody Hice","2017-07-07","2017-07-07 16:25:32","Proud to join folks yesterday in Putnam County as we honor local veterans. No one deserves red carpet treatment more than our heroes in uniform. #GA10","photo","https://www.facebook.com/CongressmanJodyHice/photos/a.657903340984792.1073741828.651078621667264/1223565907751863/?type=3",NA,131,18,7,11,0,0,0,0
"CongressmanJodyHice","651078621667264_1227088034066317","Congressman Jody Hice","2017-07-11","2017-07-11 14:03:46","Mourning the lives of the 16 brave service members lost as a result of last night's tragedy. Our prayers are with their loved ones. #SemperFi #OohRah","photo","https://www.facebook.com/marines/photos/a.389035160193.173306.323772930193/10154478674030194/?type=3",NA,36,9,0,3,0,1,61,0
"CongressmanJodyHice","651078621667264_1229184140523373","Congressman Jody Hice","2017-07-13","2017-07-13 23:02:15","Get something done. That’s what we’ve got to do, that’s what we need to be doing this week, that’s what we’ve done the week before that, and will be doing next week. Doing the job that the American people sent us here to do.   Whatever it takes to accomplish that is what we need to be willing to do, and I’m certainly on board with that. The bottom line: We’ve got to accomplish the promises that we gave to the American people.","video","https://www.facebook.com/CongressmanJodyHice/videos/1229184140523373/",NA,76,46,6,6,2,0,1,7
"CongressmanJodyHice","651078621667264_1229825060459281","Congressman Jody Hice","2017-07-14","2017-07-14 15:56:26","Just think about the threats that America faces, most especially from ISIS and the pursuit of nuclear technology by Iran and North Korea. While no one can predict the future with clarity, our national security is the fundamental responsibility of the federal government. It’s our duty to build a 21st century military that’s capable of confronting these evolving threats.  We need to bolster our military capabilities – not further degrade them. This year’s NDAA gains ground in our efforts to close the readiness gap by modernizing and fully funding our Armed Forces, while developing an effective framework to counter terrorism. Simply put, an innovative, flexible, and agile military force is vital to keeping America safe, our allies assured, and our enemies deterred. With the passage of the National Defense Authorization Act, we’ve taken a step in the right direction.","link","https://hice.house.gov/news/documentsingle.aspx?DocumentID=1398","hice.house.gov",124,45,10,10,7,0,1,3
"CongressmanJodyHice","651078621667264_1232864246822029","Congressman Jody Hice","2017-07-17","2017-07-17 22:46:36","It's #NationalBlueberryMonth! Did you know that Georgia is a leading supplier of blueberries in the nation? This month, remember to thank a Georgia farmer!  #GAGrown #Agribusiness","photo","https://www.facebook.com/HouseAgCommittee/photos/a.10158628834110364.1073741842.213570350363/10158914761240364/?type=3",NA,45,10,0,3,0,0,0,0
"CongressmanJodyHice","651078621667264_1233499663425154","Congressman Jody Hice","2017-07-18","2017-07-18 16:59:56","United States Service Academies award some of the largest and most prestigious scholarships in the country. Students who earn an offer of appointment receive a top-tier education, room and board, pay, and exclusive benefits and training. What’s more, these young men and women become commissioned officers immediately upon graduation.    Join me on Saturday, August 19th from 1:30 p.m. to 3:30 p.m. on the campus of Georgia Military College for my annual Service Academy Day to learn more about their nomination and application processes. I can think of no higher honor for Georgia’s 10th District students, and each year, I am proud to congratulate the elite group of leaders who attend a United States Service Academy.","photo","https://www.facebook.com/CongressmanJodyHice/photos/a.657903340984792.1073741828.651078621667264/1233499663425154/?type=3",NA,30,8,8,3,0,0,0,0
"CongressmanJodyHice","651078621667264_1233530506755403","Congressman Jody Hice","2017-07-18","2017-07-18 17:47:59","Celebrating #MadeInAmericaWeek with Georgia's own Chick-fil-A, started in Hapeville in 1946! Proud to have a Georgia business showcased at The White House. #EatMorChikin","photo","https://www.facebook.com/WhiteHouse/photos/a.1376021905818872.1073741847.1191441824276882/1376075542480175/?type=3",NA,121,37,0,16,1,0,0,1
"CongressmanJodyHice","651078621667264_1235669619874825","Congressman Jody Hice","2017-07-21","2017-07-21 00:07:59","Mayor Johnson and I talk about the jobs coming to Covington and the surrounding areas.","video","https://www.facebook.com/CongressmanJodyHice/videos/1235669619874825/",NA,60,15,11,5,0,0,0,0
"CongressmanJodyHice","651078621667264_1238335172941603","Congressman Jody Hice","2017-07-23","2017-07-23 22:08:48","Honored to meet Dr. James Dobson, founder and chairman emeritus of Focus on the Family, yesterday at the Western Conservative Summit.","photo","https://www.facebook.com/CongressmanJodyHice/photos/a.657903340984792.1073741828.651078621667264/1238335172941603/?type=3",NA,176,27,7,17,1,0,0,17
"CongressmanJodyHice","651078621667264_1239090696199384","Congressman Jody Hice","2017-07-24","2017-07-24 16:37:47","Want to earn on-the-job experience and skills interning in a Congressional office? Learn more about the opportunity to make a difference in the lives of 10th District residents by visiting my website at hice.house.gov/forms/internships.","photo","https://www.facebook.com/CongressmanJodyHice/photos/a.657903340984792.1073741828.651078621667264/1239088576199596/?type=3",NA,55,17,16,1,0,0,0,0
"CongressmanJodyHice","651078621667264_1239365996171854","Congressman Jody Hice","2017-07-24","2017-07-24 23:10:57","I was elected to Congress because the great citizens of the 10th District of Georgia put their trust in me to represent them well and hold Washington accountable. I remember our shared values every single day that I’m in Washington and in the District, and I’m working around the clock to help make our future safer and brighter.   Rest assured, I'm laser focused on repealing and replacing Obamacare, rewriting the tax code, and upholding my promise to put the safety and security of Georgians – and all Americans – first. Please click below to read a full Congressional update.","link","https://hice.house.gov/news/email/show.aspx?ID=DJR4VBC3OM5OQ","hice.house.gov",123,73,8,12,1,0,0,23
"CongressmanJodyHice","651078621667264_1239920466116407","Congressman Jody Hice","2017-07-25","2017-07-25 15:30:30","Telephone Town Halls are a regular part of my constituent outreach because it’s important to me that I hear directly from the people I represent. These types of Town Halls allow me to easily interact with thousands of 10th District residents from the comfort of their homes. Folks should know that I’m here to listen and get things done on their behalf, and I look forward to a productive conversation on Thursday evening.  Residents can sign up to participate by filling out the form below or calling my Washington D.C. office at 202-225-4101. Constituents can also join the conference by calling (855) 756-7520 and using the passcode 36106# at any point during the event.","link","https://hice.house.gov/forms/form/?ID=11","hice.house.gov",24,30,13,1,1,0,0,2
"CongressmanJodyHice","651078621667264_1240180299423757","Congressman Jody Hice","2017-07-25","2017-07-25 22:39:04","Today, I voted to put Russia, North Korea, and Iran on notice by imposing stricter sanctions on these bad actors that threaten America and global stability.  Chairman Ed Royce said it best earlier, ""Congress is playing its role here in terms of toughening and giving diplomatic leverage, and economic leverage, to the administration to use against these regimes""","video","https://www.facebook.com/HouseForeign/videos/1989845241041031/",NA,75,28,0,3,0,0,0,2
"CongressmanJodyHice","651078621667264_1240872519354535","Congressman Jody Hice","2017-07-26","2017-07-26 18:06:18","I spoke on the House Floor today to honor the life of Curry Tommy Haynes, a long-time Georgia resident and brave hero of the Vietnam War, who joined our Heavenly Father on July 16th after a long battle with cancer. Mr. Haynes was a one of the most decorated soldiers in our Nation’s history, earning ten Purple Heart Awards for his bravery in combat in the jungles of Vietnam. Haynes remained an active member of the community even after returning from duty by launching the Newton County EMT service, teaching locals to fly and skydive, and serving as a VA counselor to his fellow servicemembers.   While serving in Vietnam as part of the U.S. Army 173rd Airborne Brigade, Company C of the 503rd Infantry, Mr. Haynes was wounded multiple times. He was shot in the arm, the thighs, and the hand, and ultimately lost two fingers during one enemy ambush alone. Despite his many serious injuries, he never stopped fighting.   Curry Haynes is a hero who deserves the respect of all Americans and will be sorely missed by so many in the community.","video","https://www.facebook.com/CongressmanJodyHice/videos/1240872519354535/",NA,83,18,69,16,0,0,0,0
"CongressmanJodyHice","651078621667264_1241957612579359","Congressman Jody Hice","2017-07-27","2017-07-27 21:39:11","I’ll be hosting my Telephone Town Hall within the next hour. Make sure to comment below if you have any questions, and I’ll do my best to get to them. Many of you will be receiving the call, but if you don’t and want to participate, please call (855) 756-7520 and use the passcode 36106# at any point during the event.","video","https://www.facebook.com/CongressmanJodyHice/videos/1241957612579359/",NA,62,55,6,6,0,0,0,6
"CongressmanJodyHice","651078621667264_1242620279179759","Congressman Jody Hice","2017-07-28","2017-07-28 15:22:29","Earlier today, I took to the House floor to honor the life of my friend who recently passed away, Larry Eley. Larry was a strong advocate for farmers, growers, and landowners in my home district. He was well-known in Greene County, Georgia as a “gentle giant” and will be remembered for his love for his family, his tireless efforts as President of the Greene County Farm Bureau, and his steadfast leadership in the Georgia Association of Conservation Districts.  I am grateful to have known Larry and witnessed his passion firsthand. We’ll miss you, Larry.","video","https://www.facebook.com/CongressmanJodyHice/videos/1242620279179759/",NA,112,29,44,15,0,0,1,0
"CongressmanJodyHice","651078621667264_1242757039166083","Congressman Jody Hice","2017-07-28","2017-07-28 19:26:01","I’ve always been a champion of fully repealing Obamacare and replacing it with a health care system that lowers costs, empowers patients with more choice, and increases access to quality care. While we in the House came to agreement on legislation that accomplishes those goals, I am disappointed that the Senate came up short. I encourage my colleagues to continue doing the hard work required to save the American people from the disaster of Obamacare.   One thing is clear: Failure is not an option.","status",NA,NA,242,154,16,5,17,0,1,27
"CongressmanJodyHice","651078621667264_1244945928947194","Congressman Jody Hice","2017-07-31","2017-07-31 13:31:14","With all the noise coming out of Washington lately, big-ticket items, like health care and tax reform, have been on the forefront of most of our minds.  While these are important issues we’re tackling, they’ve also drowned out some of the other valuable things Congress is doing. With that in mind, I want to take the time to outline a few of my own legislative proposals I’m very proud to be introducing in the coming months.  Just a few short weeks ago, the House passed Kate’s Law to crack down on sanctuary cities after witnessing the devastation that can arise from policies that effectively roll out the welcome mat for illegal immigrants. Perhaps even more shocking, however, are the loopholes in our legal system that allow these criminal aliens who are sex offenders to wander freely around our communities without being registered on sex offender rolls and without the knowledge of our law enforcement officials. My bill, the Sex Offender Registration & Tracking Improvement Act would require the Department of Homeland Security to collect extensive information about these offenders and share it with the Department of Justice, as well as local law enforcement, to ensure that these criminals are placed on sex offender registries.  All sex offenders — regardless of immigration status — should be identified and registered.  Public safety must not be a partisan issue, and I am proud to be introducing this bill soon.  Another measure I’m working on is the Strengthening Aviation Security Act. Since 2001, the Transportation Security Administration has aimed to increase the number of federal air marshals they place on flights. However, in deciding which flights they are placed on, the Government Accountability Office found the TSA fails to use a quantitative risk assessment to clearly demonstrate which flights are higher risk and therefore deserving of extra attention.  When it comes to protecting our skies, we need to use every method at our disposal. This includes both the qualitative professional judgment of experts and quantitative evidence-based strategies. The Strengthening Aviation Security Act would require the Federal Air Marshal Service incorporate risk-based strategies in deciding domestic and international air marshal allocation.  Please know, although I’ll be heading down to Georgia for the August “recess,” my legislative and constituent work will continue. I’ll be taking meetings and visiting with folks across the district to hear what’s most important to you and discuss how we can move forward together.  You may rest assured my team and I are working day in and day out to enact meaningful legislation that will benefit the citizens of the 10th District, our state and our great nation.","link","http://www.waltontribune.com/opinion/columns/article_c1362766-73c3-11e7-a68b-83303aa3e1c8.html","waltontribune.com",28,18,1,0,1,0,0,0
"CongressmanJodyHice","651078621667264_1245282378913549","Congressman Jody Hice","2017-07-31","2017-07-31 21:51:30","Moving ceremony at the White House today. We owe all of our servicemembers a debt of gratitude that we can never repay. To all those who currently are, or have been, members of our armed forces – THANK YOU for all you do in the name of freedom and liberty. May God watch over the men and women in uniform as they defend us on the frontlines.","link","http://trib.al/72SpWun","trib.al",82,12,0,11,0,0,0,0
"CongressmanJodyHice","651078621667264_1246857345422719","Congressman Jody Hice","2017-08-02","2017-08-02 21:29:23","Great bill introduced by my colleagues, Senator David Perdue and Senator Tom Cotton! Addressing the ever-rising tide of chain migration, while admitting immigrants based on the skills they bring to the table is the type of immigration reform America needs. Under the current law, one immigrant can serve as a catalyst for up to 273 other legal immigrants entering our country based solely on genetics.  I’ve introduced a bill in the House, H.R. 1149, the Nuclear Family Priority Act, which would eliminate extended family visa categories for adult siblings and adult children, thereby clamping down on chain migration and allowing us to instead prioritize the reunification of nuclear families (spouses and minor children) of both citizens and lawful permanent residents. In other words, it addresses the assumption that legal status will be granted to the extended family of legal immigrants, regardless of their ability to contribute to our nation.  The American Dream is something that is worth fighting for and protecting, but it's not a guarantee. In the spirit of the American dream, this legislation does not hinder the efforts of legal immigrants to reunite with their immediate families in America, but instead prevents abuse of our already overwhelmed immigration system.","video","https://www.facebook.com/SenatorDavidPerdue/videos/660465720817822/",NA,107,42,0,9,1,1,0,25
"CongressmanJodyHice","651078621667264_1248413385267115","Congressman Jody Hice","2017-08-04","2017-08-04 20:08:02","A big thank you to our summer interns Anna, Kaylee, Luke, and Dominic on their last day. Your assistance and dedication to serving the people of the 10th District was invaluable!   If you know of anyone interested in interning in one of my offices, head to my website at https://hice.house.gov/forms/internships/ to apply. Fall and Spring sessions still accepting applications!","photo","https://www.facebook.com/CongressmanJodyHice/photos/a.669936796448113.1073741829.651078621667264/1248413138600473/?type=3",NA,49,4,8,2,0,0,0,0
"CongressmanJodyHice","651078621667264_1250861901688930","Congressman Jody Hice","2017-08-07","2017-08-07 16:39:45","Whether I’m in Washington, D.C. or working hard in the district, I’m fortunate to have a dedicated team of constituent service representatives who stand willing and ready to help. If you have questions regarding Social Security benefits, Medicare, immigration, veterans’ benefits, the IRS, and other federal programs, I hope you will take advantage of my Mobile Office Hours. This month, my staff will be at the Warren County Senior Citizen Center and the Eatonton-Putnam Chamber of Commerce, and they look forward to meeting with you.  A constituent service representative will be at each of the following locations:   Warren County, GA Monday, August 14, 2017 9:00 a.m. – 12:00 p.m. Warren County Senior Citizen Center 48 Warren Street Warrenton, GA 30828  Putnam County, GA Monday, August 14, 2017 9:00 a.m. –  11:00 a.m. Eatonton-Putnam Chamber of Commerce, Board Room 305 N Madison Avenue Eatonton, GA 31024  For more information, residents may call the Monroe office at 770-207-1776 or Milledgeville office at 478-457-0007.","link","https://hice.house.gov/news/documentsingle.aspx?DocumentID=1432","hice.house.gov",31,27,4,0,6,0,0,0
"CongressmanJodyHice","651078621667264_1251070701668050","Congressman Jody Hice","2017-08-07","2017-08-07 20:54:05","Today marks National Purple Heart Day, where we honor and celebrate those who proudly served and earned America’s oldest military decoration for their wounds in combat. I am truly grateful for the generations of our brave men and women in uniform who willingly protect our country, our values, and our freedom. I cannot thank them enough for their service and sacrifice, and I encourage you to take time to thank our heroes. We, as a Nation, owe them a tremendous debt of gratitude.","video","https://www.facebook.com/DeptofDefense/videos/10155662036515719/",NA,45,4,0,6,0,0,1,0
"CongressmanJodyHice","651078621667264_1254015164706937","Congressman Jody Hice","2017-08-11","2017-08-11 15:58:05","Need help with a federal agency? Come take advantage of my Mobile Office Hours in Warrenton and Eatonton this Monday. My team is ready to help!","photo","https://www.facebook.com/CongressmanJodyHice/photos/a.657903340984792.1073741828.651078621667264/1254014844706969/?type=3",NA,25,11,3,0,2,1,0,1
"CongressmanJodyHice","651078621667264_1255051807936606","Congressman Jody Hice","2017-08-12","2017-08-12 22:10:03","‪There is no place for hate in America. I condemn the events that have transpired in Charlottesville. We must unite as a Nation and overcome that which divides us.‬","status",NA,NA,237,81,11,22,0,1,1,5
"CongressmanJodyHice","651078621667264_1255732311201889","Congressman Jody Hice","2017-08-13","2017-08-13 18:23:52","The events that have transpired in Charlottesville over the last few days are shameful, vile, and horrific. I strongly condemn the message and actions of these white nationalists. Let me be clear: there is no place for hate or racism in America. We are all the same at the foot of the cross and we, as Americans, must stand for freedom, peace, and justice for all. As we pray for national healing, Dee Dee and my thoughts are with the victims and community shaken by this hateful display of violence.","status",NA,NA,290,84,32,20,0,0,18,4
"CongressmanJodyHice","651078621667264_1257579324350521","Congressman Jody Hice","2017-08-16","2017-08-16 01:58:18","‪I was clear about this violence and bigotry over the weekend, and I'll say it again: There is no place for hate and racism in America.‬","status",NA,NA,291,95,4,24,6,0,2,0
"CongressmanJodyHice","651078621667264_1258983100876810","Congressman Jody Hice","2017-08-17","2017-08-17 20:29:40","I was honored to receive the annual Spirit of Enterprise Award from the U.S. Chamber of Commerce during a gathering at the ""Gwinnett Chamber ON TOPIC"" yesterday. Reducing regulatory red tape and focusing on pro-business principles will help create jobs and grow our economy. Now more than ever, we need to implement policies that create space for businesses to flourish and hire more workers. I am humbled to receive this award and will continue fighting every day to fuel economic opportunity for Georgia's hardworking families and businesses.","link","https://hice.house.gov/news/documentsingle.aspx?DocumentID=1456","hice.house.gov",72,29,3,6,4,0,0,0
"CongressmanJodyHice","651078621667264_1259004787541308","Congressman Jody Hice","2017-08-17","2017-08-17 21:09:02","‪Horrifying terror attack in #Barcelona. Our hearts and prayers are with the victims and their families. Stand strong as we continue to fight against global terrorism.‬","status",NA,NA,48,22,2,0,0,2,19,0
