"screen_name","id","from_name","date","datetime","message","type","link","domain","likes_count","comments_count","shares_count","love_count","haha_count","wow_count","sad_count","angry_count"
"CongressmanJodyHice","651078621667264_1055458761229246","Congressman Jody Hice","2017-01-01","2017-01-01 14:26:00","Happy New Year! Dee Dee and I wish you and your family every blessing for a bright, joyful, healthy, and prosperous New Year.   I look forward to working with you and the Trump Administration in 2017 to make the 10th District an even better place to live, work, raise a family, and start a business. #MAGA","photo","https://www.facebook.com/CongressmanJodyHice/photos/a.657903340984792.1073741828.651078621667264/1055458761229246/?type=3",NA,100,10,6,3,0,0,0,0
"CongressmanJodyHice","651078621667264_1056755254432930","Congressman Jody Hice","2017-01-02","2017-01-02 14:37:24","Happy Birthday, Georgia! On this day in 1788, the Peach State officially joined the Union, becoming the 4th state of our great Nation. Join us in celebrating 229 years of Georgia’s history.","photo","https://www.facebook.com/CongressmanJodyHice/photos/a.657903340984792.1073741828.651078621667264/1056755254432930/?type=3",NA,438,16,277,16,0,4,0,0
"CongressmanJodyHice","651078621667264_1057757067666082","Congressman Jody Hice","2017-01-04","2017-01-04 00:05:10","Serving the Tenth District of Georgia in the U.S. House of Representatives is an incredible honor, responsibility, and duty that I take earnestly. My constituents placed their faith in me as their voice in Washington, and I pledge to uphold that trust.  While our Nation faces difficult challenges that will require thoughtful consideration to resolve, the opportunity to implement meaningful, conservative solutions that so many Americans deserve is in sight. I am committed to forging agreements that represent my district’s values, and I’m excited to officially begin the 115th Congress to help get our Nation back on track.  I’m always humbled by the people who have entrusted me with the honor of serving as their Representative, and I am grateful for your continued support, guidance, and encouragement.   From the bottom of my heart, thank you for the opportunity to serve you.","photo","https://www.facebook.com/CongressmanJodyHice/photos/a.657903340984792.1073741828.651078621667264/1057757067666082/?type=3",NA,258,21,6,9,0,0,0,1
"CongressmanJodyHice","651078621667264_1058212250953897","Congressman Jody Hice","2017-01-04","2017-01-04 15:15:20","As we enter a new Congress, I wanted to reflect on some of the work we’ve accomplished during the 114th Congress for Georgia's Tenth District! As always, it is an honor to serve you.","photo","https://www.facebook.com/CongressmanJodyHice/photos/a.657903340984792.1073741828.651078621667264/1058212250953897/?type=3",NA,32,3,2,1,0,0,0,0
"CongressmanJodyHice","651078621667264_1058457690929353","Congressman Jody Hice","2017-01-04","2017-01-04 22:08:27","It’s clear that the American people are suffocating under the Obama Administration’s regulatory regime. Today, the House took its first step toward dismantling it by passing H.R. 21, the Midnight Rules Relief Act. This legislation establishes a simple, rapid-response method for Congress to undo abusive and overly burdensome “midnight” rules submitted during the final legislative days of Congress by an outgoing administration.  Americans can no longer bear these burdens, and I’m pleased that this bill will not only deter lame-duck Presidents from shuffling in last-minute regulations, but it will also create an efficient method for any incoming Congress to express its disapproval and reverse them.","link","http://thehill.com/regulation/legislation/312568-gop-lawmaker-brings-back-bill-attacking-midnight-rules","thehill.com",238,20,30,13,0,0,0,4
"CongressmanJodyHice","651078621667264_1059041984204257","Congressman Jody Hice","2017-01-05","2017-01-05 17:27:55","Today is a very sad day for the Bulldawg faithful. Rest in peace, Mike ""Big Dawg"" Woods. You will be sorely missed. My condolences to his family and friends.","link","http://onlineathens.com/local-news/2017-01-04/uga-fan-mike-big-dawg-woods-has-died","onlineathens.com",73,6,14,0,0,0,57,0
"CongressmanJodyHice","651078621667264_1059225497519239","Congressman Jody Hice","2017-01-05","2017-01-05 23:19:39","Weather forecast predicts that parts of the Tenth District will receive up to 4 inches of snow this weekend. Please be safe and use extreme caution!  Stay up-to-date and get safety tips here: http://www.gema.ga.gov/","photo","https://www.facebook.com/NWSAtlanta/photos/a.1391817770830981.1073742153.211963985483038/1391817774164314/?type=3",NA,17,0,0,0,0,4,0,0
"CongressmanJodyHice","651078621667264_1059697137472075","Congressman Jody Hice","2017-01-06","2017-01-06 14:37:08","Down to the very bitter end, the Obama Administration continues to undermine and threaten our partnership with Israel, our strongest ally in the Middle East. Ambassador Power’s abstention vote in December might as well have been a vote in favor of this anti-Israel resolution. Therefore, I voted yesterday to strongly condemn U.N. Security Council resolution 2334 and the Obama Administration’s inaction. I will always stand with Israel, and I look forward to working with a unified government this year to strengthen our relationship.","link","http://hice.house.gov/news/documentsingle.aspx?DocumentID=1036","hice.house.gov",258,20,23,15,0,0,0,2
"CongressmanJodyHice","651078621667264_1059956270779495","Congressman Jody Hice","2017-01-06","2017-01-06 22:12:43","The rapid build-up of burdensome federal regulations has not only severely slowed the growth of our economy but has also stifled employment opportunities. To address this, the House, with my support, swiftly passed the REINS Act which will curb the power of unelected, unaccountable bureaucrats. It will also restore constitutional balance by requiring Congressional approval and the President’s signature before any new regulation with more than $100 million in economic impact can go into effect.   Our action illustrates our dedication to provide the American people with real, conservative solutions, and I applaud my colleague and fellow Georgian, Congressman Doug Collins, for introducing this important bill. With the passage of H.R. 26, it’s clear that Washington cannot continue to fund reckless regulations on the backs of hardworking Americans.","link","http://hice.house.gov/news/documentsingle.aspx?DocumentID=1037","hice.house.gov",112,13,10,7,0,1,0,2
"CongressmanJodyHice","651078621667264_1060657094042746","Congressman Jody Hice","2017-01-07","2017-01-07 20:21:40","Great talk this week with Vice President-elect Mike Pence about repealing and replacing Obamacare and the Johnson Amendment. Ready to #MAGA!","photo","https://www.facebook.com/CongressmanJodyHice/photos/a.657903340984792.1073741828.651078621667264/1060657094042746/?type=3",NA,198,30,9,8,0,1,0,3
"CongressmanJodyHice","651078621667264_1061914190583703","Congressman Jody Hice","2017-01-09","2017-01-09 14:57:36","Are you planning to attend #Inauguration2017? I’m excited to announce that I’m hosting an Open House reception on Thursday, January 19, 2017 from 2 p.m. to 4 p.m. in my Washington, D.C. office.   Hearing from you and receiving feedback is a critical part of my job as your Representative, and I encourage all Tenth District constituents to stop by Room 324 in the Cannon House Office Building if you are in our Nation’s Capital for Inauguration festivities.  Please RSVP to Rep.JodyHice@mail.house.gov by January 13th. Light refreshments will be served.","photo","https://www.facebook.com/CongressmanJodyHice/photos/a.657903340984792.1073741828.651078621667264/1061914190583703/?type=3",NA,31,7,3,2,0,0,0,0
"CongressmanJodyHice","651078621667264_1062186230556499","Congressman Jody Hice","2017-01-09","2017-01-09 23:20:01","Today marks National Law Enforcement Appreciation Day. I proudly joined Members of Congress to show my support by placing blue lights in the windows of my Washington, D.C. office. Despite the dangers of the job, these brave men and women in blue wear their badges every day in service to the American people.  Please join me in recognizing the outstanding service and commitment of our law enforcement agents across America. #TakeTheLEAD #BackTheBlue","photo","https://www.facebook.com/CongressmanJodyHice/photos/a.657903340984792.1073741828.651078621667264/1062186230556499/?type=3",NA,142,10,28,13,0,0,1,1
"CongressmanJodyHice","651078621667264_1062218960553226","Congressman Jody Hice","2017-01-10","2017-01-10 13:28:00","I understand that many of you who are in need of assistance with a federal agency may find it difficult to visit one of my district offices, whether that difficulty is due to schedules, transportation, or other personal matters. With that in mind, I have a dedicated full-time team on the ground who stand willing and ready to help. If you have questions regarding Social Security benefits, Medicare, veterans’ benefits, the IRS, and other federal programs, I hope you will take advantage of my January Mobile Office Hours.    This month, my staff will join the AMVETS Post 12 at the Golden Corral in Winder and set up shop at the Tennille Community Health Center and the Family Connection and Communities in Schools of Glascock County in Gibson.  A constituent service representative will be at each of the following locations:  Barrow County, GA – Thursday, January 12 7:00 p.m. – 8:30 p.m. Golden Corral 163 E. May Street Winder, GA 30680  Washington County, GA – Wednesday, January 18 9:30 a.m. – 11:30 a.m. Tennille Community Health Center 116 Smith Street Tennille, GA 31089  Glascock County, GA – Monday, January 23 10:00 a.m. – 12:00 p.m. Family Connections and Communities in Schools of Glascock County 370 W. Main Street Gibson, GA 30810  For more information, residents may call the Monroe office at 770-207-1776 or Milledgeville office at 478-457-0007.","link","http://hice.house.gov/news/documentsingle.aspx?DocumentID=1038","hice.house.gov",69,5,7,1,0,0,0,0
"CongressmanJodyHice","651078621667264_1062972590477863","Congressman Jody Hice","2017-01-11","2017-01-11 01:33:33","Depicting our men and women in blue as pigs is both despicable and down-right wrong. Our law enforcement put their lives at risk without hesitation each and every day in service to the American people. They proudly wear their badge with bravery in our defense. They take action when no one else does.   I deeply respect Congressman Hunter for his courage in correcting a matter that is so blatantly appalling. To our law enforcement, thank you for keeping us safe.","link","http://www.foxnews.com/politics/2017/01/06/gop-congressman-takes-down-colleagues-sponsored-art-depicting-police-as-pigs.html","foxnews.com",140,40,27,0,0,0,15,22
"CongressmanJodyHice","651078621667264_1063533077088481","Congressman Jody Hice","2017-01-11","2017-01-11 19:02:44","It is my honor to offer my congratulations to these exceptional students who are among the best and brightest in the Tenth Congressional District. These young men and women exemplify the highest attributes of character, scholarship, and patriotism and will go on to become the future leaders of America’s Armed Forces.   Jacob, William, and Alexis are the first of twenty-five students whom I nominated to receive prestigious appointments to one of our Nation’s Service Academies, and I look forward to congratulating additional nominees in the weeks and months ahead.  I submitted the following twenty-five students for nomination:  1. Jacob Allen (Loganville, GA), Walnut Grove High School – offered appointment to United States Air Force Academy  2. Christopher Austin (Oxford, GA), Georgia State University  3. Shane Blalock (McDonough, GA), Ola High School  4. Justin Blough (Braselton, GA), Mill Creek High School  5. Benjamin Bruner (Athens, GA), Cedar Shoals High School  6. William Caldwell V (Milledgeville, GA), Georgia Military College  7. Jack Chambers (Bishop, GA), North Oconee High School  8. Allen Dodge (Evans, GA), Augusta Christian Schools  9. Craig Edwards (Social Circle, GA), Providence Christian School  10. Zachary Fedak (Evans, GA), Greenbrier East High School  11. Wyatt Galloway (Mansfield, GA), Piedmont Academy  12. Justin Gittemeier (McDonough, GA), Union Grove High School  13. Ian Gonzales (Auburn, GA), Dacula High School  14. Garrett Hipp (Dacula, GA), Archer High School  15. Alexa Jacquitte (Monroe, GA), George Walton Academy  16. Anna Jerald (Bishop, GA), North Oconee High School  17. William Johnson (Warrenton, GA), Briarwood Academy – offered appointment to United States Air Force Academy  18. Korrey King (McDonough, GA), Naval Academy Preparatory School  19. Madison McKee (Dacula, GA), Bethlehem Christian Academy  20. Thomas Mims (Buckhead, GA), Riverside Military Academy  21. Forde Norris (Athens, GA), Prince Avenue Christian School  22. Morgan Phillips (Winterville, GA), UNG - University of North Georgia  23. Andrew Salies (McDonough, GA), United States Military Academy Preparatory School  24. Richard Salies (McDonough, GA), Georgia State University  25. Alexis Shirley (Watkinsville, GA), North Oconee High School – accepted appointment to United States Air Force Academy","link","http://hice.house.gov/news/documentsingle.aspx?DocumentID=1042","hice.house.gov",102,7,29,2,0,0,0,0
"CongressmanJodyHice","651078621667264_1063765377065251","Congressman Jody Hice","2017-01-11","2017-01-11 23:48:23","Great meeting with Auburn Mayor and Georgia Municipal Association 2nd Vice President Linda Blechinger this week to discuss top legislative priorities for the Tenth District and our state!","photo","https://www.facebook.com/CongressmanJodyHice/photos/a.657903340984792.1073741828.651078621667264/1063765377065251/?type=3",NA,75,0,3,2,0,0,0,0
"CongressmanJodyHice","651078621667264_1064385823669873","Congressman Jody Hice","2017-01-12","2017-01-12 17:19:26","Last night, I continued my mission to lessen the burden of overreaching government regulations by voting for H.R. 5, the Regulatory Accountability Act of 2017. The 115th Congress is only two weeks in, and House Republicans have advanced three major pieces of legislation to address the problem. But, we have more to do on behalf of the American people.","link","http://gph.is/2iGFItL","gph.is",58,10,4,1,0,0,0,1
"CongressmanJodyHice","651078621667264_1065335346908254","Congressman Jody Hice","2017-01-13","2017-01-13 21:37:12","The history of Obamacare is clear-cut: It was crafted behind closed doors, with no real discussion of opposing views; it was overly complicated, riddled with mountains of mandates and penalties; and it has failed to rein in costs, causing the collapse of exchanges, double-digit premium increases, and fewer healthcare choices for patients. Simply put, Obamacare is an expensive failure that is unpopular, unworkable, and unaffordable.  By passing S. Con. Res. 3, we opened a procedural door to repealing this deeply flawed law, following through on our promise to the American people. While conversations about the replacement plan are ongoing, rest assured that there will be a smooth transition period between the current system and a new free-market healthcare system that is patient-centered. Americans deserve the freedom to buy coverage that is right for their needs and budgets, not the needs of Washington. With President-elect Donald Trump and Rep. Tom Price at the helm, Congress will pass legislation that will increase access to the care Americans need, at a price they can afford.  This budget resolution is far from perfect. It is a snapshot of where we’ve been under the Obama Administration, not a roadmap of where we need to go moving forward. Time and again, President Obama has ignored the staggering losses caused by his flawed policies simply to preserve his legacy. As soon as the Trump Administration is able to submit a budget to Congress detailing its priorities, Congress will debate more conservative budget proposals designed to restore fiscal order and achieve long-term fiscal sustainability. Today’s vote was a vote for relief for Americans who have been suffering for too long under a burdensome system. It’s time to make healthcare work for all Americans.","link","http://hice.house.gov/news/documentsingle.aspx?DocumentID=1043","hice.house.gov",328,85,41,19,0,1,2,26
"CongressmanJodyHice","651078621667264_1066971120078010","Congressman Jody Hice","2017-01-15","2017-01-15 21:01:31","As an intelligent and seasoned warrior, General James Mattis will serve our country with bravery and honor as Secretary of Defense. His decades of command experience and his fundamental understanding of civilian and military relations is unparalleled.  He is the best man for the job, and I was proud to vote for S. 84, which clears the path for his confirmation. I’m confident in his ability to shape our Nation’s military strategy and foreign policy and renew U.S. leadership. I urge my Senate colleagues to confirm General Mattis immediately for the good of our warfighters, who serve and defend Americans here at home and around the world.","link","http://hice.house.gov/news/documentsingle.aspx?DocumentID=1044","hice.house.gov",210,12,20,10,0,0,0,2
"CongressmanJodyHice","651078621667264_1067184680056654","Congressman Jody Hice","2017-01-16","2017-01-16 14:17:37","Celebrating and honoring the life and legacy of Dr. Martin Luther King Jr., a man who never doubted the power of a dream. #MLKDay","photo","https://www.facebook.com/CongressmanJodyHice/photos/a.657903340984792.1073741828.651078621667264/1067184680056654/?type=3",NA,78,5,6,5,0,0,0,0
"CongressmanJodyHice","651078621667264_1068584193250036","Congressman Jody Hice","2017-01-18","2017-01-18 00:28:35","Yet another shameful decision by President Obama. Manning broke the law by committing a massive leak of our Nation's most sensitive secrets, put American lives at risk, and severely undermined our national security.  Now, with only three days left in office, the President is allowing a convicted Army leaker to go free nearly three decades early as part of a sweeping move to offer clemency. What a massive mistake.","link","https://www.nytimes.com/2017/01/17/us/politics/obama-commutes-bulk-of-chelsea-mannings-sentence.html?_r=0","nytimes.com",80,62,52,1,0,6,12,121
"CongressmanJodyHice","651078621667264_1069199183188537","Congressman Jody Hice","2017-01-18","2017-01-18 16:44:10","With Rep. Tom Price at the helm of the U.S. Department of Health and Human Services, Americans will be in the driver’s seat to ensure that their healthcare options work for their needs.  We must have a healthcare system that will provide Georgians with what they need – accessibility, affordability, and quality – all of which have disappeared under Obamacare.  Watch his hearing in the U.S. Senate Health, Education, Labor and Pensions Committee Republicans live here!","video","https://www.facebook.com/FoxNews/videos/10155013822381336/",NA,42,13,0,5,0,0,0,8
"CongressmanJodyHice","651078621667264_1070550396386749","Congressman Jody Hice","2017-01-20","2017-01-20 00:25:39","Looking forward to a great night celebrating the inauguration of President-elect Donald Trump. #MAGA","photo","https://www.facebook.com/CongressmanJodyHice/photos/a.657903340984792.1073741828.651078621667264/1070550396386749/?type=3",NA,1032,107,46,101,0,2,0,6
"CongressmanJodyHice","651078621667264_1074019546039834","Congressman Jody Hice","2017-01-23","2017-01-23 16:42:24","Great visiting Putnam County College and Career Academy last week! What a great group of students. #GA10","photo","https://www.facebook.com/CongressmanJodyHice/photos/a.657903340984792.1073741828.651078621667264/1074019279373194/?type=3",NA,102,16,7,2,0,0,0,2
"CongressmanJodyHice","651078621667264_1074434482665007","Congressman Jody Hice","2017-01-24","2017-01-24 00:13:24","On Friday, millions of people here at home and around the world witnessed the peaceful transfer of power in America, one of the great hallmarks of our country’s democracy. For over 200 years, this transfer of authority has demonstrated to the rest of the world that in the United States, the voters choose their leaders, and it is the Constitution — not one person nor one political party — that reigns supreme. In his Inaugural address, President Trump told us that he will take action to move the country forward, creating economic opportunity, building a strong national defense, and working to strengthen relationships with our existing allies while reaching out to create new ones. He also emphasized something that far too many in Washington, D.C. have forgotten: That our government was established to serve the people, not the other way around.  Demonstrating their patriotism and love of country, hundreds of Georgians flew to our Nation’s Capital for the Inauguration. Like them, I want to congratulate President Trump, Vice President Pence, and their families on this historic day. Whatever our opinion of the people who occupy the office, we owe the office itself respect. I ask for your prayers and support to help guide this new Administration and Commander in Chief as our branches of government work together. With the inauguration of Donald Trump as the 45th President of the United States, the first 100 days of the new Administration are now underway, and I’m ready to get to work!","photo","https://www.facebook.com/CongressmanJodyHice/photos/a.657903340984792.1073741828.651078621667264/1074434482665007/?type=3",NA,270,28,20,20,0,0,0,5
"CongressmanJodyHice","651078621667264_1074872915954497","Congressman Jody Hice","2017-01-24","2017-01-24 13:23:09","“Pro-family, pro-America, pro-business,” Hice said. “All these types of things are on the platform of the Republican Party, and those are going to be the types of things we stick to. This is who we are, this is what we believe, and this is the platform we are going to fight for.”  Great talk with David Clemons of The Walton Tribune last week. Read more below!","link","http://www.waltontribune.com/news/article_43e532fe-df65-11e6-983a-df160c020318.html","waltontribune.com",286,36,21,25,0,2,0,10
"CongressmanJodyHice","651078621667264_1075182015923587","Congressman Jody Hice","2017-01-24","2017-01-24 16:55:54","Yesterday, I joined members of the Georgia and Mississippi Delegations for a moment of silence for the victims and families of the severe storms that moved through both states on Saturday and Sunday, claiming the lives of many and inflicting widespread damage.   Dee Dee and I are praying for a swift recovery and express our grief for the lives lost. As always, we are grateful for our first responders, especially those who continue to assist with this disaster relief.","video","https://www.facebook.com/RepAustinScott/videos/1329737923757568/",NA,96,9,0,3,0,0,25,0
"CongressmanJodyHice","651078621667264_1075273695914419","Congressman Jody Hice","2017-01-24","2017-01-24 21:04:39","Great move, President Trump! With this order, we are ready to squash our dependence on Venezuelan oil, create jobs, and stimulate the economy.","link","https://www.washingtonpost.com/news/energy-environment/wp/2017/01/24/trump-gives-green-light-to-dakota-access-keystone-xl-oil-pipelines/?utm_term=.c8ec0145431e","washingtonpost.com",308,38,25,29,0,2,2,18
"CongressmanJodyHice","651078621667264_1075480949227027","Congressman Jody Hice","2017-01-24","2017-01-24 23:08:52","No American should ever be forced to pay for abortions. Period. The Hyde Amendment has been a staple of protecting the unborn for 40 years, saving more than two million lives, including 99,350 lives in the State of Georgia. Needless to say, it is vital that we keep it in place. I am pleased that President Trump has made it abundantly clear that the Administration is committed to a consistent, government-wide policy that no taxpayer dollars should fund abortion or the abortion industry — either domestically or internationally. With the President’s commitment and the action taken today by the House, we will continue fighting for the culture of life.  Additionally, I recently introduced H.R. 586, the Sanctity of Human Life Act. The Sanctity of Human Life Act defines life as beginning at fertilization, defending the inalienable right to life protected by the Constitution. In the Declaration of Independence, our Founding Fathers affirmed that everyone is endowed by their Creator with certain unalienable rights, chief among them being life.   Today, with the right to life under attack, now more than ever before, we must stand up as advocates for the unborn. Our culture must affirm the value of the weak and vulnerable in our society, beginning with our children. With that in mind, I introduced the Sanctity of Human Life Act, which rightly defines life as beginning at conception. I am proud of this legislation and proud to be a voice for the unborn with clarity and conviction.","link","http://hice.house.gov/news/documentsingle.aspx?DocumentID=1083","hice.house.gov",483,125,71,62,0,0,1,23
