"screen_name","id","from_name","date","datetime","message","type","link","domain","likes_count","comments_count","shares_count","love_count","haha_count","wow_count","sad_count","angry_count"
"congressmanpittenger","376142742468386_1453811118034871","Congressman Robert Pittenger","2017-09-26","2017-09-26 12:39:00","Yesterday, I addressed the U.S. House of Representatives in honor of the Moser Group of Indian Trail and Wingate University, which are partnering to collect and transport relief supplies for hurricane victims.  This week, these two organizations will load two 18-wheeler trucks to deliver supplies directly to the affected areas. Commitment to charity and compassion for victims of natural disasters is truly what makes America great.","video","https://www.facebook.com/CongressmanPittenger/videos/1453811118034871/",NA,28,10,3,3,1,0,0,0
"congressmanpittenger","376142742468386_1454651841284132","Congressman Robert Pittenger","2017-09-26","2017-09-26 21:46:22","Today, I testified in support in support of full federal recognition for the Lumbee Tribe. This is an issue of fairness. In heritage, culture, and many times in their relationship with state and federal government, the Lumbee are every bit as Indian as any other tribe in this country. They deserve nothing less than FULL Federal Recognition.    My Lumbee Recognition Act (H.R. 3650) would grant full federal recognition, and today was the subject of a hearing by the House Natural Resources Subcommittee on Indian, Insular, and Alaska Native Affairs.","photo","https://www.facebook.com/CongressmanPittenger/photos/a.406945429388117.95715.376142742468386/1454651731284143/?type=3",NA,302,52,348,47,4,0,0,0
"congressmanpittenger","376142742468386_1455427667873216","Congressman Robert Pittenger","2017-09-27","2017-09-27 20:42:28","We are moving forward with #taxreform.  Really, our tax reform plan is an extraordinary jobs bill.  This is going to spark major economic growth.  Our plan allows hardworking Americans to keep more of their own money, brings our corporate tax rate in line with the rest of the industrialized world, and finally provides fairness for the small business owners who create the majority of new jobs.  Learn more at FairAndSimple.gop.","video","https://www.facebook.com/CongressmanPittenger/videos/1455427667873216/",NA,31,41,3,1,4,0,0,5
"congressmanpittenger","376142742468386_1455430777872905","Congressman Robert Pittenger","2017-09-28","2017-09-28 10:30:00",NA,"video","https://www.facebook.com/CongressmanPittenger/videos/1455430777872905/",NA,8,22,2,3,3,0,0,2
"congressmanpittenger","376142742468386_1456087104473939","Congressman Robert Pittenger","2017-09-28","2017-09-28 16:38:19","Today I was thrilled to see my friend Congressman Steve Scalise return to the House Chamber.  Steve publicly thanked God for the miracles and answers to prayer that saved his life, and I echo Speaker Paul Ryan's remark that “our prayers have been answered.”  Thank God for a real patriot in Steve Scalise.","photo","https://www.facebook.com/CongressmanPittenger/photos/a.406945429388117.95715.376142742468386/1456087011140615/?type=3",NA,120,13,5,14,0,0,0,2
"congressmanpittenger","376142742468386_1456874587728524","Congressman Robert Pittenger","2017-09-29","2017-09-29 17:00:04","Today, radical Islamic terror groups are exploiting the global banking system to finance their operations around the world. This poses a grave threat to our national security.   As Vice Chairman of the House Financial Services Subcommittee on Terrorism and Illicit Finance, I am leading a multinational effort to bolster authorities ability to work with banks in order to track and stop transactions involving terror groups. Like a business, terrorist organizations need money to operate, thus tracking and intercepting their financing is key to stopping future attacks.","photo","https://www.facebook.com/CongressmanPittenger/photos/a.406945429388117.95715.376142742468386/1456874474395202/?type=3",NA,27,14,3,0,0,0,0,0
"congressmanpittenger","376142742468386_1456901564392493","Congressman Robert Pittenger","2017-09-30","2017-09-30 14:00:00","Here’s what I told Spectrum News North Carolina about the House Republicans tax reform plan:  “This is really an extraordinary jobs bill.  This is about lighting a fire under our economy.  We’ve been so stagnant for a decade.  Now is the time, with these tax cuts, that will enable small and large businesses to expand and create more and better jobs.”  Click below to watch my full interview on tax reform, healthcare reform, and support for  President Donald J. Trump.","video","https://www.facebook.com/CongressmanPittenger/videos/1456901564392493/",NA,30,44,5,0,6,2,1,12
"congressmanpittenger","376142742468386_1459378627478120","Congressman Robert Pittenger","2017-10-02","2017-10-02 15:32:30","The tragedy in Las Vegas in absolutely heartbreaking. Such cruel, senseless violence reflects the wickedness present in our world, and the need to regain our moral footing.   We will await a full review to learn the facts regarding this attack. Tonight, I will join my fellow Members of the Congressional Prayer Caucus at a special service to pray for the victims and their families.","photo","https://www.facebook.com/CongressmanPittenger/photos/a.406945429388117.95715.376142742468386/1459378420811474/?type=3",NA,98,92,13,8,0,0,27,4
"congressmanpittenger","376142742468386_1460322467383736","Congressman Robert Pittenger","2017-10-03","2017-10-03 18:50:57","America has always been a beacon for human rights.  Yet according to a 2014 report by the Charlotte Lozier Institute, the U.S. is among just seven countries that permit elective abortion past twenty weeks.  We are in the Hall of Shame with China and North Korea, two oppressive regimes with no respect for human life or human rights.  Today, I urged Congress to join me in support of H.R. 36, the Pain-Capable Unborn Child Protection Act, which would ban late-term elective abortions.","video","https://www.facebook.com/CongressmanPittenger/videos/1460322467383736/",NA,110,65,27,11,2,1,2,23
"congressmanpittenger","376142742468386_1460401847375798","Congressman Robert Pittenger","2017-10-03","2017-10-03 22:04:53","PASSED! The U.S. House of Representatives just passed a bill banning ALL elective late-term abortions (those conducted after 20 weeks).   “H.R. 36, the Unborn Pain-Capable Child Protection Act,” which I co-sponsored, is a major victory for life! One that will save countless innocent lives and restore our national commitment to promoting and protecting human life.","photo","https://www.facebook.com/CongressmanPittenger/photos/a.406945429388117.95715.376142742468386/1460401847375798/?type=3",NA,433,136,86,128,0,1,7,74
"congressmanpittenger","376142742468386_1460947900654526","Congressman Robert Pittenger","2017-10-06","2017-10-06 15:30:00","Pastor and Mrs. Loran Livingston are celebrating 40 years of ministry at Central Church, Charlotte, NC.  On Tuesday, I addressed Congress in their honor.  God has used the Livingstons to grow and lead a church which truly impacts our community and the world.  Click below to watch my full speech.","video","https://www.facebook.com/CongressmanPittenger/videos/1460947900654526/",NA,58,43,12,14,1,2,0,7
"congressmanpittenger","376142742468386_1461092523973397","Congressman Robert Pittenger","2017-10-04","2017-10-04 17:02:14","All human life is precious and must be protected, yet sadly, it is too often taken for granted.    Yesterday, the U.S. House of Representatives took action by passing a bill that I co-sponsored which will ban ALL elective late-term abortions.","photo","https://www.facebook.com/CongressmanPittenger/photos/a.406945429388117.95715.376142742468386/1461092217306761/?type=3",NA,236,88,1029,47,2,1,4,32
"congressmanpittenger","376142742468386_1462108273871822","Congressman Robert Pittenger","2017-10-05","2017-10-05 19:51:18","Congress should examine any loopholes or vulnerabilities in current law that enable modifications to create an automatic weapon. But addressing gun violence will not be resolved with further gun restrictions.  Assault rifles are only used 27% of the time in public mass shootings. We need good data to identify threats and better laws to deny guns to the mentally ill.  Notwithstanding, we have a culture of violence in television, movies and games that has normalized these abhorrent acts.  The American people and Congress need to give thoughtful focus on mitigating this cultural evil.","status",NA,NA,88,130,9,7,1,1,0,36
"congressmanpittenger","376142742468386_1467164896699493","Congressman Robert Pittenger","2017-10-11","2017-10-11 13:08:11","Here’s what I told WBT's “Carolina Focus” about the House Republicans tax reform plan:  “There have been 4,500 companies that have left the United States to go overseas because we have the highest corporate tax rate in the industrialized world.  If our tax rate is 35%, and the tax rate for business in Ireland is 12.5%, you can be assured they’re going to head to Ireland, and they’ve done that, and they’ve gone to the U.K. and many other countries.  We’ve got to become competitive and bring these companies back, and create the dynamic where we are the country that flourishes for economic opportunity.  This is about jobs.”   Click below for my full interview.","video","https://www.facebook.com/CongressmanPittenger/videos/1467164896699493/",NA,29,35,9,5,0,0,0,3
"congressmanpittenger","376142742468386_1467387473343902","Congressman Robert Pittenger","2017-10-11","2017-10-11 20:00:00","Late term elective abortions are an egregious human rights violation. Recent advancements in science and medical research have revealed that 20 weeks old babies are fully capable of feeling pain. To subject innocent, defenseless babies to the excruciating pain of an abortion is barbaric and inhumane.  Last week, the people’s Representatives took action by passing the Pain-Capable Unborn Child Protection Act (H.R. 36), which bans elective abortions after 20 weeks post-fertilization. This is a HUGE win for life, and as one of the bill’s early co-sponsors, I am honored to have help led the effort.    Please take a second to hear my thoughts on this critically important issue: http://www.bladenjournal.com/opinion/14547/unborn-child-protection-act-is-critical","photo","https://www.facebook.com/CongressmanPittenger/photos/a.406945429388117.95715.376142742468386/1467383533344296/?type=3",NA,102,83,18,16,0,0,3,34
"congressmanpittenger","376142742468386_1468344686581514","Congressman Robert Pittenger","2017-10-12","2017-10-12 21:07:44","America must help those in need, including the tragedy in Puerto Rico, but we must do so responsibly.  When hardworking American families face unexpected expenses, they find offsets elsewhere in the family budget.  That’s real life, but not in Washington.  Just moments ago, Congress approved a $36.5 billion emergency funding package without making any effort to trim expenses elsewhere to help pay for it!   This legislation also takes no account of hardworking taxpayers, bailing out the failing National Flood Insurance Program without instituting a single reform to address the illogical practice of repeatedly rebuilding the same properties over and over.  Support for Puerto Rico?  Absolutely.  This bill?  Absolutely not without suitable accountability.    This legislation has no impact on ongoing funding for Hurricane Matthew disaster recovery in North Carolina.","status",NA,NA,47,99,8,3,3,1,2,26
"congressmanpittenger","376142742468386_1472383816177601","Congressman Robert Pittenger","2017-10-17","2017-10-17 12:37:29","For years, special interest groups and environmentalists have used “sue and settle” to coerce the EPA into making new rules and regulations behind closed doors. A favorite tactic of the Obama Administration, ‘sue and Settle’ was used to create an unprecedented numbers of burdensome regulations, including the Clean Power Plan.    Yesterday, EPA Administrator Scott Pruitt officially ended the practice of ‘sue and settle;’ a move that will lead to much needed transparency and accountability.  This important decision will put an end to years of back door judicial fiat and unchecked collusion between special interest environmentalist and unelected Washington bureaucrats.","link","http://www.washingtonexaminer.com/trumps-epa-sets-precedent-by-becoming-first-agency-to-end-sue-and-settle-practice/article/2637650","washingtonexaminer.com",63,58,4,3,0,1,0,26
"congressmanpittenger","376142742468386_1472709689478347","Congressman Robert Pittenger","2017-10-17","2017-10-17 18:57:13","President Obama’s severely flawed Iran Deal provides Iran with a viable path to continue developing nuclear weapons. Furthermore, the Deal permits Iran to continue development of long-range ballistic missiles that could reach anywhere in the world. This is madness! President Donald J. Trump is right to decertify this dangerous Deal.","link","http://www.foxnews.com/politics/2017/10/13/trump-to-decertify-iran-nuclear-deal.html","foxnews.com",35,30,2,3,1,1,0,13
"congressmanpittenger","376142742468386_1473591006056882","Congressman Robert Pittenger","2017-10-18","2017-10-18 18:01:37","President Obama believed Americans should be forced to violate their religious beliefs to fulfill his liberal agenda.  At last, we have a President who upholds the Constitution and stands for religious liberty. Last week, President Donald J. Trump ended an Obama-era mandate forcing employers to violate their religious beliefs with regard to contraceptives and birth control. Once again, our citizens will have the freedom to act consistent with their beliefs","status",NA,NA,221,207,25,28,6,2,2,150
"congressmanpittenger","376142742468386_1474495992633050","Congressman Robert Pittenger","2017-10-19","2017-10-19 18:04:41","Does anybody really believe this? Blue Cross has raised Obamacare premiums every year, totaling 176 percent since 2013. President Donald J. Trump did the right thing by upholding the Constitution, which clearly states that appropriations originate in the House, not the Oval Office. A federal court validated this position. Nonsense on the rhetoric from Blue Cross.","link","http://www.washingtonexaminer.com/north-carolina-insurer-says-rate-increases-would-be-near-zero-if-trump-hadnt-cut-off-payments/article/2637967","washingtonexaminer.com",73,88,17,1,13,3,3,24
"congressmanpittenger","376142742468386_1474666599282656","Congressman Robert Pittenger","2017-10-20","2017-10-20 19:09:00","Recently, I joined Fox & Friends to discuss the imminent terrorism threat in Europe.   Threat realities in Europe and the U.K. underscore that open-border policies are dangerous and deeply flawed. That’s why I commend Donald J. Trump for trying to secure our border as it’s not just an immigration issue, it’s a national security issue.","video","https://www.facebook.com/CongressmanPittenger/videos/1474666599282656/",NA,59,42,7,2,7,1,1,14
"congressmanpittenger","376142742468386_1477239212358728","Congressman Robert Pittenger","2017-10-22","2017-10-22 20:46:13","This past week, I called on both the House Oversight Committee and the House Committee on Energy and Commerce to hold hearings on the DEA's ability to crack down on suspicious shipments of opioids.  Opioid abuse is a crisis. We must ensure the DEA has the appropriate tools, authorities, and focus to combat this crisis.","status",NA,NA,18,26,2,1,1,0,0,2
"congressmanpittenger","376142742468386_1478051755610807","Congressman Robert Pittenger","2017-10-23","2017-10-23 19:03:39","This week, I am introducing legislation to end federal tax-exempt bonds for abortion providers. Under the current system, a loophole in the tax code allows abortion providers to use tax-exempt bonds to finance the construction of their facilities. These abortion bonds are unacceptable. Taxpayers shouldn’t be forced to support abortions and the Federal Government shouldn’t be providing any preferential tax treatment to abortion providers.  My legislation will put an end to this disturbing practice.","link","http://www.washingtontimes.com/news/2017/oct/22/abortion-clinics-built-with-federal-tax-law-aid/","washingtontimes.com",102,66,17,9,0,2,2,49
"congressmanpittenger","376142742468386_1478851802197469","Congressman Robert Pittenger","2017-10-24","2017-10-24 14:37:35","Last week, I wrote a column talking about America’s broken immigration system and the dire implications it is having on our citizens and our communities.    The United States clearly needs immigration reform and I believe that any effort must focus on securing our borders, upholding the rule of law and ending sanctuary cities. It’s time to put American workers and American communities first.    Click here to read my column on immigration reform: http://www.robesonian.com/opinion/columns/103974/time-to-fix-immigration-system","photo","https://www.facebook.com/CongressmanPittenger/photos/a.406945429388117.95715.376142742468386/1478851272197522/?type=3",NA,60,33,10,5,2,0,0,12
"congressmanpittenger","376142742468386_1479198035496179","Congressman Robert Pittenger","2017-10-25","2017-10-25 12:00:31","Hurricane Matthew recovery has been one of my top priorities since I-95 was underwater. The damage inflicted by the hurricane was catastrophic and many of those impacted are still in need of help.  This week I confirmed an additional $5.1 million in FEMA disaster assistance for Lumberton.   These funds will supplement the already $1.28 billion disaster in federal relief we’ve previously secured for North Carolina.","status",NA,NA,28,12,1,2,1,1,0,0
"congressmanpittenger","376142742468386_1480016682080981","Congressman Robert Pittenger","2017-10-25","2017-10-25 18:57:33","Today, I introduced a major pro-life bill that will prohibit abortion providers from using tax-exempt, taxpayer-backed bonds to finance their abortion facilities. These tax-free bonds are intended to finance schools, hospitals, and infrastructure, not abortion clinics. My bill, which is cosponsored by more than 50 bipartisan Members of Congress, will put an end to this disturbing practice.   Click here for more details: https://pittenger.house.gov/media-center/press-releases/pittenger-no-abortion-bonds-act","video","https://www.facebook.com/CongressmanPittenger/videos/1480016682080981/",NA,186,80,28,28,4,3,0,57
"congressmanpittenger","376142742468386_1480882015327781","Congressman Robert Pittenger","2017-10-26","2017-10-26 17:58:12","Today, The Wall Street Journal reported on my upcoming legislation that fights back against Chinese investments that threaten U.S. national security.   “Two influential Republican lawmakers plan to unveil legislation as soon as next week that would ratchet up scrutiny of foreign investment, taking aim in particular at Chinese technology deals.   The identical bills from Senate Majority Whip John Cornyn (R., Texas) and Rep. Robert Pittenger (R., N.C.), a prominent anti-China hawk, would broaden the authority of the Committee on Foreign Investment in the U.S. The panel, known as CFIUS, is a multiagency body that can advise the president to block foreign deals on national-security grounds….” Click below to continue reading","link","https://www.wsj.com/articles/gop-bill-seeks-tougher-vetting-of-foreign-investment-in-u-s-1508981854","wsj.com",14,13,2,0,0,0,0,0
"congressmanpittenger","376142742468386_1481895561893093","Congressman Robert Pittenger","2017-10-27","2017-10-27 18:48:06","Planned Parenthood and other abortion providers have been using a little-known tax code loophole to finance construction of their abortion clinics with tax-payer backed, tax-exempt municipal bonds. This is unacceptable. These tax-free bonds are intended to finance schools, hospitals, and infrastructure, not abortion clinics.  That is why, this week I introduced the ""No Abortion Bonds Act,"" a bipartisan bill that will put an end to this egregious practice.","link","http://www1.cbn.com/cbnnews/politics/2017/october/congressman-hopes-to-end-tax-free-bonds-for-construction-of-abortion-clinics","1.cbn.com",43,55,21,2,0,1,1,45
"congressmanpittenger","376142742468386_1484533004962682","Congressman Robert Pittenger","2017-10-30","2017-10-30 15:55:26","For decades, American taxpayers have unknowingly provided tax breaks that help lower the cost of building new abortion clinics. This is absolutely unacceptable. That is why last week, I introduced a bill which will put an end to this deeply disturbing practice.    To learn more, please take a few minutes to read my column in the Robesonian: http://www.robesonian.com/opinion/104178/bill-ends-tax-supported-abortions","photo","https://www.facebook.com/CongressmanPittenger/photos/a.406945429388117.95715.376142742468386/1484532751629374/?type=3",NA,132,89,24,26,2,2,2,33
"congressmanpittenger","376142742468386_1485443208204995","Congressman Robert Pittenger","2017-10-31","2017-10-31 15:10:06","This morning, MSNBC invited me on their show to discuss tax reform. However, all they wanted to talk about was Russia and the special counsel probe. Not surprising…   While the cable news pundits obsess over Russia, I’m focused on my job. This week we will be unveiling a major tax reform plan that will cut taxes for all Americans and spark much needed economic growth and job creation.","video","https://www.facebook.com/CongressmanPittenger/videos/1485443208204995/",NA,84,87,11,3,18,0,0,12
"congressmanpittenger","376142742468386_1485781484837834","Congressman Robert Pittenger","2017-10-31","2017-10-31 23:59:20","Today’s terrorist attack was a manifestation of pure evil and bears a disturbing resemblance to recent lone wolf attacks in Europe.  We must give law enforcement adequate data to know who is in communication with radical terrorists.    We must also work with our allies to cut off the money required to inspire, coordinate, and carry out these attacks.","status",NA,NA,35,28,6,0,0,0,7,3
"congressmanpittenger","376142742468386_1486279261454723","Congressman Robert Pittenger","2017-11-01","2017-11-01 15:04:00","China is acquiring American companies at a breathtaking pace. To be specific, between 2012 and 2016, Chinese investment in the US increased by over 900%. What is concerning is that much of the investment is controlled or directed by China’s Communist leadership as part of a strategy to target American infrastructure and companies that provide critical national security services.    For the past two years, I have been leading a bipartisan Congressional effort to increase U.S. scrutiny of specific Chinese investments which threaten our national security. In the coming days, I will being introducing new legislation to strengthen our procedures for blocking foreign investments which threaten America’s national security.","link","https://www.bloomberg.com/news/articles/2017-10-26/china-s-u-s-buying-spree-prompts-move-to-toughen-deal-reviews","bloomberg.com",22,20,9,1,3,1,0,0
"congressmanpittenger","376142742468386_1486625604753422","Congressman Robert Pittenger","2017-11-01","2017-11-01 22:34:11","For decades, American taxpayers have unknowingly provided tax breaks that help finance the construction of Planned Parenthood abortion clinics. This is unconscionable!   That’s why I recently introduced bipartisan legislation that will stop tax giveaways to Planned Parenthood and other abortion providers.","link","http://dailycaller.com/2017/11/01/stop-tax-giveaways-for-planned-parenthood/","dailycaller.com",61,92,12,5,3,0,2,47
"congressmanpittenger","376142742468386_1486681994747783","Congressman Robert Pittenger","2017-11-02","2017-11-02 11:50:00","Last Friday I had the privilege of meeting with about 100 History and Civics students at Scotland Senior High School. We spent almost an hour discussing current events and important political issues. Our future leaders are fully engaged and asked great questions!","photo","https://www.facebook.com/CongressmanPittenger/photos/a.406945429388117.95715.376142742468386/1486681411414508/?type=3",NA,31,19,1,2,3,0,0,2
"congressmanpittenger","376142742468386_1487442531338396","Congressman Robert Pittenger","2017-11-02","2017-11-02 20:58:50","What would you do with an extra $1,182?  That’s how much the typical American family will save each year under the “Tax Cuts and Jobs Act” my House Republicans colleagues and I introduced today.  Our historic tax cut isn’t just about letting you keep more of your hard-earned money.  Our historic tax cut will help you earn more money by boosting the economy and creating more good-paying jobs.  Click here to learn more:  https://goo.gl/9im5Eb","photo","https://www.facebook.com/CongressmanPittenger/photos/a.406945429388117.95715.376142742468386/1487442244671758/?type=3",NA,55,102,7,5,14,0,3,15
"congressmanpittenger","376142742468386_1490139547735361","Congressman Robert Pittenger","2017-11-05","2017-11-05 20:33:02","How grievous to learn of the church shooting in Sutherland Springs, TX. We won't know the motives until an investigation is completed.  Our deepest sympathy and prayers for surviving victims and family members. An unimaginable nightmare for that small Christian church and community.","link","http://www.foxnews.com/us/2017/11/05/mass-shooting-reported-at-texas-sutherland-springs-church.html","foxnews.com",20,46,16,0,0,0,35,12
