"screen_name","id","from_name","date","datetime","message","type","link","domain","likes_count","comments_count","shares_count","love_count","haha_count","wow_count","sad_count","angry_count"
"CongressmanJodyHice","651078621667264_1285122508262869","Congressman Jody Hice","2017-09-20","2017-09-20 16:21:44","Celebrating 25 years of service by the The Food Bank of Northeast Georgia. It's a testament to what can take place with community outreach. Grateful to be a part of this tremendous occasion.","link","http://onlineathens.com/local-news/2017-09-18/food-bank-northeast-georgia-celebrates-25-years-dedicates-new-space","onlineathens.com",15,10,1,0,0,0,0,0
"CongressmanJodyHice","651078621667264_1285384001570053","Congressman Jody Hice","2017-09-20","2017-09-20 22:11:46","A very happy new year to our Jewish friends and family as they celebrate #RoshHashanah. Wishing you all peace and happiness. L'Shana Tova!","photo","https://www.facebook.com/CongressmanJodyHice/photos/a.657903340984792.1073741828.651078621667264/1285383831570070/?type=3",NA,53,2,9,4,0,0,0,0
"CongressmanJodyHice","651078621667264_1286047101503743","Congressman Jody Hice","2017-09-21","2017-09-21 14:26:22","HAPPENING NOW: Join us at our 2017 Regional Job Fair until 4:00 p.m. at Georgia Piedmont Technical College in Covington. This event is designed to connect Georgia job seekers with good-paying local employers who are hiring in the fields of bio/life sciences, advanced/process manufacturing, film and tourism, and service industries.   Be sure to stop by sometime today!","video","https://www.facebook.com/covnews/videos/1508811625874409/",NA,33,1,0,0,0,0,0,0
"CongressmanJodyHice","651078621667264_1286083904833396","Congressman Jody Hice","2017-09-21","2017-09-21 15:13:51","This is the place to be!","video","https://www.facebook.com/selectnewton/videos/1533155683396904/",NA,13,2,0,0,0,0,0,0
"CongressmanJodyHice","651078621667264_1286244978150622","Congressman Jody Hice","2017-09-21","2017-09-21 19:25:34","With more than 1,400 job seekers and 58+ employers, it was a phenomenal day in Newton County at the 2017 regional job fair. In the video with me is Dr. Irvin Clark, VP of Economic development and dean of the main campus, and Ralph Staffins, Newton County chamber president. Check it out below!","video","https://www.facebook.com/CongressmanJodyHice/videos/1286244978150622/",NA,72,11,6,1,0,0,0,0
"CongressmanJodyHice","651078621667264_1287232968051823","Congressman Jody Hice","2017-09-22","2017-09-22 18:09:45","Happy Fall, y'all! #FirstDayofFall","photo","https://www.facebook.com/CongressmanJodyHice/photos/a.657903340984792.1073741828.651078621667264/1287232891385164/?type=3",NA,53,27,3,4,0,0,0,0
"CongressmanJodyHice","651078621667264_1291373884304398","Congressman Jody Hice","2017-09-26","2017-09-26 20:37:35","Last week, I was humbled to participate in Georgia Military College’s (GMC) Constitution Day parade. As our Nation’s most fundamental document, the Constitution is the cornerstone of our liberties and freedoms and speaks to the tenacity of Americans. “We the People” should remember every day how important it is to uphold the principles, values, and character upon which America was founded. At the ceremony, I was pleased to honor Lieutenant Colonel Edward Shelor for his retirement from GMC and welcome him as the newest addition to Team Hice.","photo","https://www.facebook.com/CongressmanJodyHice/photos/a.657903340984792.1073741828.651078621667264/1291372820971171/?type=3",NA,37,5,5,2,0,0,0,0
"CongressmanJodyHice","651078621667264_1292256164216170","Congressman Jody Hice","2017-09-27","2017-09-27 18:43:40","I really like what I’m seeing so far with the tax reform framework. This bold, new proposal is just the first step toward creating a system that is both competitive and fair. I’m pleased that it will empower Americans to take home more of their hard-earned paychecks and enable businesses of all sizes to grow and thrive. We're moving in the right direction, and I'm proud to be a part of this long overdue reform effort. As the tax-writing committees continue to flesh out the specific legislation, I look forward to being a partner in the discussion so we can send a final bill to President Trump’s desk as soon as possible.","link","https://hice.house.gov/news/documentsingle.aspx?DocumentID=1572","hice.house.gov",169,87,14,1,5,2,0,21
"CongressmanJodyHice","651078621667264_1293053574136429","Congressman Jody Hice","2017-09-28","2017-09-28 15:05:15","Happy birthday to Louisville resident Rosa Lee Lewis who turned 99 earlier this month! She celebrated at the Jefferson County Leisure Center with cake and ice cream. Congratulations, Rosa Lee - I hope you had a fantastic day!","photo","https://www.facebook.com/CongressmanJodyHice/photos/a.669936796448113.1073741829.651078621667264/1293053554136431/?type=3",NA,96,11,2,4,0,2,0,0
"CongressmanJodyHice","651078621667264_1293159244125862","Congressman Jody Hice","2017-09-28","2017-09-28 17:42:24","Easily one of the most powerful moments I've experienced on the House Floor as a Member of Congress. Incredibly moving. God truly answered our prayers. #TeamScalise","video","https://www.facebook.com/ABCNews/videos/10156367391363812/",NA,223,22,0,42,2,0,0,0
"CongressmanJodyHice","651078621667264_1293997437375376","Congressman Jody Hice","2017-09-29","2017-09-29 17:59:03","Join me in welcoming Paul Reviere as the newest Sheriff of Lincoln County! We are praying for you to follow in the footsteps of the recently passed Sheriff Bruce Beggs and take on this responsibility with wisdom and courage. Best of luck to you.","photo","https://www.facebook.com/CongressmanJodyHice/photos/a.669936796448113.1073741829.651078621667264/1293996967375423/?type=3",NA,24,0,1,0,0,0,0,0
"CongressmanJodyHice","651078621667264_1294174500691003","Congressman Jody Hice","2017-09-29","2017-09-29 23:04:02","Wishing a happy and holy #YomKippur to all those celebrating at home and abroad. G'mar Chatimah Tova!","photo","https://www.facebook.com/CongressmanJodyHice/photos/a.669936796448113.1073741829.651078621667264/1294174394024347/?type=3",NA,16,0,0,0,0,0,0,0
"CongressmanJodyHice","651078621667264_1296173823824404","Congressman Jody Hice","2017-10-02","2017-10-02 12:16:47","Heartbreaking tragedy this morning in Las Vegas. My deepest sympathies and condolences to the victims, wounded, and their families. Praying for healing.‬","status",NA,NA,60,37,1,0,0,0,20,2
"CongressmanJodyHice","651078621667264_1296522777122842","Congressman Jody Hice","2017-10-02","2017-10-02 22:10:56","On Friday, I traveled to Tennille to meet with representatives from Community Health Care Systems, Inc. (CHCS) and toured its mobile unit. CHCS is a federally qualified health center that provides medical services in Johnson, Washington, Jefferson, Warren, Hancock, Glascock, and Baldwin counties. During the visit, I was also given a telehealth demonstration.   Afterwards, I joined Jon Jackson, a veteran who served for 11 years with the U.S. Army Rangers and is now the Executive Director of Comfort Farms, for a tour of its crisis agriculture center. Comfort Farms prepares veterans and students for careers in sustainable food production that integrate economic profitability, environmental stewardship, and healing through the use of agri-therapy and a time-tested natural approach. What remarkable facilities. Thanks for having me!","photo","https://www.facebook.com/CongressmanJodyHice/photos/a.657903340984792.1073741828.651078621667264/1296522513789535/?type=3",NA,41,7,3,4,0,0,0,0
"CongressmanJodyHice","651078621667264_1296525193789267","Congressman Jody Hice","2017-10-02","2017-10-02 22:15:31","Dee Dee and I are deeply saddened by the terrible tragedy that took place last night in Las Vegas. Our heartfelt prayers go out to the victims, their families, and all those impacted by this senseless act of evil. As we grieve, may God provide comfort and relief to all those suffering.   The heroic actions taken by the Las Vegas Metropolitan first responders, law enforcement, medical personnel, and off-duty officers saved so many lives, and I’m thankful for their continued service. In the face of this cowardly act, Americans everywhere must stand united as one. Tragedy reveals the worst and the best of humankind, and I’m grateful for all of the everyday heroes who helped others and showed us the goodness and light in the world.","video","https://www.facebook.com/wsbtv/videos/10156087929250695/",NA,31,33,0,4,0,0,15,1
"CongressmanJodyHice","651078621667264_1296949890413464","Congressman Jody Hice","2017-10-03","2017-10-03 12:52:54","I understand that many of you who are in need of assistance with a federal agency may find it difficult to visit one of my district offices, whether that difficulty is due to schedules, transportation, or other personal matters. That is why, in an effort to conveniently provide 10th District residents with help, I have a full-time team who regularly hosts Mobile Office Hours at various locations throughout our district.   This month, I encourage you to stop by Reese-Hyman American Legion in Warrenton, the Oglethorpe County Board of Commissioners Office, or the Wrightsville-Johnson Chamber of Commerce if you need assistance navigating the bureaucratic red tape of federal agencies.","photo","https://www.facebook.com/CongressmanJodyHice/photos/a.657903340984792.1073741828.651078621667264/1296949503746836/?type=3",NA,17,11,4,0,0,0,0,5
"CongressmanJodyHice","651078621667264_1297262870382166","Congressman Jody Hice","2017-10-03","2017-10-03 22:10:47","BREAKING: The House just advanced Micah's Law.   The atrocity that ends the life of an unborn baby when that child can live outside the womb and feel the pain inflicted by violent procedures is unconscionable. I firmly believe that all human life at every stage of its development is worthy of protection. Unfortunately, the United States remains one of only seven nations, in the same company as North Korea and China, that allows abortions after 20 weeks – a practice that kills thousands of innocent babies each year.  Today, I’m pleased that H.R. 36, the Pain-Capable Unborn Child Protection Act, which will stem late-term abortions at 20 weeks or greater, advanced through the House. This incremental measure is an improvement over existing policy and mirrors our own state law banning abortions at 20 weeks or later. I’m hopeful that additional pro-life legislation, like H.R. 490, the Heartbeat Protection Act, and H.R. 586, the Sanctity of Human Life, will be considered as we continue our efforts to defend the defenseless and champion the cause for life.","photo","https://www.facebook.com/CongressmanJodyHice/photos/a.657903340984792.1073741828.651078621667264/1297262287048891/?type=3",NA,310,130,72,49,0,1,4,49
"CongressmanJodyHice","651078621667264_1297995146975605","Congressman Jody Hice","2017-10-04","2017-10-04 21:02:23","Today, on the House Floor, I honored the life of Nolan Watson, a Georgia resident and veteran of the United States Air Force, who joined our Heavenly Father earlier this year after battling kidney cancer for over a decade. In 1966, Mr. Watson was one of the heroic men during the Cold War who was involved in the cleanup efforts after a B-52 bomber collided with a KC-135 tanker over Palomares, Spain, releasing four hydrogen bombs. After his service, Mr. Watson suffered from severe medical problems and was ultimately diagnosed with kidney cancer in 2002.   Nolan is survived by his loving wife, Nona, who has been a fierce and dedicated advocate for her husband, working tirelessly throughout the years to garner the recognition these young men deserved for the sacrifices they made in responding to this unfortunate disaster.  Nolan Watson is a hero who deserves the respect of all Americans and will be sorely missed by so many in the community.","video","https://www.facebook.com/CongressmanJodyHice/videos/1297995146975605/",NA,58,7,5,2,0,0,6,0
"CongressmanJodyHice","651078621667264_1298098960298557","Congressman Jody Hice","2017-10-05","2017-10-05 00:25:28","Great talking timber and natural resources with University of Georgia's Warnell School of Forestry's Dean Dale Greene today. Thanks for coming by. #GoDawgs","photo","https://www.facebook.com/CongressmanJodyHice/photos/a.669936796448113.1073741829.651078621667264/1298098516965268/?type=3",NA,42,9,0,1,0,0,0,0
"CongressmanJodyHice","651078621667264_1298505450257908","Congressman Jody Hice","2017-10-05","2017-10-05 13:40:57","With my Service Academy application deadline right around the corner, I encourage students to learn more about the process of earning an academy nomination. These students are the future leaders of our country, and I’m grateful for their sincere desire to serve our Nation.   If you know any bright and motivated students interested in receiving a first-rate undergraduate education, while giving back to America by serving on active duty as a military officer, then please share this information with them. Please visit my website below or call my academy director, Carolyn Dallas, at (706) 201-5968 for more information.","link","https://hice.house.gov/constituent-services/serviceacademynominations.htm","hice.house.gov",11,0,2,0,0,0,0,0
"CongressmanJodyHice","651078621667264_1302805889827864","Congressman Jody Hice","2017-10-10","2017-10-10 21:25:17","Balancing environmental protection with economic growth is vital for future generations. Unfortunately, President Obama’s top-down approach under the Clean Power Plan was deeply flawed and yet another blatant regulatory overreach by his administration.   Instead of protecting the public interest, it picked winners and losers, jeopardized jobs, and curbed economic growth. I applaud President Trump and EPA Administrator Scott Pruitt for reversing course, which will ultimately create new jobs and spur the energy sector.","link","http://www.washingtonexaminer.com/pruitt-signs-proposed-rule-to-repeal-obama-era-climate-plan/article/2637036","washingtonexaminer.com",95,57,9,9,1,1,0,55
"CongressmanJodyHice","651078621667264_1302837349824718","Congressman Jody Hice","2017-10-10","2017-10-10 22:28:56","With so much going on currently before Congress, fostering thoughtful discussion, where my constituents and I can talk about the issues of the day, is of the utmost importance. That’s why I regularly host Telephone Town Halls, which are an effective, large-scale effort to stay in touch with you as part of my communication outreach. With that in mind, I hope 10th District residents will join me on Thursday, October 12th at approximately 6:15 p.m. for a vibrant conversation. I value any opportunity to hear from 10th District residents, and I look forward to speaking with many of you then. If you would like to participate in the conference call, RSVP by clicking on the link below and you’ll receive the call. Constituents can also join the conference by calling (855) 756-7520 and using the passcode 37024# at any point during the event.","link","https://hice.house.gov/forms/form/?ID=16","hice.house.gov",36,23,8,0,5,0,0,1
"CongressmanJodyHice","651078621667264_1303302149778238","Congressman Jody Hice","2017-10-11","2017-10-11 13:01:24","Incredibly proud of this event. Thank you again to all of our partners who helped make it a success.","video","https://youtu.be/yHx6JIdMRwg",NA,10,1,0,0,0,0,0,0
"CongressmanJodyHice","651078621667264_1303440236431096","Congressman Jody Hice","2017-10-11","2017-10-11 16:28:14","When my constituents get good-paying jobs and local entrepreneurs flourish, it positively impacts our entire community. A new tax reform blueprint was unveiled last month aimed at creating a lower tax rate for all Americans, especially the middle-class. These tax reform principles will also encourage businesses to grow and restore prosperity for this generation and those to come.  While the plan is still being written in legislative language, I want to hear from you. Please take just 60 seconds to respond to my short survey below.  Be sure to share this with other #GA10 residents.","link","https://hice.house.gov/forms/form/?ID=15","hice.house.gov",59,47,14,5,4,1,0,7
"CongressmanJodyHice","651078621667264_1303568029751650","Congressman Jody Hice","2017-10-11","2017-10-11 20:00:15","Thoughtful devotionals open our hearts & guide us in His wisdom. I'm thankful for this decision. May God continue to bless our great nation.","link","https://www.facebook.com/speakerryan/posts/1495363060512215","facebook.com",84,42,0,10,4,2,0,2
"CongressmanJodyHice","651078621667264_1303672723074514","Congressman Jody Hice","2017-10-11","2017-10-11 23:24:12","Each year, I am fortunate enough to nominate several bright, young students from the 10th District for appointments to our country’s most prestigious service academies, including the U.S. Military Academy, U.S. Air Force Academy, U.S. Naval Academy, and U.S. Merchant Marine Academy. I am incredibly proud of all our servicemen and women, and I am overjoyed to have the privilege of participating in this process.   If you are considering applying to a service academy, or know an interested 10th District student who wants more information, please encourage them to visit my website below or call my academy director, Carolyn Dallas, at (706) 201-5968 for more information.   Applications and all necessary documents must be submitted to my Monroe District Office by this Friday, October 13th at 5 p.m.","link","https://hice.house.gov/constituent-services/serviceacademynominations.htm","hice.house.gov",7,4,0,0,0,0,0,1
"CongressmanJodyHice","651078621667264_1304418256333294","Congressman Jody Hice","2017-10-12","2017-10-12 20:31:00","Did you hear? I'm hosting another Telephone Town Hall tonight at 6:15 p.m. to update #GA10 and take questions from many of you. Make sure to comment below if you have any questions, and I’ll do my best to get to them. Thousands of you will be receiving the call, but if you don’t and you want to participate, please call (855) 756-7520 and use the passcode 37024# at any point to join.","video","https://www.facebook.com/CongressmanJodyHice/videos/1304418256333294/",NA,41,39,10,3,0,0,0,6
"CongressmanJodyHice","651078621667264_1304466932995093","Congressman Jody Hice","2017-10-12","2017-10-12 21:49:31","My Telephone Town Hall will be getting started soon. Remember, if you have a question for me, comment below!","video","https://www.facebook.com/CongressmanJodyHice/videos/1304418256333294/",NA,34,36,0,1,3,0,0,1
"CongressmanJodyHice","651078621667264_1310920819016371","Congressman Jody Hice","2017-10-20","2017-10-20 18:26:41","Nothing better than being with young #GA10 learners. I thoroughly enjoyed reading ""A is for America"" to kids at Kiddie Academy of Dacula yesterday. Thanks for having me!","photo","https://www.facebook.com/CongressmanJodyHice/photos/a.657903340984792.1073741828.651078621667264/1310920139016439/?type=3",NA,50,10,5,1,0,0,1,0
"CongressmanJodyHice","651078621667264_1310925969015856","Congressman Jody Hice","2017-10-20","2017-10-20 18:36:04","Proud to have district offices in Monroe, Milledgevillle, and Thomson, Georgia. Stop by anytime if you need assistance with a federal agency.","photo","https://www.facebook.com/CongressmanJodyHice/photos/a.651519951623131.1073741827.651078621667264/1310925855682534/?type=3",NA,150,33,2,4,2,0,0,2
"CongressmanJodyHice","651078621667264_1313428442098942","Congressman Jody Hice","2017-10-23","2017-10-23 19:37:43","October is National Breast Cancer Awareness Month. Join me in honoring all those who've lost their lives to breast cancer and recognize the courageous survivors who are still fighting it.","photo","https://www.facebook.com/CongressmanJodyHice/photos/a.657903340984792.1073741828.651078621667264/1313428315432288/?type=3",NA,27,14,7,2,0,1,0,3
"CongressmanJodyHice","651078621667264_1313517382090048","Congressman Jody Hice","2017-10-23","2017-10-23 22:12:02","Last week while in Dacula, I read “A is for America” to young students at Kiddie Academy and met with a network of business owners at Hamilton Mill to provide a legislative update. I wholeheartedly believe that the best ideas come from individuals like you, and I want to thank you again for your continued engagement.   At my “Coffee with Your Congressman” event in Greene County, I enjoyed sharing an update on the latest from Washington and engaging in thoughtful discussion with local residents. The conversation included topics such as tax reform, my work on the House Oversight and Government Reform Committee, the latest on repealing and replacing Obamacare, and much more. A big thank you to Robert and Rhonda Bradley, owners of Fishtales, for their hospitality. I hope to see many of you at the next coffee!","photo","https://www.facebook.com/CongressmanJodyHice/photos/a.657903340984792.1073741828.651078621667264/1313516545423465/?type=3",NA,54,10,0,1,0,0,0,4
"CongressmanJodyHice","651078621667264_1314047052037081","Congressman Jody Hice","2017-10-24","2017-10-24 13:16:33","My offices in Monroe, Milledgeville, and Washington, D.C. are all looking for hardworking interns to join Team Hice next Spring. Internships are open to motivated, detail-oriented, and energetic college students with excellent written and oral communication skills. Applications are due by Friday, November 10th at 5:00 p.m.   More information about internship opportunities can be found here: https://hice.house.gov/forms/internships.   Interested students can also email questions to nathan.barker@mail.house.gov regarding D.C.-based internships or ben.stout@mail.house.gov regarding district-based internships.","photo","https://www.facebook.com/CongressmanJodyHice/photos/a.657903340984792.1073741828.651078621667264/1314045235370596/?type=3",NA,24,1,9,1,0,0,0,0
"CongressmanJodyHice","651078621667264_1314400315335088","Congressman Jody Hice","2017-10-24","2017-10-24 21:54:57","It's Down Syndrome Awareness Month. Every semester, my DC office is thrilled to #celebrateability by participating in the George Mason LIFE Program. Here are a few of our outstanding past interns!","photo","https://www.facebook.com/CongressmanJodyHice/photos/a.657903340984792.1073741828.651078621667264/1314399345335185/?type=3",NA,84,4,4,9,0,0,0,0
"CongressmanJodyHice","651078621667264_1314423621999424","Congressman Jody Hice","2017-10-24","2017-10-24 22:33:49","BIG NEWS: Today, the House Oversight Committee, of which I am a member, and the House Judiciary Committee opened a joint investigation into the decisions made by the Obama-era Department of Justice regarding the “matter” – not investigation – into the dealings of former Democratic presidential candidate, Hillary Clinton. Simply put, justice must be blind.  Below are Chairmen Gowdy and Goodlatte’s thoughts:  “Our justice system is represented by a blind-folded woman holding a set of scales. Those scales do not tip to the right or the left; they do not recognize wealth, power, or social status. The impartiality of our justice system is the bedrock of our republic and our fellow citizens must have confidence in its objectivity, independence, and evenhandedness. The law is the most equalizing force in this country. No entity or individual is exempt from oversight.   “Decisions made by the Department of Justice in 2016 have led to a host of outstanding questions that must be answered. These include, but are not limited to:  • FBI’s decision to publicly announce the investigation into Secretary Clinton’s handling of classified information but not to publicly announce the investigation into campaign associates of then-candidate Donald Trump; • FBI’s decision to notify Congress by formal letter of the status of the investigation both in October and November of 2016; • FBI’s decision to appropriate full decision making in respect to charging or not charging Secretary Clinton to the FBI rather than the DOJ; and • FBI’s timeline in respect to charging decisions.  “The Committees will review these decisions and others to better understand the reasoning behind how certain conclusions were drawn. Congress has a constitutional duty to preserve the integrity of our justice system by ensuring transparency and accountability of actions taken.”  More- https://oversight.house.gov/release/gowdy-goodlatte-open-investigation-decisions-made-doj-2016/","status",NA,NA,241,152,36,21,5,1,3,40
"CongressmanJodyHice","651078621667264_1314899388618514","Congressman Jody Hice","2017-10-25","2017-10-25 12:58:15","There's no question that North Korea is a threat to America. Yesterday, the House voted to turn on the screws by imposing critical sanctions against the rogue states that support its efforts with the passage of H.R. 3898.   We all know the heartbreaking story of Otto Warmbier.  It's time to address the North Korea’s unfortunate history of human rights violations and threat to global security. I’m glad that the House was able to come together to pass this vital legislation.","link","http://www.washingtonexaminer.com/house-passes-otto-warmbier-act-to-sanction-north-koreas-backers-in-china/article/2638503","washingtonexaminer.com",32,16,3,1,0,0,2,0
"CongressmanJodyHice","651078621667264_1315110878597365","Congressman Jody Hice","2017-10-25","2017-10-25 18:34:11","The end goal is tax cuts and tax reform, and this budget is the vehicle to get there. It's past time to fix our broken tax code.","video","https://www.facebook.com/CongressmanJodyHice/videos/1315110878597365/",NA,105,44,10,5,1,1,0,14
"CongressmanJodyHice","651078621667264_1315248155250304","Congressman Jody Hice","2017-10-25","2017-10-25 21:56:51","The IRS has a mismanagement problem that starts at the top and flows to the bottom infecting everywhere it goes.","video","https://www.facebook.com/CongressmanJodyHice/videos/1315248155250304/",NA,140,44,20,3,3,5,0,11
