"screen_name","id","from_name","date","datetime","message","type","link","domain","likes_count","comments_count","shares_count","love_count","haha_count","wow_count","sad_count","angry_count"
"congressmanpittenger","376142742468386_1352717198144264","Congressman Robert Pittenger","2017-06-08","2017-06-08 20:58:00","Here in North Carolina, we’ve lost 50% of our banks due to Dodd-Frank, a failed Obama-era financial reform.  We are slogging through the slowest economic recovery in 70 years because small businesses can’t access the capital needed to create jobs.  Taxpayers are still expected to fund massive Wall Street bailouts.  Maintaining the status quo isn’t acceptable.   This afternoon, the U.S. House of Representatives approved the Financial CHOICE Act (H.R. 10), which I co-sponsored, to properly regulate the financial industry while removing unnecessary restrictions on community banks and credit unions.  We also impose the toughest penalties in history for Wall Street fraud and end Wall Street bailouts.  This is about creating opportunity for ordinary Americans.  Click here to learn more: http://bit.ly/2rRi6rA.","photo","https://www.facebook.com/CongressmanPittenger/photos/a.406945429388117.95715.376142742468386/1352717198144264/?type=3",NA,26,28,8,0,0,1,0,9
"congressmanpittenger","376142742468386_1353682104714440","Congressman Robert Pittenger","2017-06-09","2017-06-09 19:39:37","The #FinancialCHOICEAct places more punitive damages on Wall Street than ever before, for any type of violation of fraud.  This legislation is very tough on Wall Street, but it opens up Main Street and allows small banks and credit unions to really be functional again.  Learn more in my interview with Spectrum News North Carolina.","video","https://www.facebook.com/CongressmanPittenger/videos/1353682104714440/",NA,14,26,2,0,3,0,0,6
"congressmanpittenger","376142742468386_1357860364296614","Congressman Robert Pittenger","2017-06-13","2017-06-13 16:01:42","Obamacare for your community bank and credit union.  That’s the easiest way to explain President Obama’s financial regulation legislation known as Dodd-Frank.  Under Obamacare, many lost their doctors.  Under Dodd-Frank, many lost their local banks.  Last week, House Republicans joined me in passing the Financial CHOICE Act, which I co-sponsored and helped introduce, to properly regulate the financial system while ending taxpayer bailouts, increasing accountability, and supporting economic growth.  Read more in my column for Sunday’s The Robesonian.","link","http://www.robesonian.com/opinion/99867/dodd-frank-strangled-banks","robesonian.com",39,56,4,0,6,1,0,27
"congressmanpittenger","376142742468386_1358114674271183","Congressman Robert Pittenger","2017-06-13","2017-06-13 23:00:00","Thousands of Christians, Yazidis, and other religious and ethnic minorities continue to suffer brutal persecution and genocide at the hands of ISIS. Only a few weeks ago, this evil manifested itself again when ISIS soldiers opened fire on Coptic Christians in Egypt, killing 29, including 10 children.     Last week, the U.S. House unanimously passed the Iraq and Syria Genocide Emergency Relief and Accountability Act (H.R. 390), which I cosponsored along with Congressman Chris Smith, to provide relief to ISIS victims.  President Donald J. Trump and House Republicans remain committed to not only eliminating ISIS, but also providing humanitarian relief to those who have suffered from their diabolic violence.”","link","https://www.youtube.com/watch?v=jIZfyVkNjRQ&feature=youtu.be","youtube.com",22,13,2,2,0,0,2,0
"congressmanpittenger","376142742468386_1358127070936610","Congressman Robert Pittenger","2017-06-13","2017-06-13 21:37:20","Every single day, my phone rings with veterans who are not receiving appropriate care at VA facilities.  On average, my staff is actively involved in over 500 veterans’ cases.  We know many VA employees are dedicated public servants, but the current system is so focused on protecting incompetent employees that everyone suffers.  The Department of Veterans Affairs Accountability and Whistleblower Protection Act, which passed today with a strong bipartisan majority, will restore accountability at the VA, and I am excited it is now on the way to President Donald J. Trump.","link","http://go.usa.gov/xNVG6","go.usa.gov",15,4,0,1,0,0,0,0
"congressmanpittenger","376142742468386_1359047137511270","Congressman Robert Pittenger","2017-06-14","2017-06-14 18:56:42","Congressman Steve Scalise is a wonderful person, a close friend, and a great leader.  Most mornings, I am in the gym with Steve.  Today’s shooting is incredibly sad, but I am also so grateful for the extraordinarily brave Capitol Police officers who put themselves in harm’s way to prevent a massacre.  Without their valor, today could have been much worse.   Please join me in praying for quick healing for Steve, the police officers, and the Congressional aide who was injured.  Today’s news was very upsetting.  We will continue our work in behalf of the American people.  This morning, I joined WBT to discuss the shooting.  Click below to listen to my full interview.","video","https://www.facebook.com/CongressmanPittenger/videos/1359047137511270/",NA,34,12,2,0,0,0,1,3
"congressmanpittenger","376142742468386_1359049237511060","Congressman Robert Pittenger","2017-06-14","2017-06-14 21:30:00","The man who shot Majority Whip Congressman Steve Scalise, two Capitol Police officers, and a Congressional aide this morning was a former Bernie Sanders campaign volunteer and member of several anti-Republican groups.  That prompted Neil Cavuto to ask me about the current lack of civil discourse, and nastiness and violence at town halls.     Here was my reply:  “There’s a great verse in the Old Testament that says, ‘come, let us reason together,’  We need to reason.  This is a process.  We have a great democracy.  We have a great opportunity for discourse, but that needs to continue.  Yes, we have sharp differences, but we need to show respect one for another.”  Click below for my full interview with Fox Business.","video","https://www.facebook.com/CongressmanPittenger/videos/1359049237511060/",NA,71,63,10,1,0,0,1,17
"congressmanpittenger","376142742468386_1364113217004662","Congressman Robert Pittenger","2017-06-19","2017-06-19 15:45:07","America is a nation of laws.  Our illegal immigration problem is the result of President Obama and other government leaders failing to enforce our existing laws.  On Thursday, President Donald J. Trump and DHS Secretary Kelly rescinded President Obama’s “Deferred Action for Parents of Americans” (DAPA) amnesty program, which had already been blocked by federal courts.   This decision sends a strong message that America will no longer tolerate the lack of enforcement.  The majority of Americans, who choose to follow and live their lives in accord with the law, and who do not support a pathway to citizenship, certainly applaud this decision.","link","http://www.mcclatchydc.com/news/politics-government/white-house/article156486779.html","mcclatchydc.com",106,44,11,14,1,1,1,38
"congressmanpittenger","376142742468386_1364213590327958","Congressman Robert Pittenger","2017-06-20","2017-06-20 15:45:00","With full support I embrace President Donald J. Trump's correct decision to restrict economic activities with the Cuban military monopoly, which was only supporting a tyrannical government and not helping the Cuban people.  Friday’s decision will re-assert pressure on the oppressive Castro regime.  President Obama’s decision to cozy up to human rights and freedom-of-conscience abusers was un-American and counterproductive.  President Trump’s new policy reaffirms that America stands with and supports those countries who respect liberty and freedom","link","http://www.foxnews.com/politics/2017/06/16/trump-says-hes-canceling-obamas-one-sided-cuba-deal.html","foxnews.com",49,38,0,0,0,0,1,21
"congressmanpittenger","376142742468386_1364215230327794","Congressman Robert Pittenger","2017-06-20","2017-06-20 10:30:00","In addition to last week’s shooting of Majority Whip Steve Scalise, this year we’ve seen dozens of town halls erupt into uncontrollable mobs, Hollywood push the boundary of what’s acceptable, a comedian posing in a disturbingly graphic photo depicting a beheaded President Trump, a Central Park play with despicable political references, and a celebrity threatening to blow up the White House.  Many, it seems, have lost their ability to respectfully disagree and refrain from vitriolic rhetoric against “the other side.”   On Sunday, The Robesonian published my column on the need for a return to civility.  Click below to read.","link","http://www.robesonian.com/opinion/100058/a-return-to-civility-is-needed","robesonian.com",135,81,24,5,8,1,1,2
"congressmanpittenger","376142742468386_1364351933647457","Congressman Robert Pittenger","2017-06-19","2017-06-19 20:43:43","Today I hosted more than 100 Members of Parliament and other officials from 28 nations for the 8th Parliamentary Intelligence-Security Forum in Riga, Latvia.  Our 8th forum brought together a diverse group of nations – including Egypt, Israel, and the Vatican – to discuss joint efforts to fight radical Islamic terrorism.  Speakers included top experts on financial crimes, cyber, Intelligence, and other relevant topics . . . all with a focus on collaborative efforts to help defeat Islamic jihad.   Response to our forum was very positive, with representatives from seven countries inviting me to host similar forums in their country.","photo","https://www.facebook.com/CongressmanPittenger/photos/a.406945429388117.95715.376142742468386/1364351496980834/?type=3",NA,27,11,4,2,0,1,0,3
"congressmanpittenger","376142742468386_1365336953548955","Congressman Robert Pittenger","2017-06-21","2017-06-21 20:00:00","This week, I’m working to increase federal funding for job training and economic growth in rural communities.  Our bipartisan legislation increases the percentage of funds North Carolina can set aside for rural students and gives more flexibility to target Career & Technical Education funding to local economic needs.  As the Congressman for Lumberton, North Carolina, Wadesboro, North Carolina, Maxton, North Carolina,  Hamlet, North Carolina, Hope Mills, North Carolina, Bladenboro, North Carolina, and many vibrant rural communities, my goal is to help rural residents better connect with the millions of good-paying jobs that go unfilled due to a lack of qualified workers.    The “Strengthening Career and Technical Education for the 21st Century Act” will come up for a vote on Thursday.  #whyCTE","photo","https://www.facebook.com/CongressmanPittenger/photos/a.406945429388117.95715.376142742468386/1365336953548955/?type=3",NA,8,5,0,0,0,0,0,0
"congressmanpittenger","376142742468386_1365339586882025","Congressman Robert Pittenger","2017-06-20","2017-06-20 20:00:00","What good is a federal job training program if it doesn’t prepare you for jobs actually available in your community?  This week, I’m working on bipartisan legislation that would ensure local business leaders are involved in developing local career and technical education programs and goals.  Federal CTE legislation hasn’t been updated in over a decade and gives too much control to Washington bureaucrats.  Our bipartisan reforms would ensure federal tax dollars are more wisely spent by partnering with local leaders to focus on in-demand jobs.   #whyCTE","photo","https://www.facebook.com/CongressmanPittenger/photos/a.406945429388117.95715.376142742468386/1365339586882025/?type=3",NA,14,2,2,2,0,0,0,0
"congressmanpittenger","376142742468386_1365348813547769","Congressman Robert Pittenger","2017-06-22","2017-06-22 15:30:00","Who knows more about local job opportunities – local businesses, or Washington bureaucrats?  Current federal law on Career & Technical Education requires states to negotiate performance goals with the Secretary of Education.  This week, I’m working on bipartisan reform to incorporate input from local educators, parents, students, workforce development boards, community leaders, and local businesses into CTE planning.  We need to support jobs training programs, but it is vital those programs are designed for local needs and local jobs.  The “Strengthening Career and Technical Education for the 21st Century Act” is bipartisan legislation to improve federal jobs training programs and help grow the economy.  #whyCTE","photo","https://www.facebook.com/CongressmanPittenger/photos/a.406945429388117.95715.376142742468386/1365348813547769/?type=3",NA,2,5,1,0,0,0,0,0
"congressmanpittenger","376142742468386_1365466386869345","Congressman Robert Pittenger","2017-06-20","2017-06-20 23:00:00","Small businesses create 70% of new jobs.  Local community banks traditionally catered to the small business market, but the Obama-era Dodd-Frank financial regulatory system smothered community banks and credit unions, leading North Carolina to lose 50% of our banks since 2010.  This makes it harder for small business owners to access the capital and credit needed to expand and create jobs.  Earlier this month, my House Committee on Financial Services colleagues and I passed common sense legislation to properly regulate the financial system while providing relief to community banks, which in turn will help small businesses and job growth.  Learn more in my recent interview with Spectrum News North Carolina.","video","https://www.facebook.com/CongressmanPittenger/videos/1365466386869345/",NA,20,27,0,0,0,0,1,6
"congressmanpittenger","376142742468386_1366160086799975","Congressman Robert Pittenger","2017-06-21","2017-06-21 14:50:40","As Scotland County’s Congressman, I am committed to supporting economic growth, which is why I met yesterday with Economic Development Director Mark Ward to discuss opportunities for attracting new companies and new jobs.  We also discussed the opioid epidemic.  Over the past year, I’ve helped pass 18 bipartisan bills with $1 billion in funding to address the opioid epidemic, and I will continue to remain engaged.","photo","https://www.facebook.com/CongressmanPittenger/photos/a.406945429388117.95715.376142742468386/1366160086799975/?type=3",NA,20,8,0,0,0,0,0,0
"congressmanpittenger","376142742468386_1366450900104227","Congressman Robert Pittenger","2017-06-26","2017-06-26 14:00:00","Congratulations to Eagle Scout Quinn Schneider, who received a prestigious appointment to the United States Naval Academy!  Quinn helped gather oral histories of World War Two veterans for a Library of Congress project, produced a documentary to help the public understand the challenges veterans face after leaving service, and helped lead his high school cross country team to the state championship in 2015.","photo","https://www.facebook.com/CongressmanPittenger/photos/a.406945429388117.95715.376142742468386/1366450900104227/?type=3",NA,43,3,1,2,0,0,0,0
"congressmanpittenger","376142742468386_1366452470104070","Congressman Robert Pittenger","2017-06-27","2017-06-27 14:00:00","Congratulations to JROTC Cadet Eyan Bowers on his prestigious appointment to the U.S. Naval Academy.  Eyan’s ambition is to “serve this country I know and love.”  In high school, he prepared by becoming a leader in JROTC and was recognized for his leadership potential by the Military Officers Association of America.","photo","https://www.facebook.com/CongressmanPittenger/photos/a.406945429388117.95715.376142742468386/1366452470104070/?type=3",NA,64,11,6,13,0,1,0,0
"congressmanpittenger","376142742468386_1366453266770657","Congressman Robert Pittenger","2017-06-28","2017-06-28 14:00:00","Congratulations to Parkwood High School - NC graduate Stephen Harold, who received a prestigious appointment to the  US Air Force Academy (Official)!  Stephen had the unique experience of growing up in two cultures (Waxhaw and Indonesia) as his parents faithfully serve with the JAARS, Inc. missionary organization.  As we face global challenges, he cross-cultural experience will be an invaluable asset to the U.S. Air Force.","photo","https://www.facebook.com/CongressmanPittenger/photos/a.406945429388117.95715.376142742468386/1366453266770657/?type=3",NA,42,4,3,1,0,0,0,0
"congressmanpittenger","376142742468386_1370966272986023","Congressman Robert Pittenger","2017-06-26","2017-06-26 18:31:40","The Supreme Court today performed a solemn duty too often ignored by lower courts . . . they issued a ruling based on the law and not on political activism.  Ordinary Americans already knew what the Supreme Court today reminded the lower courts:  The federal government and President Donald J. Trump have responsibility for national security, and a thorough and fair vetting of refugees is part of that responsibility.","link","https://www.reuters.com/article/us-usa-court-immigration-idUSKBN19H1OR","reuters.com",108,43,11,16,2,0,0,25
"congressmanpittenger","376142742468386_1371939516222032","Congressman Robert Pittenger","2017-06-27","2017-06-27 20:00:00","Amid all the noise on health care reform, most media outlets are missing one key reality:  What we have in Obamacare today doesn’t provide healthcare!  United Healthcare, Humana, Aetna, and Anthem are all pulling out of Obamacare markets.  Here in North Carolina, Blue Cross has seriously considered pulling out.  Premiums in North Carolina have gone up 176 percent just since 2013.   So the reality is, the American people don’t have healthcare.  It reminds me of that song by Johnny Lee, the country-western song, “Looking for Love in All the Wrong Places.”  There is no love found in Obamacare for the American people.   Click below to watch my full interview with MSNBC Alex Witt.","video","https://www.facebook.com/CongressmanPittenger/videos/1371939516222032/",NA,69,72,27,4,3,2,1,21
"congressmanpittenger","376142742468386_1372093602873290","Congressman Robert Pittenger","2017-06-28","2017-06-28 10:30:00","Did you know there are currently more than 6 million job openings nationwide?  Unfortunately, many of these jobs remain unfilled due to the “skills gap” in our labor force.  Part of the problem is that in Washington’s swamp, federal job training programs haven’t been updated in over a decade.  Otherwise capable students aren’t being trained for in-demand, 21st century jobs.   Last week, we took steps to help drain the swamp by passing multiple, bipartisan pieces of legislation to address the skills gap, increase funding for job training in rural communities, and equip local workers to help grow the economy.  Learn more in my column for The Robesonian.","link","http://www.robesonian.com/opinion/100318/job-skills-needed-not-jobs","robesonian.com",43,31,4,1,3,0,0,6
"congressmanpittenger","376142742468386_1372144916201492","Congressman Robert Pittenger","2017-06-27","2017-06-27 23:00:00","Both the American Health Care Act and the Senate’s proposed health care reform include major victories for the pro-life community, defunding Planned Parenthood and keeping your tax dollars from being used to support abortion.  Earlier today, I met with House Speaker Paul Ryan to express gratitude for his pro-life leadership, and to discuss the importance of retaining these provisions in the final bill.  As a committed #prolife leader, I will keep this issue at the forefront.","status",NA,NA,72,99,9,10,0,2,3,74
"congressmanpittenger","376142742468386_1373252272757423","Congressman Robert Pittenger","2017-06-28","2017-06-28 21:40:52","Opponents of repealing and replacing Obamacare repeatedly point to the CBO.  But the CBO score is based on an inaccurate 2016 estimate of how many Americans will purchase Obamacare.  The numbers are old!  If you use their January 2017 update, Republican legislation to repeal and replace Obamacare would result in only 2 million fewer on the individual market by 2026.  Much of that loss can be attributed to Americans choosing other options, as is their right.  After all, Republican health care reform involves restoring your freedom to choose the health coverage best for you and your family.   Humana, Aetna, United Healthcare, and Blue Cross have all exited Obamacare markets.  Premiums in North Carolina have increased 176% since 2013.  Constituents tell me of deductibles so high the insurance is practically worthless.  Maintaining the status quo is not acceptable.","link","https://www.forbes.com/sites/theapothecary/2017/06/28/real-cbo-bcra-headline-no-individual-market-losses-in-2018-but-up-1-million-from-2017/#1da39632601d","forbes.com",40,61,15,2,1,0,0,27
"congressmanpittenger","376142742468386_1374195479329769","Congressman Robert Pittenger","2017-06-29","2017-06-29 13:25:48","Did you know that Charlotte’s Providence Presbyterian Church and Cemetery is celebrating their 250th anniversary?  Yesterday, we took a moment on the House floor to recognize this tremendous achievement and to congratulate the congregation on 250 years of faithful service to the community.  As I told my colleagues, God bless this wonderful congregation of believers.","video","https://www.facebook.com/CongressmanPittenger/videos/1374195479329769/",NA,40,17,5,0,1,3,0,0
"congressmanpittenger","376142742468386_1374593019290015","Congressman Robert Pittenger","2017-06-29","2017-06-29 21:31:49","Sanctuary cities put American citizens at risk, forcing police to look the other way and allowing dangerous criminals to go free.  This is madness, not compassion.  Today, I helped pass the No Sanctuary for Criminals Act (H.R. 3003), which will withhold certain federal grants from sanctuary cities and allow crime victims to sue sanctuary cities.  Earlier, I spoke in favor of Kate’s Law (H.R. 3004), which also passed the House and will enhance penalties for deported felons who return to the United States without permission.  #SaveAmericanLives","video","https://www.facebook.com/CongressmanPittenger/videos/1374593019290015/",NA,128,52,18,19,1,1,6,28
"congressmanpittenger","376142742468386_1375289702553680","Congressman Robert Pittenger","2017-06-30","2017-06-30 14:18:51","The American Health Care Act defunds Planned Parenthood and prevents the use of tax credits to pay for abortion.  As a leader in the Pro-Life Caucus, I am working to ensure these important pro-life protections remain in the final legislation.  Earlier this week, I discussed the issue with Speaker Paul Ryan.  Learn more in this report from EWTN News Nightly.","video","https://www.facebook.com/CongressmanPittenger/videos/1375289702553680/",NA,58,55,6,8,0,0,3,35
"congressmanpittenger","376142742468386_1375578842524766","Congressman Robert Pittenger","2017-07-04","2017-07-04 11:00:00","""We hold these Truths to be self-evident, that all men are created equal, that they are endowed by their Creator with certain unalienable rights, that among these are Life, Liberty, and the Pursuit of Happiness.""  Therein is the most important statement conveying the foundation of our freedoms and liberties, authored by Thomas Jefferson and adopted along with the full Declaration of Independence by the thirteen original colonies on July 4, 1776.  May we each persevere with all vigilance to maintain the liberties and freedoms so many fought and died for in our behalf.","photo","https://www.facebook.com/CongressmanPittenger/photos/a.406945429388117.95715.376142742468386/1375578842524766/?type=3",NA,58,28,7,10,0,0,0,2
"congressmanpittenger","376142742468386_1376837639065553","Congressman Robert Pittenger","2017-07-01","2017-07-01 22:49:21","Earlier today, I spoke to over 100,000 people at the pro-democracy “Grand Gathering of Iranians for #FreeIran” rally in Villepinte, France.  When our forefathers met 241 years ago to craft the Declaration of Independence, they pledged their lives, fortunes, and sacred honor.  From that, we found Life, Liberty, and the Pursuit of Happiness, and that’s what we want for Iran today.     Also speaking were Speaker Newt Gingrich, Mayor Rudy Giuliani, Senator Joe Lieberman, Senator Robert Torricelli,  General Jack Keane, John Bolton (ambassador), and many Members of Parliament from around the world.","link","https://youtu.be/kWXLXt58ksE","youtu.be",28,32,7,3,0,0,0,2
"congressmanpittenger","376142742468386_1381904155225568","Congressman Robert Pittenger","2017-07-06","2017-07-06 18:50:34","China is the key to any response to North Korea’s provocative ICBM test, and our strategy must reflect that.  If China wants to continue playing both sides, then we must begin applying pressure on China.  Learn more in my interview with MSNBC's Ali Velshi.","video","https://www.facebook.com/CongressmanPittenger/videos/1381904155225568/",NA,21,19,3,0,0,0,0,0
"congressmanpittenger","376142742468386_1382638345152149","Congressman Robert Pittenger","2017-07-08","2017-07-08 13:00:00","Over the past six months, I have been working hard to advance our conservative agenda in partnership with my  House Republicans colleagues and President Donald J. Trump.  The media doesn’t seem to want to cover our success, or the more than 150 significant bills we’ve passed.  Take a look at this video about our major accomplishments that will help Make America Great Again!","video","https://www.facebook.com/CongressmanPittenger/videos/1382638345152149/",NA,61,74,19,4,1,0,0,33
