"screen_name","id","from_name","date","datetime","message","type","link","domain","likes_count","comments_count","shares_count","love_count","haha_count","wow_count","sad_count","angry_count"
"DianaDeGette","110757973488_10155003681458489","Congresswoman Diana DeGette","2017-01-03","2017-01-03 17:41:38","Thanks to all who expressed outrage against the attempted gutting of the House ethics office. They backed down!","link","http://degette.house.gov/media-center/press-releases/degette-to-vote-against-new-house-rules-package-a-shameless-power-grab","degette.house.gov",776,57,38,56,1,5,1,2
"DianaDeGette","110757973488_10155006213968489","Congresswoman Diana DeGette","2017-01-04","2017-01-04 16:05:53","Protecting the gains made under the Affordable Care Act is in the interest of all Americans. But many in the GOP want to repeal the ACA without a replacement, which would leave millions without coverage, cause premiums to skyrocket for the rest, and damage local hospitals. President Obama spoke with Democratic members of the House and Senate today to get us fired up and ready to go for this fight.","photo","https://www.facebook.com/DianaDeGette/photos/a.153523148488.111218.110757973488/10155006213968489/?type=3",NA,217,40,17,17,0,0,2,5
"DianaDeGette","110757973488_10155009862318489","Congresswoman Diana DeGette","2017-01-05","2017-01-05 21:51:29","Partners in the fight to preserve the Affordable Care Act sent a powerful message to the #GOP today: We will #ProtectOurCare. My fellow Pro-Choice Caucus Co-Chair Louise Slaughter, House Democratic Leader Nancy Pelosi, Cecile Richards of Planned Parenthood,  Ilyse Hogue of NARAL and other members of the Pro-Choice Caucus joined me in reminding Republicans of the injustices women faced in the years before the ACA that severely limited our access to fair and affordable health coverage. We can’t let Republicans turn back the clock. I want all women, and men who care about women, who are worried right now about this issue to know that we are fighting for you. Women deserve more than this from Congress. Make your voices heard","photo","https://www.facebook.com/DianaDeGette/photos/a.153523148488.111218.110757973488/10155009862318489/?type=3",NA,173,21,20,27,0,0,0,1
"DianaDeGette","110757973488_10155011836623489","Congresswoman Diana DeGette","2017-01-06","2017-01-06 15:45:05","At our #ProtectOurCare event yesterday, I was honored to lead an incredible group of speakers, including the presidents of NARAL and Planned Parenthood, in calling on Republicans to keep their hands off of the #ACA and preserve the fair and affordable coverage that the law has ensured for millions of women. Watch this video and join us in the fight!","video","https://www.facebook.com/DianaDeGette/videos/10155011836623489/",NA,157,17,14,14,0,0,0,1
"DianaDeGette","110757973488_10155012875028489","Congresswoman Diana DeGette","2017-01-06","2017-01-06 21:54:30","The Affordable Care Act is more than a law, it’s a lifeline for millions of people across the country. As Republicans prepare to repeal the #ACA, let’s let them know exactly what they’ll be taking away from Coloradans. Tell me how the ACA has benefited you or your family right here on my Facebook page with the hashtag #ProtectOurCareCO.","photo","https://www.facebook.com/DianaDeGette/photos/a.153523148488.111218.110757973488/10155012875028489/?type=3",NA,101,61,39,5,0,0,1,3
"DianaDeGette","110757973488_10155024881018489","Congresswoman Diana DeGette","2017-01-10","2017-01-10 20:52:04","Many of you have questions about what the changes in Washington mean for you and your families. I’ll do my best to answer them in a #FacebookLive Q&A next Tuesday at 4 p.m. MT. To kick off this important discussion, write your policy-related questions below; you can also chime in during the chat. I’m excited to connect with you. Please note that this page is an official resource, not affiliated with any campaign, and therefore questions about upcoming elections are not permissible.","photo","https://www.facebook.com/DianaDeGette/photos/a.153523148488.111218.110757973488/10155024881018489/?type=3",NA,49,14,21,2,1,0,0,0
"DianaDeGette","110757973488_10155033805653489","Congresswoman Diana DeGette","2017-01-12","2017-01-12 22:45:07","I’m honored today to join the House Committee on Energy and Commerce subcommittees on the Environment and Health, as well as to continue serving as the top Democrat on the Oversight and Investigations Subcommittee. We’ll cover issues affecting everyday life in Colorado and our country’s long-term future. I’ll work across the political aisle whenever possible to ensure that we’re headed in the right direction, but I also won’t shy away from a fight – the stakes are too high.","photo","https://www.facebook.com/DianaDeGette/photos/a.153523148488.111218.110757973488/10155033805653489/?type=3",NA,102,7,3,6,0,0,2,0
"DianaDeGette","110757973488_10155037327698489","Congresswoman Diana DeGette","2017-01-16","2017-01-16 13:45:02","This #MLKDay, the march towards fairness and equality continues – but we have come a long way. Despite setbacks, we will fight even harder, knowing that we have love and light on our side. Dr. King put it best: “The arc of the moral universe is long, but it bends towards justice.”","photo","https://www.facebook.com/DianaDeGette/photos/a.153523148488.111218.110757973488/10155037327698489/?type=3",NA,59,6,4,8,0,0,0,0
"DianaDeGette","110757973488_10155037420923489","Congresswoman Diana DeGette","2017-01-13","2017-01-13 22:08:30","This morning I did a live interview on C-SPAN’s Washington Journal, taking viewer calls and engaging in a spirited discussion about the dramatic costs of #ACA repeal – and what we’re doing to fight it. Watch here, and let me know what you think.","link","https://www.c-span.org/video/?421019-4%2Fwashington-journal-representative-diana-degette-discusses-future-affordable-care-act","c-span.org",193,21,26,17,0,0,1,4
"DianaDeGette","110757973488_10155043047743489","Congresswoman Diana DeGette","2017-01-15","2017-01-15 16:12:44","Today's the day! Join us to protest the heedless rush to repeal the Affordable Care Act.","event","https://www.facebook.com/events/150264875464256/",NA,133,11,0,10,1,0,0,1
"DianaDeGette","110757973488_10155043617458489","Congresswoman Diana DeGette","2017-01-15","2017-01-15 20:04:30","Our First Stand. Rally to save the #ProtectOurCare","video","https://www.facebook.com/DianaDeGette/videos/10155043617458489/",NA,172,31,31,25,2,0,0,1
"DianaDeGette","110757973488_10155044729088489","Congresswoman Diana DeGette","2017-01-16","2017-01-16 03:13:50","Thank you so much to the nearly 500 constituents who turned out today to protest the reckless rush toward repealing the Affordable Care Act. It was especially touching that so many of you stood outside to listen on loudspeakers since we'd filled every seat n the house!  Rep. Ed Perlmutter, Lt. Gov. Donna Lynne, Speaker Crisanta Duran and SEIU Local President Ron Ruggiero really got the crowd fired up. That's what we need -- we may be in for a long fight.","photo","https://www.facebook.com/DianaDeGette/photos/a.10155044728208489.1073741834.110757973488/10155044729088489/?type=3",NA,285,18,29,30,1,3,0,1
"DianaDeGette","110757973488_10155045944763489","Congresswoman Diana DeGette","2017-01-16","2017-01-16 13:59:31",NA,"photo","https://www.facebook.com/DianaDeGette/photos/a.10150734907053489.425607.110757973488/10155045939918489/?type=3",NA,126,13,6,16,1,0,0,1
"DianaDeGette","110757973488_10155049482588489","Congresswoman Diana DeGette","2017-01-17","2017-01-17 17:08:25","Our community was infused with the spirit of #MLK as we gathered for Denver’s annual #Marade. We still need to draw strength and inspiration from Dr. King’s work to ensure equal rights and civil liberties for everyone. He faced unimaginable adversity and paid the highest price, but succeeded in changing our nation and our world through the power of principle. We can protect and advance his legacy if we stand united in the values we hold dear.","photo","https://www.facebook.com/DianaDeGette/photos/a.153523148488.111218.110757973488/10155049482588489/?type=3",NA,45,4,1,5,0,0,2,0
"DianaDeGette","110757973488_10155049568778489","Congresswoman Diana DeGette","2017-01-17","2017-01-17 17:52:05","Join me for a #FacebookLive Q&A TODAY at 4 p.m. MT. After a big weekend rallying to prevent repeal of the #ACA, I’m excited to answer questions about how this step and other proposed changes in Washington will affect you and your families. Submit your questions in advance in the comments below or ask them live via the chat. Please note that this page is an official resource, not affiliated with any campaign, and therefore questions about upcoming elections are not permissible.","photo","https://www.facebook.com/DianaDeGette/photos/a.153523148488.111218.110757973488/10155024881018489/?type=3",NA,29,12,0,3,0,0,0,0
"DianaDeGette","110757973488_10155050335618489","Congresswoman Diana DeGette","2017-01-17","2017-01-17 23:00:41","Starting now: join us for a FB Live Q&A. Please type your questions below.","video","https://www.facebook.com/DianaDeGette/videos/10155050335618489/",NA,33,61,3,4,0,0,0,1
"DianaDeGette","110757973488_10155050392758489","Congresswoman Diana DeGette","2017-01-17","2017-01-17 23:15:38",NA,"video","https://www.facebook.com/DianaDeGette/videos/10155050392758489/",NA,50,27,4,9,0,0,0,0
"DianaDeGette","110757973488_10155050579803489","Congresswoman Diana DeGette","2017-01-18","2017-01-18 00:49:14","Thank you to all who joined our Facebook Live Q&A today, submitting questions in advance or during the chat. It was a good conversation. Apologies to those who experienced technical difficulties; we look forward to connecting with you more smoothly in the future.","status",NA,NA,35,12,0,0,0,0,0,0
"DianaDeGette","110757973488_10155052571248489","Congresswoman Diana DeGette","2017-01-18","2017-01-18 17:26:54","“It was a joy visiting my alma mater, Denver South High School, to engage with a diverse group of students about what a Trump presidency means for their future. Understandably, many are worried about the recent rise nationwide of hate speech and anti-immigrant sentiment, along with proposed changes to immigration and refugee policy. I wanted them to know that I will continue fighting hard to ensure that all students in this country are able to realize their dreams. Thanks to these bright kids for sharing their perspectives during this enlightening and uplifting visit.","photo","https://www.facebook.com/DianaDeGette/photos/a.153523148488.111218.110757973488/10155052571248489/?type=3",NA,103,10,1,16,0,0,0,0
"DianaDeGette","110757973488_10155055462828489","Congresswoman Diana DeGette","2017-01-19","2017-01-19 14:55:42","#WomenAreWatching, President-elect Trump. That’s why Louise Slaughter and I are sending you a letter, signed by 174 House members, urging you to be a president who values women in policy and principle. We ask that you reconsider plans to repeal the #ACA, defund Planned Parenthood and strip away our reproductive rights. The women (and men who care about women) of this country won’t stand for it. We suggest you read this letter carefully.","link","https://www.washingtonpost.com/news/powerpost/wp/2017/01/19/house-democrats-to-donald-trump-the-women-of-america-are-watching/?utm_term=.124660fa3347","washingtonpost.com",292,24,33,23,1,3,0,1
"DianaDeGette","110757973488_10155071481463489","Congresswoman Diana DeGette","2017-01-23","2017-01-23 20:50:24","Saturday’s #WomensMarch is an experience I will never forget. I hit the streets of DC with half a million others, including an estimated 2,000 Coloradans, to advocate for reproductive rights, equal pay, affordable health care, social justice and more. Our calls were echoed by people in rallies around the world, including an estimated 100,000 in Denver. It should now be clear to President Trump that #WomenAreWatching, and we will hold him and his administration accountable.","photo","https://www.facebook.com/DianaDeGette/photos/a.153523148488.111218.110757973488/10155071481463489/?type=3",NA,134,17,5,16,0,1,0,1
"DianaDeGette","110757973488_10155071522968489","Congresswoman Diana DeGette","2017-01-23","2017-01-23 21:01:32","#TrumpGlobalGag signing today proves yet again how long the road ahead will be to reach gender equality. #WomenAreWatching","photo","https://www.facebook.com/DianaDeGette/photos/a.153523148488.111218.110757973488/10155071522968489/?type=3",NA,197,101,305,2,3,5,101,316
"DianaDeGette","110757973488_10155077566753489","Congresswoman Diana DeGette","2017-01-25","2017-01-25 01:41:13","Today the House of Representatives passed #HR7, the “No Taxpayer Funding for Abortion and Abortion Insurance Full Disclosure Act of 2017,”  by a vote of 238-183, with just three Democrats supporting it. I led the debate on the House floor against this extreme bill, which will further limit access to abortion for millions of women. These restrictions against federal funding, imposed year after year through the Hyde Amendment, deny reproductive services to low-income women, who often need them the most. I have long opposed Hyde, co-sponsoring the EACH Woman Act, which would end this unfair policy once and for all. While this bill’s passage in the House is dismaying, it’s likely that the Senate will again stop it.  And I will continue fighting against the GOP’s extreme, anti-choice agenda because women are worth it.","link","https://www.c-span.org/video/?c4651746%2Fcongresswoman-degette-speaks-hr-7","c-span.org",545,146,44,43,1,2,15,71
"DianaDeGette","110757973488_10155081259933489","Congresswoman Diana DeGette","2017-01-25","2017-01-25 22:46:06","So sad to hear of the passing of my friend #MaryTylerMoore, a tireless advocate for diabetes prevention through the JDRF, embryonic stem cell research and an inspiration to every young girl with big dreams. I’ll always remember your wise words: ""Take chances, make mistakes. That's how you grow. Pain nourishes your courage. You have to fail in order to practice being brave.” You may no longer be with us, but you’ll continue to turn the world on with your smile.","photo","https://www.facebook.com/DianaDeGette/photos/a.153523148488.111218.110757973488/10155081259933489/?type=3",NA,132,3,4,27,0,0,27,0
"DianaDeGette","110757973488_10155082010718489","Congresswoman Diana DeGette","2017-01-26","2017-01-26 03:59:04","‎I condemn in the strongest terms the two executive orders issued by the President Trump today. They will roll back progress on immigration policy that our country has made during the past eight years.   Notably, these orders would reinstate the Secure Communities program that Colorado has already tried and soundly rejected. They direct the Department of Homeland Security not only to build a wall we don't need, but also to build more detention centers and hold individuals there in violation of their due process rights.  And they threaten to withhold federal funds from any jurisdiction that doesn't agree with the new draconian policies, putting millions of dollars for Colorado in question.  President Trump's orders today do not reflect long-held American values. They do not reflect Colorado values. Over the last few years, as fear of immigrants and refugees has increased in some places, Coloradans have pulled together and made ‎clear that we will not be divided. While saddened by this day, I know we will come together again as a community and do what is right.","photo","https://www.facebook.com/DianaDeGette/photos/a.153523148488.111218.110757973488/10155082010718489/?type=3",NA,670,79,66,38,0,0,30,11
"DianaDeGette","110757973488_10155083539273489","Congresswoman Diana DeGette","2017-01-26","2017-01-26 16:46:44","Thanks to the more than 200 Coloradans who attended my listening session on saving the Affordable Care Act. Your stories about what this coverage means for you and your families inspired and energized our continued efforts to stop a reckless repeal by President Trump and the GOP. The #ACA is more than a law: It’s a lifeline that has allowed millions to achieve health, quality of life and peace of mind. We won’t give it up without a fight. If you were unable to attend last night’s event, you can share your stories on my Facebook page with the hashtag #ProtectOurCareCO. I’d love to hear from you.","photo","https://www.facebook.com/DianaDeGette/photos/a.153523148488.111218.110757973488/10155083539273489/?type=3",NA,178,16,14,23,0,0,0,0
"DianaDeGette","110757973488_10155086157498489","Congresswoman Diana DeGette","2017-01-27","2017-01-27 15:37:07","Under the plan announced yesterday, every American will be paying for President Trump's wall whether we like it or not. #Trumponomics","photo","https://www.facebook.com/DianaDeGette/photos/a.153523148488.111218.110757973488/10155086157498489/?type=3",NA,129,43,119,1,3,2,8,131
"DianaDeGette","110757973488_10155086300218489","Congresswoman Diana DeGette","2017-01-27","2017-01-27 16:34:25",NA,"link","https://www.washingtonpost.com/national/health-science/white-house-stops-ads-outreach-for-last-days-of-aca-enrollment/2017/01/26/a2f92682-e420-11e6-ba11-63c4b4fb5a63_story.html?utm_term=.469266856765","washingtonpost.com",27,5,0,2,1,0,0,18
"DianaDeGette","110757973488_10155087275558489","Congresswoman Diana DeGette","2017-01-27","2017-01-27 23:12:24","President Trump's executive order on refugees slammed the door to safety, security and hope for millions around the world. America has always been a beacon to oppressed people, and while this extreme policy is a major setback, it doesn't change America's inclusive spirit. Can President Trump look refugees like Omran Daqneesh, the Syrian boy in this photo, in the eye and say they’re not welcome? Could anyone with a conscience?","photo","https://www.facebook.com/DianaDeGette/photos/a.153523148488.111218.110757973488/10155087275558489/?type=3",NA,196,71,89,5,1,0,125,67
"DianaDeGette","110757973488_10155089087773489","Congresswoman Diana DeGette","2017-01-28","2017-01-28 15:45:42","Lots of #AlternativeFacts have been used to support the repeal of the #ACA, but in today’s Denver Post, I set the record straight by outlining the many ways the law benefits Americans and exactly what we have to lose if it goes away. http://www.denverpost.com/2017/01/27/repealing-the-affordable-care-act-would-endanger-americans-health/","link","http://www.denverpost.com/2017/01/27/repealing-the-affordable-care-act-would-endanger-americans-health/","denverpost.com",413,28,60,32,1,0,11,2
"DianaDeGette","110757973488_10155096428288489","Congresswoman Diana DeGette","2017-01-31","2017-01-31 00:52:11","Tonight I joined my Democratic colleagues from the Senate and House on the steps of the U.S. Supreme Court to demand that President Trump end his unconstitutional, discriminatory and dangerous #MuslimBan. Leaders around the world, from presidents to the Pope, have condemned this edict, which has slammed the door to safety for millions and jeopardized U.S. national security by alienating Muslims in the United States and abroad. We won’t stand by while the White House undermines our nation’s values, and we’ll use all legal channels available to resist this irresponsible move.","photo","https://www.facebook.com/DianaDeGette/photos/a.153523148488.111218.110757973488/10155096428288489/?type=3",NA,1027,126,74,114,2,3,12,2
"DianaDeGette","110757973488_10155099457808489","Congresswoman Diana DeGette","2017-01-31","2017-01-31 20:22:05","I’m speaking out to protect our health care system during three Energy and Commerce Committee hearings this week. At today’s meeting of the Oversight and Investigations Subcommittee, on which I’m ranking member, fellow Democrats joined me in defending Medicaid against dishonest attacks and discussed ways to strengthen this crucial program.","photo","https://www.facebook.com/DianaDeGette/photos/a.153523148488.111218.110757973488/10155099457808489/?type=3",NA,286,33,12,26,0,1,0,0
"DianaDeGette","110757973488_10155102176783489","Congresswoman Diana DeGette","2017-02-01","2017-02-01 19:42:10","#BlackHistoryMonth is a chance to take stock of changes over time to American society. From afar, the centuries-long legacy of African Americans is a dynamic and often tragic patchwork, but a closer look reveals the individual stories of brave men and women who dared to challenge the status quo and fought for acknowledgement, representation and equality. This month should not only be an occasion to honor the accomplishments of black Americans, but also an opportunity to recognize those currently engaged in the ongoing quest for justice.","photo","https://www.facebook.com/DianaDeGette/photos/a.153523148488.111218.110757973488/10155102176783489/?type=3",NA,68,2,7,4,0,0,0,0
"DianaDeGette","110757973488_10155104618478489","Congresswoman Diana DeGette","2017-02-02","2017-02-02 16:44:21","I will never stand for dishonest attacks on the healthcare reforms that have helped our community and our nation thrive. At yesterday’s Health Subcommittee hearing focused on Medicaid, I told the story of a previously uninsurable Denver resident whose life was drastically improved thanks to this crucial program’s expansion through the ACA. #ProtectOurCare","video","https://www.youtube.com/watch?v=97aL0dDE41Q",NA,233,29,12,27,0,0,0,0
"DianaDeGette","110757973488_10155105514743489","Congresswoman Diana DeGette","2017-02-02","2017-02-02 22:09:30","At today's Energy and Commerce hearing, our third of the week, I once again defended the Affordable Care Act from false and misleading charges against its effectiveness. Republicans have vowed to repeal the #ACA for nearly seven years, but in that time they have failed to create any viable replacement plan. Meanwhile, millions of people have gained coverage through the law. Is it worth it to the GOP to make good on their threats even when it means disaster for our country? I challenge them to examine their consciences, where they will easily find the answer. #ProtectOurCare","photo","https://www.facebook.com/DianaDeGette/photos/a.153523148488.111218.110757973488/10155105514743489/?type=3",NA,365,62,24,35,0,0,1,3
"DianaDeGette","110757973488_10155111014863489","Congresswoman Diana DeGette","2017-02-04","2017-02-04 19:57:57","Many thanks to the nearly 1000 constituents who came to our community forum in Denver today. We covered a lot of ground, from the President's distressing recent Executive Orders on immigration and refugees to how the debate on the Affordable Care Act is changing thanks to public pressure on Congress. Stay engaged!","photo","https://www.facebook.com/DianaDeGette/photos/a.153523148488.111218.110757973488/10155111014863489/?type=3",NA,487,31,31,37,1,3,0,0
"DianaDeGette","110757973488_10155118738863489","Congresswoman Diana DeGette","2017-02-07","2017-02-07 14:27:00","As a founding member of the Congressional LGBT Equality Caucus, I’ve been heartened to witness its tremendous growth and am proud to join once more for the 115th Congress. #LGBTQ Americans have gained so much in recent years, but now have even more to lose at the hands of politicians who want to turn back the clock on equality. We won’t let that happen without a fight  -- and our bipartisan caucus, now 102 members strong, will lead the charge.","photo","https://www.facebook.com/DianaDeGette/photos/a.153523148488.111218.110757973488/10155118738863489/?type=3",NA,326,14,17,46,0,0,0,0
"DianaDeGette","110757973488_10155119470473489","Congresswoman Diana DeGette","2017-02-07","2017-02-07 19:31:46","We must fight to #ProtectOurCare for the children in Colorado and across America whose voices aren’t always heard. Repealing the #ACA and gutting other crucial health programs would devastate children’s care, particularly among the most economically vulnerable. A healthy start boosts potential for lifelong success, and no child should be denied that right.","photo","https://www.facebook.com/DianaDeGette/photos/a.153523148488.111218.110757973488/10155119470473489/?type=3",NA,124,9,14,8,0,0,1,0
"DianaDeGette","110757973488_10155122684733489","Congresswoman Diana DeGette","2017-02-08","2017-02-08 21:26:40","Thank you, Senator Mitch McConnell, for perfectly encapsulating the power of women in three words: #Nevertheless, she persisted.","photo","https://www.facebook.com/DianaDeGette/photos/a.153523148488.111218.110757973488/10155122684733489/?type=3",NA,885,22,313,170,4,0,0,0
"DianaDeGette","110757973488_10155128341498489","Congresswoman Diana DeGette","2017-02-10","2017-02-10 23:28:14","Thanks to the Denver Green School for inviting my staff to a climate change summit today led by kids with a passion for the planet. @DenverPublicSchools","photo","https://www.facebook.com/DianaDeGette/photos/a.153523148488.111218.110757973488/10155128341498489/?type=3",NA,119,2,13,14,0,0,0,0
"DianaDeGette","110757973488_10155138126433489","Congresswoman Diana DeGette","2017-02-14","2017-02-14 16:44:02","#MichaelFlynn’s resignation from his National Security Advisor post comes the day after I signed a letter with 40 other House Democrats calling for his suspension. It appears that our concerns over his ties to Russia, and his failure to disclose them, were well-founded. While it is good that Mr. Flynn is no longer in a position of trust within our government, this development only underscores how little we know about the Trump transition’s ties to Russia and any lingering risks. We need a bipartisan inquiry into this matter.","photo","https://www.facebook.com/DianaDeGette/photos/a.153523148488.111218.110757973488/10155138126433489/?type=3",NA,476,82,47,20,0,8,1,2
