"screen_name","id","from_name","date","datetime","message","type","link","domain","likes_count","comments_count","shares_count","love_count","haha_count","wow_count","sad_count","angry_count"
"DianaDeGette","110757973488_10155634784138489","Congresswoman Diana DeGette","2017-07-13","2017-07-13 14:24:32","Unilateral Senate tweaks to #Trumpcare aren’t the solution. The non-partisan Congressional Budget Office showed last month that the Senate Republicans’ bill would rip coverage away from 22 million people. We’ll now await the CBO’s verdict on the latest iteration of Trumpcare, but no amount of repair to this deeply flawed bill will lead to a product that truly addresses ongoing issues in our health care system. Polls show most Americans think the parties should work together to mend the Affordable Care Act, not end it. That means abandoning Trumpcare and working on bipartisan solutions to the problems the American people want us to solve. In my latest post on Medium, I outline the steps that must be taken to achieve bipartisan health care reform that benefits people over party.","photo","https://www.facebook.com/DianaDeGette/photos/a.153523148488.111218.110757973488/10155634784138489/?type=3",NA,59,7,9,10,0,0,2,1
"DianaDeGette","110757973488_10155636036953489","Congresswoman Diana DeGette","2017-07-13","2017-07-13 20:52:30","The Senate GOP‘s latest  #Trumpcare bill is even more cruel than the version they abandoned last month. The tweaks made to the bill won’t address the damage it would do to millions of Americans who would lose health care or be forced to pay more for it. Still included are substantial and heartless cuts to Medicaid, significantly higher costs for working families and seniors, and provisions that gut protections for those with pre-existing conditions. Republicans should work with Democrats on strengthening America’s health care system. Watch this video and let me know your views.","video","https://www.facebook.com/DianaDeGette/videos/10155636036953489/",NA,161,48,43,8,1,1,21,37
"DianaDeGette","110757973488_10155636206563489","Congresswoman Diana DeGette","2017-07-13","2017-07-13 21:54:57","Ninety-one Americans die each day due to #opioid addiction according to the Centers for Disease Control; some people are using this epidemic to line their pockets. Patient brokers, or body brokers, target opioid users by helping them book stays at luxurious treatment centers, for which the brokers get kickbacks, and they’ll often sign patients up for flimsy insurance plans to cover the cost. Once the coverage runs out, the patient is kicked out of treatment and the broker moves on to his or her next victim. This is an unconscionable practice, which is why leading members of the House Committee on Energy and Commerce are asking U.S. Department of Health and Human Services Secretary Tom Price for information on the steps being taken to fight these schemes – and we’re urging stronger oversight to prevent them. Body brokers must not be able to profit from the suffering of others, and shady treatment centers that employ them to fill beds must be shut down. Millions of Americans struggle with opioid addiction; we must work to ensure their efforts to achieve sobriety end in success, not swindling and tragedy.","photo","https://www.facebook.com/DianaDeGette/photos/a.153523148488.111218.110757973488/10155636206563489/?type=3",NA,23,5,5,1,0,0,1,3
"DianaDeGette","110757973488_10155639334153489","Congresswoman Diana DeGette","2017-07-14","2017-07-14 18:29:24","Most of my #GOP congressional colleagues who are heading to their home states and districts for the weekend will once again have to defend another terrible iteration of #Trumpcare. The Senate bill released yesterday is even more cruel than the previous version. It includes substantial cuts to Medicaid, higher costs to working families and seniors, and fewer protections for people with pre-existing conditions. Next week’s report on the bill by the non-partisan Congressional Budget Office will likely show many millions of people still losing coverage, despite cosmetic tweaks to the bill. It’s time Republicans listen to their constituents; polls say the majority of whom want Congress to work together to repair the #ACA, not repeal it. I’ve been urging this plan of action; my post on Medium this week outlines the steps we must take to achieve lasting bipartisan reforms.","photo","https://www.facebook.com/DianaDeGette/photos/a.153523148488.111218.110757973488/10155639334153489/?type=3",NA,24,4,7,2,0,0,5,1
"DianaDeGette","110757973488_10155640360843489","Congresswoman Diana DeGette","2017-07-14","2017-07-14 21:07:21","How does the latest news in DC affect you? My e-newsletter recaps this week’s important developments in health care, including the Senate’s latest version of #Trumpcare, my efforts to protect #netneutrality and a bill to provide greater access to America’s national parks. Click on the link to read all about it.","link","https://iqconnect.lmhostediq.com/iqextranet/view_newsletter.aspx?id=151874&c=CO01DD","iqconnect.lmhostediq.com",28,5,0,0,0,0,0,2
"DianaDeGette","110757973488_10155651591803489","Congresswoman Diana DeGette","2017-07-17","2017-07-17 19:52:25","Democrats held 36 hearings on the Affordable Care Act before it became law and expanded coverage for millions of people. The #GOP has held only five on their #Trumpcare legislation that aims to dismantle the #ACA, ripping coverage away from millions and making it far more costly for millions of others. With so much at stake, why are they leaving Americans in the dark? Since the Senate is adjusting its timeline for action on Trumpcare, there's more time to examine this proposal closely and see if it really addresses the country's health care needs. To achieve this goal, I’m calling for House and Senate hearings to reveal the truth about what the Senate’s bill would mean for every American.","photo","https://www.facebook.com/DianaDeGette/photos/a.153523148488.111218.110757973488/10155651591803489/?type=3",NA,107,22,11,5,0,0,0,6
"DianaDeGette","110757973488_10155654948763489","Congresswoman Diana DeGette","2017-07-18","2017-07-18 19:22:25","I joined more than 70 members of Congress in urging President Trump’s purported voter fraud commission to withdraw its request for voter registration data. This effort to collect Americans’ personal information is based on the false and unsubstantiated claim that millions of people voted illegally in the 2016 election. The commission’s work as proposed is nothing more than a sham investigation that puts voters’ personal information in danger of identity theft. What’s more, the commission has already created a dangerous chilling effect – reports show that more than 3,000 people in Colorado canceled their voter registrations after the request for information. Maintaining the integrity of our elections is a critical priority, but this effort is just a ruse. I commend the 40 states that have rejected this witch-hunt and will continue working to protect voters’ privacy.","photo","https://www.facebook.com/DianaDeGette/photos/a.153523148488.111218.110757973488/10155654948763489/?type=3",NA,99,14,7,0,0,0,0,2
"DianaDeGette","110757973488_10155655350138489","Congresswoman Diana DeGette","2017-07-18","2017-07-18 21:46:46","Today the House overwhelmingly approved the Small Promoting Conduit Hydropower Facilities Act of 2017 (H.R. 2786), my bipartisan bill with Rep. Rich Hudson of North Carolina that promotes new energy projects using existing infrastructure. Hydropower is a clean, domestic energy source that has provided almost six percent of U.S. electricity and almost half of all renewable electricity. It also supports hundreds of thousands of good jobs across the country. As a westerner, I know how important water is to our environment and our communities, and as a senior member of the Energy and Commerce committee, I’m proud that this bill’s strong support from Chairman Greg Walden and Ranking Member Frank Pallone has proven what we can achieve when we put partisanship aside and work together to address our country’s energy needs. I urge the Senate to make the same smart choice and put America on the road to a clean energy future by supporting this legislation.","photo","https://www.facebook.com/DianaDeGette/photos/a.153523148488.111218.110757973488/10155655350138489/?type=3",NA,25,7,1,0,0,0,0,1
"DianaDeGette","110757973488_10155655376153489","Congresswoman Diana DeGette","2017-07-18","2017-07-18 21:57:08","At a hearing of the Oversight and Investigation Subcommittee of which I’m Ranking Member, I spoke about the need for stronger oversight of and support for the 340B Drug Discount Program. Congress created this program 25 years ago to help safety net providers leverage their scarce resources to serve more people, especially low-income and vulnerable patients. Troubling reports from Government Accountability Office and the HHS Office of Inspector General have found there is a need for more oversight to ensure that the program achieves its critical mission. However, I am even more concerned by the Centers for Medicare and Medicaid’s recently proposed rule dramatically reducing Medicare Part B drug reimbursements for 340B hospitals. I want to work with this committee to fairly address the 340B program’s problems, but using hearings to attack it won’t solve the crisis of rising prescription drug costs. To achieve this goal, Congress must hold more hearings and consider legislation that will tackle the issue head-on – and we must strengthen resources such as 340B, not gut them","video","https://www.facebook.com/DianaDeGette/videos/10155655376153489/",NA,64,22,6,4,0,0,0,1
"DianaDeGette","110757973488_10155659387718489","Congresswoman Diana DeGette","2017-07-20","2017-07-20 00:12:09","Honored to meet members of the Afghan Girls' Robotics Team who've just won a silver medal at the International Robotics Contest here in DC. Our country must keep it doors open to inspiring people such as these bright young women, not close them. http://bit.ly/2uB3G2E","photo","https://www.facebook.com/DianaDeGette/photos/a.153523148488.111218.110757973488/10155659387718489/?type=3",NA,138,9,6,27,0,1,0,1
"DianaDeGette","110757973488_10155662478418489","Congresswoman Diana DeGette","2017-07-20","2017-07-20 18:47:25","Today I led my Congressional Pro Choice Caucus colleagues in condemning the anti-choice, anti-woman provisions attacking women’s health and reproductive rights that were included in Fiscal Year 2018 appropriations bills. The House appropriations package is riddled with a shocking number of awful riders that go far beyond anything seen in previous proposals. But this is only one line of attack. Virtually every week, women across the country are waking up to news that their rights and access to care are being stripped away by politicians at the state and federal levels. Between the unprecedented defunding of Planned Parenthood in the President’s proposed budget, expanding the global gag rule, blocking access to low-cost birth control, and much more, the onslaught has been relentless. This has to stop. We will not tolerate any more anti-woman policies in government funding bills. The women of America are fed up, and we are standing by them to defend their rights. As co-chair of the Pro Choice Caucus, I’m prepared to lead that fight because women (and men) are worth it.","photo","https://www.facebook.com/DianaDeGette/photos/a.153523148488.111218.110757973488/10155662478418489/?type=3",NA,110,20,12,18,0,0,3,1
"DianaDeGette","110757973488_10155666356413489","Congresswoman Diana DeGette","2017-07-21","2017-07-21 21:08:50","How does the latest news in DC affect you? My e-newsletter recaps this week’s important developments, including #Trumpcare’s troubles, my efforts to oppose anti-choice provisions in #appropriations, defending a critical discount drug program and opposing the President’s election “integrity” commission. Click on the link to read all about it.","link","https://iqconnect.lmhostediq.com/iqextranet/view_newsletter.aspx?id=151993&c=CO01DD","iqconnect.lmhostediq.com",31,6,4,3,0,0,0,2
"DianaDeGette","110757973488_10155676645278489","Congresswoman Diana DeGette","2017-07-24","2017-07-24 17:42:31","For more than six months, Republicans have had complete control in Washington. What do they have to show for it? A health plan that rips coverage away from millions, tax breaks for millionaires and a shocking lack of transparency and accountability. Democrats have #abetterdeal for Americans – a plan to create millions of jobs, crack down on unchecked corporate power and dramatically lower the cost of prescription drugs. It won’t be easy, but we have never shied from finding bold solutions to big problems. The American people deserve better than what we’ve seen so far this year. With a Democratic Congress starting in 2019, a better deal is possible.","photo","https://www.facebook.com/DianaDeGette/photos/a.153523148488.111218.110757973488/10155676645278489/?type=3",NA,116,36,16,11,3,3,0,0
"DianaDeGette","110757973488_10155680222768489","Congresswoman Diana DeGette","2017-07-25","2017-07-25 17:23:03","Last night, the House unanimously passed The Harry W. Colmery Veterans Educational Assistance Act (#HR3218), which I was proud to co-sponsor. This measure is the most substantial update to the GI Bill since passage of the Post-9/11 GI Bill in 2008. It includes strong education improvements and protections that veterans and military service organizations had proposed. These changes will help new service members, reservists, National Guard members, veterans and survivors/dependents receive the quality education they deserve. We must continue to make good on the promise we made to our veterans with initial passage of the GI Bill more than 70 years ago: Answering the call of duty should be rewarded with opportunity and the chance to succeed, both on and off the battlefield.","photo","https://www.facebook.com/DianaDeGette/photos/a.153523148488.111218.110757973488/10155680222768489/?type=3",NA,51,7,3,8,0,0,0,1
"DianaDeGette","110757973488_10155683221883489","Congresswoman Diana DeGette","2017-07-26","2017-07-26 14:30:15","After the Senate's long night of debate that culminated in a failed Affordable Care Act repeal vote, Team DeGette showed our thanks to Team Senator Michael Bennet with a big bag of fresh bagels -- hand delivered! You'll need sustenance to keep up the fight to #ProtectOurCare. #ACA #Trumpcare","photo","https://www.facebook.com/DianaDeGette/photos/a.153523148488.111218.110757973488/10155683214403489/?type=3",NA,412,17,8,67,0,1,1,1
"DianaDeGette","110757973488_10155684061608489","Congresswoman Diana DeGette","2017-07-26","2017-07-26 19:09:33","President Trump’s bigoted decision to reverse an Obama-era policy allowing #transgender people to serve openly in the U.S. military won’t make us any safer. Those serving in and out of uniform on behalf of the United States now will have to leave or keep secrets that put them at risk. This edict forces America backward, well before the questionable days of “Don’t Ask, Don’t Tell,” to the unjust era when service members stayed in the closet to avoid being persecuted or purged. As a founding member of the Congressional LGBT Equality Caucus, I will work to reverse this ill-conceived decision based in the biased notion that America must protect itself from those who seek to protect us.","link","https://www.washingtonpost.com/news/post-politics/wp/2017/07/26/trump-announces-ban-on-transgender-people-in-u-s-military/?utm_term=.710adf70fc4b","washingtonpost.com",205,53,25,7,0,0,34,61
"DianaDeGette","110757973488_10155690116923489","Congresswoman Diana DeGette","2017-07-28","2017-07-28 14:20:09","With its overnight defeat in the Senate, the Republican effort to dismantle the Affordable Care Act has reached a road block. However, the path toward improving the #ACA is not at an end. Bipartisan solutions must be found. I continue to reach out to my colleagues across the aisle to work on those improvements. Maybe now they're ready to do so; Americans certainly are, and they've shown it with their vocal outcry against every version of #Trumpcare this year. Your tireless advocacy was instrumental in this heartening development. For months, I have listened to constituents’ stories on how the #ACA is a lifeline for you and your families, and was able to pass them along as promised to your Colorado senators. When Republicans and Democrats finally come together to make these needed improvements, I will make sure your ideas and concerns aren’t ignored, but instead contribute to making affordable coverage a reality for millions more.","photo","https://www.facebook.com/DianaDeGette/photos/a.153523148488.111218.110757973488/10155690116923489/?type=3",NA,167,26,6,18,1,0,0,4
"DianaDeGette","110757973488_10155690817493489","Congresswoman Diana DeGette","2017-07-28","2017-07-28 18:51:18","As #DACA’s future hangs in the balance, it’s more important than ever to protect this program and expand its original promise.That’s why I’m honored to cosponsor the #AmericanHopeAct of 2017. This bill allows DACA beneficiaries as well as other immigrant youth to apply for conditional permanent resident status, providing a pathway to citizenship. The bill will also improve college affordability for undocumented youth and other immigrants by repealing rules that limit their access to in-state tuition and college loans. Millions of undocumented residents brought here as children are contributing to our country—some as students, but others as parents, caregivers, full-time workers or military personnel. They are all valued and they all deserve their shot at the American dream.","photo","https://www.facebook.com/DianaDeGette/photos/a.153523148488.111218.110757973488/10155690817493489/?type=3",NA,40,7,7,9,0,0,0,2
"DianaDeGette","110757973488_10155691140718489","Congresswoman Diana DeGette","2017-07-28","2017-07-28 21:01:23","Yesterday was a wonderful day for families and patients across America. #Trumpcare’s defeat in the Senate was due in no small part to the tireless advocacy of millions of citizens, and we should all be proud of this achievement. But we can’t stop there. All of us in Congress must now come together to work to improve the #ACA in a bipartisan manner. My list of 10 ways to improve health care are provided in the comments below, but please continue sharing your ideas as well – I want to hear them.","video","https://www.youtube.com/watch?v=2J7WN0Wz-FQ",NA,83,10,7,17,0,0,0,3
"DianaDeGette","110757973488_10155691226883489","Congresswoman Diana DeGette","2017-07-28","2017-07-28 21:32:49","How does the latest news in DC affect you? My e-newsletter recaps this week’s important developments, including #Trumpcare’s dramatic demise, President Trump’s transgender military ban, my efforts to help undocumented young people and more. Click on the link to read all about it.","link","https://iqconnect.lmhostediq.com/iqextranet/view_newsletter.aspx?id=152057&c=CO01DD","iqconnect.lmhostediq.com",27,13,3,7,0,1,0,2
"DianaDeGette","110757973488_10155701636928489","Congresswoman Diana DeGette","2017-08-01","2017-08-01 14:32:49","Happy #ColoradoDay! Here’s to 141 years of statehood and many more. This special anniversary affirms my passion for the place where I’ve spent my life, raised a family and advocated for my friends and neighbors as a member of the state legislature and then the U.S. Congress. I’m happy to be home to celebrate this occasion and to work with fellow Coloradans on ways to make the future even brighter for the Centennial State.","photo","https://www.facebook.com/DianaDeGette/photos/a.153523148488.111218.110757973488/10155701634888489/?type=3",NA,66,1,11,7,0,1,0,1
"DianaDeGette","110757973488_10155704698448489","Congresswoman Diana DeGette","2017-08-02","2017-08-02 17:11:30","I had a wonderful time visiting with canvassers for Environment Colorado. We discussed my efforts in Congress to combat the Trump administration’s anti-environment policies and learned about the success of their impressive grassroots activism. These hard-working participants have spoken to more than 60,000 Coloradans about clean energy and sustainability this summer alone. Thanks for your important work across our state and for your wonderful gift – a collage of the group’s many creative signs displayed at rallies. Together we’ll work for a more sustainable Colorado and world.","photo","https://www.facebook.com/DianaDeGette/photos/a.153523148488.111218.110757973488/10155704695683489/?type=3",NA,29,4,1,1,0,0,0,0
"DianaDeGette","110757973488_10155705083093489","Congresswoman Diana DeGette","2017-08-02","2017-08-02 19:26:42","Today I spoke at Jefferson County’s second annual Aerospace and Defense Small Business Day on the critical need to strengthen and support these industries here in Colorado. Large entities such as Lockheed Martin and small businesses alike have contributed to this critical nexus of 21st century careers, making our state the nation’s number one private-sector aerospace employer. For my part, I will continue working with the entire Colorado delegation to secure funding to keep the shared priorities of the U.S. government and the commercial space industry on track, and will also keep pushing for new, qualified nominees to head NASA - National Aeronautics and Space Administration and National Oceanic and Atmospheric Administration (NOAA). Thanks to the innovators represented at this gathering, the future of Colorado is looking very bright.","photo","https://www.facebook.com/DianaDeGette/photos/a.153523148488.111218.110757973488/10155705079333489/?type=3",NA,21,5,1,1,0,0,0,0
"DianaDeGette","110757973488_10155707336813489","Congresswoman Diana DeGette","2017-08-03","2017-08-03 15:15:03","Last night's celebration of the 150th anniversary of the Denver Press Club was both memorable and meaningful. Together with Denver Mayor Michael B. Hancock, other local dignitaries, renowned Colorado historians, club presidents past and present and many club members, I celebrated the place's colorful history and the critical role that media play today in our democracy. I also helped install a plaque to commemorate the building's entry onto the National Register of Historic Places. What began 150 years ago as a means for frontier-town rival reporters to play poker and debate the news of the day has grown alongside the Front Range to become a magnet for exemplary journalists and a stalwart of our First Amendment rights.","photo","https://www.facebook.com/DianaDeGette/photos/a.10152499127143489.1073741829.110757973488/10155707336013489/?type=3",NA,39,5,4,2,0,0,0,1
"DianaDeGette","110757973488_10155710182368489","Congresswoman Diana DeGette","2017-08-04","2017-08-04 15:47:25","Happy Birthday, President Obama! I’m thankful to have had you as a supporter and partner in my efforts to tackle many important priorities. Whether ending the ban on stem cell research, updating the Toxic Substances Control Act, shepherding the landmark 21st Century Cures Act into law, promoting clean energy, preserving #reprorights and more, you have helped improve the lives of Coloradans and every American. Thank you for showing us what real, principled leadership looks like.","photo","https://www.facebook.com/DianaDeGette/photos/a.153523148488.111218.110757973488/10155710180878489/?type=3",NA,109,7,6,23,2,0,1,1
"DianaDeGette","110757973488_10155710558598489","Congresswoman Diana DeGette","2017-08-04","2017-08-04 17:58:43","I had a fascinating time visiting Phunkshun Wear in Denver, a small business that combines entrepreneurship and environmentalism. Founded in 2011, the company makes ski masks and other active wear from recycled materials, such as water bottles, and boasts a 99% waste-free production process that’s completely powered by wind energy. Thanks to the team at Phunksun for a great tour and for exemplifying Colorado ingenuity. Small businesses often need a boost to get off the ground, which is why I will continue supporting microloan programs and the intermediary lending pilot program within the Small Business Administration to ensure that Coloradans are able to turn good ideas into great investments for our communities.","photo","https://www.facebook.com/DianaDeGette/photos/a.153523148488.111218.110757973488/10155710553513489/?type=3",NA,42,1,2,5,0,0,0,0
"DianaDeGette","110757973488_10155723372043489","Congresswoman Diana DeGette","2017-08-08","2017-08-08 19:39:30","On this day in 2009, my friend, Justice Sonia Sotomayor, was sworn in as the first Latina to serve on the Supreme Court. Her historic rise to the highest court in the land is an inspiration for our ongoing work to break barriers and shatter glass ceilings for all.","photo","https://www.facebook.com/DianaDeGette/photos/a.153523148488.111218.110757973488/10155723372043489/?type=3",NA,367,7,23,74,1,0,3,0
