"screen_name","id","from_name","date","datetime","message","type","link","domain","likes_count","comments_count","shares_count","love_count","haha_count","wow_count","sad_count","angry_count"
"lloyddoggett","154050553704_10154502028088705","Rep. Lloyd Doggett","2017-01-01","2017-01-01 19:57:00","There is a new Sheriff in town. Libby and I begin each New Year at the home of Cecila Crossley. This morning was special, District Judge Bob Perkins swore in new Travis County Sheriff Sally Hernandez, joined by her husband Ted. This afternoon I am participating in the investiture of new Bexar County Sheriff Javier Salazar. It is a great two sheriff day.","photo","https://www.facebook.com/lloyddoggett/photos/a.162214153704.115569.154050553704/10154502028088705/?type=3",NA,168,4,3,6,0,0,0,0
"lloyddoggett","154050553704_10154502120673705","Rep. Lloyd Doggett","2017-01-01","2017-01-01 20:23:52","Investiture of Judge Angelica Jimenez, Bexar County 408th District Court","video","https://www.facebook.com/lloyddoggett/videos/10154502120673705/",NA,89,14,5,14,0,0,0,0
"lloyddoggett","154050553704_10154504788148705","Rep. Lloyd Doggett","2017-01-02","2017-01-02 20:53:22","Participated in the inauguration of our new Bexar County Sheriff Javier Salazar.","photo","https://www.facebook.com/lloyddoggett/photos/a.162214153704.115569.154050553704/10154504788148705/?type=3",NA,207,5,4,3,0,0,0,0
"lloyddoggett","154050553704_10154505129788705","Rep. Lloyd Doggett","2017-01-03","2017-01-03 00:01:30","Nineteen states rang in a Happy New Year indeed with an increase in the minimum wage. Unfortunately, not in Texas.","link","http://www.expressnews.com/business/national/article/Pay-to-rise-for-millions-as-19-states-increase-10825468.php","expressnews.com",84,8,21,2,1,2,14,27
"lloyddoggett","154050553704_10154506613488705","Rep. Lloyd Doggett","2017-01-03","2017-01-03 14:31:13","The San Antonio Express-News editorial board is absolutely right: repealing the Affordable Care Act (ACA) is terrible news for Texans. Before the ACA, nearly a quarter of Texans didn’t have health insurance. We can’t go back to that broken system—we need to strengthen what we have. #ACA","link","http://www.mysanantonio.com/opinion/editorials/article/Repeal-ACA-Very-bad-for-Texas-10816130.php","mysanantonio.com",243,22,68,4,1,2,19,33
"lloyddoggett","154050553704_10154507748528705","Rep. Lloyd Doggett","2017-01-03","2017-01-03 22:43:08","Last chance for a House floor photo with my dear friend and colleague Rep. John Lewis before Republican House majority passed rule designed to gag Members.","photo","https://www.facebook.com/lloyddoggett/photos/a.162214153704.115569.154050553704/10154507748528705/?type=3",NA,535,52,65,74,2,6,75,27
"lloyddoggett","154050553704_10154509885953705","Rep. Lloyd Doggett","2017-01-04","2017-01-04 16:42:46","Rep. Nancy Pelosi presented the President with the flag that flew over the Capitol on his inauguration day - a day of hope. This year's inauguration will be a day of hurt. After accepting this gift, the President stressed the importance of preserving the Affordable Care Act to ensure millions of Americans do not lose their health insurance. I remain committed to preserving these hard-fought reforms and will resist all efforts by my Republican colleagues who seek to repeal it.","photo","https://www.facebook.com/lloyddoggett/photos/a.162214153704.115569.154050553704/10154509885953705/?type=3",NA,394,48,34,71,1,1,22,1
"lloyddoggett","154050553704_10154512935648705","Rep. Lloyd Doggett","2017-01-05","2017-01-05 18:33:31","To repeal Obamacare and replace it with To-Be-Decided-Care is cruel to the millions who will lose affordable coverage. Attached are all the details of the Republican replacement plan:","link","https://az616578.vo.msecnd.net/files/2016/03/04/635926606544285859-2097768260_blinking%20cursor.gif","az616578.vo.msecnd.net",400,35,138,13,69,3,53,41
"lloyddoggett","154050553704_10154513444518705","Rep. Lloyd Doggett","2017-01-05","2017-01-05 22:01:27","The ACA works to protect women’s health—here's some of what women stand to lose from a Republican repeal of Obamacare.","photo","https://www.facebook.com/lloyddoggett/photos/a.162214153704.115569.154050553704/10154513444518705/?type=3",NA,146,11,132,1,0,4,28,33
"lloyddoggett","154050553704_10154520952048705","Rep. Lloyd Doggett","2017-01-08","2017-01-08 18:04:18","The GOP wants to Gut Our Protection by repealing the Affordable Care Act. The Urban Institute estimates this will take away health coverage from 30 million Americans. How have you or your family benefited from this important law? Share your story by commenting below or email me at Lloyd.Doggett@mail.house.gov. I will continue to fight for you. #ProtectOurCare","photo","https://www.facebook.com/lloyddoggett/photos/a.162214153704.115569.154050553704/10154520952048705/?type=3",NA,60,20,23,0,2,2,2,11
"lloyddoggett","154050553704_10154521889328705","Rep. Lloyd Doggett","2017-01-09","2017-01-09 01:08:35","On this frigid Sunday in Washington, Libby and I took a short work break to view the faded originals of the Constitution, Declaration, and Bill of Rights.  At this troubled time in America, we are reminded that preserving democracy has never been an easy task--it requires our continuous participation to overcome those forces that would undermine it.  And amazing that out of the 18th Century we have this unique set of checks and balances, which will likely prove so vital during the next four years.  The parchment fades, but our commitment to democratic values must never do so.","photo","https://www.facebook.com/lloyddoggett/photos/a.162214153704.115569.154050553704/10154521889328705/?type=3",NA,481,37,40,68,0,0,4,0
"lloyddoggett","154050553704_10154523906023705","Rep. Lloyd Doggett","2017-01-09","2017-01-09 17:52:32","In these troubling times, I am working to keep hope alive. Let’s stand together and fight for affordable health care, sensible immigration reform, environmental protection, and fair tax policies. Let’s listen to one another and join together to make our voices heard.   Watch my video below for my full message to you.","video","https://youtu.be/TpqgOoFC7yY",NA,338,24,53,46,1,0,0,0
"lloyddoggett","154050553704_10154524430288705","Rep. Lloyd Doggett","2017-01-09","2017-01-09 21:21:24",NA,"video","https://www.facebook.com/lloyddoggett/videos/10154524430288705/",NA,163,25,60,26,0,0,0,0
"lloyddoggett","154050553704_10154524614658705","Rep. Lloyd Doggett","2017-01-09","2017-01-09 23:00:06","This weekend, I saw a bold renewable energy plan that would create millions of jobs. But it wasn’t Trump’s. It was China’s. We either need to lead the road to clean and green energy, or we risk getting run over by others.","link","http://www.nytimes.com/2017/01/05/world/asia/china-renewable-energy-investment.html","nytimes.com",226,11,81,6,1,15,1,1
"lloyddoggett","154050553704_10154532408763705","Rep. Lloyd Doggett","2017-01-11","2017-01-11 18:50:39","The people’s business must come first.  I joined my colleagues to force a vote on the Presidential Conflicts of Interest Act, which would require the President and Vice President to disclose to the public and divest from any financial interests that pose a potential conflict of interest. Our effort was defeated today by the Republican majority, but we will not relent.","status",NA,NA,545,62,51,35,2,4,11,58
"lloyddoggett","154050553704_10154533432013705","Rep. Lloyd Doggett","2017-01-11","2017-01-11 23:20:49","Good to have Mike Flores, President of Palo Alto College, and wife Martha and daughter Mara, at our Capitol recently. Dr. Flores provides outstanding leadership.  If you are interested in visiting Washington, you can find more information here: https://doggett.house.gov/services/washington-dc-visitors","photo","https://www.facebook.com/lloyddoggett/photos/a.162214153704.115569.154050553704/10154533432013705/?type=3",NA,52,0,2,1,0,0,0,0
"lloyddoggett","154050553704_10154537021703705","Rep. Lloyd Doggett","2017-01-12","2017-01-12 17:30:46","It was great to meet with several Texas veterans yesterday, including several members of the Military Order of the Purple Heart. Thank you Commander Henry Garcia, Alejandra Hernandez, Tonya Stewart, Gary Ard, Jesse Martin, Joe Washam, and Joseph Nalepka, for stopping by my Washington office.","photo","https://www.facebook.com/lloyddoggett/photos/a.162214153704.115569.154050553704/10154537019818705/?type=3",NA,58,2,5,6,0,1,0,0
"lloyddoggett","154050553704_10154537741188705","Rep. Lloyd Doggett","2017-01-12","2017-01-12 22:18:27","If you can’t get insurance through work, Medicare, Medicaid, CHIP, or the VA, sign up for coverage now during open enrollment. Open enrollment ends on Tuesday, January 31, and even with the Republican push to repeal the ACA, your contract will help you stay covered in 2017. Check out www.insurecentraltexas.org for more information.","link","http://www.insurecentraltexas.org/","insurecentraltexas.org",120,8,53,10,0,0,0,0
"lloyddoggett","154050553704_10154539926103705","Rep. Lloyd Doggett","2017-01-13","2017-01-13 15:18:50","As I noted to Michael King in the Austin Chronicle, it is important we keep hope alive – making our neighbors aware that we cannot give up on our democracy. We must stay involved, participating, and presenting alternatives. There is too much that we care about at stake. You can read the article here.","link","http://www.austinchronicle.com/news/2017-01-13/point-austin-keeping-hope-alive/","austinchronicle.com",94,5,18,6,0,0,0,0
"lloyddoggett","154050553704_10154540297148705","Rep. Lloyd Doggett","2017-01-13","2017-01-13 18:09:19","Walls that should be built:  - Between Trump and Putin - Between Trump and his business - Between Trump and his Twitter   The San Antonio Express-News got it right – Congress should not use any taxpayer dollars to pay for Trump’s border wall, an atrocious idea.","link","http://www.expressnews.com/opinion/editorials/article/No-Mexico-will-not-pay-for-border-wall-10854179.php","expressnews.com",892,33,164,87,30,3,1,1
"lloyddoggett","154050553704_10154541043038705","Rep. Lloyd Doggett","2017-01-13","2017-01-13 22:50:08","When I look out my office window and see the work being done to prepare for the Inauguration, I contemplate all the challenges we will face, on healthcare, immigration, education, economic justice and more. I came across an apt quote from Thomas Jefferson recently. Although in more archaic language, it describes our responsibility in such times as these: “Educate and inform the great mass of the people. They are the only sure reliance for the preservation of our liberty.” This weekend, I’ll be back in Texas speaking at events to celebrate the legacy of Dr. Martin Luther King Jr. Feel free to call my office for more details.","photo","https://www.facebook.com/lloyddoggett/photos/a.162214153704.115569.154050553704/10154541043038705/?type=3",NA,279,29,28,29,0,0,7,1
"lloyddoggett","154050553704_10154543657638705","Rep. Lloyd Doggett","2017-01-14","2017-01-14 21:06:49","Climate change is not fake news. Russia's interference in our elections is not fake news. Referring to stories one disagrees with as ""fake news"" is only designed to undermine the press reports of a reality that doesn't match their political needs.","link","http://www.sacurrent.com/the-daily/archives/2017/01/12/texas-republicans-are-calling-news-they-dont-like-fake","sacurrent.com",837,107,364,13,8,40,26,292
"lloyddoggett","154050553704_10154546408693705","Rep. Lloyd Doggett","2017-01-15","2017-01-15 21:31:01","Republicans’ misguided quest to repeal the Affordable Care Act without enacting a replacement could result in the loss of coverage for people with Marketplace plans, young people below 26 on their parents’ plans, and reduced or denied coverage for people with pre-existing conditions. This is a rough guide to the Republicans’ moves to dismantle the Affordable Care Act—I will keep fighting for you.","photo","https://www.facebook.com/lloyddoggett/photos/a.162214153704.115569.154050553704/10154546408693705/?type=3",NA,117,31,75,5,1,0,24,29
"lloyddoggett","154050553704_10154546741653705","Rep. Lloyd Doggett","2017-01-16","2017-01-16 00:16:52","Tomorrow we honor the legacy of Dr. Martin Luther King Jr. Amidst the hate, we will spread love.  More than ever, we must come together to support one another and keep hope alive.   Activities begin at 9am UT Austin by MLK statue to HTU, at 9:45 at the Hays County Courthouse to Dunbar Center, and at 11:45 at Lockhart City Hall to Cedar Hall.  While I hope to be represented at all, I will get an early start in San Antonio with my friend Bishop Rosa Wilson for a program at MLK Academy before the formal 10am kickoff.  Let’s march together and keep working together.","link","http://www.expressnews.com/news/local/article/In-word-and-song-MLK-march-participants-10858231.php","expressnews.com",140,2,12,14,0,0,0,0
"lloyddoggett","154050553704_10154549098788705","Rep. Lloyd Doggett","2017-01-16","2017-01-16 21:14:51","Lockhart celebrated Dr. Martin Luther King Jr. today. These children marched alongside others for peace and for hope. These children are our future, and we must continue to give them hope. #MLK","photo","https://www.facebook.com/lloyddoggett/photos/a.162214153704.115569.154050553704/10154549098788705/?type=3",NA,178,2,10,23,0,0,0,0
"lloyddoggett","154050553704_10154549552323705","Rep. Lloyd Doggett","2017-01-17","2017-01-17 01:34:41","San Antonio MLK March 2017","video","https://www.facebook.com/lloyddoggett/videos/10154549552323705/",NA,148,4,6,18,0,0,0,0
"lloyddoggett","154050553704_10154550888843705","Rep. Lloyd Doggett","2017-01-17","2017-01-17 14:26:04","I am serving on the Democracy Reform Task Force, created to advance legislation that will restore integrity to our voting laws and empower Americans to reclaim their voice in the political process. This Task Force will work to confront the new Administration’s conflicts of interest and call out the GOP’s special-interest agenda.","status",NA,NA,627,49,34,64,2,3,0,1
"lloyddoggett","154050553704_10154551452348705","Rep. Lloyd Doggett","2017-01-17","2017-01-17 19:00:19","I will not be attending the inauguration this Friday.   We are sending a message to Mr. Trump. Respect, like Pennsylvania Avenue, is a two-way street. Instead of uniting our country, his continued  unprecedented, unpresidential actions are further dividing it. By repeatedly taking the lowest road, he is not showing respect for the highest office.  We are in for a long struggle that must strategically utilize every nonviolent opposition tool available.","status",NA,NA,6130,1175,957,1114,14,19,17,97
"lloyddoggett","154050553704_10154551891293705","Rep. Lloyd Doggett","2017-01-17","2017-01-17 22:25:59","After marching to honor Dr. Martin Luther King Jr. I visited with three of our National Pan-Hellenic Council fraternities – Kappa Alpha Psi, Omega Psi Phi, and MLK’s own – Alpha Phi Alpha. Thankful for the great hospitality and continued support of our historically black Greek-letter organizations.","photo","https://www.facebook.com/lloyddoggett/photos/a.162214153704.115569.154050553704/10154551888623705/?type=3",NA,197,9,8,19,0,1,0,1
"lloyddoggett","154050553704_10154556836258705","Rep. Lloyd Doggett","2017-01-19","2017-01-19 19:55:44","I urged Trump to live up to his claim that “nobody respects women more” than he does—he can begin by keeping the protections the Affordable Care Act has in place for women and rejecting efforts to defund Planned Parenthood, which provides health screenings and contraception to around 2.5 million Americans.","link","https://www.washingtonpost.com/news/powerpost/wp/2017/01/19/house-democrats-to-donald-trump-the-women-of-america-are-watching/?utm_term=.57cc1b8ae0f3","washingtonpost.com",397,20,49,51,0,1,0,0
"lloyddoggett","154050553704_10154558715538705","Rep. Lloyd Doggett","2017-01-20","2017-01-20 15:01:39","For the first time in nearly thirty years, the President's Cabinet won’t include a Latino voice. When asked about this stunning lack of diversity, his Press Secretary Sean Spicer claimed that Trump wants the “best and brightest.” Trump is walling himself off from the talent we need.","link","https://www.washingtonpost.com/blogs/plum-line/wp/2017/01/19/donald-trump-has-assembled-the-worst-cabinet-in-american-history/?utm_term=.f364391414ee","washingtonpost.com",427,54,178,6,8,22,92,205
"lloyddoggett","154050553704_10154559623938705","Rep. Lloyd Doggett","2017-01-20","2017-01-20 21:03:48","Tonight, you can find me at the LGBTQ Human Rights Rally on the South steps of our State Capitol, where I will continue the push for equality, call out hypocrisy and hate, and keep hope alive.  Together, we’ll bring along more in our community as partners.","link","http://www.austinchronicle.com/daily/gay-place/2017-01-19/coming-out-in-the-dark/","austinchronicle.com",1130,43,116,233,1,4,2,0
"lloyddoggett","154050553704_10154559796443705","Rep. Lloyd Doggett","2017-01-20","2017-01-20 22:34:58","Today, one of my Legislative Assistants, Ana Builes, attended Trump’s inauguration in silent protest while wearing her “I AM AN IMMIGRANT” t-shirt. During the event, whenever a Democrat was introduced, including President Obama and Senator Schumer, there was a wave of “boos” from the crowd. My staffer received ugly comments from some attendees while walking to take her place—comments like “Build the wall,” and “Oh, it’ll be harder for you to get back across the border with the new wall,” and “Now we’ll get e-verify.” Ana said those comments only make her more fired up, ready to help me push back on Trump’s agenda.","photo","https://www.facebook.com/lloyddoggett/photos/a.162214153704.115569.154050553704/10154559796443705/?type=3",NA,1678,173,193,265,1,20,128,32
"lloyddoggett","154050553704_10154560076008705","Rep. Lloyd Doggett","2017-01-21","2017-01-21 00:51:15","Tomorrow, along with my daughter Dr. Lisa Doggett, my third-grade granddaughter, Clara, and thousands of other Texas women and allies, I will be speaking and marching at the Austin Women’s March. There, I will talk about the importance of preserving our democracy and using every nonviolent opposition tool available to move our country forward and keep hope alive.   Meanwhile, Libby will be in DC greeting Texas women from San Antonio and Austin around 8:30am at the Spirit of Justice Park on C St. SW behind the Rayburn House building. She’ll be participating in the rally on the National Mall at 10am and the Women’s March at 1pm, joining hundreds of thousands of women and allies across the country. Our family will reunite in Texas on Saturday evening.","status",NA,NA,1675,107,111,349,2,3,0,0
"lloyddoggett","154050553704_10154561857258705","Rep. Lloyd Doggett","2017-01-21","2017-01-21 15:33:27","Team Doggett joined two buses of women from San Antonio Thursday night for a send off as they embarked on their trip to D.C. to participate in the Women's March on Washington.  My wife, Libby, will meet them in DC today.  It was a long hard journey across America as part of the long hard struggle that will ultimately be successful #WhyIMarch","photo","https://www.facebook.com/lloyddoggett/photos/a.162214153704.115569.154050553704/10154561857258705/?type=3",NA,540,5,21,80,0,5,0,0
"lloyddoggett","154050553704_10154562054728705","Rep. Lloyd Doggett","2017-01-21","2017-01-21 16:59:24","While we may get outspent by billionaires, we cannot be outworked.  That is our Trump card. With Councilmembers Delia Garza - Austin City Council District 2, Gregorio Casar, Council Member Pio Renteria, District 3, and Austin Mayor Steve Adler at the One Resistance March.","photo","https://www.facebook.com/lloyddoggett/photos/a.162214153704.115569.154050553704/10154562054728705/?type=3",NA,710,41,47,118,1,5,1,1
"lloyddoggett","154050553704_10154562204038705","Rep. Lloyd Doggett","2017-01-21","2017-01-21 18:06:33","I am here at the Women's March with my daughters and granddaughters, marching for justice, equality and reproductive freedom.  I will be speaking at the Women's March on Austin today at around 1:35 - if you aren't at the march, tune in to Facebook live.","photo","https://www.facebook.com/lloyddoggett/photos/a.162214153704.115569.154050553704/10154562204038705/?type=3",NA,1315,61,66,232,3,2,1,0
"lloyddoggett","154050553704_10154563091728705","Rep. Lloyd Doggett","2017-01-21","2017-01-21 23:32:56","Today I joined my daughters, granddaughter, and an estimated 50,000 women, men, and children from all over Texas at the Women's March on Austin to ensure our voices are heard.  Here are some photos from the day.","photo","https://www.facebook.com/lloyddoggett/photos/a.162214153704.115569.154050553704/10154563088968705/?type=3",NA,1316,39,39,241,1,1,0,1
"lloyddoggett","154050553704_10154565775933705","Rep. Lloyd Doggett","2017-01-22","2017-01-22 18:53:44","I joined KVUE this morning to talk about the Austin Women's March, where I was joined by my daughters and one of my granddaughters. I also discussed the many challenges ahead.","video","https://www.facebook.com/lloyddoggett/videos/10154565775933705/",NA,308,19,21,37,0,0,0,0
"lloyddoggett","154050553704_10154566155068705","Rep. Lloyd Doggett","2017-01-22","2017-01-22 21:06:29","This must be the beginning of our march, not the end. Because if the march ends here, we get nowhere.","link","http://www.expressnews.com/news/local/article/Women-in-San-Antonio-take-to-the-streets-to-10873833.php","expressnews.com",408,11,7,39,0,0,0,0
"lloyddoggett","154050553704_10154566439418705","Rep. Lloyd Doggett","2017-01-22","2017-01-22 22:52:34","It was incredible and inspiring to be amongst an estimated 50,000 people yesterday at the Austin Women's March -- see this aerial shot of downtown taken by KVUE. There were also some great signs at the Austin March. But the one sign you did not see was ""Yield Right of Way” because we remain unyielding.","photo","https://www.facebook.com/lloyddoggett/photos/a.162214153704.115569.154050553704/10154566439418705/?type=3",NA,589,28,48,87,0,10,1,0
"lloyddoggett","154050553704_10154573379268705","Rep. Lloyd Doggett","2017-01-24","2017-01-24 15:08:46","Empowering the next generation to shape the world it will inherit cannot start too soon.","photo","https://www.facebook.com/lloyddoggett/photos/a.162214153704.115569.154050553704/10154573379268705/?type=3",NA,293,8,47,80,6,0,0,1
"lloyddoggett","154050553704_10154573779283705","Rep. Lloyd Doggett","2017-01-24","2017-01-24 17:24:35","My former Washington Legislative Assistant, Elisa Santana, now researching in Berlin, took part in the Women's March there over the weekend.  Elisa is pictured in front of the Brandenburg Gate with her empowering message.","photo","https://www.facebook.com/lloyddoggett/photos/a.162214153704.115569.154050553704/10154573779283705/?type=3",NA,500,10,18,79,0,2,0,1
"lloyddoggett","154050553704_10154574407423705","Rep. Lloyd Doggett","2017-01-24","2017-01-24 20:32:47","Once again, House Republicans launch a sweeping radical attack on women’s reproductive rights, this time with HR 7. This bill limits a woman’s access to reproductive healthcare based on where she lives, her income level, or whether she’s in the military or a federal employee—it even pushes private insurers to drop abortion coverage and takes away tax credits from small businesses that give their employees coverage that includes abortion services. The hundreds of women’s marches across the country made clear that politicians should not get between a woman and her healthcare provider.","status",NA,NA,294,46,139,4,0,3,66,306
"lloyddoggett","154050553704_10154577415653705","Rep. Lloyd Doggett","2017-01-25","2017-01-25 17:04:16","Please join me in San Antonio this Saturday with Rep. Castro for a forum in support of the Affordable Care Act. This will be an important opportunity to rally in defense of this critical law. I will also share stories on how the ACA has helped San Antonio families. Come out to Daughters for Charity Services (7607 Somerset Rd) at 2pm. I look forward to seeing you and hearing your voice.","photo","https://www.facebook.com/lloyddoggett/photos/a.162214153704.115569.154050553704/10154577415653705/?type=3",NA,311,11,57,20,1,0,0,1
"lloyddoggett","154050553704_10154577969058705","Rep. Lloyd Doggett","2017-01-25","2017-01-25 20:42:27",NA,"video","https://www.facebook.com/lloyddoggett/videos/10154577969058705/",NA,224,58,45,92,1,1,0,2
"lloyddoggett","154050553704_10154580453688705","Rep. Lloyd Doggett","2017-01-26","2017-01-26 16:56:03","Governor Abbott’s threat to remove duly-elected Sheriff Hernandez is eerily reminiscent of Trump’s “lock her up” rhetoric on the campaign trail – threatening to jail political opponents. Abbott threat undermines local law enforcement, the Texas Constitution and U.S. Bill of Rights.","video","https://www.facebook.com/lloyddoggett/videos/10154580453688705/",NA,448,48,109,7,1,10,24,189
"lloyddoggett","154050553704_10154581051403705","Rep. Lloyd Doggett","2017-01-26","2017-01-26 22:13:28","“It’s the single biggest simultaneous departure of institutional memory [at the State Department] that anyone can remember, and that’s incredibly difficult to replicate.” –per David Wade, who served as State Department Chief of Staff under former Secretary of State John Kerry","link","https://www.washingtonpost.com/news/josh-rogin/wp/2017/01/26/the-state-departments-entire-senior-management-team-just-resigned/","washingtonpost.com",135,34,97,4,4,95,18,39
