"screen_name","id","from_name","date","datetime","message","type","link","domain","likes_count","comments_count","shares_count","love_count","haha_count","wow_count","sad_count","angry_count"
"lloyddoggett","154050553704_10155111916623705","Rep. Lloyd Doggett","2017-07-16","2017-07-16 19:52:50",NA,"video","https://www.facebook.com/lloyddoggett/videos/10155111916623705/",NA,140,83,34,30,1,0,0,1
"lloyddoggett","154050553704_10155112362328705","Rep. Lloyd Doggett","2017-07-16","2017-07-16 22:30:44","A powerful voice for the oppressed—civil  rights, immigrant rights, worker rights—remains with us only in spirit.  Jaime Martinez lost his long struggle with cancer but inspires us to continue the struggle for social justice.  He has been my friend for more than 30 years—preserving the legacy of Cesar Chavez,  promoting educational opportunities with his scholarship program, and always seeking to do more for those who have the least.  Our prayers are with his wonderful family and his extended family working together to build a better America. Services will be at the Chapel at Cornerstone Church on Thursday at 12pm.","photo","https://www.facebook.com/lloyddoggett/photos/a.162214153704.115569.154050553704/10155112362328705/?type=3",NA,106,4,9,9,0,0,20,0
"lloyddoggett","154050553704_10155114977278705","Rep. Lloyd Doggett","2017-07-17","2017-07-17 17:39:50","Thank you to all who attended my health care town hall this weekend – if you were unable to make it, you can view the Facebook Live video on my profile page, or read this feature in the Austin American-Statesman.","link","http://www.mystatesman.com/news/national-govt--politics/hundreds-wary-gop-health-care-bill-attend-doggett-town-hall-meeting/0sidpvgo2k97OPXqqUR5DI/","mystatesman.com",201,8,10,21,0,0,0,0
"lloyddoggett","154050553704_10155115555003705","Rep. Lloyd Doggett","2017-07-17","2017-07-17 22:08:26","I joined over 400 people in Austin at my fifth town hall to discuss the dangerous consequences of the new health care bill and to listen to powerful and moving stories from those whose lives depend on Medicaid. Thank you to all who attended and engaged online!","photo","https://www.facebook.com/lloyddoggett/photos/a.162214153704.115569.154050553704/10155115553998705/?type=3",NA,302,26,8,37,0,0,1,0
"lloyddoggett","154050553704_10155117858173705","Rep. Lloyd Doggett","2017-07-18","2017-07-18 14:41:06","Gail Collins brings a sense of humor to the tragedy for America that is the Trump family, shedding light on how recently, Europe was treated to the many faces of our President, including “Ad Lib Trump,” “Nearly Unhinged Trump,” and “Speechreading Trump.”  However it is “Diplomacy Don” who we must be especially concerned about since it is he that blindly accepted Putin’s assurance of Russia’s innocence in the election hacking.","link","https://www.nytimes.com/2017/07/07/opinion/putin-meets-tons-of-trumps.html","nytimes.com",57,35,6,0,3,1,12,15
"lloyddoggett","154050553704_10155119036133705","Rep. Lloyd Doggett","2017-07-18","2017-07-18 21:27:59","As many shared through their moving personal stories at my town hall in Austin on Sunday, Medicaid is an extremely valuable lifeline. Having to choose between groceries and a child’s medical treatment is something no parent should have to face. Every family should have access to a family doctor. If you were unable to attend, you can catch a recap on Spectrum News Austin here.","video","https://www.facebook.com/lloyddoggett/videos/10155119036133705/",NA,97,7,13,8,0,0,0,0
"lloyddoggett","154050553704_10155121666533705","Rep. Lloyd Doggett","2017-07-19","2017-07-19 17:02:23","Republicans kept their failed 'pay more get less' health care bill in a secret room under lock and key before it came to a vote, rightly afraid of showing it to the American people. Looks like they may take the same route with their tax plan, holding no hearings whenever they conceive specific legislation that will likely borrow trillions from abroad to pay for tax breaks for multinationals and the wealthiest few.","link","https://doggett.house.gov/politico-pro-hatch-unsure-whether-tax-reform-plan-will-get-finance-committee-hearing","doggett.house.gov",63,27,20,0,3,10,4,69
"lloyddoggett","154050553704_10155122254598705","Rep. Lloyd Doggett","2017-07-19","2017-07-19 20:41:40","Pleased to meet with my friend Mehmet Oguz from San Antonio, who is the Vice President of the American Turkic Business Council, and other Turkish Americans and Turks to discuss the troubling undermining of democracy in Turkey. Thank you for visiting with me.","photo","https://www.facebook.com/lloyddoggett/photos/a.162214153704.115569.154050553704/10155122254598705/?type=3",NA,87,11,3,6,0,0,0,0
"lloyddoggett","154050553704_10155122693428705","Rep. Lloyd Doggett","2017-07-21","2017-07-21 00:51:19","This week's Tax Policy Subcommittee hearing is the first to explore the impact on individual taxpayers of the GOP's tax blueprint introduced over 13 months ago. I offer comments on lessons learned from the first GOP tax bill this year and express concern about current tax provisions intended to encourage retirement savings. Recent studies show how unevenly these laws work: 60% percent of American households get a mere 16% of the tax benefits, while the top 20% of income earners get 66% of retirement tax incentive benefits. We need to improve a system in which too many families are not adequately prepared for retirement. You can watch here including good advice from Eric Rodriguez of UnidosUS.","video","https://www.facebook.com/lloyddoggett/videos/10155122693428705/",NA,45,3,8,0,1,0,0,0
"lloyddoggett","154050553704_10155124801343705","Rep. Lloyd Doggett","2017-07-20","2017-07-20 15:54:55","Our dear friend Jaime is laid to rest today. Though he remains with us only in spirit, his legacy lives on in each of us as we continue his fight for social justice.","link","http://www.expressnews.com/news/local/article/Local-leader-Martinez-remembered-for-nationwide-11292806.php#photo-13253133","expressnews.com",35,4,1,6,0,0,17,1
"lloyddoggett","154050553704_10155125196883705","Rep. Lloyd Doggett","2017-07-20","2017-07-20 18:09:39","President Trump fired Manhattan U.S. Attorney Preet Bharara, Deputy Attorney General Director Sally Yates, FBI Director James Comey, and now threatens Special Counsel Robert Mueller. Anyone who gets too close for comfort to Trump business dealings risks losing their job. The Presidency is not an episode of The Apprentice, and “you’re fired” actually has far-reaching implications for our Nation.","link","https://www.bloomberg.com/news/articles/2017-07-20/mueller-is-said-to-expand-probe-to-trump-business-transactions","bloomberg.com",448,72,96,25,5,15,11,94
"lloyddoggett","154050553704_10155128336618705","Rep. Lloyd Doggett","2017-07-21","2017-07-21 18:14:15","Joined by Eric Rodriguez of UnidosUS, along with his colleagues Yugi Wang and my former staff member, Manuel Grajeda. I invited Mr. Rodriguez to testify as an expert witness before the Tax Policy Subcommittee, on which I serve as the Ranking Democrat. He indicated that working class families could be worse off under the Trump tax plan, which has focused its benefits on the superrich and multinational corporations. Thank you to Unidos US for lifting the voices of the Latino community and fighting for working families across the country.","photo","https://www.facebook.com/lloyddoggett/photos/a.162214153704.115569.154050553704/10155128336618705/?type=3",NA,44,11,4,5,0,2,1,0
"lloyddoggett","154050553704_10155128831423705","Rep. Lloyd Doggett","2017-07-22","2017-07-22 22:00:00","At my neighborhood town hall, I had the privilege of hearing from Texans who are calling on Washington to protect their access to quality health care. I am grateful to all who bravely spoke up and shared their stories of how Medicaid helps their families receive affordable care. Watch more from this CBS Austin recap.","video","https://www.facebook.com/lloyddoggett/videos/10155128831423705/",NA,140,9,20,4,0,0,0,1
"lloyddoggett","154050553704_10155131229248705","Rep. Lloyd Doggett","2017-07-22","2017-07-22 17:04:15","In another short-sighted decision, done by fiat behind closed doors, President Trump has cut funding to teen pregnancy prevention programs in San Antonio and the rest of the U.S. two years early, leaving program grantees and at-risk youth confused and without resources. These programs bring life-changing education to our youth, helping those in our community avoid unplanned pregnancies and make healthy decisions. The Trump Administration must provide an explanation for its forsaking Texas teens by dismantling this valued initiative.","link","http://www.expressnews.com/news/local/article/Trump-administration-ends-teen-pregnancy-11299979.php","expressnews.com",72,55,114,3,1,16,106,413
"lloyddoggett","154050553704_10155134496413705","Rep. Lloyd Doggett","2017-07-24","2017-07-24 00:56:39","I share my thoughts on some of the significant developments of the week that was, and the one ahead. As always, I welcome your good counsel.","video","https://www.facebook.com/lloyddoggett/videos/10155134496413705/",NA,152,21,15,15,0,0,2,3
"lloyddoggett","154050553704_10155135092018705","Rep. Lloyd Doggett","2017-07-23","2017-07-23 19:36:45","I stand with those who are rallied this weekend to oppose the Trump Administration’s proposed $6 billion in budget cuts to the U.S. Department of Housing and Urban Development. A salute to Austin Habitat for Humanity, Foundation Communities, and others for all that you regularly do for our community. Your commitment to some of our most disadvantaged neighbors is always inspiring. The Trump budget greatly harms our already difficult struggle to address affordable housing challenges. There is not a local education or social services initiative that will go undamaged if this appalling budget is implemented. All of these cuts to provide a few at the top with another tax windfall, while still digging us deeper into debt. Republicans are building an economic ladder with all the rungs at the top. Thank you for continuing to express our shared values and our united concern about this vital matter. We must continue to resist and to persist.","link","http://www.mystatesman.com/news/local/federal-cuts-could-worsen-austin-affordability-crisis-groups-say/od1u6eJ3UhKtWUKub4XsEK/","mystatesman.com",93,12,11,4,0,2,21,17
"lloyddoggett","154050553704_10155135332393705","Rep. Lloyd Doggett","2017-07-23","2017-07-23 21:00:46","Our neighbors stand ready to help after this unnecessary horror and have asked how they can help. I have learned of an additional death, and all other victims remain hospitalized.  Those who want to offer humanitarian assistance can contact American Gateways. Tonight at 6pm community members will gather in front of the San Fernando Cathedral in prayer for the victims.","status",NA,NA,75,9,7,12,0,1,52,0
"lloyddoggett","154050553704_10155138368343705","Rep. Lloyd Doggett","2017-07-24","2017-07-24 18:30:01","I couldn’t have said it any better myself. Thank you Mr. Ron Soele, for your letter to the editor in today’s San Antonio Express-News.","photo","https://www.facebook.com/lloyddoggett/photos/a.162214153704.115569.154050553704/10155138368343705/?type=3",NA,222,45,40,16,91,2,1,1
"lloyddoggett","154050553704_10155139028303705","Rep. Lloyd Doggett","2017-07-24","2017-07-24 22:11:01","The Republican repeal bill threatens both health care and our democratic process. The Affordable Care Act included almost two hundred Republican amendments, adopted over the course of dozens of hours of hearings and floor debate. In their zeal to repeal, the Republicans refused to let any Democratic ideas be considered or adopted. As a result, they are left touting partisan bills that would cause millions more to become uninsured, cut hundreds of billions of dollars from Medicaid, and decimate protections for people with pre-existing conditions.","link","https://www.nytimes.com/interactive/2017/07/21/us/health-care-amendments.html","nytimes.com",177,39,134,2,1,12,35,127
"lloyddoggett","154050553704_10155141067008705","Rep. Lloyd Doggett","2017-07-25","2017-07-25 14:42:33","President Trump sought information on whether he has power to pardon himself and his family regarding anything uncovered by Special Counsel Robert Mueller’s Russia investigation. If the Trump family did nothing wrong, if it had nothing to hide, then it wouldn’t need a pardon. As the list of people that he fires grows, and if he gets pardoning underway, even mute Republicans will have to find their voices. Some of Trump’s house of cards will surely fall down.","link","https://www.washingtonpost.com/news/post-politics/wp/2017/07/22/trump-denounces-illegal-leaks-in-new-accounts-of-his-campaigns-contact-with-russia/?utm_term=.b86f0d8eb84f","washingtonpost.com",106,41,21,0,4,5,16,44
"lloyddoggett","154050553704_10155142295478705","Rep. Lloyd Doggett","2017-07-25","2017-07-25 21:38:38","While Republican senators voted to proceed into the great unknown, we know that trouble is on the way. President Trump is demanding that health care access be ripped away from millions. Hatched in darkness, with no open hearings, no amendments, and no respect for the American people, this Republican repeal process puts Americans last. We must keep working together, telling the stories of our many neighbors who will be harmed, and resisting this travesty every day, in every nonviolent way.","status",NA,NA,251,41,40,3,2,2,34,62
"lloyddoggett","154050553704_10155142459583705","Rep. Lloyd Doggett","2017-07-26","2017-07-26 22:22:53","Congratulations to Celeste Brown, who ably served as a Field Representative in my San Antonio office. She will do great work in her new role as Director of Communications & Engagement for City Councilman Cruz Shaw, District 2.","photo","https://www.facebook.com/lloyddoggett/photos/a.162214153704.115569.154050553704/10155142459583705/?type=3",NA,213,10,3,19,0,1,0,0
"lloyddoggett","154050553704_10155145142593705","Rep. Lloyd Doggett","2017-07-26","2017-07-26 19:33:49","The master of distraction is at it again. Caught up in the swirl of misconduct surrounding the Trump family, President Trump issues yet another ban to change the subject. Tweeting that he will not “allow” an estimated 2,500 out of 1.3 million servicemembers “to serve in any capacity” does a great disservice to our country. It puts politics over safety. It is blatant discrimination against the transgender community. We should honor and protect all, no matter their gender, who risk their lives to defend our freedoms.","status",NA,NA,351,62,52,8,1,4,24,56
"lloyddoggett","154050553704_10155148351048705","Rep. Lloyd Doggett","2017-07-27","2017-07-27 19:26:50","For our Nation of immigrants, a wall rejects our very history. A border wall is not about America leading the world; it is about shutting the world off from us. Why build Trump’s boondoggle in the desert while Republicans refuse to invest in healthcare and education? I oppose this wall of ignorance—this wall of prejudice, in favor of building a bridge of opportunity. To achieve true security, we need to reject this narrow-minded approach in favor of comprehensive immigration reform.","video","https://www.facebook.com/lloyddoggett/videos/10155148351048705/",NA,425,63,107,82,0,3,0,2
"lloyddoggett","154050553704_10155148617683705","Rep. Lloyd Doggett","2017-07-27","2017-07-27 21:30:52","This headline says it all. If Republicans know that ripping millions of Americans off health insurance is bad policy, bad politics, and “mean mean mean,” then the choice should be easy. Vote no.","link","http://www.politico.com/story/2017/07/27/obamacare-repeal-republicans-status-241025","politico.com",112,15,25,3,3,6,2,21
"lloyddoggett","154050553704_10155150867858705","Rep. Lloyd Doggett","2017-07-28","2017-07-28 15:57:05","Fresh off the Republican failure to jam through their first tax cut for the superrich that masqueraded as health care repeal, I was interviewed today about the sorry sequel they’re preparing on taxes.  They have yet to show any genuine interest in bipartisan reform.  Nor have they evidenced learning any lessons from their health repeal failure, such as abandoning their reliance on secrecy and exclusion of the public.  We should not award massive tax breaks to the superrich and large multinationals by cutting Medicare and Social Security. We should not widen  income inequality while leaving a few tax crumbs for the middle class. You can watch my interview with Bloomberg Television here.","video","https://www.facebook.com/lloyddoggett/videos/10155150867858705/",NA,132,11,14,9,0,5,0,2
"lloyddoggett","154050553704_10155151416363705","Rep. Lloyd Doggett","2017-07-28","2017-07-28 20:15:01","Democracy worked last night– slowly, painfully, and with not a vote to spare. Our responsibility is to keep it working by telling the stories of how much harm this ‘mean’ effort would cause our neighbors. We must continue demanding accountability from every elected official. The real ‘skinny,’ the truth about the ‘skinny bill’ strategy, is that House Republicans had already prepared a ‘martial law’ resolution to immediately jam this sorry bill through the House this very weekend and send on immediately for President Trump’s signature, with no public evaluation.   If this strategy won, American families would have lost. Though we have delayed the Republican assault, health care coverage for millions continues to hang by a thread. We must remain vigilant against any more attacks on care and fight for real solutions.","link","https://www.washingtonpost.com/powerpost/senate-rejects-measure-to-partly-repeal-affordable-care-act-dealing-trump-and-gop-leaders-a-major-setback/2017/07/28/f2865b10-7364-11e7-8f39-eeb7d3a2d304_story.html?utm_term=.8c28564a8c47","washingtonpost.com",236,29,19,19,0,2,4,1
"lloyddoggett","154050553704_10155154656818705","Rep. Lloyd Doggett","2017-07-30","2017-07-30 00:56:21","Recent study, published in the Proceedings of the National Academy of Sciences, shows our planet is undergoing an era of “biological annihilation.” Conservatively, scientists estimate that 200 species have gone extinct in the past 100 years, compared to the “normal” extinction rate of two species going extinct every 100 years. This alarming development cannot be ignored; we must invest in strategies that preserve biodiversity. One way is to combat rising carbon pollution and global warming.","link","https://www.nytimes.com/2017/07/11/climate/mass-extinction-animal-species.html","nytimes.com",95,16,73,2,0,9,126,38
"lloyddoggett","154050553704_10155158558068705","Rep. Lloyd Doggett","2017-07-31","2017-07-31 14:29:42","As chair of the House Prescription Drug Task Force, I continue working to expose pharmaceutical companies that put overcharge patients and to advance legislative and administrative solutions to lower the cost of medications. Unfortunately, Republicans do not even want to get accurate price data, much less do anything about it.","video","https://www.facebook.com/lloyddoggett/videos/10155158558068705/",NA,163,31,39,10,0,1,17,10
"lloyddoggett","154050553704_10155159473708705","Rep. Lloyd Doggett","2017-07-31","2017-07-31 21:45:27","President Trump's chaos continues. Sad! But good riddance.","link","https://www.nytimes.com/2017/07/31/us/politics/anthony-scaramucci-white-house.html?_r=0","nytimes.com",242,17,11,10,38,2,1,0
"lloyddoggett","154050553704_10155159681093705","Rep. Lloyd Doggett","2017-08-01","2017-08-01 00:11:43","While the Central Texas music scene focuses on young talent, the Texas Chapter of the Recording Academy today celebrated a long time creative stalwart of the industry. I joined in honoring Grammy award winning audio engineer and Wimberley resident, Rupert Neve on his 91st birthday, along with Academy members from across the country. His creations still remain some of the most sought-after pieces. Geoff Emerick, recording studio audio engineer, who worked on the classic Sgt. Pepper’s Lonely Hearts Club Band album, which turned 50 this year, spoke.  Though we all celebrate the performers that bring joy to our lives, behind these performers are key professionals—amazing creators like Rupert and Geoff who bring quality sounds to us in an ever changing music industry.  I joined Alan Parsons, Carlos Alvarez, Ernie Gonzalez, David Messier and Andrea Villarreal.","photo","https://www.facebook.com/lloyddoggett/photos/a.10151839121778705.1073741865.154050553704/10155159681028705/?type=3",NA,68,5,1,4,0,0,0,0
"lloyddoggett","154050553704_10155161806818705","Rep. Lloyd Doggett","2017-08-01","2017-08-01 18:27:38","President Trump, a master of distraction, tries to deflect blame from his families’ scandals by targeting those who risk their lives to defend our freedom. This ban does a disservice to our country by putting politics over safety—and over respect for those who serve our Nation.","link","https://www.dallasnews.com/news/politics/2017/07/26/trumps-transgender-ban-military-catches-texans-offguard-splits-lawmakers","dallasnews.com",83,27,8,0,0,3,11,28
"lloyddoggett","154050553704_10155162517108705","Rep. Lloyd Doggett","2017-08-02","2017-08-02 00:02:49","Today marks 51 years since UT Tower tragedy. As we solemnly honor those who died and those affected, we also rededicate ourselves to preventing gun violence.  Campus carry policy, ironically imposed upon Texas public universities last year on the 50th anniversary, was today expanded to community colleges. Campus carry only makes the college community less safe.","link","http://www.texasmonthly.com/articles/96-minutes/","texasmonthly.com",197,42,71,4,0,2,173,27
"lloyddoggett","154050553704_10155164603208705","Rep. Lloyd Doggett","2017-08-02","2017-08-02 19:49:18","The San Antonio Express-News Editorial Board is exactly right. These teen pregnancy prevention programs bring life-changing education to our youth, helping those in our community avoid unplanned pregnancies and make healthy decisions. The Trump Administration must provide an explanation for its forsaking Texas teens by dismantling this valued initiative in yet another short-sighted, politically motivated decision. That’s why I have asked the Administration multiple times for an answer, joined by my Texas Democratic colleagues and by Democratic leaders around the country.","link","http://www.mysanantonio.com/opinion/editorials/article/Trump-axes-teen-pregnancy-prevention-programs-11725566.php","mysanantonio.com",67,30,35,1,1,4,23,110
"lloyddoggett","154050553704_10155167597578705","Rep. Lloyd Doggett","2017-08-04","2017-08-04 00:31:32","The Gang That Couldn’t Lie Straight – more Trump antics to protect himself are revealed. In his conversation with Mexican President Peña Nieto, just after being inaugurated, President Trump believed the border wall to be the “least important” thing to discuss. Knowing full well Mexico wouldn’t pay for the wall, Trump was mainly eager to hide that and his broken border wall campaign promise from the public  As usual, his biggest concern appears to have been, how Mexican comments would make him look, personally, not what was best for our country.  And now American taxpayers are being forced to pay for a wasteful campaign pledge that will not make us more secure.","link","http://www.cnn.com/2017/08/03/politics/trump-pena-nieto-call-transcript/index.html","cnn.com",88,32,25,1,23,12,12,40
"lloyddoggett","154050553704_10155167707428705","Rep. Lloyd Doggett","2017-08-04","2017-08-04 01:14:55","Tune in tonight at 9pm on FOX 7 Austin as I'll be speaking live about what happened with the Republican health care repeal failure and the need to #ProtectOurCare.","status",NA,NA,42,8,2,2,0,0,0,0
"lloyddoggett","154050553704_10155169022223705","Rep. Lloyd Doggett","2017-08-04","2017-08-04 15:35:15","The many in Central Texas and across America who have continued speaking out, demanding “Don’t take away our health care,” and telling stories of how they, their families, and their neighbors would be harmed—that’s the most important factor in stopping the sorry Republican health care repeal. With no public hearings, no testimony from the Trump Administration, and no amendments accepted, Republicans couldn’t convince some of their own Senators, though as usual House Republicans embraced what even Trump called a “mean bill.” Watch more of my thoughts on the GOP’s efforts to repeal the ACA and how we can move forward together in a bipartisan manner.","video","https://www.facebook.com/lloyddoggett/videos/10155169022223705/",NA,135,15,11,3,1,1,0,2
"lloyddoggett","154050553704_10155169577778705","Rep. Lloyd Doggett","2017-08-04","2017-08-04 19:18:28","Sowing autocracy reaps only instability & violence, yet again. This thuggish governing, which aims at suffocating out the opposition, is more of the same. The U.S. should be doing more to oppose this outrageous suppression of democracy and destruction of the Venezuelan economy.","link","https://www.nytimes.com/2017/07/30/world/americas/venezuela-constituent-assembly-election.html?_r=0","nytimes.com",18,10,2,0,0,0,14,4
"lloyddoggett","154050553704_10155171738748705","Rep. Lloyd Doggett","2017-08-05","2017-08-05 14:59:48","Pregnant women are more likely to die in Texas than in any other state, and ten times more likely than mothers-to-be in Spain or Sweden. Our state is failing expecting Texan women, by closing reproductive health clinics, restricting Medicaid, and refusing to help women avoid unwanted pregnancies. That’s why I am a sponsor of the Preventing Maternal Deaths Act and oppose efforts to restrict funding to reproductive health clinics, including Planned Parenthood.","link","https://www.nytimes.com/2017/07/29/opinion/sunday/texas-childbirth-maternal-mortality.html","nytimes.com",246,40,99,13,1,10,85,61
