"screen_name","id","from_name","date","datetime","message","type","link","domain","likes_count","comments_count","shares_count","love_count","haha_count","wow_count","sad_count","angry_count"
"lloyddoggett","154050553704_10155404925013705","Rep. Lloyd Doggett","2017-11-03","2017-11-03 18:20:42","The Children's Health Insurance Program used to be a bipartisan priority. Then Republicans let it expire, endangering coverage for 400,000 Texas children, and are insisting on using Medicare and public health prevention money to try to pay for their belated bill. We need a bipartisan compromise to restore funding and restore parents’ peace of mind, not another partisan proposal that continues to leave children’s health in jeopardy.","video","https://www.facebook.com/lloyddoggett/videos/10155404925013705/",NA,186,35,58,6,0,9,33,23
"lloyddoggett","154050553704_10155405482948705","Rep. Lloyd Doggett","2017-11-03","2017-11-03 21:52:47","Final Friday has been, for years, an opportunity for our community to gather and discuss important social issues. I’ve attended many and appreciate people like Bob and Jo Anne Comeaux and others for keeping this tradition alive. Thank you to Nicki and Norma Roberson for opening up your home and hosting this special gathering. Libby and I enjoyed the conversation, hospitality, and fellowship.","photo","https://www.facebook.com/lloyddoggett/photos/a.162214153704.115569.154050553704/10155405482768705/?type=3",NA,30,2,3,2,0,0,0,0
"lloyddoggett","154050553704_10155405593533705","Rep. Lloyd Doggett","2017-11-04","2017-11-04 23:51:10","Meeting with San Juan Mayor Cruz to learn more about Trump Administration failures and the continuing needs of so many in Puerto Rico, American citizens, many of whom are surrounded by devastation and are still without safe drinking water.","photo","https://www.facebook.com/lloyddoggett/photos/a.162214153704.115569.154050553704/10155405593338705/?type=3",NA,693,51,41,117,3,0,6,11
"lloyddoggett","154050553704_10155407244378705","Rep. Lloyd Doggett","2017-11-04","2017-11-04 16:11:09","Who are the winners and losers in this Republican tax scam? Simply put: Winners: big corporations and the wealthy. Losers: Everyone else.","link","https://www.washingtonpost.com/news/wonk/wp/2017/11/02/winners-and-losers-in-the-gop-tax-plan/?hpid=hp_rhp-top-table-high_tax-winnerslosers-230pm%3Ahomepage%2Fstory&utm_term=.0cf62fffb138","washingtonpost.com",53,24,49,0,0,3,8,53
"lloyddoggett","154050553704_10155407730198705","Rep. Lloyd Doggett","2017-11-04","2017-11-04 19:23:22","As a former Texas Supreme Court Justice, I find his comments appalling. Continually debasing our democracy exacts a heavy price. So does Republican silence. Together with his sustained attacks on our free press, urging the DOJ to attack his political foes, and his ""hug a thug” admiration for Putin and tin pot dictators, who trample human rights, he would take our country on a path to authoritarianism. Our system of checks and balances and actively committed citizens must resist his impulsive wrongs.","link","https://www.nytimes.com/2017/11/02/us/politics/fact-check-trump-terror-convictions.html","nytimes.com",117,62,33,2,2,3,11,53
"lloyddoggett","154050553704_10155409835738705","Rep. Lloyd Doggett","2017-11-05","2017-11-05 17:29:25","Thomas Friedman notes that you need to connect the dots when it comes to strife in North Africa. As the desert expands, amplified by climate change and a booming population, farmers find their fields no longer produce enough for survival. This creates “climate migrants,” refugees, or even militants, as their countries become less stable. Our national response should not just be to throw more troops into the region. Instead, President Trump needs to acknowledge the political, economic, and environmental roots of conflict in countries like Niger. Of course, strategies require more than 140 characters.","link","https://www.nytimes.com/2017/10/31/opinion/trump-niger-africa-desertification.html","nytimes.com",72,17,21,1,0,0,4,6
"lloyddoggett","154050553704_10155410500713705","Rep. Lloyd Doggett","2017-11-05","2017-11-05 21:48:51","Once again gun violence destroys lives, while this Congress, owned lock, stock, and barrel by the NRA refuses to act. The Las Vegas tragedy was the 272nd incident of mass gun violence in America this year. Today, the number has already climbed to 307!  It was good to have Moms Demand Action at our successful town hall this weekend—determined not to let this horrible and unnecessary loss of life be ignored. #SutherlandSprings","status",NA,NA,590,183,152,12,2,8,227,104
"lloyddoggett","154050553704_10155410907353705","Rep. Lloyd Doggett","2017-11-06","2017-11-06 02:02:02","Today, the International Consortium of Investigative Journalists (ICIJ) revealed the “Paradise Papers” and announced a global investigation of offshore tax avoidance activities by politicians, world leaders, and multinational corporations to be disclosed further over the course of the next few days. When the privileged avoid their taxes, individuals and small businesses are forced to pay more.   Since the Panama Papers were released last year, Republicans have refused my call for Committee hearings on tax fraud. We should not fear the truth.","link","https://www.icij.org/blog/2017/785/icij-releases-paradise-papers/","icij.org",138,15,46,8,0,20,1,2
"lloyddoggett","154050553704_10155412025663705","Rep. Lloyd Doggett","2017-11-06","2017-11-06 15:05:57","Wonderful gathering with the Indian-American community, which contributes so much to Central Texas.  With the leadership of founder Harish Kotecha, HC4A (Hindu Charities for America) is raising funds predominantly from Hindu residents to create educational opportunities for their non-Hindu neighbors seeking to overcome poverty.  The focus is on vocational opportunities in cooperation with Capital Idea, ACC, and local school districts.  Our community is enriched by the culture and many contributions of our Indian-American neighbors.","photo","https://www.facebook.com/lloyddoggett/photos/a.162214153704.115569.154050553704/10155412013598705/?type=3",NA,32,0,0,0,0,0,0,0
"lloyddoggett","154050553704_10155412332063705","Rep. Lloyd Doggett","2017-11-06","2017-11-06 18:14:27","Today, House Republicans are forcing us to mark-up their tax scam bill, after introducing it less than 100 hours ago. I introduced an amendment to postpone this debate for one week, so that it receives proper review and analysis. My objective is insight, not delay. Incredibly, for such a broad bill, this plan has never had a single public hearing, nor has any Trump Administration official had the courage to come before this Committee and answer questions about it. No expert witness has been given the opportunity to explain this bill’s deficiencies, nor has there been an opportunity for thorough, independent evaluation of the proposal in this this rush to injustice.  Like the rushed-through Trump immigration policy and the health care repeal disaster, we need to learn from experience, we need some vetting – in the President’s words, we need ‘extreme vetting.’ If they don’t have anything to hide, a week and one public hearing won’t impair their efforts.","video","https://www.facebook.com/lloyddoggett/videos/10155412332063705/",NA,499,111,141,18,0,14,2,73
"lloyddoggett","154050553704_10155412880023705","Rep. Lloyd Doggett","2017-11-06","2017-11-06 22:26:21","Today, we reached the holy grail of the Republican party. It exists to provide more tax breaks to the few, to benefit the privileged, and it’s been amazing at the price that’s already been paid to get to this point. Apparently, there is no wrongdoing in which Donald Trump can engage, no insult, no attack on our justice system or our law enforcement, no endangerment of our security, that will cause many of our Republican colleagues to say “enough” or to speak out about that wrongdoing, because they are convinced that Donald Trump is their ticket to tax breaks that mainly benefit the few and multinational corporations.","video","https://www.facebook.com/lloyddoggett/videos/10155412880023705/",NA,248,69,131,10,1,8,54,105
"lloyddoggett","154050553704_10155413079263705","Rep. Lloyd Doggett","2017-11-06","2017-11-06 23:58:15","In hour six of this markup on the Republicans’ tax scheme, it has become very clear: this markup is not about tax reform—it is a political life preserver for the Republican party. This whole procedure is totally out of order, as Republicans dropped a far-reaching 33-page amendment to a 400-plus page bill that itself only was made public on Thursday, and which will impact every American. This is not worthy of this Committee’s important work, and has lobbyist fingerprints all over it.","video","https://www.youtube.com/watch?v=GYogjXljFNs&feature=youtu.be",NA,201,43,112,3,1,32,12,141
"lloyddoggett","154050553704_10155413228893705","Rep. Lloyd Doggett","2017-11-07","2017-11-07 01:31:58","I was saddened to learn of the passing of Ceci Gratias, an outspoken advocate in our community. Through her work at the Austin Gay and Lesbian Chamber of Commerce, OutYouth, Allgo, and HRC, Ceci helped to expand individual opportunity for so many in ways that made this an even better place to call home for all of us. She was incredibly deserving of the Bettie Naylor award from the HRC this year. Ceci opened doors and opened minds with her spirit for social justice and equality by embracing the hard work of pushing forward when so many others were determined to pull us backward. Whether at Chamber events or meeting in my office, I always appreciated the time that we spent together. My thoughts and prayers are with Ceci’s family and friends during this difficult time.","photo","https://www.facebook.com/lloyddoggett/photos/a.162214153704.115569.154050553704/10155413216788705/?type=3",NA,78,11,7,4,0,0,51,1
"lloyddoggett","154050553704_10155413462803705","Rep. Lloyd Doggett","2017-11-07","2017-11-07 03:17:00","Thoughts and prayers are important for the victims' families, as is deep gratitude to our law enforcement officers as well as the local heroes who took quick action and put their lives on the line, but that is just not enough.  What we have here are moments of silence followed by unending moments of inaction. This Congress is owned lock, stock, and barrel by the NRA. Yesterday, on the 309th day of 2017, Sutherland Springs became the 307th mass shooting this year. Following the horrifying shooting in Las Vegas, Republicans failed to even consider narrow legislation to ban a “bump stock” accessory that enables weapons to function like already banned automatic weapons. Sutherland Springs and its young victims should not be another example of inaction. Just this weekend I met in San Antonio with members of Moms Demand Action for Gun Sense in America. I remain determined not to let this horrible and unnecessary loss of life be ignored and committed to ending gun violence and enacting smart gun safety measures.","status",NA,NA,325,70,77,38,0,1,54,11
"lloyddoggett","154050553704_10155414341743705","Rep. Lloyd Doggett","2017-11-07","2017-11-07 14:10:21","Successful town hall (my tenth) this weekend with guest State Representative Diego Bernal. We were also joined by individuals from Tobin Hill, Alta Vista, and many other neighborhoods. I was pleased to have VFW Commander Robert Martinez and other veterans, members of the San Antonio Alliance of Teachers and Support Personnel and Moms Demand Action for Gun Sense in America participate in the conversation. Thank you to Alta Vista Neighborhood Association President Claudia Guerra for your warm introduction and to Pastor Jim and Kercida McClain of Laurel Heights United Methodist Church for hosting us.  Accessibility is important to my work representing you.","photo","https://www.facebook.com/lloyddoggett/photos/a.162214153704.115569.154050553704/10155414339563705/?type=3",NA,50,2,0,4,0,0,0,0
"lloyddoggett","154050553704_10155414591728705","Rep. Lloyd Doggett","2017-11-07","2017-11-07 16:36:41","Republicans propose to cut the statutory corporate tax rate almost in half; they propose to reward those who have dodged their taxes and hidden their profits in offshore tax havens and islands as reflected in the Paradise Papers; they propose a tax break for those at the top of the income scale. And as a result of that, we are going to borrow nearly $1.5 trillion. That’s $1 trillion + $500 billion – the loan, the IOU, that these Republicans are telling Americans we are taking out. Remember, just a few months ago – the only tax cut they said they would support would be fully paid for. Our country’s future clearly depends on how quickly the truth can catch up with the lie.","video","https://www.facebook.com/lloyddoggett/videos/10155414591728705/",NA,120,43,104,4,1,6,9,84
"lloyddoggett","154050553704_10155414962908705","Rep. Lloyd Doggett","2017-11-07","2017-11-07 19:05:40","The Republican tax scheme will bring immense debt—to the tune of about $1.5 trillion—at immense cost to the American people, just to benefit some at the very top and multinational corporations that already exploit loopholes  to dodge paying their taxes. Meanwhile, those with high health expenses, small businesses, and companies that do not outsourcing American jobs are left at a disadvantage.","link","https://www.nytimes.com/2017/11/07/us/politics/republican-tax-bill.html?_r=0","nytimes.com",31,30,31,0,2,3,12,68
"lloyddoggett","154050553704_10155415219058705","Rep. Lloyd Doggett","2017-11-07","2017-11-07 21:27:16","Don't get confused—get covered. While the Trump Administration tries to make it more complex, there are simple steps you can take to obtain health insurance before open enrollment ends on Dec. 15. Contact my office at 210-704-1080 (San Antonio) or 512-916-5921 (Austin) to be connected with groups that can help.","link","http://www.mysanantonio.com/opinion/editorials/article/New-policies-create-ACA-enrollment-confusion-12336348.php","mysanantonio.com",63,10,38,1,0,0,3,1
"lloyddoggett","154050553704_10155415406343705","Rep. Lloyd Doggett","2017-11-07","2017-11-07 23:23:42","President Trump has made stopping the outsourcing of American jobs a central element of his promise to the American people. Unfortunately, like his promise to have Mexico pay for his unnecessary wall, it’s very much a broken promise. The Republican tax bill incentivizes companies to outsource their jobs in search of a lower tax rate on profits.  It is flat wrong that the corner pharmacy should have to pay a rate that is substantially higher on its operations than Pfizer on its offshore operations. This is why I introduced my “Stop Outsourcing of American Jobs” amendment today that would treat profits abroad the same way as profits earned at home. We’re not against profits; we’re not against maximizing profits; multinational corporations should just pay their fair share.","video","https://www.facebook.com/lloyddoggett/videos/10155415406343705/",NA,168,33,44,19,1,10,0,5
"lloyddoggett","154050553704_10155416911653705","Rep. Lloyd Doggett","2017-11-08","2017-11-08 16:03:07","The economic evidence is clear, the Republican tax bill is a job killer –  it will not grow our economy. I offered an amendment that centers on investing in people. It restores all of the critical education deductions – including the Student Loan Interest deduction, Teacher Expenses deduction, and Tuition and Fees deduction – that the Republican tax scam would eliminate. To really boost our economy, let’s strengthen our workforce, and grow jobs by investing in people and education.","video","https://www.facebook.com/lloyddoggett/videos/10155416911653705/",NA,179,21,42,21,2,4,2,1
"lloyddoggett","154050553704_10155417193043705","Rep. Lloyd Doggett","2017-11-08","2017-11-08 17:50:21","We don’t need a First Church of Political Expediency, or a United Congregation of Available Political Endorsements, or a Megachurch of Mega-PACs, and that’s where the Republican tax scam will lead. That’s why I support my friend Rep. John Lewis’s amendment, which would restore the 63-year standard that protects religious, non-profit, charitable, and related organizations from being used for partisan campaign activities paid for with their tax-deductible donations. There is enough damage already done to our elections laws and campaign laws – let’s not let our places of worship become tools of wealthy donors and partisan interests.","video","https://www.facebook.com/lloyddoggett/videos/10155417193043705/",NA,285,37,61,53,0,4,3,7
"lloyddoggett","154050553704_10155417431363705","Rep. Lloyd Doggett","2017-11-08","2017-11-08 19:21:35","Rep. Doggett Speaks on Republican Tax Scam","video","https://www.facebook.com/lloyddoggett/videos/10155417431363705/",NA,231,53,37,36,2,8,2,3
"lloyddoggett","154050553704_10155417879103705","Rep. Lloyd Doggett","2017-11-08","2017-11-08 23:34:41","On Monday, five and a half hours after this Committee tax mark-up began, the Republican Chairman urged adoption of a 33-page amendment no Democrat had ever seen before but we were forced to vote on. Review of this surprise amendment and the Joint Taxation Committee analysis shows that it is a $157 billion gift to multinationals—particularly the Koch brothers and big Wall Street banks. With the same $157 billion that is a multinational giveaway – the medical expense deduction for middle class families, the student loan interest deduction to help with loans that are burdening so many students, the out-of-pocket cost of teachers across America, the adoption tax credit, the Work Opportunity Tax Credit to help veterans and others get back in our workforce – all of those could have been included in this bill and still would have left a billion or two left to spare.","video","https://www.facebook.com/lloyddoggett/videos/10155417879103705/",NA,100,45,126,3,1,13,5,157
"lloyddoggett","154050553704_10155418222838705","Rep. Lloyd Doggett","2017-11-09","2017-11-09 02:32:03","Most taxpayers who use the medical expense deduction make less than $100,000. A majority are over 65-years-old. This deduction makes a big difference to people paying for nursing homes, cancer drugs, fertility treatment, or care for children with special needs. The Republican tax scheme would eliminate this deduction, which would deliver a “gut punch” to middle-class families.","link","https://www.nytimes.com/2017/11/08/health/medical-deduction-tax-bill.html","nytimes.com",50,13,86,0,0,1,30,109
"lloyddoggett","154050553704_10155419619518705","Rep. Lloyd Doggett","2017-11-09","2017-11-09 16:41:53","Since starting #GOPTaxScam mark-up 4 days ago, every single Democratic amendment has been rejected, with absolutely amazing circus-level contortions by some of our Republican friends explaining why they are voting against something their constituents support. The only thing that has changed the cost of the #GOPTaxBill, making it more expensive, is an amendment by the Chairman, and it added a big gift to multinational corporations. Now it exceeds the budget limit and that’s the excuse for needing another manager’s amendment – to correct what we were not told the first one did.","video","https://www.facebook.com/lloyddoggett/videos/10155419619518705/",NA,58,26,23,7,1,5,2,28
"lloyddoggett","154050553704_10155420161738705","Rep. Lloyd Doggett","2017-11-09","2017-11-09 20:37:33","I don’t attend social events at the White House – I’m not interested in spending time with a President who attacks my constituents. But I have read that when it comes time to serve dessert, the President gets two scoops of ice cream, while guests receive one scoop. There is a lot of similarity in that dessert practice and what is being served up in the Republican tax scam. Trump and his billionaire buddies get a big, sweet bowl of ice cream and the American people get to lick the bowl and pay for the ice cream.","video","https://www.facebook.com/lloyddoggett/videos/10155420161738705/",NA,634,87,205,97,43,16,12,25
"lloyddoggett","154050553704_10155420685283705","Rep. Lloyd Doggett","2017-11-10","2017-11-10 02:11:59","Earlier today, Republicans forced a Ways and Means Committee vote on their tax scam, which outsources jobs overseas, explodes the deficit, and gives big-league tax breaks to the wealthiest few and large multinational corporations. What a complete lack of courage this whole secretive process represents: no hearings, no Administration official or expert testimony to defend it, no opportunity for fair consideration. The bill is so bad, so wretched, that Republicans blocked a fair review by Members of the committee and by the American people. If the truth can catch up with the lies, this bill will be defeated.","status",NA,NA,153,29,92,0,0,4,24,138
"lloyddoggett","154050553704_10155421998883705","Rep. Lloyd Doggett","2017-11-10","2017-11-10 16:50:09","Based on documents obtained under the Freedom of Information Act, the Trump administration had collected 60% less in civil penalties from polluters through July 31 than the previous three administrations over a similar period. We pay for such Pollute for Free” cards with our health.","link","https://www.nytimes.com/2017/10/31/climate/exxon-fine.html","nytimes.com",44,15,44,1,0,10,4,52
"lloyddoggett","154050553704_10155422318853705","Rep. Lloyd Doggett","2017-11-10","2017-11-10 19:17:58","Saluting our veterans tomorrow in both San Marcos and San Antonio. We begin with ceremonies at the Hays County Courthouse at 9:30am, parade at 10. In San Antonio, meeting with vet parade participants at 11:30, and parade passing by the Alamo begins at noon. Later Saturday afternoon I will once again participate in the Southtown District Arts Festival founded by my talented friends Andy and Yvette Benavides. I look forward to hearing from our vets and the many who come to wish them well. Happy Veterans Day.","status",NA,NA,70,6,2,2,0,0,0,0
"lloyddoggett","154050553704_10155422955808705","Rep. Lloyd Doggett","2017-11-11","2017-11-11 01:04:43","Our Republican colleagues have made it clear by their surprise tactics and their refusal to permit any real public discussion of their tax bill in the committee that they want to do this in an entirely partisan enterprise. This whole process is about a bill so bad, so wretched, that they fear the involvement not just of us as Members of this Committee on a fair and democratic basis, but they fear the examination of this bill by the American people.","video","https://www.youtube.com/watch?v=zsHzxTZUbCU&feature=youtu.be",NA,97,21,41,3,0,6,3,43
"lloyddoggett","154050553704_10155424668653705","Rep. Lloyd Doggett","2017-11-11","2017-11-11 17:32:32","A great morning in San Marcos honoring our veterans. I was pleased to meet our Grand Marshal Lt Commander Sullivan and Lori McNabb, wife of Honorary Grand Marshal Colonel McNabb along with the Campusano family who help care for him as he battles Alzheimer's. Thank you to all who have served and continue to serve our great Nation.","photo","https://www.facebook.com/lloyddoggett/photos/a.10151839121778705.1073741865.154050553704/10155424668378705/?type=3",NA,120,4,7,10,0,0,0,0
"lloyddoggett","154050553704_10155425023633705","Rep. Lloyd Doggett","2017-11-11","2017-11-11 19:28:14","Josh Eilers, a former US Army Ranger, who served multiple tours in Iraq and Afghanistan, now owns and runs Ranger Cattle in Austin. I thank my friend, and all veterans, for their brave service to our country.","photo","https://www.facebook.com/lloyddoggett/photos/a.10151839121778705.1073741865.154050553704/10155425023578705/?type=3",NA,348,12,16,19,0,0,0,0
"lloyddoggett","154050553704_10155427519348705","Rep. Lloyd Doggett","2017-11-12","2017-11-12 18:22:21","Republicans started a mark-up of a tax scam bill not even 100 hours after revealing it. Monday, I called to postpone the mark-up for a week, so that we could properly analyze the bill that would impact every American. However, Republicans voted down my measure and forced a vote on their bill with no public hearings nor expert testimony, and without any analysis of the explosive revelations in the #ParadisePapers.","video","https://youtu.be/opA_7IUq-0o",NA,71,11,28,0,0,6,3,53
"lloyddoggett","154050553704_10155428118613705","Rep. Lloyd Doggett","2017-11-12","2017-11-12 23:17:12","Good news on Affordable Care Act insurance enrollment. One way to tell Trump & Co to keep their hands off your health insurance is to sign up now before expiration of the enrollment period that he shortened.","link","http://kut.org/post/local-groups-report-surge-obamacare-sign-ups-during-first-week-enrollment","kut.org",184,11,45,16,4,0,0,0
"lloyddoggett","154050553704_10155428322048705","Rep. Lloyd Doggett","2017-11-13","2017-11-13 01:01:13","Huge community support and turnout for Planned Parenthood this evening. Always great when Senator Kirk Watson serves as Master of Ceremonies.","photo","https://www.facebook.com/lloyddoggett/photos/a.10151839121778705.1073741865.154050553704/10155428321998705/?type=3",NA,456,29,18,66,4,0,1,5
"lloyddoggett","154050553704_10155429720783705","Rep. Lloyd Doggett","2017-11-13","2017-11-13 15:59:40","Saluting our veterans in Military City, U.S.A. Each year, I am fortunate to participate in the San Antonio Veterans Day parade with Maj. Val Martinez and Janie Barrera, who offers such important leadership for small businesses at LiftFund. Pleased to also be joined by Bexar County Sheriff Javier Salazar.","photo","https://www.facebook.com/lloyddoggett/photos/a.162214153704.115569.154050553704/10155429684683705/?type=3",NA,41,1,3,5,0,0,0,0
