"screen_name","id","from_name","date","datetime","message","type","link","domain","likes_count","comments_count","shares_count","love_count","haha_count","wow_count","sad_count","angry_count"
"RepAustinScott","131177916946914_1455964761134883","Rep. Austin Scott","2017-05-24","2017-05-24 21:11:31","Nationwide, May is Military Appreciation Month, a time to celebrate and honor those who’ve raised their hand and taken the oath to serve their fellow Americans. I took some time to write down my thanks, and I wanted to share them with you. To our service members: Thank you for the sacrifices you make to defend our great country. We celebrate you not only this month, but each and every day. EDIMGIAFAD.","link","http://www.macon.com/opinion/readers-opinion/article152108637.html","macon.com",35,5,4,3,0,0,1,1
"RepAustinScott","131177916946914_1460944540636905","Rep. Austin Scott","2017-05-29","2017-05-29 19:28:29","Today we honor those brave men and women who've paid the ultimate sacrifice for our freedoms.","photo","https://www.facebook.com/RepAustinScott/photos/a.141920472539325.28932.131177916946914/1460944540636905/?type=3",NA,41,1,4,1,0,0,0,0
"RepAustinScott","131177916946914_1461777687220257","Rep. Austin Scott","2017-05-30","2017-05-30 15:42:48","Late last week, Army Specialist Etienne J. Murphy of Loganville was killed in Syria. He was twenty-two years old. Our thoughts and prayers are with his family and friends during this time, and we thank him and honor him for his serve to our nation.","link","http://www.dailymail.co.uk/news/article-4548340/Pentagon-identifies-Army-Ranger-died-Friday-Syria.html","dailymail.co.uk",134,22,87,12,0,0,206,2
"RepAustinScott","131177916946914_1461795170551842","Rep. Austin Scott","2017-05-30","2017-05-30 17:18:43","Members of the House Armed Services Committee and I are in East Asia for the next several days meeting with world leaders and discussing the impacts of continued security cooperation and support between the United States and our allies. Stay tuned for more updates from the road.","photo","https://www.facebook.com/RepAustinScott/photos/a.1461791853885507.1073741837.131177916946914/1461795170551842/?type=3",NA,19,1,2,0,0,0,0,0
"RepAustinScott","131177916946914_1461933313871361","Rep. Austin Scott","2017-05-30","2017-05-30 22:10:23","I spent Memorial Day honoring the fallen soldiers of the Korean War at the War Memorial of Korea in Seoul, South Korea.  It was a humbling experience and a time to reflect on the sacrifices our men and women in uniform make to defend our freedoms and the freedoms of democracy around the world.","photo","https://www.facebook.com/RepAustinScott/photos/a.141920472539325.28932.131177916946914/1461933183871374/?type=3",NA,44,5,1,2,0,0,3,0
"RepAustinScott","131177916946914_1462971777100848","Rep. Austin Scott","2017-05-31","2017-05-31 19:03:55","Today is the last day of Military Appreciation Month, and this morning our Delegation had the opportunity to meet with U.S. Marines at the American Embassy in Hanoi, Vietnam and thank them for their service to our great nation. I ask you to join me in thanking our men and women in uniform not only today but each and every day. EDIMGIAFAD.","photo","https://www.facebook.com/RepAustinScott/photos/a.1461791853885507.1073741837.131177916946914/1462971777100848/?type=3",NA,17,0,1,3,0,0,0,0
"RepAustinScott","131177916946914_1464130800318279","Rep. Austin Scott","2017-06-01","2017-06-01 20:53:46","Last week, the U.S. Air Force performed an “Elephant Walk” and a “surge exercise” at Moody Air Force Base. Aircraft from the 23d Wing conducted the exercise operating A-10C Thunderbolt IIs, HH-60G Pave Hawks, and HC-130J Combat King II aircraft. It was a great display of U.S. aircraft combat power and defense capability in the skies.","link","http://defence-blog.com/news/us-air-force-conducted-a-surge-exercise-at-moody-air-force-base-in-georgia.html","defence-blog.com",147,16,23,12,0,2,0,0
"RepAustinScott","131177916946914_1464896903575002","Rep. Austin Scott","2017-06-02","2017-06-02 14:46:52","Yesterday, I had the opportunity to tour the Hỏa Lò Prison—or “Hanoi Hilton”—in Hanoi, Vietnam where many U.S. warfighters were kept as POWs during the Vietnam War. It was a humbling experience and a time to reflect on those who’ve given so much for our country, especially those who never returned home. To our veterans: Thank you, and welcome home.","photo","https://www.facebook.com/RepAustinScott/photos/a.1461791853885507.1073741837.131177916946914/1464895496908476/?type=3",NA,22,5,0,0,0,1,0,0
"RepAustinScott","131177916946914_1465147066883319","Rep. Austin Scott","2017-06-05","2017-06-05 14:44:51","Good news out of Lowndes County as more folks in our rural communities now have access to broadband. Reliable broadband infrastructure is critical to growth in our rural communities, and I am committed to pushing for infrastructure investments that connect small town America through dependable, high-speed broadband service.","link","http://www.valdostadailytimes.com/news/local_news/high-speed-internet-comes-to-rural-lowndes/article_406d6a6d-8bdc-592c-bfef-962d3d4652ec.html","valdostadailytimes.com",40,17,3,1,0,1,0,0
"RepAustinScott","131177916946914_1473460432718649","Rep. Austin Scott","2017-06-09","2017-06-09 19:17:08","Great morning at Dobbins Air Reserve Base with Vice President Mike Pence and Georgia Delegation Members in supporting our troops and thanking them for their commitment and service to our great nation.","photo","https://www.facebook.com/RepAustinScott/photos/a.141920472539325.28932.131177916946914/1473460432718649/?type=3",NA,384,19,12,11,0,0,0,3
"RepAustinScott","131177916946914_1478245438906815","Rep. Austin Scott","2017-06-14","2017-06-14 12:35:23","Praying for my colleague and friend House Majority Whip Steve Scalise and others shot this morning during a morning baseball practice in a D.C. suburb.","link","http://www.foxnews.com/us/2017/06/14/virginia-gop-baseball-practice-shooting-multiple-people-shot.html","foxnews.com",170,52,33,7,1,8,111,28
"RepAustinScott","131177916946914_1478544972210195","Rep. Austin Scott","2017-06-14","2017-06-14 18:52:52","Thank you to the brave men and women who have answered the call to defend our great nation. Happy 242nd Birthday to the U.S. Army!","photo","https://www.facebook.com/RepAustinScott/photos/a.141920472539325.28932.131177916946914/1478544972210195/?type=3",NA,68,4,3,4,0,0,0,0
"RepAustinScott","131177916946914_1480532602011432","Rep. Austin Scott","2017-06-16","2017-06-16 16:45:21","Today is the last day for two of our interns: Analhi of Americus and Matt of Johns Creek. These two young Georgians have been busy helping our legislative staff, giving constituent tours, attending briefings, and speaking with constituents who call our D.C. office. We wish them the best and thank them for their service to the people of the 8th District.","photo","https://www.facebook.com/RepAustinScott/photos/a.141920472539325.28932.131177916946914/1480528435345182/?type=3",NA,82,6,2,4,0,0,0,0
"RepAustinScott","131177916946914_1480672071997485","Rep. Austin Scott","2017-06-16","2017-06-16 19:44:52","“Rural America is stranded in the dial-up age.” I couldn’t have said it better myself. Lack of broadband service means less growth and fewer opportunities in communities across the country. That’s why I’m pressing for updated and upgraded broadband framework in any infrastructure packages that come out of Congress. A strong and thriving rural America mean a strong and thriving USA. Read some of my thoughts:","link","https://www.wsj.com/articles/rural-america-is-stranded-in-the-dial-up-age-1497535841?mg=prod%2Faccounts-wsj","wsj.com",91,29,17,5,0,0,0,0
"RepAustinScott","131177916946914_1484659618265397","Rep. Austin Scott","2017-06-20","2017-06-20 20:27:20","Yesterday in my Tifton office, I met with several members of Indivisible Women of South Georgia. I am grateful for their personal stories shared as we had a productive dialogue about health care concerns and other issues impacting Georgia's Eighth District.","photo","https://www.facebook.com/RepAustinScott/photos/a.141920472539325.28932.131177916946914/1484659618265397/?type=3",NA,52,11,3,3,0,0,0,1
"RepAustinScott","131177916946914_1487849037946455","Rep. Austin Scott","2017-06-23","2017-06-23 20:07:30","Today the President signed new VA accountability legislation into law, bringing full circle a years-long bipartisan effort to fix our broken VA to provide better care for those who've sacrificed so much for our great nation.","link","http://www.washingtonexaminer.com/trump-signs-one-of-the-largest-reforms-to-the-va-in-its-history/article/2626924","washingtonexaminer.com",152,15,21,14,0,0,0,0
"RepAustinScott","131177916946914_1492069874191038","Rep. Austin Scott","2017-06-27","2017-06-27 21:45:01","Affordable, reliable broadband access is critical to economic growth and a higher quality of life in rural communities around the country, and I applaud President Trump on his pledge to promote and foster critical broadband infrastructure investments in rural America.","link","https://www.bloomberg.com/news/articles/2017-06-22/trump-pledges-rural-broadband-support-in-infrastructure-package","bloomberg.com",72,14,7,3,0,0,0,1
"RepAustinScott","131177916946914_1493383720726320","Rep. Austin Scott","2017-06-28","2017-06-28 21:29:04","In just a few minutes, we'll be getting back to the House Armed Services Committee mark up of the FY18 National Defense Authorization Act (NDAA). We've just finished our second break of the day to vote, but we have many more hours of debate left to go. You can tune in here:","link","https://armedservices.house.gov/hearings-and-legislation/ndaa-national-defense-authorization-act","armedservices.house.gov",33,5,8,1,0,0,0,2
"RepAustinScott","131177916946914_1494536360611056","Rep. Austin Scott","2017-06-29","2017-06-29 15:03:04","After nearly 13 hours of debate, the House Armed Services Committee approved a $695.9 billion military funding bill to make key reforms and repairs to our nation’s military and provide for our warfighters, including $417 million for JSTARS recapitalization. I'm also proud to report that five bipartisan amendments I introduced were included in the mark. Those amendments focus on recapitalization of the JSTARS fleet, training and recruitment of combat pilots and cyber security and defense personnel, and streamlining small arms acquisitions. You can read more here:","link","https://austinscott.house.gov/media-center/press-releases/rep-austin-scott-fights-moody-robins-approval-ndaa","austinscott.house.gov",245,22,52,12,0,0,1,0
"RepAustinScott","131177916946914_1500622033335822","Rep. Austin Scott","2017-07-04","2017-07-04 17:16:45","Home of the free, because of the brave! Happy 4th of July from our family to yours!","photo","https://www.facebook.com/RepAustinScott/photos/a.141920472539325.28932.131177916946914/1500622033335822/?type=3",NA,67,6,4,3,0,0,0,0
"RepAustinScott","131177916946914_1502640793133946","Rep. Austin Scott","2017-07-06","2017-07-06 16:23:12","Our thoughts and prayers continue to remain with our friend and colleague Steve Scalise and his family during this time.","link","http://www.nola.com/politics/index.ssf/2017/07/rep_steve_scalise_readmitted_t.html","nola.com",107,31,10,5,0,2,65,0
"RepAustinScott","131177916946914_1502915729773119","Rep. Austin Scott","2017-07-06","2017-07-06 21:05:54","Just a few short weeks ago, I had the opportunity to visit East Asia to hear from our allies and U.S. military leaders in the region on the ever-increasing threats of the Kim Jong-un regime and the partnerships and resources we’re using to tackle those threats head-on. I recently sat down with Voice of America to talk about the trip, U.S.-China relations, and the North Korean nuclear threat. You can read more and watch my interview here:","link","https://austinscott.house.gov/media-center/in-the-news/icymi-congressman-austin-scott-stresses-importance-continued-defense","austinscott.house.gov",41,10,4,0,0,0,0,0
"RepAustinScott","131177916946914_1503772063020819","Rep. Austin Scott","2017-07-07","2017-07-07 17:11:34","If you’ve phoned or visited my Washington, D.C. office lately, you’ve probably spoken with Austin Griffin of Sylvester, a West Point Cadet who’s been interning in my office for the last several weeks. I had the honor of nominating Cadet Griffin to the United States Military Academy in West Point, New York, and it has been a pleasure having him in our D.C. office helping our legislative staff, giving constituent tours, attending briefings, and speaking with constituents.  We wish Cadet Griffin the best as he finishes his last year at West Point, and we thank him for his service to our great nation.","photo","https://www.facebook.com/RepAustinScott/photos/a.141920472539325.28932.131177916946914/1503772063020819/?type=3",NA,364,47,34,24,0,2,0,1
"RepAustinScott","131177916946914_1508025802595445","Rep. Austin Scott","2017-07-11","2017-07-11 14:26:22","Yesterday, the Flying Tigers welcomed Col. Jennifer Short as she took command of the 23rd Wing at Moody Air Force Base. It was a great ceremony welcoming her to Moody and a fond farewell for Col. Thomas E. Kunkel, who leaves Moody to serve as Chief, Air Force Liaison, House of Representatives in Washington D.C.","photo","https://www.facebook.com/RepAustinScott/photos/a.141920472539325.28932.131177916946914/1508024562595569/?type=3",NA,69,4,5,5,0,0,0,0
"RepAustinScott","131177916946914_1510227312375294","Rep. Austin Scott","2017-07-13","2017-07-13 15:56:50","Last night I spoke on the House Floor in opposition to an amendment to the Fiscal Year 2018 National Defense Authorization Act (FY18 NDAA) that would allow for conducting an additional round of Base Realignment and Closure (BRAC). Earlier this year, Secretary Mattis testified to the Armed Services Committee on the need to reassess our military’s current infrastructure resources and needs before closing or realigning current resources. If the Secretary of Defense needs to reassess our current capacity, then there is a need to halt BRAC to give time to do so.","link","http://bit.ly/2tMtmrZ","bit.ly",64,14,8,6,1,0,0,0
"RepAustinScott","131177916946914_1511261065605252","Rep. Austin Scott","2017-07-14","2017-07-14 17:53:13","Providing for Our National Defense in House Passage of NDAA","status",NA,NA,7,0,2,0,0,0,0,0
"RepAustinScott","131177916946914_1515602741837751","Rep. Austin Scott","2017-07-18","2017-07-18 12:51:46","Tracy Ingram, a Georgia Science Ambassador and a second grade teacher at Len Lastinger Primary in Tifton, stopped by my D.C. office yesterday. Mrs. Ingram is in D.C. this week participating in the Summer Teacher Institutes at the Library of Congress. During the five-day program, she'll work with Library education specialists and subject-matter experts to learn effective practices for using primary sources in the classroom. I congratulate her on being selected to this program, and I look forward to hearing what innovative ideas she brings back to our classrooms.","photo","https://www.facebook.com/RepAustinScott/photos/a.141920472539325.28932.131177916946914/1515602741837751/?type=3",NA,68,9,5,2,0,0,0,0
"RepAustinScott","131177916946914_1515784661819559","Rep. Austin Scott","2017-07-18","2017-07-18 16:06:16","Last night, I joined some of my colleagues on the House Floor in strong support of our community pharmacies. In many counties in Georgia’s Eighth District, locally owned and operated pharmacies are often the first stop when illness strikes, and ensuring their ability to remain competitive means stronger and healthier communities across the country. You can watch my remarks here:","video","https://www.youtube.com/watch?v=CFrhy7ln2CU",NA,56,22,5,2,1,0,1,0
"RepAustinScott","131177916946914_1518021811595844","Rep. Austin Scott","2017-07-20","2017-07-20 15:36:17","A few months ago I, along with Members of the House and Senate Armed Services Committees, had the opportunity to visit the Hỏa Lò Prison (also known as the Hanoi Hilton) in Vietnam with Sen. John McCain. It was powerful to be there with him to hear his personal stories from his time held at the prison as a POW. Our thoughts and prayers are with Sen. McCain and his family during this time, and we stand with him and his loved ones as he fights this disease.","photo","https://www.facebook.com/RepAustinScott/photos/a.141920472539325.28932.131177916946914/1518021398262552/?type=3",NA,63,12,7,3,0,0,3,1
"RepAustinScott","131177916946914_1519102958154396","Rep. Austin Scott","2017-07-21","2017-07-21 21:03:32","We had a new group of interns start in our Washington, D.C. office this week, and on Tuesday I was able to take them on a tour of the Dome of the U.S. Capitol Building. If you call or visit our D.C. office, please be sure to thank them for the important work they do!  (From left to right: Jim Henderson of Macon, Sean Grossnickle of Macon, Griffin Bell of Thomasville, and Brittany Sherrod of Swainsboro)","photo","https://www.facebook.com/RepAustinScott/photos/a.141920472539325.28932.131177916946914/1519102958154396/?type=3",NA,105,9,10,3,1,0,0,0
"RepAustinScott","131177916946914_1519179644813394","Rep. Austin Scott","2017-07-21","2017-07-21 16:27:42","On Wednesday, I continued my push to provide rural America with reliable access to broadband. For me, all options are on the table when it comes to providing our rural communities with the technological resources they need to grow and thrive.   I look forward to continuing to work with my colleagues and the Trump Administration to bring 21st century technology to rural America with accountability measures in place for reliable and affordable service.","link","https://youtu.be/Je3fCZTghEQ","youtu.be",37,16,3,0,1,0,0,0
"RepAustinScott","131177916946914_1524900820907943","Rep. Austin Scott","2017-07-26","2017-07-26 20:17:16","This morning, the House Agriculture Committee held a hearing on renegotiating the North American Free Trade Agreement (NAFTA). One of the biggest concerns I have while we renegotiate the NAFTA is the adjustment of existing frameworks to improve our nation’s trade, in particular when it comes to achieving greater opportunities for poultry in Canada and specialty crops in Mexico without disrupting our current market access. I appreciate the conversations today and look forward to working with my colleagues to craft an agreement that will work on behalf of our nation’s producers and not against them.","video","https://www.youtube.com/watch?v=Y5SOkDPQTcs&feature=youtu.be",NA,18,25,1,0,0,1,0,1
"RepAustinScott","131177916946914_1527164327348259","Rep. Austin Scott","2017-07-28","2017-07-28 21:40:54","Yesterday, the House passed legislation green-lighting funding to secure our border and fulfilling our promise to tackle the security concerns along our Southern border. Border security remains a top priority this Congress, and I’m proud to stand with my colleagues providing solutions to one of our nation’s biggest concerns.","link","http://politics.blog.ajc.com/2017/07/27/georgia-lawmakers-border-wall/","politics.blog.ajc.com",266,110,27,29,3,1,2,41
"RepAustinScott","131177916946914_1540435979354427","Rep. Austin Scott","2017-08-10","2017-08-10 15:14:03","Very honored to receive an award from the National Association of Community Health Centers. Community health centers are vital in our rural counties in Georgia and play a key role in keeping our communities healthy. Rest assured I am committed to continuing to advance policies that help, not hinder, these cornerstones in our communities.","photo","https://www.facebook.com/RepAustinScott/photos/a.141920472539325.28932.131177916946914/1540435979354427/?type=3",NA,56,16,2,1,0,0,0,0
"RepAustinScott","131177916946914_1540547746009917","Rep. Austin Scott","2017-08-11","2017-08-11 17:30:43","Earlier this week, I had the opportunity to visit Georgia Veterans Education Career Transition Resource Center (VECTR) in Warner Robins. VECTR provides education and career resources for veterans and their families looking to transition to a Georgia public college, university, or the state’s workforce. It was a great visit, and I thank them for the important work they do for our veterans and their families.","photo","https://www.facebook.com/RepAustinScott/photos/a.141920472539325.28932.131177916946914/1540547632676595/?type=3",NA,46,3,9,0,0,0,0,0
"RepAustinScott","131177916946914_1540560399341985","Rep. Austin Scott","2017-08-10","2017-08-10 18:05:07","Thank you to 23d Wing Commander - Col Jennifer Short and her team for showing me and a few members of my staff around Moody Air Force Base yesterday and highlighting Moody's unique and strategic missions. We appreciate it!","photo","https://www.facebook.com/flyingtigercc/photos/a.902745366480528.1073741828.869475883140810/1549913785097013/?type=3",NA,122,9,1,1,0,0,0,0
"RepAustinScott","131177916946914_1541598839238141","Rep. Austin Scott","2017-08-11","2017-08-11 19:38:32","Today is the last day for our second session of summer interns. We thank them for their service to the people of Georgia's Eighth District and wish them the best.","photo","https://www.facebook.com/RepAustinScott/photos/a.141920472539325.28932.131177916946914/1541598135904878/?type=3",NA,58,2,1,2,0,0,0,0
"RepAustinScott","131177916946914_1545737855490906","Rep. Austin Scott","2017-08-15","2017-08-15 20:19:04","I look forward to the Georgia Chamber of Commerce Congressional Luncheon each year. It's a time to come together to celebrate the things our businesses and state accomplish together to make Georgia one of the best places to live and do business. This year's event was particularly impactful as Members of the Georgia Congressional Delegation, state and local officials, and business leaders from across the state took time to pray for those impacted by the recent violence in Charlottesville, Virginia while condemning the violence and rhetoric we saw over the weekend. America is the greatest nation in the world, and the events of this past weekend have no place in our society.","photo","https://www.facebook.com/RepAustinScott/photos/a.141920472539325.28932.131177916946914/1545737855490906/?type=3",NA,36,13,3,0,0,0,0,0
"RepAustinScott","131177916946914_1546626055402086","Rep. Austin Scott","2017-08-16","2017-08-16 17:12:43","America is the greatest country in the world, and there is no room for hate and violence like we saw over the weekend in Charlottesville.","status",NA,NA,347,102,8,24,0,0,4,13
"RepAustinScott","131177916946914_1548547658543259","Rep. Austin Scott","2017-08-18","2017-08-18 15:05:04","Our thoughts and prayers are with those impacted by the horrific terror attack in Barcelona, Spain yesterday, including with the family and friends of the American citizen killed in the attack. The United States remains strongly committed to fighting against the threat of global terrorism and those forces which seek to erode and destroy democracy.","link","http://abcnews.go.com/International/truck-hits-pedestrians-busy-barcelona-street/story?id=49272618","abcnews.go.com",30,10,1,0,0,0,24,4
"RepAustinScott","131177916946914_1552509894813702","Rep. Austin Scott","2017-08-22","2017-08-22 14:55:02","I commend President Trump’s three prong diplomatic, economic, and military strategy for U.S. involvement in Afghanistan outlined in last night’s remarks. The Administration’s new approach with regards to Afghanistan clearly focuses on achieving security for America, stability in Afghanistan, and a continued effort to root out terrorism around the world.","status",NA,NA,158,31,9,9,1,1,1,9
"RepAustinScott","131177916946914_1554372947960730","Rep. Austin Scott","2017-08-24","2017-08-24 15:44:03","Our young people are certainly the future of our state, and supporting them and recognizing their successes are key to keeping our communities strong and thriving. On Tuesday, I met with Amelia Day, a member of the 4-H Club in Houston County. Amelia was selected as the national winner for the 2017 4-H Youth In Action Award for Citizenship for her leadership as founder of Operation: Veteran Smiles (OVS), a community service initiative she started at age 13. She’s a bright young woman, and I look forward to seeing her continued growth and success.","photo","https://www.facebook.com/RepAustinScott/photos/a.141920472539325.28932.131177916946914/1554371511294207/?type=3",NA,43,3,3,4,0,0,0,0
"RepAustinScott","131177916946914_1561119010619457","Rep. Austin Scott","2017-08-31","2017-08-31 15:24:17","Our thoughts and prayers remain with those impacted by Hurricane Harvey and those aiding in rescue and relief efforts.","link","http://www.valdostadailytimes.com/news/local_news/moody-flies-out-to-help-hurricane-harvey-victims/article_472cf3b2-2d6f-5738-bc80-d3dac5030430.html","valdostadailytimes.com",227,10,33,14,0,0,0,0
"RepAustinScott","131177916946914_1566328546765170","Rep. Austin Scott","2017-09-05","2017-09-05 20:04:03","I just wrapped up an eight-day, four nation visit to East Africa, where I led a bipartisan Congressional Delegation of my colleagues on the House Armed Services Committee to visit joint U.S. training sites and military installations in Kenya, Djibouti, Sudan, and Somalia. The chief aim of the visit was to observe U.S. forces conducting security cooperation activities with local partners and see first-hand the challenges our warfighters face in combating the threat of terrorism in the region and around the world.","photo","https://www.facebook.com/cjtfhornofafrica/photos/a.130859803613295.14550.106168799415729/1744416025590990/?type=3",NA,50,10,0,0,0,1,0,0
