"screen_name","id","from_name","date","datetime","message","type","link","domain","likes_count","comments_count","shares_count","love_count","haha_count","wow_count","sad_count","angry_count"
"RepAustinScott","131177916946914_1352119238186103","Rep. Austin Scott","2017-02-13","2017-02-13 22:57:00","Great video from Moody Air Force Base in advance of the Flying Tiger's 75th Anniversary. #FlyingTigers","video","https://www.facebook.com/moodyairforcebase/videos/1748733241807211/",NA,28,1,0,0,0,0,0,0
"RepAustinScott","131177916946914_1352805448117482","Rep. Austin Scott","2017-02-14","2017-02-14 18:24:49","Happy Valentine's Day to Georgia's Eighth Congressional District! I am thankful everyday for my Valentine, Vivien, who is a wonderful mother to our children and a supportive wife.","status",NA,NA,32,2,0,2,0,0,0,0
"RepAustinScott","131177916946914_1353831831348177","Rep. Austin Scott","2017-02-15","2017-02-15 22:12:19","Enjoyed talking with WGXA this afternoon! We discussed important matters relating to Georgia’s Eighth Congressional District like repealing the Affordable Care Act and replacing it with patient-centered health care that is affordable for all Americans, as well as how improvements to our weather radar and technology have been critical during severe weather events like the tornadoes that recently hit South Georgia.","photo","https://www.facebook.com/RepAustinScott/photos/a.141920472539325.28932.131177916946914/1353831831348177/?type=3",NA,17,3,0,0,0,0,0,0
"RepAustinScott","131177916946914_1354888317909195","Rep. Austin Scott","2017-02-16","2017-02-16 19:15:52","I testified in front of the House Judiciary Committee about one of the top issues in the health care industry that we must address when repealing and replacing the Affordable Care Act (ACA) – turn the sound on to hear what it is.  I want to be clear that I believe there were a number of problems in the health insurance market before the ACA passed. However, leaving the health insurance industry exempt from the antitrust laws of our country was one of the ACA’s most egregious missteps. This exemption is not only damaging to the consumer, leaving constituents in some counties I represent with only one choice of health insurer, but it also limits American's access to those who provide our health care like our physicians, hospitals, and pharmacies. I don’t think this issue alone solves all of the problems in the health care industry, but I don't think that any of the problems in the insurance market will be solved if this exemption stays in place.","video","https://www.facebook.com/RepAustinScott/videos/1354888317909195/",NA,61,13,22,1,0,0,1,1
"RepAustinScott","131177916946914_1355861741145186","Rep. Austin Scott","2017-02-17","2017-02-17 15:38:25","What do taxes and weather radar have in common? Well... nothing. But hear what I have to say regarding our corporate tax rate and legislation to improve weather radar systems (to help in severe weather events, like the recent tornadoes in South Georgia) by clicking below!","link","http://wgxa.tv/news/connect-to-congress/rep-austin-scott-on-taxes-weather-radar","gxa.tv",9,1,0,0,0,0,0,2
"RepAustinScott","131177916946914_1357236264341067","Rep. Austin Scott","2017-02-18","2017-02-18 18:48:03","Do you agree?","link","http://www.politico.com/story/2017/02/obamacare-market-death-spiral-aetna-mark-bertolini-235041","politico.com",43,39,7,0,0,0,0,4
"RepAustinScott","131177916946914_1359883920742968","Rep. Austin Scott","2017-02-20","2017-02-20 22:07:02","Happy Presidents' Day!","photo","https://www.facebook.com/RepAustinScott/photos/a.141920472539325.28932.131177916946914/1359883920742968/?type=3",NA,16,11,1,1,0,0,0,0
"RepAustinScott","131177916946914_1365174656880561","Rep. Austin Scott","2017-02-25","2017-02-25 19:25:35","Great meeting with Brooks County Family Connection, Inc. in my Tifton Office this week. We had a great discussion about the work they are doing as the local decision-making body committed to improving conditions for at-risk children, families, and communities in Brooks County.","photo","https://www.facebook.com/RepAustinScott/photos/a.141920472539325.28932.131177916946914/1365174656880561/?type=3",NA,34,11,2,1,0,0,0,0
"RepAustinScott","131177916946914_1368423013222392","Rep. Austin Scott","2017-02-28","2017-02-28 20:52:43","Spent some time this afternoon with Gray Television Washington News Bureau talking about on what’s going on in Washington right now. I enjoyed discussing what to expect tonight from President Trump’s speech and how we can continue working together to promote economic growth for American citizens.","photo","https://www.facebook.com/RepAustinScott/photos/a.141920472539325.28932.131177916946914/1368423013222392/?type=3",NA,25,3,2,0,0,0,0,0
"RepAustinScott","131177916946914_1368533629877997","Rep. Austin Scott","2017-03-01","2017-03-01 01:50:00","President Trump makes his first Joint Address to Congress tonight. Will you be tuning in? What do you hope to hear? #JointAddress","photo","https://www.facebook.com/RepAustinScott/photos/a.141920472539325.28932.131177916946914/1368533629877997/?type=3",NA,39,17,1,6,1,0,0,0
"RepAustinScott","131177916946914_1369455936452433","Rep. Austin Scott","2017-03-01","2017-03-01 22:28:53","Did you catch my interview with Scott James on TALK 92.1 this morning? In case you missed it, here’s a rundown of what we talked about.   As a member of Congress, and as a Georgian, I was glad to hear President Trump make it clear he is looking towards the future to unite Americans, rebuild the economy, and put Americans back to work- something that many of you in Middle and South Georgia have repeatedly said is your number one concern. I am especially encouraged by his commitment to rebuilding our military, supporting our warfighters, and keeping us safe. He has exemplified this commitment by his appointment of General Mattis as Secretary of Defense.   I was also glad to hear about the President’s commitment to working with Dr. Tom Price from Georgia as our Secretary of HHS and Congress to replace Obamacare with a system that expands choice, increases access, and lowers costs; a patient-centered, free market solution that does not exclude people for pre-existing conditions and gives states the flexibility and resources they need to ensure no one is slipping through the cracks. I believe we must focus on repealing the antitrust exemption for the health care industry, an effort on which I’ve been working very hard. Two weeks ago, I testified in front of the Judiciary Committee about a bill that would repeal this exemption- that bill just passed the Committee this week.   We have to give President Trump a chance- and if we do, I firmly believe he'll be a good President. Some of this will mean keeping the men and women of the administration in our prayers. I look forward to working with President Trump to create a more prosperous, safer America for future generations.  In addition to President Trump’s address, we also discussed the future of Moody Air Force Base. One thing other bases don't have is the ability to transition from one mission to the other like we do at Moody. Moody has the ability to take on new missions, like training pilots from our ally countries, making the base, and the warfighters stationed there, a vital asset to our national security.","status",NA,NA,17,6,0,1,0,0,0,0
"RepAustinScott","131177916946914_1370268916371135","Rep. Austin Scott","2017-03-02","2017-03-02 21:54:52","I got a little... let's call it passionate... on the House Floor on Wednesday night.  But I had a good reason! Generic drug prices are skyrocketing, affecting families and patients who are forced to choose between medicine and their health or paying their mortgage and making ends meet. These astronomical prices put vulnerable patients in a difficult situation at a time where they least need to be thinking of dollars and cents.  I don’t think this is a decision Americans should have to make.   I mentioned my heart wrenching discussion with a mother from Warner Robins whose daughter has juvenile diabetes. She has to have insulin or she dies. This drug can be found in other countries for just a fraction of what they have to pay for it here in America, and they are struggling with the cost of the drug.   In my speech, I also talked about a parent who I met with last week.  His son is named Gabe, and Gabe suffers from Duchenne muscular Dystrophy, a rare genetic disorder that requires a drug called Deflazacort to stay alive. Gabe is now 11 years old and has been taking Deflazacort since he was 5. Gabe’s family currently pays roughly $418.83 per year for Deflazacort from Europe, as it has not been available in the United States. However, recently, Marathon Pharmaceuticals bought the rights to Deflazacort.  Note I say bought the rights, because they spent almost nothing on research, development or trials.  Then, they to bring the drug to market under the name Emflaza priced at $89,000 a year. 89 THOUSAND for the same drug Gabe's family was having to get from another country for under $419 a year. This is the drug an 11 year old boy is taking to live. The American system should be set up in such a way as to drive costs down and increase availability of life-saving drugs, not the other way around.    This Congress, I call on my colleagues to work with me to ease the regulatory burden the FDA places on generic drug applicants in order to increase competition in this market, which currently has little to no competitors to drive down costs. We must also alleviate the FDA’s backlog on generic drug applications to bring more drugs to market.   In the coming months, I look forward to finding a conservative, free market solution to address the problematic rise in generic drug prices for American families.","video","https://www.facebook.com/RepAustinScott/videos/1370268916371135/",NA,329,126,224,43,0,3,1,3
"RepAustinScott","131177916946914_1377037539027606","Rep. Austin Scott","2017-03-08","2017-03-08 22:48:25","Glad I could visit with members from Georgia Farm Bureau Young Farmers today before heading to votes. Since Georgia is one of the top agricultural states in our country, it was great to see such an inspiring group of young agricultural leaders.","photo","https://www.facebook.com/RepAustinScott/photos/a.141920472539325.28932.131177916946914/1377037539027606/?type=3",NA,26,12,1,0,0,0,0,0
"RepAustinScott","131177916946914_1386849828046377","Rep. Austin Scott","2017-03-15","2017-03-15 13:09:53","Congratulations to the Warner Robins Air Logistics Complex on being awarded the top depot maintenance unit in the U.S. Air Force for the second year in a row! Robins Air Force base is a strategic asset to the United States and its national security mission. It plays an important role in the global fight against terrorism, provides strategic depth, and command & control capability. It’s a privilege to represent Robins Air Force Base.  Take a look at the link below to learn more about this prestigious award given to Warner Robins Air Logistics Complex (WRALC).","link","http://www.13wmaz.com/news/local/warner-robins-air-logistic-complex-honored-as-best-in-air-force/422162531","13wmaz.com",320,10,127,17,1,6,0,0
"RepAustinScott","131177916946914_1392844214113605","Rep. Austin Scott","2017-03-21","2017-03-21 20:34:16","Georgia’s agricultural roots run deep and contribute to a big slice of our state’s economy. Rest assured I’ll continue fighting for farmers in the Eighth District to ensure Washington works for and not against you. Happy National Ag Day to all our 8th District farmers.","photo","https://www.facebook.com/RepAustinScott/photos/a.141920472539325.28932.131177916946914/1392844214113605/?type=3",NA,61,13,8,1,0,0,0,0
"RepAustinScott","131177916946914_1393820080682685","Rep. Austin Scott","2017-03-22","2017-03-22 20:05:10","Had a great meeting with Pentagon, Marine Corps, and Albany officials yesterday on the state of storm recovery at Marine Corps Logistics Base Albany and updating them on ways we’re fighting for funding to help.","photo","https://www.facebook.com/RepAustinScott/photos/a.141920472539325.28932.131177916946914/1393820080682685/?type=3",NA,12,29,2,0,0,0,0,0
"RepAustinScott","131177916946914_1399021533495873","Rep. Austin Scott","2017-03-27","2017-03-27 21:02:47","If you are a resident of Berrien, Cook, Crisp, Dougherty, Thomas, Turner, Wilcox, or Worth counties and were affected by the January storms, tornadoes and flooding, today is the last day to register with FEMA for disaster assistance. You can do that online at www.DisasterAssistance.gov, or by calling 800-621-3362.","link","http://www.disasterassistance.gov/","disasterassistance.gov",6,3,2,0,0,0,0,0
"RepAustinScott","131177916946914_1399851396746220","Rep. Austin Scott","2017-03-28","2017-03-28 20:19:51","There’s a good healthy discussion going on and a unified message that we need to find a solution because a lot of Americans will continue to suffer under the burdens of increased costs, diminished access to care, and a lower quality of care that resulted from President Obama's health care law unless we repeal it.","link","http://washex.am/2ndGgIN","ashex.am",35,51,6,0,0,2,0,6
"RepAustinScott","131177916946914_1400515530013140","Rep. Austin Scott","2017-03-29","2017-03-29 13:55:40","The 2017 Congressional Art Competition is here, and it’s YOUR choice who wins the People’s Choice Award for Georgia’s Eighth Congressional District.  LIKE your favorite piece of artwork before Tuesday, April 4th at noon and the picture with the most “likes” will hang in my DC office lobby for one year.  All of these submissions are by talented high school students across the district.  Which piece is your favorite?","photo","https://www.facebook.com/RepAustinScott/photos/a.1400515133346513.1073741835.131177916946914/1400515530013140/?type=3",NA,42,6,50,0,0,0,0,0
"RepAustinScott","131177916946914_1400775516653808","Rep. Austin Scott","2017-03-29","2017-03-29 20:55:43","To all our Vietnam Veterans: Thank you for your bravery, courage, and service. Your sacrifices will never be forgotten.","photo","https://www.facebook.com/RepAustinScott/photos/a.141920472539325.28932.131177916946914/1400775516653808/?type=3",NA,47,4,8,0,0,0,0,0
"RepAustinScott","131177916946914_1406971969367496","Rep. Austin Scott","2017-04-04","2017-04-04 18:04:36","Coming up in a few minutes here, I’ll be chairing a subcommittee hearing on credit programs and the next Farm Bill. You can watch the hearing live by clicking here: https://www.youtube.com/watch?v=UMgXPxmzpm4.","photo","https://www.facebook.com/RepAustinScott/photos/a.141920472539325.28932.131177916946914/1406971969367496/?type=3",NA,6,7,5,0,0,0,0,0
"RepAustinScott","131177916946914_1408196129245080","Rep. Austin Scott","2017-04-05","2017-04-05 21:29:17","The JSTARS fleet is vital to our airborne battle management, and most Americans would be surprised to know some of these critically important aircraft are nearly fifty years old. I'm committed to protecting and promoting the fleet’s recapitalization, and working on policies that meet the requirements our military needs to keep our homeland and men and women in uniform safe and prepared to take on any threats.","video","https://www.youtube.com/watch?v=Hejge9U3niU&feature=youtu.be&t=6105",NA,26,2,4,0,0,0,0,0
"RepAustinScott","131177916946914_1413263722071654","Rep. Austin Scott","2017-04-10","2017-04-10 19:54:40","The Congressional Art Competition is a great way to showcase the talent of students across the Eighth District, and this year’s crop of submissions was certainly no exception. I would like to personally extend a ‘congratulations’ to this year’s winners, as well as to each and every submission I received this year, and extend a ‘thank you’ to the art teachers who inspire the talent, creativity, and confidence of these students. As I pass by these great works, either in our district offices or in the U.S. Capitol, I will be reminded that the work we’re doing today is to ensure a brighter future for them.","photo","https://www.facebook.com/RepAustinScott/photos/a.141920472539325.28932.131177916946914/1413263078738385/?type=3",NA,14,1,2,1,0,0,0,0
"RepAustinScott","131177916946914_1416665288398164","Rep. Austin Scott","2017-04-13","2017-04-13 19:06:43",NA,"photo","https://www.facebook.com/moodyairforcebase/photos/a.251613038185913.83153.186652858015265/1841490099198191/?type=3",NA,15,2,0,0,0,0,0,0
"RepAustinScott","131177916946914_1417918944939465","Rep. Austin Scott","2017-04-14","2017-04-14 23:06:29","I stopped by the new Georgia State Patrol Hangar in Perry this week. This project has been a long time coming, and it was great to see up close and personal the tools our law enforcement officials utilize in keeping Georgians safe.","photo","https://www.facebook.com/RepAustinScott/photos/a.575811242483577.1073741827.131177916946914/1417916078273085/?type=3",NA,68,3,5,2,1,0,0,0
"RepAustinScott","131177916946914_1419438608120832","Rep. Austin Scott","2017-04-16","2017-04-16 12:20:50","He is Risen! Wishing you a Happy Easter from our family to yours.","photo","https://www.facebook.com/RepAustinScott/photos/a.141920472539325.28932.131177916946914/1419438608120832/?type=3",NA,70,8,1,2,0,0,0,0
"RepAustinScott","131177916946914_1427982710599755","Rep. Austin Scott","2017-04-24","2017-04-24 22:15:10","Georgians certainly understand the importance our nation’s agriculture industry plays in our state and national economy and in keeping the world fed. Between his public service to the state of Georgia and his background in agribusiness, Sonny is the perfect choice to lead USDA. I am confident he will continue to be a champion for the needs of our farmers, ranchers, and manufacturers, and I congratulate him on his confirmation to be United States Secretary of Agriculture.","link","http://www.ajc.com/news/local/senate-confirms-sonny-perdue-agriculture-secretary/JyI8rGs5GyWB8I6720v7vJ/","ajc.com",337,25,49,15,0,0,0,0
"RepAustinScott","131177916946914_1430544467010246","Rep. Austin Scott","2017-04-27","2017-04-27 16:23:58","April is Lineman Appreciation Month in Georgia, a time to honor the men and women who keep our great nation powered. Following the destructive storms in January, the hard work and dedication of our linemen was on full display as they worked around the clock to get our communities back on the grid. Thanks to all our linemen and the important work you do in keeping America connected and running. #ThankaLineman","link","http://bit.ly/2pjiUEn","bit.ly",44,7,12,0,0,0,0,0
"RepAustinScott","131177916946914_1431385796926113","Rep. Austin Scott","2017-04-28","2017-04-28 16:43:43","This week, I was honored to receive the “Friend of Farm Bureau” award from Farm Bureau and Georgia Farm Bureau for my work supporting farmers and ranchers.","photo","https://www.facebook.com/RepAustinScott/photos/a.141920472539325.28932.131177916946914/1431385796926113/?type=3",NA,43,8,2,0,0,0,0,0
"RepAustinScott","131177916946914_1434357906628902","Rep. Austin Scott","2017-05-01","2017-05-01 19:09:21","Our thoughts are with the family and friends of 1st Lt. Weston C. Lee of Bluffton who was killed in Iraq over the weekend. We thank and honor him for his service to our nation.","link","http://bit.ly/2pyakBQ","bit.ly",326,81,215,33,0,0,318,3
"RepAustinScott","131177916946914_1436040676460625","Rep. Austin Scott","2017-05-03","2017-05-03 20:45:37","Yesterday, NOAA Fisheries announced the federal red snapper season for recreational fishermen in the Gulf will run for only three days, while the commercial industry will continue to be allocated year-round access to the same federal red snapper fisheries in the Gulf. It’s a clear game of the federal government picking winners and losers, and its result is vast sums of wealth for just a select few at the expense of the recreational angler.","link","http://bit.ly/2pHMJk7","bit.ly",111,35,49,2,0,1,1,16
"RepAustinScott","131177916946914_1436329253098434","Rep. Austin Scott","2017-05-03","2017-05-03 22:13:59","Today’s funding bill takes a big step forward in ensuring our men and women in uniform have the resources they need to tackle 21st century threats.   Some highlights include: --Provides $128 million to further the development of the next generation JSTARS intelligence, surveillance, and reconnaissance, and battle management aircraft, and $19.7 million for mission computer upgrades to two E-8C JSTARS aircraft currently flown out of Robins Air Force Base.  --Supports the fleet of A-10C Warthog aircraft flown out of Moody Air Force Base and prohibits retirement of the crucial close-air support asset and provides $20 million for wing replacements for the A-10C fleet.  --Includes critical maintenance and sustainment funding for the military, including for work performed on combat aircraft at the Robins Air Logistics Center and combat vehicles at Marine Corps Logistics Base in Albany.  --Provides a 2.1% pay raise for the more than 100,000 active duty service members stationed throughout Georgia.","link","http://bit.ly/2pZDNYf","bit.ly",43,35,10,2,0,0,0,6
"RepAustinScott","131177916946914_1442519402479419","Rep. Austin Scott","2017-05-10","2017-05-10 16:44:51","Yesterday, I had the honor to present three young men from Houston County  with Congressional Certificates and congratulate them on their appointments to our prestigious US Service Academies. This is an extraordinary achievement that they have spent years working towards and for no greater calling than to serve our country.  It is the best of the best that actually get selected to go to an Academy. I congratulate them on their achievements and look forward to their continued success.","link","http://bit.ly/2r1DVE8","bit.ly",114,17,2,4,0,0,0,0
"RepAustinScott","131177916946914_1444645282266831","Rep. Austin Scott","2017-05-12","2017-05-12 17:25:20","Had the opportunity to present another Eighth District graduating senior with a Congressional Certificate recognizing his appointment to one of our U.S. Service Military Academies. Jackson Danner of Lowndes County is headed to U.S. Military Academy, West Point. Congratulations, Jackson, and thank you for your service to our country.","link","http://bit.ly/2q9Pyuy","bit.ly",96,7,4,3,0,0,0,0
"RepAustinScott","131177916946914_1444658108932215","Rep. Austin Scott","2017-05-12","2017-05-12 20:31:48","It was great to meet with educators and parents at the Thomasville Community Resource Center yesterday. The center is a Federal 21st Century Community Learning Center (CCLC) and provides academic enrichment opportunities during non-school hours for children, particularly students, in the rural communities of Thomas and Grady Counties.  The program helps students meet state and local student standards in core academic subjects and offers other activities that complement their regular academic programs. One of the wins in last week's bipartisan passed spending bill was that 21st CCLC's received increased funding for their after school programs, giving more kids more opportunities for success.","photo","https://www.facebook.com/RepAustinScott/photos/a.141920472539325.28932.131177916946914/1444657908932235/?type=3",NA,8,7,0,0,0,0,0,0
"RepAustinScott","131177916946914_1448614975203195","Rep. Austin Scott","2017-05-16","2017-05-16 21:45:20","This week is National Police Week, a time to recognize our law enforcement officials as well as remember those officers who’ve fallen in the line of duty. To our officers: Thank you for the tireless work you do in protecting our families, friends, neighbors, and communities.  This week is for you. #PoliceWeek","photo","https://www.facebook.com/RepAustinScott/photos/a.141920472539325.28932.131177916946914/1448614975203195/?type=3",NA,11,2,2,3,0,0,0,0
"RepAustinScott","131177916946914_1449563595108333","Rep. Austin Scott","2017-05-17","2017-05-17 21:51:35","The Ag Committee held a hearing with USDA Secretary Sonny Perdue this morning. During the hearing, I had the chance to discuss with Secretary Perdue the importance of broadband infrastructure in rural communities. We also discussed the good work programs like 4-H and FFA do in engaging and supporting students. You can watch here:","link","http://bit.ly/2pXM5eS","bit.ly",36,15,7,3,0,0,0,0
"RepAustinScott","131177916946914_1454132331318126","Rep. Austin Scott","2017-05-22","2017-05-22 22:34:31","I wanted to share a column by our former Governor Sonny Perdue on the importance of agriculture trade and the positive impact it makes on our economy. Farmers are lucky to have an advocate like Sonny leading the USDA and representing rural America.","link","https://www.wsj.com/articles/farmers-know-the-benefits-of-trade-1494455790","wsj.com",46,4,2,0,0,0,0,0
"RepAustinScott","131177916946914_1454683897929636","Rep. Austin Scott","2017-05-23","2017-05-23 13:36:14","An attack on democracy is an attack on all of us. Our thoughts and prayers are with the family and friends of those killed and injured in this senseless attack.","link","http://www.13wmaz.com/ext/news/nation-now/manchester-death-toll-reaches-22-isis-claims-responsibility/93/nationnow/5RCwjGkQNO8gMYUq6AyacC","13wmaz.com",32,12,2,0,0,1,9,3
"RepAustinScott","131177916946914_1455761964488496","Rep. Austin Scott","2017-05-24","2017-05-24 16:07:42","Exciting morning at Robins AFB as the RQ-4 Global Hawk was the first unmanned aircraft to land at the base! It's set for some maintenance. Very cool, and a big opportunity for Robins and the surrounding community.","link","http://www.macon.com/news/local/community/houston-peach/article152294862.html","macon.com",256,12,83,8,0,19,0,0
