"screen_name","id","from_name","date","datetime","message","type","link","domain","likes_count","comments_count","shares_count","love_count","haha_count","wow_count","sad_count","angry_count"
"RepAustinScott","131177916946914_1309913069073387","Rep. Austin Scott","2017-01-03","2017-01-03 22:07:34","Happy my wife and daughter could be here for my swearing in (missing my son though)! I am honored to represent Georgia's Eighth Congressional District in the 115th Congress and remain committed to working hard for the people of Middle and South Georgia. Thought I'd share a few pictures from our day.","photo","https://www.facebook.com/RepAustinScott/photos/a.141920472539325.28932.131177916946914/1309912885740072/?type=3",NA,417,32,10,18,0,0,0,0
"RepAustinScott","131177916946914_1310745108990183","Rep. Austin Scott","2017-01-04","2017-01-04 21:49:30","This week, 229 years ago, Georgia joined the Union. SHARE and LIKE this post if you love our great state!","photo","https://www.facebook.com/RepAustinScott/photos/a.141920472539325.28932.131177916946914/1310745108990183/?type=3",NA,85,7,42,4,0,0,0,0
"RepAustinScott","131177916946914_1310777505653610","Rep. Austin Scott","2017-01-04","2017-01-04 23:49:00","BREAKING NEWS: House Republicans introduce Obamacare repeal and replace legislation.  Last Congress, I was honored to co-chair a task force that authored the American Health Care Reform Act (AHCRA). Today, we re-introduced the AHCRA which fully repeals and replaces Obamacare. I hope this legislation will serve as the baseline for discussions on how to repeal and replace Obamacare, bring about debate on how to lower health care costs, and allow for input from both sides of the aisle- something Obamacare did not do.","photo","https://www.facebook.com/RepAustinScott/photos/a.141920472539325.28932.131177916946914/1310776808987013/?type=3",NA,235,32,29,18,0,0,3,7
"RepAustinScott","131177916946914_1311350105596350","Rep. Austin Scott","2017-01-05","2017-01-05 14:10:16","For a break in political news, thought you'd like to read this lighthearted (and hilarious) story from the Oconee County Georgia Sheriff's Office, just north of our district. Glad they saved the llama! Will post later today about legislation on the floor this week- stay tuned.","photo","https://www.facebook.com/oconeesheriff/photos/a.129322563761449.21909.124926707534368/1614540625239628/?type=3",NA,46,1,0,4,13,0,0,0
"RepAustinScott","131177916946914_1311748905556470","Rep. Austin Scott","2017-01-06","2017-01-06 01:12:27","The House is hitting the ground running to hold the executive branch accountable for expensive rules and regulations. Tonight, the House passed the REINS Act- legislation that requires approval by the people's representatives for major, expensive rules and regulations coming out of the federal government. #REINSAct Read more here: http://bit.ly/2jgDViW","status",NA,NA,34,3,1,2,0,0,1,0
"RepAustinScott","131177916946914_1312499052148122","Rep. Austin Scott","2017-01-06","2017-01-06 21:54:44","Attention Middle and South Georgia: Several counties in Georgia's Eighth Congressional District are under a State of Emergency.  Please stay off the roads and be safe this weekend!!","link","http://www.macon.com/news/local/article124910204.html","macon.com",63,1,54,1,1,7,0,0
"RepAustinScott","131177916946914_1314971161900911","Rep. Austin Scott","2017-01-09","2017-01-09 20:32:51","Thank you to our Eighth District law enforcement for keeping our communities safe! #SupportBlue #TaketheLEAD2017 #ThankACop #lawenforcementappreciationday","photo","https://www.facebook.com/RepAustinScott/photos/a.141920472539325.28932.131177916946914/1314971161900911/?type=3",NA,33,1,7,2,0,0,0,0
"RepAustinScott","131177916946914_1317639428300751","Rep. Austin Scott","2017-01-12","2017-01-12 19:56:49","Happy National Pharmacists Day! In many areas like my hometown in rural South Georgia, the town pharmacy is often a fixture in the community, and our local, community pharmacists play a major role in rural healthcare delivery.  In areas where a doctor can be many miles away, local pharmacists deliver flu shots, give advice on over the counter drugs, and help with those late night drugstore runs for a sick child.  Many people see their pharmacists much more often than their doctor, and there is a very personal relationship between pharmacist, patient, and physician.   If you’re in a pharmacy today, thank your pharmacist for all they do! #NationalPharmacistsDay","photo","https://www.facebook.com/RepAustinScott/photos/a.141920472539325.28932.131177916946914/1317639428300751/?type=3",NA,22,5,4,0,0,0,0,0
"RepAustinScott","131177916946914_1318518898212804","Rep. Austin Scott","2017-01-13","2017-01-13 18:32:38","This is the most important thing we must address when replacing Obamacare. Turn the sound on to hear what it is.    I have a couple of questions: How is it that Obamacare can mandate Americans purchase a product from an industry that is exempt from playing by the rules?    Why did President Obama and Democratic leaders leave the health insurance industry exempt from the antitrust laws of our country in their bill?    And what will our Republican leaders and President-elect Trump do about it?    I don’t know the answer to these questions, but I do know that I will stand up and fight for American citizens. Antitrust laws are designed to promote fair competition for the benefit and protection of consumers.  Leaving the health insurance industry exempt from the antitrust laws of our country is only good for the health insurance industry- not Americans. We have to stand up and do right by the people.  Applying the antitrust laws to the insurance industry makes the market more competitive, which in-turn drives down premium costs and increases choice. Makes sense to me.","video","https://www.facebook.com/RepAustinScott/videos/1318518898212804/",NA,102,27,39,5,0,0,0,0
"RepAustinScott","131177916946914_1318615211536506","Rep. Austin Scott","2017-01-14","2017-01-14 15:15:00","Fighting for small businesses. I supported the passage of the Helping Angels Lead Our Startups Act this week which makes it easier for startups to connect with investors and showcase innovative ideas. #smallbiz","photo","https://www.facebook.com/RepAustinScott/photos/a.141920472539325.28932.131177916946914/1318615211536506/?type=3",NA,10,1,0,0,0,0,0,0
"RepAustinScott","131177916946914_1318627468201947","Rep. Austin Scott","2017-01-15","2017-01-15 16:38:33","The one-size-fits-all approach to federal regulation is devastating to America's small businesses, their owners, and employees. I voted for the Regulatory Accountability Act last week which directly address the burden of regulations to create jobs and reverses their negative economic impact by streamlining the writing regulations to make rules clearly understandable to American small businesses.","link","http://giphy.com/gifs/regulatory-reform-l0JMpawCf5lxDYNW0","giphy.com",16,5,1,1,0,0,0,0
"RepAustinScott","131177916946914_1321588127905881","Rep. Austin Scott","2017-01-16","2017-01-16 17:29:40","Please join me today in remembering and honoring the life and legacy of Dr. Martin Luther King, Jr. May we reflect on the peace and equality he so courageously championed in order to make a stronger, more just America. #MLKDay","status",NA,NA,51,5,0,1,0,0,0,0
"RepAustinScott","131177916946914_1322380314493329","Rep. Austin Scott","2017-01-17","2017-01-17 15:53:10","Here's a pretty interesting read for this Inauguration Week on how quickly the White House is transformed between incoming and outgoing Presidents. Thought you'd enjoy!","link","http://www.usatoday.com/story/news/politics/2017/01/16/inauguration-day-moving-white-house-residence/96439926/","usatoday.com",206,17,83,10,1,13,0,0
"RepAustinScott","131177916946914_1323158307748863","Rep. Austin Scott","2017-01-18","2017-01-18 14:46:00","My colleague, friend, and fellow Georgian Rep. Tom Price is in front of the Senate Health, Education, Labor and Pensions Committee for his confirmation hearing for HHS Secretary today.  Mr. Price is an excellent choice for Secretary of the US Department of Health and Human Services, and I am confident that Tom will put his years of experience to good use as he plays a leading role in our efforts replace Obamacare with reforms that focus on the patient, drive down the cost, and increase the accessibility of health care for all Americans. Here's where you can watch!","link","http://cs.pn/2j914jm","cs.pn",43,12,5,3,0,0,0,0
"RepAustinScott","131177916946914_1324295090968518","Rep. Austin Scott","2017-01-19","2017-01-19 17:11:57","Capitol is ready for President-elect Trump's Inauguration tomorrow! Thought you'd like to see some pictures.","photo","https://www.facebook.com/RepAustinScott/photos/a.141920472539325.28932.131177916946914/1324291007635593/?type=3",NA,326,19,18,24,1,0,0,1
"RepAustinScott","131177916946914_1324362034295157","Rep. Austin Scott","2017-01-19","2017-01-19 21:25:31","America’s will have a great Secretary of Agriculture in Sonny Perdue, and I am confident Sonny will be an excellent representative of our state in his service to our country’s agriculture communities. Agriculture is Georgia’s leading industry, so we’re glad to have someone who understands our state’s agricultural needs and act as a champion for the needs of our farmers, ranchers, and manufacturers in the U.S. Department of Agriculture.","link","http://www.usatoday.com/story/news/politics/2017/01/19/donald-trump-sonny-perdue-secretary-of-agriculture/96764902/","usatoday.com",312,19,25,16,0,3,0,0
"RepAustinScott","131177916946914_1325059097558784","Rep. Austin Scott","2017-01-20","2017-01-20 14:36:20","Getting ready to head to the 58th Presidential Inauguration with my family! Exciting day for our country.","photo","https://www.facebook.com/RepAustinScott/photos/a.141920472539325.28932.131177916946914/1325059097558784/?type=3",NA,525,31,9,30,1,1,1,2
"RepAustinScott","131177916946914_1325226364208724","Rep. Austin Scott","2017-01-20","2017-01-20 18:54:38","Today, we witnessed our democracy in action as Donald J. Trump was sworn in as our 45th President. This peaceful transition of power is an important moment for our country, and I have a tremendous amount of confidence in President Trump that he will lead our nation in the right direction. I look forward to working with the President to get our country back on track and to ensure the United States of America is once again a secure, safe, and prosperous nation for all Americans. Here are a few pictures of the ceremony from my seat.","photo","https://www.facebook.com/RepAustinScott/photos/a.141920472539325.28932.131177916946914/1325225857542108/?type=3",NA,290,13,20,22,0,0,0,1
"RepAustinScott","131177916946914_1327048240693203","Rep. Austin Scott","2017-01-22","2017-01-22 15:26:32","I hope you are staying safe in Middle and South Georgia! If you are in need of assistance or have any questions, please call my Tifton District Office at (229) 396-5175. We will work with you to put you in contact with the correct authorities. There is good information on WALB News 10's site below, as well. My prayers are with those already affected by the storms coming through the Eighth District.","link","http://www.walb.com/story/34312825/four-fatalities-three-injuries-after-storms-rip-through-swga","walb.com",285,50,558,11,0,42,175,1
"RepAustinScott","131177916946914_1327288780669149","Rep. Austin Scott","2017-01-22","2017-01-22 20:48:17","Thank you to all of those who have provided mutual aid. President Trump called Governor Deal and has pledged his support to our state. You can read more about that here: http://on.11alive.com/2khtqfG  Gov. Deal has declared a state of emergency for Atkinson, Berrien, Brooks, Colquitt, Cook, Lowndes, and Thomas counties. If you are in need of assistance in the aftermath of the storm, you can call my Tifton Office at (229) 396-5175, and we will help to put you in contact with the correct state authorities.","photo","https://www.facebook.com/RepAustinScott/photos/a.141920472539325.28932.131177916946914/1327281644003196/?type=3",NA,294,29,334,3,0,14,47,0
"RepAustinScott","131177916946914_1328293420568685","Rep. Austin Scott","2017-01-23","2017-01-23 16:20:52","Affected by the recent storms? The resources you need can be found here: https://austinscott.house.gov/storm_assistance  Please call my Tifton Office at (229) 396-5175 if you have questions. UPDATE: The counties under a state of emergency have been expanded to include the following: Atkinson, Baker, Berrien, Brooks, Calhoun, Clay, Colquitt, Cook, Crisp, Dougherty, Lowndes, Mitchell, Thomas, Turner, Wilcox and Worth Counties. 9 of these counties are in the Eighth Congressional District.","link","https://austinscott.house.gov/storm_assistance","austinscott.house.gov",53,2,85,0,0,2,1,0
"RepAustinScott","131177916946914_1329022130495814","Rep. Austin Scott","2017-01-24","2017-01-24 02:24:35","These guys have been at it non-stop all over South Georgia. Thank you, Georgia Search and Rescue.","photo","https://www.facebook.com/RepAustinScott/photos/a.141920472539325.28932.131177916946914/1329022130495814/?type=3",NA,735,32,314,102,0,0,0,0
"RepAustinScott","131177916946914_1329737923757568","Rep. Austin Scott","2017-01-24","2017-01-24 15:53:16","With a heavy heart, I spoke on the House Floor about the lives we've lost in the recent storms in South Georgia and to thank those who have selflessly offered help. It is particularly distressing as the Eighth Congressional District is my hometown, and its constituents, my neighbors. If you are in need of assistance, click here for resources and information: http://bit.ly/2jYIJZW","video","https://www.facebook.com/RepAustinScott/videos/1329737923757568/",NA,384,30,207,37,1,0,39,0
"RepAustinScott","131177916946914_1331450416919652","Rep. Austin Scott","2017-01-25","2017-01-25 20:19:01","Flew home last night and have been touring Thomas, Brooks, Berrien, and Cook counties today to assess need and see where I can be of assistance. The destruction is devastating, breathtaking. Thought I'd share a few pictures. The warehouse you see is the Disaster Relief Distribution Center in Cook County- it was an old, unused warehouse until Sunday when people started dropping off donations here when churches ran out of room. Now, its organized, has about 200 volunteers a day, and is sending donations to other areas in need. This is what Georgians are like- coming together to help their neighbors in a crisis.","photo","https://www.facebook.com/RepAustinScott/photos/a.141920472539325.28932.131177916946914/1331448616919832/?type=3",NA,185,10,45,9,0,2,15,0
"RepAustinScott","131177916946914_1332354516829242","Rep. Austin Scott","2017-01-26","2017-01-26 14:56:56","Yesterday showed me the strength of Mother Nature. But even more, it showed me the strength of America and our communities here in Georgia. On my way to Turner, Worth, and Wilcox counties today to assess the damage. Mitchell Power is working around the clock to get power restored to 4600 homes in Worth County.","photo","https://www.facebook.com/RepAustinScott/photos/a.141920472539325.28932.131177916946914/1332353123496048/?type=3",NA,81,4,20,5,0,0,3,0
"RepAustinScott","131177916946914_1332709440127083","Rep. Austin Scott","2017-01-26","2017-01-26 20:58:57","Just finished assessing damage in Turner, Wilcox, and Worth counties. Thought I'd update you in case you missed the news. President Trump has approved Berrien, Cook, Turner, and Wilcox counties in Georgia's Eighth Congressional District, as well as Dougherty and Crisp Counties in my colleague Congressman Sanford Bishop's District, for individual assistance through FEMA. This is something that Governor Deal requested, while Congressman Bishop and I have been working with the White House to grant this relief as expeditiously as possible. We will continue to make sure those impacted by these storms get the assistance they need to recover.","status",NA,NA,180,26,33,15,0,0,0,0
"RepAustinScott","131177916946914_1333547040043323","Rep. Austin Scott","2017-01-27","2017-01-27 15:24:16","I want to clarify a few things for those asking about assistance for Worth County (and for others who may have questions). The individual assistance awarded yesterday from the White House and FEMA is NOT final. The declaration is amendable. My office has inquired about the status of Worth and our other counties under the Governor's original declaration. Worth County’s damage assessment has not been completed, but it is in the process of being completed within the next few days- same goes for several of our other counties. As FEMA and the state jointly complete their assessment of each of the 16 counties requested by Governor Deal, FEMA will continually amend the declaration. Those still in need of assistance, in Worth County and other areas, rest assured. President Trump and his administration have been unbelievably quick to offer assistance for majority of counties requested by Governor Deal. Governor Deal’s request for Federal Assistance included many other provisions which have not been granted, and more importantly have not been denied. As the federal government evaluates more areas based on need, it is my hope President Trump will strongly consider Governor Deal's request for Individual Assistance in Worth and Brooks Counties, Public Assistance in the many of our affected counties like Thomas County, and Hazard Mitigation for the entire state.","status",NA,NA,60,16,41,0,0,0,0,0
"RepAustinScott","131177916946914_1337243539673673","Rep. Austin Scott","2017-01-30","2017-01-30 16:24:28","Passing along some helpful information from FEMA. Federal disaster survivor assistance teams are working in storm – stricken neighborhoods helping Georgians recover from the January tornadoes. Additionally, housing inspectors contracted by FEMA are reviewing residential damages with survivors on-site. I will post more information and updates for additional counties as they come.","link","https://www.fema.gov/news-release/2017/01/26/georgia-storm-survivors-should-register-disaster-assistance-1","fema.gov",24,2,13,0,0,0,0,0
"RepAustinScott","131177916946914_1338532112878149","Rep. Austin Scott","2017-01-31","2017-01-31 16:30:02","The House passed legislation to benefit Middle Georgia with a bipartisan vote of 396 to 8! Turn the sound on to hear what I have to say about the Ocmulgee Mounds National Historic Park Boundary Revision Act that I co-authored with my colleague, Congressman Sanford D. Bishop, Jr. Our legislation is a welcomed example of what can be achieved when a local community, state leaders, and Members of Congress, from both sides of the aisle, collaborate towards a worthy goal.","video","https://www.facebook.com/RepAustinScott/videos/1338532112878149/",NA,103,12,19,4,0,0,0,0
"RepAustinScott","131177916946914_1339854486079245","Rep. Austin Scott","2017-02-01","2017-02-01 22:13:38","Thought I'd share some more Storm Assistance information. A few things to note: Disaster Recovery Centers are slated to open in Cook and Turner counties (so far). That info is provided/will be updated here: https://www.fema.gov/disaster/4297  Also, the picture below is helpful to discern whether your country falls under Individual or Public Assistance. These are just the counties that have already been awarded assistance- FEMA's assessments are ongoing and more can be added. Information on how to register for FEMA assistance can be found here: https://www.disasterassistance.gov/  One last thing! I will be working to provide as many updates as possible here on my facebook and in my enewsletter that comes out every Sunday. Be sure to sign up for my enewsletter here: https://austinscott.house.gov/contact/newsletter","photo","https://www.facebook.com/RepAustinScott/photos/a.141920472539325.28932.131177916946914/1339854486079245/?type=3",NA,13,1,5,0,0,0,0,0
"RepAustinScott","131177916946914_1342009449197082","Rep. Austin Scott","2017-02-03","2017-02-03 21:43:49","It was reported that Iran, the largest state sponsor of terror, tested ballistic missiles earlier this week.  In response, the Trump Administration has made the decision to impose additional sanctions on Iran. I applaud this decision, as the United States must continue to show a strong, united stance against these types of threatening activities, which violates UN Security Council Resolution 2231 prohibiting ballistic missile tests, and terrorism.  This week, my colleagues and I on the House Armed Services Committee heard testimony from John McLaughlin about the national security threats and challenges our country faces. I believe his assessment is spot on- the U.S. and our partners must remain vigilant as we navigate new threats to our security that increased technology enables, such as cyber warfare or ballistic missile testing from actors like Iran and North Korea. You can read what Mr. McLaughlin has to say below.","link","http://docs.house.gov/meetings/AS/AS00/20170201/105509/HHRG-115-AS00-Wstate-McLaughlinJ-20170201.pdf","docs.house.gov",112,9,4,2,0,0,0,0
"RepAustinScott","131177916946914_1343979649000062","Rep. Austin Scott","2017-02-05","2017-02-05 17:00:14","Go Falcons! Will you be watching today? What is your prediction? #InBrotherhood #RiseUp #Falcons","video","https://www.facebook.com/atlantafalcons/videos/10154456859982842/",NA,57,22,0,0,0,0,0,0
"RepAustinScott","131177916946914_1345335842197776","Rep. Austin Scott","2017-02-06","2017-02-06 22:01:11","G makes a guest appearance in Speaker Paul Ryan's video from swearing in day earlier this year. Just click play (we're right in the beginning)!","video","https://www.facebook.com/speakerryan/videos/1249440835104440/",NA,48,6,0,5,0,0,0,0
"RepAustinScott","131177916946914_1346583335406360","Rep. Austin Scott","2017-02-07","2017-02-07 23:55:00","More bad weather and tornadoes are coming through South Georgia tonight- please stay safe. If you haven't already, I'd suggest downloading the FEMA app. Be safe!","status",NA,NA,24,2,4,0,0,0,2,0
"RepAustinScott","131177916946914_1347948951936465","Rep. Austin Scott","2017-02-09","2017-02-09 15:55:00","The Marine Corps Logistics Base Albany was damaged by the recent storms in South Georgia. In advance of my visit to the base tomorrow, I asked General Walter, Assistant Commandant of the Marine Corps, when the base will be back up to operational status and why this base is so critical to the U.S. Marine Corps. Turn the sound on to hear his answers! House Armed Services Committee Republicans","video","https://www.facebook.com/RepAustinScott/videos/1347948951936465/",NA,33,1,3,2,0,0,0,0
"RepAustinScott","131177916946914_1349272791804081","Rep. Austin Scott","2017-02-10","2017-02-10 21:55:04","Still want to know ways you can help after the recent storms? Here are a few ways how you can assist in the recovery efforts.","link","http://www.walb.com/story/34324978/helping-recovery-efforts-after-the-storm","walb.com",29,0,5,0,0,0,0,0
"RepAustinScott","131177916946914_1350093101722050","Rep. Austin Scott","2017-02-11","2017-02-11 18:57:24","My friend and (now) former Congressman from Georgia, Dr. Tom Price, was confirmed by the Senate to serve as our Secretary of the U.S. Department of Health and Human Services this week. Dr. Price will be an excellent Secretary of Health and Human Services.  I am confident that Tom will put his years of experience to good use as he plays a leading role in our efforts replace Obamacare with reforms that focus on the patient, drive down the cost, and increase the accessibility of health care for all Americans. I look forward to continuing our work together on behalf of Georgians in his new role.","status",NA,NA,103,12,4,4,0,0,1,3
"RepAustinScott","131177916946914_1350111951720165","Rep. Austin Scott","2017-02-12","2017-02-12 17:01:01","Storm Assistance Update! Feel free to SHARE with a friend who you think would want to know this information. The counties from the Eighth Congressional District included in Individual Assistance (assistance for individuals and households) are the following: Berrien, Cook, Thomas, Turner, Wilcox, and Worth (Crisp and Dougherty Counties right outside our district are also included).  Constituents in these counties can apply for disaster assistance HERE: https://www.disasterassistance.gov/  The counties from the Eighth Congressional District included in Public Assistance (assistance for emergency work and repair or replacement of disaster-damaged facilities) are the following: Berrien, Brooks, Cook, Lowndes, Thomas, Turner, Wilcox, and Worth.   There are several Disaster Recovery Centers in the Eighth Congressional District.  These centers are located in Cook County, Thomas County, Turner County, and Worth County. You can find out more information on Disaster Recovery Centers by clicking HERE: https://www.fema.gov/disaster/4297  As always, please do not hesitate to call my Tifton District Office at (229) 396-5175 if you are in need to assistance, and a member of my staff will make every attempt to connect you with the correct","status",NA,NA,7,0,6,0,0,0,0,0
"RepAustinScott","131177916946914_1351809371550423","Rep. Austin Scott","2017-02-13","2017-02-13 15:57:54","I visited Marine Corps Logistics Base Albany to see firsthand the damage done by the recent tornadoes in South Georgia. MCLB Albany can count on me to ensure they have what they need and to work across the aisle with my colleague Congressman Sanford Bishop to get the base back up and running.","photo","https://www.facebook.com/MCLBAlbany/photos/a.524739067598339.1073741830.512695405469372/1395873317151572/?type=3",NA,35,2,0,0,0,2,0,0
