"screen_name","id","from_name","date","datetime","message","type","link","domain","likes_count","comments_count","shares_count","love_count","haha_count","wow_count","sad_count","angry_count"
"repgregwalden","313301365382225_1526563910722625","Greg Walden","2017-09-07","2017-09-07 14:31:03","This summer, Oregonians have seen the devastating images of fires burning across our state. As I traveled throughout our district in August, I saw first-hand the fires that once again choked our skies with smoke. From southern Oregon to my home town of Hood River, photos I took along the way offer a small snapshot of a larger picture of another summer filled with fire and smoke in Oregon. I wanted to share with you my photos and invite you to share yours with me – this is invaluable as I continue my efforts in Congress to address how federal forests are managed and how these fires are controlled. Whether you are feeling the effects of the Chetco Bar fire in southern Oregon, the Milli fire in central Oregon, the Eagle Creek fire in the Columbia Gorge, or any of the 23 fires burning across our state, I want to hear how your lives and communities are being impacted. Send your photos to congressman.greg.walden@mail.house.gov, and I will share them on my Facebook page to help capture the full picture of how wildfires are impacting our day-to-day lives.","photo","https://www.facebook.com/repgregwalden/photos/a.1526563894055960.1073741838.313301365382225/1526563910722625/?type=3",NA,47,41,16,0,0,4,28,0
"repgregwalden","313301365382225_1526897460689270","Greg Walden","2017-09-07","2017-09-07 21:30:37",NA,"link","http://www.eastoregonian.com/eo/columnists/20170907/walden-a-voice-for-rural-oregon-on-the-ninth-circuit","eastoregonian.com",279,88,30,21,15,3,2,40
"repgregwalden","313301365382225_1527866910592325","Greg Walden","2017-09-08","2017-09-08 19:35:39","Just wrapped up a meeting with U.S. Forest Service Chief Tony Tooke. We had a great discussion about the need for changes to forest and range management to reduce catastrophic fires and improve the health of our forests and communities. I look forward to welcoming Chief Tooke to Oregon this weekend to continue this discussion and meet with fire officials on the ground working to contain the Eagle Creek Fire.","photo","https://www.facebook.com/repgregwalden/photos/a.344279145617780.77317.313301365382225/1527866330592383/?type=3",NA,394,193,65,17,0,1,2,9
"repgregwalden","313301365382225_1527921197253563","Greg Walden","2017-09-08","2017-09-08 20:54:55","Today 10 World War II veterans from Oregon flew to Washington, D.C. to see their memorial on the National Mall. I presented them with flags flown over the Capitol in honor of their service - a small token of the debt of gratitude they are owed for their service to our country. Thank you to Honor Flight of Oregon for making this trip possible for these heroes. Thank you most of all to the veterans for making this day so special, and for your service.","photo","https://www.facebook.com/repgregwalden/photos/a.1527921183920231.1073741840.313301365382225/1527921197253563/?type=3",NA,97,7,4,11,0,0,0,0
"repgregwalden","313301365382225_1528175187228164","Greg Walden","2017-09-09","2017-09-09 03:13:02","Mt. Hood with Mt. Jefferson in the smokey background as the plane began its descent into Portland Friday night.  Sure appreciate the US Forest Service Chief flying out to Oregon to get a first hand look at our situation.  He was officially sworn in today in DC.","photo","https://www.facebook.com/repgregwalden/photos/a.730027740376250.1073741832.313301365382225/1528175157228167/?type=3",NA,161,32,21,6,0,3,11,1
"repgregwalden","313301365382225_1528797090499307","Greg Walden","2017-09-09","2017-09-09 18:34:17","John Pierson, incident commander, begins the fire briefing at the Hood River County Fairgrounds.","photo","https://www.facebook.com/repgregwalden/photos/a.730027740376250.1073741832.313301365382225/1528797050499311/?type=3",NA,22,3,1,0,0,0,0,0
"repgregwalden","313301365382225_1528800027165680","Greg Walden","2017-09-09","2017-09-09 18:38:28","Fire progression map.","photo","https://www.facebook.com/repgregwalden/photos/a.730027740376250.1073741832.313301365382225/1528799997165683/?type=3",NA,19,9,7,0,0,6,17,1
"repgregwalden","313301365382225_1528814180497598","Greg Walden","2017-09-09","2017-09-09 18:58:06","USFS Chief Tony Tooke honors the brave men and women who rescued the hikers from the Eagle Creek Trail.","photo","https://www.facebook.com/repgregwalden/photos/a.730027740376250.1073741832.313301365382225/1528814160497600/?type=3",NA,87,7,4,3,0,1,0,0
"repgregwalden","313301365382225_1528823777163305","Greg Walden","2017-09-09","2017-09-09 19:09:43","Great to meet with the brave men and women of the crew that has been working tirelessly to contain the Eagle Creek Fire.","photo","https://www.facebook.com/repgregwalden/photos/a.730027740376250.1073741832.313301365382225/1528823760496640/?type=3",NA,171,22,6,8,0,0,0,0
"repgregwalden","313301365382225_1528879657157717","Greg Walden","2017-09-09","2017-09-09 20:16:32","Caravan down 84 begins.","photo","https://www.facebook.com/repgregwalden/photos/a.730027740376250.1073741832.313301365382225/1528879623824387/?type=3",NA,21,5,1,2,0,2,0,0
"repgregwalden","313301365382225_1528924800486536","Greg Walden","2017-09-09","2017-09-09 21:23:35","View of situation on the ground as caravan continues down 84.","photo","https://www.facebook.com/repgregwalden/photos/a.730027740376250.1073741832.313301365382225/1528924760486540/?type=3",NA,30,18,5,0,0,6,35,2
"repgregwalden","313301365382225_1529652500413766","Greg Walden","2017-09-10","2017-09-10 17:00:47","This gives you a good idea of where the Eagle Creek and Indian Creek fires are burning.  Thanks to all those who are working hard  to extinguish the blaze and begin the recovery.","photo","https://www.facebook.com/repgregwalden/photos/a.730027740376250.1073741832.313301365382225/1529652490413767/?type=3",NA,68,21,16,0,0,9,28,1
"repgregwalden","313301365382225_1530688033643546","Greg Walden","2017-09-11","2017-09-11 19:57:34","Like all Americans, I will never forget where I was on the morning of September 11, 2001 when our country was attacked.  Still reeling from the attack on the World Trade Center in New York City, Members of Congress were told to evacuate the Capitol immediately after another plane tore through the Pentagon. It was believed the Capitol building was also a target and if it were not for the bravery of 40 Americans aboard United Airlines Flight 93 another iconic U.S. symbol and countless more lives would have been lost. The horrifying images from that day are seared into our national conscious and will forever remind us that we are not invincible and that we are stronger together and united. Today, we remember the thousands of lives who were lost. We remember the first responders and everyday citizens who put their lives on the line to save others. As we pause to reflect on this day, let us honor the brave men and women in uniform defending our freedom and way of life each and every day, and let us never forget.","photo","https://www.facebook.com/repgregwalden/photos/a.344279145617780.77317.313301365382225/1530686450310371/?type=3",NA,80,9,4,8,0,0,13,0
"repgregwalden","313301365382225_1531351113577238","Greg Walden","2017-09-12","2017-09-12 14:42:37","In Case You Missed It:","link","https://www.eenews.net/eedaily/stories/1060060343","eenews.net",53,32,8,2,4,2,1,9
"repgregwalden","313301365382225_1531641640214852","Greg Walden","2017-09-12","2017-09-12 21:41:28","It was an honor to help assemble USO care packages today for our men and women in uniform who've been helping those affected by hurricanes Harvey and Irma.","photo","https://www.facebook.com/repgregwalden/photos/a.344279145617780.77317.313301365382225/1531640543548295/?type=3",NA,124,24,1,6,4,1,0,0
"repgregwalden","313301365382225_1531667463545603","Greg Walden","2017-09-12","2017-09-12 22:36:22","GOOD NEWS: Today the House unanimously passed legislation aimed at improving the health of our firefighters. These heroic first responders experience occupational health risks every day. In our district, it’s often from forest fires like we’re having all summer long. This past weekend I saw firsthand what our firefighters face as they battle the number of fires raging in Oregon, putting themselves in harm’s way to save property, infrastructure, lives, watersheds, habitats, and forests. The Firefighter Cancer Registry Act passed unanimously today and will go a long way towards improving quality of life for the men and women who devote themselves to saving lives. Learn more here: https://energycommerce.house.gov/news/press-release/fullcmte-passes-five-subhealth-bills-advance-public-health/","video","https://www.facebook.com/repgregwalden/videos/1531667463545603/",NA,212,33,35,15,0,4,0,0
"repgregwalden","313301365382225_1532281120150904","Greg Walden","2017-09-13","2017-09-13 15:03:42","“Tune in at 11:30am EST as I join the U.S. Forest Service Chief and my colleagues in the Western Caucus to call for action on forest management reform to help prevent catastrophic wildfires: https://www.facebook.com/SteveDainesMT/","link","https://www.facebook.com/SteveDainesMT/","facebook.com",25,11,0,0,0,0,0,0
"repgregwalden","313301365382225_1532386270140389","Greg Walden","2017-09-13","2017-09-13 17:27:12","Just wrapped up a press conference with U.S. Forest Service Chief Tony Tooke, Senator Steve Daines, and Congresswoman Cathy McMorris Rodgers to call for action on forest management reform. We're united in this effort to help prevent catastrophic fires form raging across Oregon and throughout the West. Watch here:","video","https://www.facebook.com/SteveDainesMT/videos/1191468894331058/",NA,115,27,0,11,0,2,0,2
"repgregwalden","313301365382225_1533401233372226","Greg Walden","2017-09-14","2017-09-14 17:56:08","It is long past time for Congress to reform how our federal forests are managed and how we clean up after devastating fires. By streamlining management activities, we can get back to work in the woods, reduce fuel loads, and help prevent catastrophic wildfires that choke our communities with smoke each summer. If we do not act, these fires will continue to destroy our lands, pour carbon and pollutants into our atmosphere, threaten habitat and water supplies, and put people and property in harm's way. I look forward to working with my colleagues to get this job done. https://walden.house.gov/media-center/press-releases/video-release-greg-walden-forest-management-reform-we-have-do-better-air","video","https://www.facebook.com/repgregwalden/videos/1533401233372226/",NA,410,126,176,39,6,1,2,12
"repgregwalden","313301365382225_1534413866604296","Greg Walden","2017-09-15","2017-09-15 17:09:18","Hermiston Bulldog band warms up before the Westward Ho parade in Pendleton","video","https://www.facebook.com/repgregwalden/videos/1534413866604296/",NA,84,11,22,4,0,2,0,0
"repgregwalden","313301365382225_1534414363270913","Greg Walden","2017-09-15","2017-09-15 17:06:30","Parade's about to start, but even here there's smoke from the fires.","photo","https://www.facebook.com/repgregwalden/photos/a.730027740376250.1073741832.313301365382225/1534414339937582/?type=3",NA,47,8,0,1,0,1,6,0
"repgregwalden","313301365382225_1534488419930174","Greg Walden","2017-09-15","2017-09-15 18:44:22","Let 're buck!","photo","https://www.facebook.com/repgregwalden/photos/a.730027740376250.1073741832.313301365382225/1534488396596843/?type=3",NA,114,16,5,4,2,1,0,0
"repgregwalden","313301365382225_1534514539927562","Greg Walden","2017-09-15","2017-09-15 19:22:23","Great to see Tom Insko, President of Eastern Oregon University; Edward Ray, President of Oregon State University; and Dr. Camille Preus, President of Blue Mountain Community College at Round-Up today.","photo","https://www.facebook.com/repgregwalden/photos/a.730027740376250.1073741832.313301365382225/1534514523260897/?type=3",NA,113,12,0,4,1,0,0,0
"repgregwalden","313301365382225_1536547539724262","Greg Walden","2017-09-17","2017-09-17 22:03:20","Fires continue to burn in the Gorge, but thankfully, rain is on the way. Looking across the Columbia River from just west of Beacon Rock State Park.","photo","https://www.facebook.com/repgregwalden/photos/a.730027740376250.1073741832.313301365382225/1536547523057597/?type=3",NA,89,30,8,2,0,0,20,3
"repgregwalden","313301365382225_1536563253056024","Greg Walden","2017-09-17","2017-09-17 22:33:46","Eagle Creek fire still actively burning on and east of Shellrock Mountain.","video","https://www.facebook.com/repgregwalden/videos/1536563163056033/",NA,33,30,40,0,0,21,84,4
"repgregwalden","313301365382225_1536586993053650","Greg Walden","2017-09-17","2017-09-17 23:20:02","Kiteboarders skim across the Columbia as smoke pours into the Hood River Valley.","photo","https://www.facebook.com/repgregwalden/photos/a.730027740376250.1073741832.313301365382225/1536586979720318/?type=3",NA,29,12,4,0,0,5,7,1
"repgregwalden","313301365382225_1537208572991492","Greg Walden","2017-09-18","2017-09-18 16:44:59","This week is Constitution Week, a time to commemorate the anniversary of the historic occasion when the Framers signed the Constitution of the United States of America on September 17, 1787. Throughout Constitution Week, let us reflect on the revolutionary foundation our founders set in the Constitution over 230 years ago for a government of the people, by the people, and for the people. I will continue to defend these ideals and the inalienable rights we have as Americans that are inscribed into this document.","photo","https://www.facebook.com/repgregwalden/photos/a.344279145617780.77317.313301365382225/1537204509658565/?type=3",NA,95,39,15,11,0,0,0,4
"repgregwalden","313301365382225_1537254629653553","Greg Walden","2017-09-18","2017-09-18 17:53:40","The rain helps, but the fires are still burning in the Gorge.","photo","https://www.facebook.com/repgregwalden/photos/a.730027740376250.1073741832.313301365382225/1537254609653555/?type=3",NA,76,34,27,1,0,3,58,5
"repgregwalden","313301365382225_1537530019626014","Greg Walden","2017-09-19","2017-09-19 01:03:10","Sue, from Rogue River, sent me this photo of what looks like fog on her pasture. In reality, this is dense smoke from the Chetco Bar fire currently burning over 189,000 acres.","photo","https://www.facebook.com/repgregwalden/photos/a.730027740376250.1073741832.313301365382225/1537530009626015/?type=3",NA,37,35,10,0,0,16,68,4
"repgregwalden","313301365382225_1538349936210689","Greg Walden","2017-09-19","2017-09-19 21:36:27","Nice to see the snow move in and the smoke move out.  Here are the Eagle Cap Mountains in Wallowa County.","photo","https://www.facebook.com/repgregwalden/photos/a.730027740376250.1073741832.313301365382225/1538349919544024/?type=3",NA,214,17,12,8,0,0,0,2
"repgregwalden","313301365382225_1538582939520722","Greg Walden","2017-09-20","2017-09-20 00:55:57","Great meeting with members of the Eastern Oregon Counties Association today in Enterprise. Thanks to all who joined for the good discussion on the issues affecting your communities.","photo","https://www.facebook.com/repgregwalden/photos/a.730027740376250.1073741832.313301365382225/1538582882854061/?type=3",NA,75,22,2,3,1,1,0,4
"repgregwalden","313301365382225_1538658932846456","Greg Walden","2017-09-20","2017-09-20 01:45:00","John, from Prineville, sent me this picture from his drive through central Oregon. Charred trees line the road as he travels close to an area that for nearly three straight weeks had an air quality index listed as unhealthy or worse.","photo","https://www.facebook.com/repgregwalden/photos/a.730027740376250.1073741832.313301365382225/1538658906179792/?type=3",NA,51,66,14,0,0,4,92,18
"repgregwalden","313301365382225_1540724009306615","Greg Walden","2017-09-21","2017-09-21 15:40:35","The rains have cleared the skies over Umatilla County as you can see.  Making my sixth trip this year to meet with people in the county.","photo","https://www.facebook.com/repgregwalden/photos/a.730027740376250.1073741832.313301365382225/1540723992639950/?type=3",NA,214,62,7,6,2,2,0,9
"repgregwalden","313301365382225_1540822969296719","Greg Walden","2017-09-21","2017-09-21 17:27:41","Back in Hermiston to discuss power, water and data centers, among other things.  Working with local officials to get more good paying jobs into the region.","photo","https://www.facebook.com/repgregwalden/photos/a.730027740376250.1073741832.313301365382225/1540822949296721/?type=3",NA,138,39,3,1,4,0,0,7
"repgregwalden","313301365382225_1540975169281499","Greg Walden","2017-09-21","2017-09-21 20:46:49","Great to join the Hermiston Rotary Club meeting today. Thank you for inviting me to your meeting and allowing me to share a few words on the progress we're making in the House, our work at the Energy and Commerce Committee, and the urgent need for forest management reform to prevent catastrophic fires in Oregon.","photo","https://www.facebook.com/repgregwalden/photos/a.730027740376250.1073741832.313301365382225/1540975155948167/?type=3",NA,75,26,3,2,0,0,0,10
"repgregwalden","313301365382225_1541102519268764","Greg Walden","2017-09-22","2017-09-22 00:10:43","Dave, returning from a hunting trip last Saturday, sent me this picture of the Eagle Creek fire burning between Hood River and Cascade Locks.","photo","https://www.facebook.com/repgregwalden/photos/a.344279145617780.77317.313301365382225/1541100172602332/?type=3",NA,36,21,6,0,1,4,38,10
"repgregwalden","313301365382225_1541706335875049","Greg Walden","2017-09-22","2017-09-22 15:35:13",NA,"link","https://walden.house.gov/media-center/in-the-news/dalles-chronicle-walden-we-must-act-prevent-wildfires","alden.house.gov",147,63,16,8,3,2,0,5
"repgregwalden","313301365382225_1544833572228992","Greg Walden","2017-09-25","2017-09-25 16:28:15","In Case You Missed It: I was in Medford on Friday to hold a round table discussion on the impact this year's fire season has had on our region, and the need for Congress to act on forest management reform to help prevent catastrophic fires.","link","https://kobi5.com/news/enoughs-enough-walden-says-current-fire-management-policy-isnt-working-61634/","kobi5.com",271,117,34,9,2,2,1,21
"repgregwalden","313301365382225_1546126428766373","Greg Walden","2017-09-26","2017-09-26 17:18:00","Check out my latest newsletter to learn about my recent efforts to push for changes in the way we manage our forests to help prevent catastrophic fires:","link","https://iqconnect.lmhostediq.com/iqextranet/view_newsletter.aspx?id=137246&c=OR02GW","iqconnect.lmhostediq.com",145,73,18,2,1,1,5,11
"repgregwalden","313301365382225_1546873015358381","Greg Walden","2017-09-27","2017-09-27 14:35:15","ICYMI: Check out my column in the Bend Bulletin today on the need for common sense changes to protect Crooked River Ranch from wildfire:","link","http://www.bendbulletin.com/opinion/5626647-151/guest-column-common-sense-protection-for-crooked-river?referrer=section","bendbulletin.com",28,14,6,1,0,1,0,0
"repgregwalden","313301365382225_1547980708580945","Greg Walden","2017-09-28","2017-09-28 20:43:10","Year after year, catastrophic wildfires rage on federal lands, including parts of our district, and our skies are choked with smoke throughout the West. Air quality issues in Oregon continue to rise to dangerous levels because of these fires, forcing cancellations of community events, school closures, and lost tourism dollars. Enough is enough.  It's time that decisions about when and how to fight these fires takes into account the impact they have on air quality and human health.  That's why I've scheduled a hearing at the Energy and Commerce Committee - where I serve as chairman - to examine the impact wildfires have on air quality. Learn more here:","link","https://walden.house.gov/media-center/press-releases/greg-walden-s-energy-and-commerce-committee-examine-impact-wildfires","alden.house.gov",137,79,19,4,1,3,1,13
"repgregwalden","313301365382225_1548647631847586","Greg Walden","2017-09-29","2017-09-29 14:02:20","ICYMI:","link","http://www.ktvz.com/news/walden-expands-investigation-of-alleged-opioid-pill-dumping/627889908","ktvz.com",37,44,7,0,0,3,0,2
"repgregwalden","313301365382225_1551372081575141","Greg Walden","2017-10-02","2017-10-02 12:36:33","Mylene and I are deeply saddened by this vicious attack on innocent civilians in Las Vegas. Our sincerest thoughts and prayers are with the victims and their families. Our deepest appreciation and respect goes out to the first responders.","status",NA,NA,282,375,16,10,2,2,124,50
"repgregwalden","313301365382225_1552769808102035","Greg Walden","2017-10-03","2017-10-03 23:24:04","ICYMI: Every year, our skies are choked with smoke from fires in Oregon. Tomorrow, the Energy and Commerce Committee will take a long overdue look at how these catastrophic fires are impacting air quality and our health in Oregon. Tune in live at 7am PST here: https://energycommerce.house.gov/hearings/air-quality-impacts-wildfires-perspectives-key-stakeholders/","photo","https://www.facebook.com/repgregwalden/photos/a.344279145617780.77317.313301365382225/1552755344770148/?type=3",NA,76,50,9,2,0,1,15,4
"repgregwalden","313301365382225_1553314371380912","Greg Walden","2017-10-04","2017-10-04 14:01:31","HAPPENING NOW: I am about to kick off a hearing at the Energy and Commerce Committee to examine the air quality impacts of catastrophic fires. Tune in here:","link","https://energycommerce.house.gov/hearings/air-quality-impacts-wildfires-perspectives-key-stakeholders/","energycommerce.house.gov",30,19,1,3,0,0,0,4
"repgregwalden","313301365382225_1553317704713912","Greg Walden","2017-10-04","2017-10-04 14:04:55","Thank you to our witnesses for coming to testify at this important hearing today. I especially want to thank Dr. John Bailey, professor at Oregon State University's College of Forestry for joining us today. Be sure to tune in to the hearing here: https://energycommerce.house.gov/hearings/air-quality-impacts-wildfires-perspectives-key-stakeholders/","photo","https://www.facebook.com/repgregwalden/photos/a.344279145617780.77317.313301365382225/1553315401380809/?type=3",NA,42,14,5,2,0,0,0,1
"repgregwalden","313301365382225_1553338421378507","Greg Walden","2017-10-04","2017-10-04 14:26:38","View from the chair as we continue to examine the impacts of devastating fires like Eagle Creek - pictured on the screen behind our witnesses - which burned over 50,000 acres just miles from my home in Hood River. Tune in to watch expert witness testimony here: https://energycommerce.house.gov/hearings/air-quality-impacts-wildfires-perspectives-key-stakeholders/","photo","https://www.facebook.com/repgregwalden/photos/a.730027740376250.1073741832.313301365382225/1553338398045176/?type=3",NA,48,33,3,1,0,0,3,5
"repgregwalden","313301365382225_1553510301361319","Greg Walden","2017-10-04","2017-10-04 17:52:26",NA,"link","http://www.eastoregonian.com/eo/local-news/20171003/lawmakers-focus-on-air-pollution-from-wildfire","eastoregonian.com",39,20,7,1,3,0,0,1
"repgregwalden","313301365382225_1554342717944744","Greg Walden","2017-10-05","2017-10-05 14:38:41","Just wrapped up a press conference with my colleagues on the Western Caucus to address the need to act on forest management reform this Congress. After a summer filled with fire, smoke, and ash in many of our communities, it's past time to fix the problems leading to catastrophic fires across the West. I look forward to working with my colleagues to get this job done.","photo","https://www.facebook.com/repgregwalden/photos/a.730027740376250.1073741832.313301365382225/1554342701278079/?type=3",NA,215,92,10,11,2,0,2,21
"repgregwalden","313301365382225_1555861167792899","Greg Walden","2017-10-06","2017-10-06 22:04:17","Great to visit Oxford House in Medford today to learn about the work they're doing to help Oregonians recover from addiction. Now heading to a roundtable in Grants Pass to discuss how we can work together to combat the opioid epidemic in Oregon and across the country.","photo","https://www.facebook.com/repgregwalden/photos/a.730027740376250.1073741832.313301365382225/1555861091126240/?type=3",NA,128,41,5,0,1,0,0,5
"repgregwalden","313301365382225_1557435230968826","Greg Walden","2017-10-08","2017-10-08 13:07:54","Great to meet Junior ROTC students from South Salem High School yesterday!","photo","https://www.facebook.com/repgregwalden/photos/a.730027740376250.1073741832.313301365382225/1557435214302161/?type=3",NA,170,19,5,5,0,2,0,0
"repgregwalden","313301365382225_1557820807596935","Greg Walden","2017-10-08","2017-10-08 20:42:48","We need to change the law so that we can harvest the burned, dead trees while they have value and pay for growing a fresh, new forest for the next generation.","photo","https://www.facebook.com/repgregwalden/photos/a.730027740376250.1073741832.313301365382225/1557820767596939/?type=3",NA,1534,265,910,90,2,2,6,56
"repgregwalden","313301365382225_1558600070852342","Greg Walden","2017-10-09","2017-10-09 16:33:18","Underway in Bend for a roundtable with law enforcement officials and members of the Pain Standards Task Force to discuss how we can work together to combat the opioid epidemic in Oregon.","photo","https://www.facebook.com/repgregwalden/photos/a.730027740376250.1073741832.313301365382225/1558600037519012/?type=3",NA,81,32,3,3,1,1,0,5
"repgregwalden","313301365382225_1558701940842155","Greg Walden","2017-10-09","2017-10-09 18:42:07","Always great to meet with the veterans of Bend Band of Brothers. Thank you for inviting me to join you at Jake's Diner this morning, and thank you all for your service to our country.","photo","https://www.facebook.com/repgregwalden/photos/a.730027740376250.1073741832.313301365382225/1558701924175490/?type=3",NA,105,19,6,8,0,0,0,4
