"screen_name","id","from_name","date","datetime","message","type","link","domain","likes_count","comments_count","shares_count","love_count","haha_count","wow_count","sad_count","angry_count"
"repgregwalden","313301365382225_1524170160962000","Greg Walden","2017-09-04","2017-09-04 23:08:38","Per USFS: Milli Fire https://inciweb.nwcg.gov/incident/5517/#  The Milli Fire is 9 miles west of Sisters, Oregon on the Sisters Ranger District of the Deschutes National Forest. It was reported on August 11 in the Three Sisters Wilderness near the fire scar of the 2006 Black Crater Fire. The fire was caused by a lightning strike. A Type 3 Team worked on the fire until management of the fire was delegated to a Type 1 Team (Southwest Team 2) on August 16. August 31, a Type 2 Team (Northwest Team 8) under the leadership of Doug Johnson, has been delegated responsibility for fire suppression and Initial Attack with in the TFR area.   The fire continues to be a full suppression fire and all full suppression tactics are still being used. Given the dry fuels, where the fire is burning, and the location of the fire, fire managers expect this to be a long duration fire. The team continues to work with all partners in the Sisters Community, Deschutes County and the State of Oregon.  Basic Information  Current as of ‎9‎/‎4‎/‎2017‎ ‎10‎:‎20‎:‎53‎ ‎AM   Incident Type Wildfire   Cause Lightning   Date of Origin Friday August 11th, 2017 approx. 02:45 PM   Location 9 miles west of Sisters OR (in Three Sisters Wilderness)   Incident Commander Doug Johnson   Current Situation  Total Personnel 318   Size 22,527 Acres   Percent of Perimeter Contained 60%   Estimated Containment Date Sunday October 01st, 2017 approx. 12:00 AM   Fuels Involved  Timber (Litter and Understory)  Brush (2 feet)  Timber (Grass and understory)  Narrative:  Fire is burning on private lands in a plantation, along the McKenzie Highway (OR242) burning actively along the southeastern area of the fire near Yapoah Lake.   Significant Events  Active  Flanking  Backing  Short-range spotting  Narrative:  Interior unburned islands as well as the southwest flank exhibited some active fire behavior with forward spread. Movement west to the lava flow continued. Single and small group torching in the lodgepole pine continued through the shift.   Outlook  Planned Actions  Continue to suppress unburned island on private lands near containment lines. Patrol, mop up and rehab on the north and east sides of the fire. Continue to clear Highway 242 of rocks, debris, and hazardous trees.Patrol and mop up of Whychus Creek. Patrol north and west fire perimeter by air.     Projected Incident Activity  12 hours:  Re-evaluate level 1 evacuation for the Edgington, Crossroads, Tollgate, and Black Butte Ranch Subdivisions, Honeyman and Jones private properties, as well as numerous isolated structures. Patrol, mop up and rehab all containment lines.Fire will continue to be active in the private green interior island inside.  24 hours:  Heavy smoke and traffic may continue to impact the communities of Sisters, Plainview, and highways. West of the fire in the wilderness, fire may continue to spread north, west, and south. Edgington, Crossroads,Tollgate, Black Butte Ranch including Honeyman and Jones properties continue under level 1 evacuation. Continuous assessment of fire to determine evacuation levels. Patrol, mop up and rehab all containment lines.   48 hours:  Expected fire spread may continue on the west side of the fire and continue spreading both west and south.   72 hours:   West of the fire in the wilderness, it may continue to spread west and south. Patrol, mop up and rehab all containment lines.   Current Weather  Weather Concerns  A Red Flag Warning is in effect until Tuesday evening for dry-unstable conditions and hot temperatures. Persistent inversions today with widespread smoke cover. Maximum temperatures 80 to 90. Minimum relative humidity of 12 to 20 percent. Light winds except for northeast to east ridge-top winds with gusts to 20 mph on exposed ridges. The Haines Index is forecast at 5.  Partly cloudy and smoky on Tuesday with a slight chance of late-day thunderstorms near the Cascade Crest. Increasing clouds on Wednesday with chance of showers and thunderstorms. Cooler with highs in the mid-70s to low 80s and minimum humidity of 25 to 40 % Haines Index of 5.","link","https://inciweb.nwcg.gov/incident/5517/#","inciweb.nwcg.gov",28,22,10,0,0,2,14,2
"repgregwalden","313301365382225_1524172407628442","Greg Walden","2017-09-04","2017-09-04 23:11:05","Per USFS: Chetco Bar Fire https://inciweb.nwcg.gov/incident/5385/#  The Chetco Bar Fire was reported on July 12, 2017. The initial size-up of the fire was 1/4 acre burning in the 2002 Biscuit Fire and 1987 Silver Fire scars located in the Kalmiopsis Wilderness, roughly six air miles west of Pearsoll Peak and north of the Chetco River. The fire is approximately 5 miles northeast of Brookings, Oregon. The area is comprised of mixed conifer and deciduous forest, brush and snags from the 2002 Biscuit Fire and 1987 Silver Fire. The fire is burning in areas of fire scar and islands that were previously unburned. The combination of down, dead fuels with a newly cured grass makes the terrain quite hazardous for firefighters.   Closures: Due to fire activity, and firefighter and public safety concerns, there are trail, road and area closures in place on the Gold Beach and Wild Rivers Ranger Districts. For more information and details regarding the closures, please visit the Forest’s website at http://tinyurl.com/ClosureOrder.  Fire Restrictions: The IFPL (Industrial Fire Precaution Level) is Level IV.   Drones: While there has been no drone activity over the Chetco Bar Fire, please remember that drones interfere with firefighting efforts. The Federal Aviation Administration (FAA) has issued a Temporary Flight Restriction (TFR) over the Chetco Bar Fire. Any private aircraft or drone that violates the TFR could face serious criminal charges. Even without a TFR, anyone who hampers firefighting efforts could face criminal charges as well. For more information on drone use, visit the FAA's website www.KnowBeforeYouFly.org. Remember, ""If you fly, we can't!""  Basic Information Current as of ‎9‎/‎4‎/‎2017‎ ‎12‎:‎24‎:‎57‎ ‎AM   Incident Type Wildfire   Cause Lightning   Date of Origin Wednesday July 12th, 2017 approx. 01:45 PM   Location Kalmiopsis Wilderness, Chetco River corridor, timberlands, 4 fire districts   Incident Commander Unified Command    Incident Description Wildfire   Current Situation  Total Personnel 1,670   Size 142,857 Acres   Percent of Perimeter Contained 10%   Estimated Containment Date Sunday October 15th, 2017 approx. 06:00 PM   Fuels Involved  Timber (litter and understory), Brush (2 feet), Closed Timber Litter.   Fuel types across the fire area include Douglas fir stands of various age classes, tan oak and canyon oak, and dense brush fields of manzanita and ceanothus in the older fire scars which contain numerous snags and heavy dead/down. The oak leaf litter will readily support active surface fire spread when dry. Low live fuel moistures in the brush fuels will allow them to actively burn. Some areas within the harvested cut blocks have heavy slash fuel loads and large piles which will burn with intensity.   Significant Events  Extreme, group torching, spotting, short crown runs. There are several areas active around the perimeter. Very Active fire behavior with plume development on the eastern flank, to the south of Pearsoll Peak near Babyfoot Lake. Additional areas on the east flank within Biscuit scar developed plume early in the day. Torching and spots in south, Div G, fire slopped/spotted and is established in Wheeler Creek. Continued backing/flanking/torching near Div M/O break in upper Pistol River drainage. Div K continues with firing/holding 1107 Road. North flank continues to back downslope into Illinois River drainage.    Outlook  Planned Actions  Branch I: Continue suppression efforts to check fire spread from entering the Winchuck drainage. Implement point protection strategies that have a high probability of success. Continue to prep indirect line, identify contingency lines, as well as coordinate with wildland and structural resources. Continue with mop up opportunities around structures.  Branch II: Continue to improve direct dozer line and handline. Plumb and prepare direct lines for mop up. Prepare identified roads for potential firing and holding. Continue to scout and prepare contingency lines as well as scout for containment lines north and west of fire.  Branch III: Continue with line construction to connect Divisions O and R. Continue with scouting opportunities in order to look at additional lines for reducing fire size. Prepare roads for burnout. Scout for direct and indirect lines to the North and East. Build direct and indirect lines where possible. Continue to scout for direct and indirect lines to the North and East, as well as improve roads for future containment spread to the North-Northeast as the perimeter encroaching on the wilderness boundary.  Branch IV: Implement structure protection in Oak Flat, Store Gulch, McCaleb's Ranch, and Footbridge. Scout direct and indirect lines in the Illinois River Area. Continue to open previous lines from previous fires in the area with heavy equipment and coordinate with local Forest Service and Oregon Department of Forestry resources to develop a plan for containment of the fire east of the of the Kalmiopsis Wilderness.  Maintain current coordination with Curry County Sheriff and Josephine County Sheriff regarding evacuation levels while the Oregon State Fire Marshal Task Forces continue structure evaluation and preparation.  Utilize Aircraft to check fire spread when possible.    Projected Incident Activity  12 hours- Active to very active fire behavior. RH recovery poor. Torching, crown runs, spotting to 0.7 mile (maybe further), major runs likely with alignment of wind and terrain, plume development. High potential for large fire growth (Haines 5).   24 hours- Active fire behavior. Torching, crown runs, spotting to 0.5 mile (maybe further), major runs likely with alignment of wind and terrain, plume development. Moderate potential for large fire growth (Haines 5). 48 hours- Active fire behavior. Torching, crown runs, spotting to 0.5 mile, runs possible with alignment of wind and terrain. Moderate potential for large fire growth (Haines 4).   72 hours- Active fire behavior. Torching, spotting to 0.5 mile, runs likely with alignment of wind and terrain. Moderate potential for large fire growth (Haines 4). Possible thunderstorm development.   Anticipated after 72 hours: Active fire behavior. Thunderstorms possible.   Remarks  Due to an increase of fire activity in the NW, PNW 3 will retain command of Branch IV as opposed to previous transfer of command to NW Team 6 that was scheduled.   OSFM transitioned teams, IC is now Les Hallman.   Fire perimeter and acreage have been determined by IR flights. Due to a mechanical reason on the IR flight and heavy smoke layer through the day, there was not an opportunity to fly the fire for perimeter update or acreage increase. There was growth on the eastern flank, south of Pearsoll Peak and growth within the Biscuit scar. There is also established fire in Wheeler Creek.   The Office of the State Fire Marshal is operating under a Delegation of Authority on lands protected by the following jurisdictions having authority: City of Brookings Fire Department, Cape Ferrelo RFPD, and Winchuck RFPD. Additionally, Office of the State Fire Marshal is operating on unprotected land under a Delegation of Authority from the Curry County Board of Commissioners.  Current Weather  Weather Concerns  A red flag warning remains in effect through Monday morning at 9 AM along with an excessive heat warning in effect through 11 PM Monday night. As the upper level ridge and surface trough slide east of the fire area, winds have become westerly and will vary to northerly tonight. Wind speeds of 10 to 15 mph with gusts around 20 mph are expected overnight then will subside on Monday with winds remaining northerly. With moisture slowly returning to the area, cumulus clouds will be on the increase with chances of thunderstorms by midweek. Marine layer will remain between 1,000 and 1,500 feet with poor humidity recovery above the marine layer.","link","http://tinyurl.com/ClosureOrder","tinyurl.com",20,25,19,0,0,5,17,8
"repgregwalden","313301365382225_1524176420961374","Greg Walden","2017-09-04","2017-09-04 23:18:21","Per USFS: High Cascades Complex Fire https://inciweb.nwcg.gov/incident/5503/#  Fire Location: The High Cascades Complex consists of 20 fires located within Crater Lake National Park, the Rogue River/Siskiyou National Forest on the High Cascades Ranger District, the Umpqua National Forest, Tiller Ranger District, and the Fremont/Winema National Forest in the Sky Lakes wilderness. Thirteen of these fires have been contained and are in patrol status. The remaining 7 are being managed with a full suppression strategy.   Area, Road, and Trail Closures:   Closure orders have been issued by the Umpqua, Rogue River-Siskiyou, and Fremont Winema National Forests due to hazards associated with fire activity. Road, trail, and area closures have been expanded in and around the Abbott Creek Research Natural Area and the northern portion of the Sky Lakes Wilderness, including a portion of the Pacific Crest Trail. For maps and details see: https://inciweb.nwcg.gov/incident/closures/5503/  Fire History:  On July 26, 2017, lightning started the Blanket Creek fire within the Blanket Creek drainage on the Rogue River/Siskiyou National Forest. On July 29, 2017, a lightning strike started the Spruce Lake fire, burning on the west side of Crater Lake National Park. Continuing lightning events over the following week initiated numerous starts across the region. Northwest Incident Management Team (NWIMT) 7 (Knerr) began management of the High Cascades Complex on August 24, 2017. Transfer of management of the Paradise, Windy Gap and Pup fires in the Falcon Complex from NWIMT 8 (Keith) to NWIMT 7 (Knerr), occurred on Saturday, August 26, 2017. The Pup, Paradise, and Windy Gap Fires are now listed under the High Cascades Complex.   NWIMT 7 is now managing a total of 20 fires in Crater Lake National Park, Rogue River-Siskiyou, Fremont-Winema, and Umpqua National Forests.   Smoke Outlook: To see smoke visibility in the area, check out the webcams on the Crater Lake National Park website https://www.nps.gov/crla/learn/photosmultimedia/webcams.htm. A full smoke report is posted on the Inciweb website.   Basic Information  Current as of ‎9‎/‎3‎/‎2017‎ ‎11‎:‎31‎:‎52‎ ‎PM   Incident Type Wildfire   Cause Lightning/natural   Date of Origin Sunday August 13th, 2017 approx. 02:40 PM   Location Rogue River-Siskiyou NF High Cascades RD, Umpqua NF Tiller RD, Fremont-Winema NF Klamath RD and Crater Lake National Park   Incident Commander Eric Knerr   Incident Description Wildfire   Current Situation  Total Personnel 647   Size 28,362 Acres   Percent of Perimeter Contained 33%   Estimated Containment Date Sunday October 15th, 2017 approx. 12:00 AM   Fuels Involved  Closed Timber Litter. Timber (Litter and Understory). Ample surface fuels, ladder fuels and abundance of snags on each fire in the complex is providing suppression challenges. Low dead fuel moisture in all classes; live fuels near seasonal low moisture.   Significant Events  Active  Short Crown Runs  Group Torching  Short-range Spotting   Outlook  Planned Actions  Broken Lookout/Windy Gap 1st Priority-Utilize aircraft to slow fire spread. Utilize crews to strengthen indirect containment lines along the 68 road and the 6510 road. Implement structure protection measures in the Union Creek community. Burn along the 68 road and USFS road 6510 as conditions and resources allow.  Blanket Cr. 2nd Priority- utilize aircraft to slow forward spread of fire. Utilize crews and equipment to complete indirect containment lines to protect Crater Lake National Park infrastructure and resources along Highway 62. Start burning on Hwy 62 and Forest road 3282 as needed to stay ahead of approaching fire.  Spruce Lake 3rd Priority-monitor fire spread to north. Coontinue burnout and hold indirect line south of Redcone.  Pup 4th Priority- Provide point protection for Hershberger Lookout and Telecommunications Site.  Paradise 5th Priority-hold and mop-up existing containment lines on north and west, hold fire on east side of Cougar creek while monitoring spread to south.   Projected Incident Activity  12 hours: Persistent dense smoke at lower levels (<5000'), while ridge and peaks will have dry N-NE winds. Areas of very active fire behavior including high intensity flare-ups, torching and spotting due to abundant dry fuels. Acreage increases through spotting and active backing/flanking, with short-range spot fire consolidation. Some clear sky conditions in higher terrain will provide overall increase in fire activity with potential large fire growth.   24 hours: Poor humidity recovery, rapid daytime heating, E-NE gusty winds shifting to W-NW and S-SW during the afternoon. Increasing southerly flow with mid-level moisture introduces cumulus clouds in the area and east. Continued active burning conditions, especially on higher terrain with sunshine.   Remarks  The High Cascades Complex consists of 20 fires, 17 are originally part of the High Cascades Complex and 3 are originally part of the Falcon Complex.   BAER Team in place for Blanket and Spruce Lake Fires   The High Cascades Complex is supporting the Umpqua North Complex with Logistics and Planning functions at the Broken Arrow ICP. Additional support is bein given to North and South Umpqua Zones for IA. Logistical support given to Type 3 organization at Milo managing remainder of Falcon Complex Fires.  Current Weather  Weather Concerns  Continued hot, dry and unstable. Persistent smoky conditions below 5500' will moderate fire activity when present. Potential threat of lightning bringing new ignitions during week. Continued pattern of N-NE dry flow producing poor RH recovery on ridges and peaks will keep fires active through the night.   Current/Observed conditions as of 1600 PDT Saturday 9/2/17  Min RH : 13-16%  High Temp: 85-98°F between 5000-7000 ft  Afternoon ridge winds SW shifting NW late in afternoon 6 mph gusting to 12 mph. Lower level winds slope-driven 3 mph gusting to 6 mph.  A Red Flag Warning was in place over the area today from 1300 to 2000 for dry and unstable conditions with Haines 6. The best conditions for plume domination was in the cleaner air this morning over ridges. Smoke soon filled in the Complex and the instability was mitigated by shading the fuels and fire. Thick smoke over much of the Complex limited visibility to less than 1 mile in many places, especially Helibase. This significantly limited aviation support.  Sunday:  Continued hot, dry and unstable with Haines only at 5 and similar temperatures and humidity. The Haines Index will be highest over ridges with cleaner air much like Saturday. The strengthening ridge will initially trap smoke below 5500 feet, then expanding to ridges by mid-morning, making aviation operations unlikely until mid to late afternoon. Mid-level moisture begins advancing into the region today that may trigger some cumulus buildups to the east in cleaner air, but not certain enough moisture is present for thunderstorms.","link","https://inciweb.nwcg.gov/incident/closures/5503/","inciweb.nwcg.gov",25,27,8,0,0,0,7,9
"repgregwalden","313301365382225_1524783104234039","Greg Walden","2017-09-05","2017-09-05 15:22:00","Thank you to the brave firefighters who have been working tirelessly to knock down this fire and the many burning across our state.  Per USFS: https://inciweb.nwcg.gov/incident/5584/# A new fire, the Eagle Creek Fire, was reported Saturday afternoon at approximately 4:00pm in the Columbia River Gorge National Scenic Area. The fire grew to 3,000 acres overnight. The fire exhibited significant growth on the afternoon of September 4th and current fire size is still estimated at 4,800 acres. The fire will continue to grow through the night of September 4th-5th.   Public safety is the number one priority in the Eagle Creek Fire. The Eagle Creek Fire is human caused but specifics remain under investigation by the Oregon State Police. Evacuation Information:   The Multnomah County Sheriff's Office has issued Level 3 (Go!) evacuations for Larch Mountain and the communities of Dodson and Warrendale. The communities of Latourell and Bridal Veil are in Level 2 (Be Ready) evacuation status.  East Corbett is under a Level 3 (Be Set) evacuation and the rest of Corbett is under Level 1 (Be Ready) evacuation.  The Red Cross is opening a shelter in Gresham, OR at Mount Hood Community College (26000 SE Stark Street, Gresham, OR) for all Warrendale and Dodson residents.  The Hood River County Sheriff issued Level 3 (Go) evacuations for everything south of Interstate 84 in Cascade Locks. All prior Level 1 evacuations in Cascade Locks have been increased to Level 2 (Set) by the Hood River County Sheriff. A Red Cross Shelter has been set up at the Skamania County Fairgrounds, immediately across the Columbia River in Stevenson, Washington.   Basic Information Current as of ‎9‎/‎5‎/‎2017‎ ‎10‎:‎23‎:‎41‎ ‎AM Incident Type Wildfire Cause Human Caused  Date of Origin Saturday September 02nd, 2017 approx. 04:00 PM  Location 1 mile south of Cascade Locks, Oregon  Incident Commander Sheldon, ODF Buckman, OSFM Yocum  Incident Description Human-caused Wildfire Burning In The   Columbia River Gorge National Scenic Area.  Current Situation Total Personnel 294 Size 4,800 Acres  Estimated Containment Date Saturday September 30th, 2017 approx. 12:00 AM  Fuels Involved Tall timber contributed to explosive fire behavior this afternoon with 3/4 mile spotting.   Significant Events Extreme, long-range spotting, torching, wind-driven runs.   Outlook Planned Actions Oregon State Fire Marshal task forces is in the fire area doing structure protection. Additional resources have been ordered. Firefighters will continue with point structure protection.   Remarks The fire became very active late this afternoon under strong east winds with 3/4 mile spotting observed. Suppression forces were very busy with structure protection and evacuations. Interstate 84 was closed this afternoon until further notice because of public safety concerns. Smoke was causing limited visibility for travel as well as the potential for rolling debris. The railroad has been closed to all rail traffic. Some power poles have burned on the BPA power line. It will remain energized to allow for pumps to run for structure protection. The fire spotted across the Columbia River overnight.  Current Weather Weather Concerns A thermal trough will continue with hot, dry and unstable conditions with east winds and Haines 6 overnight and through tomorrow.","link","https://inciweb.nwcg.gov/incident/5584/#","inciweb.nwcg.gov",122,48,20,8,0,1,13,0
"repgregwalden","313301365382225_1524974474214902","Greg Walden","2017-09-05","2017-09-05 19:47:35","I've long been a supporter of stronger security on America’s borders -- countries that do not have control of their borders do not have control of their national security. That is what will lead us to much-needed immigration reform, and it is vital to fixing our broken system.  America’s legal immigration system, like other federal bureaucracies, is in need of reform. The current system does not work, and it is past time for Congress to act on this issue.   Like all Americans, I have compassion for those who entered our country unlawfully as children and are now in limbo in our immigration system. These are kids who know no other country as their home and were brought here through no fault of their own at a young age. It is up to Congress to find a permanent solution.  I appreciate that President Trump recognizes the need for Congress to act to address this problem. As we move forward, I will continue to work with my colleagues in Congress and the administration to secure our borders and fix our flawed immigration system.","video","https://www.facebook.com/repgregwalden/videos/1524974474214902/",NA,350,439,94,38,2,1,7,133
"repgregwalden","313301365382225_1525051240873892","Greg Walden","2017-09-05","2017-09-05 21:37:58","In Case You Missed It:","link","https://www.eenews.net/stories/1060059655","eenews.net",74,35,8,1,1,0,0,5
"repgregwalden","313301365382225_1525873924124957","Greg Walden","2017-09-06","2017-09-06 20:23:00","GOOD NEWS: The SELF DRIVE Act passed unanimously through the House of Representatives today. Self-driving cars hold the promise of making America’s roads safer, creating new economic opportunities, and helping seniors and those with disabilities live more independently. The SELF DRIVE Act strikes the critical balance of enhancing consumer safety while promoting the continued development of this cutting-edge technology. This bipartisan bill paves the way for advanced collision avoidance systems and self-driving cars nationwide, and ensures that America stays a global leader in innovation. Today marks an important milestone in the pursuit to make our roadways safer and support American leadership in self-driving innovation. Learn more here: https://walden.house.gov/media-center/press-releases/walden-helps-pass-landmark-legislation-pave-way-self-driving-cars","video","https://www.facebook.com/repgregwalden/videos/1525873924124957/",NA,75,120,25,7,7,10,3,24
