"screen_name","id","from_name","date","datetime","message","type","link","domain","likes_count","comments_count","shares_count","love_count","haha_count","wow_count","sad_count","angry_count"
"RepRalphNorman","315402818913523_341156796338125","Rep. Ralph Norman","2017-08-25","2017-08-25 20:33:02","Today, I was disappointed to hear Federal Reserve Chair Janet Yellen’s statement downplaying the harmful effects of #DoddFrank Act regulations on mortgage lending and small business lending.   As a member of the House Small Business Committee and a small businessman myself, I recognize how the Dodd-Frank Act has hindered the ability of small businesses and middle class American families to access many financial products. Dodd-Frank has impeded the ability of our community banks and credit unions to provide lower and middle class Americans the assistance they need to buy homes and build their businesses.   The Financial CHOICE Act, passed by the House of Representatives earlier this year, takes critical steps towards easing these burdens on lenders and getting real Americans the support they need to pursue the American Dream.  https://youtu.be/5r2L4HeiS0Q","video","https://youtu.be/5r2L4HeiS0Q",NA,28,13,1,0,0,0,0,0
"RepRalphNorman","315402818913523_342322929554845","Rep. Ralph Norman","2017-08-29","2017-08-29 00:05:14","Our deepest prayers and thoughts are with all those affected by #HurricaneHarvey. Thank you to all the brave first responders! #PrayForTexas  Here is a link for you to connect with voluntary organizations in order to help the victims: https://www.nvoad.org/","link","https://www.nvoad.org/","nvoad.org",11,0,2,0,0,0,0,0
"RepRalphNorman","315402818913523_343034932816978","Rep. Ralph Norman","2017-08-30","2017-08-30 20:34:20","When helping hurricane #Harvey victims, beware of any #charityscam looking to steal your money or info. www.irs.gov/eoselectcheck","photo","https://www.facebook.com/RepRalphNorman/photos/a.325588211228317.1073741829.315402818913523/343034889483649/?type=3",NA,6,0,5,0,0,0,0,0
"RepRalphNorman","315402818913523_343038992816572","Rep. Ralph Norman","2017-08-30","2017-08-30 20:55:06","President Donald J. Trump's remarks on #taxreform today were spot on. Our tax code is way too complicated! We need a simple and fair code that is pro-growth, pro-jobs, pro-family and pro-American. Great to see that the President is eager to work with Congress on a plan that will create more jobs and let Americans take home more of their hard-earned money.","photo","https://www.facebook.com/RepRalphNorman/photos/a.325588211228317.1073741829.315402818913523/343038702816601/?type=3",NA,91,18,7,0,0,0,0,7
"RepRalphNorman","315402818913523_345591175894687","Rep. Ralph Norman","2017-09-06","2017-09-06 16:11:25","I have introduced an amendment to #HR3354- the Make America Secure and Prosperous Appropriations Act, which the House will vote on later this week, to cut EPA funding  to the levels requested by President Donald J. Trump's Office of Management and Budget request.   Read my op-ed published today here: http://dailysignal.com/2017/09/06/congress-follow-trumps-lead-cut-epa-funding/","link","http://dailysignal.com/2017/09/06/congress-follow-trumps-lead-cut-epa-funding/","dailysignal.com",47,81,24,4,0,1,0,50
"RepRalphNorman","315402818913523_345633695890435","Rep. Ralph Norman","2017-09-06","2017-09-06 18:25:29","Governor Henry McMaster has declared a state of emergency before #HurricaneIrma's arrival. South Carolinians, please take this time to review safety plans so that you can be prepared should they be needed.  http://myfox8.com/2017/09/06/sc-gov-mcmaster-declares-state-of-emergency-ahead-of-irmas-arrival/","link","http://myfox8.com/2017/09/06/sc-gov-mcmaster-declares-state-of-emergency-ahead-of-irmas-arrival/","myfox8.com",44,6,26,0,0,5,0,0
"RepRalphNorman","315402818913523_345677902552681","Rep. Ralph Norman","2017-09-06","2017-09-06 21:22:13","As #HurricaneIrma approaches, please take a look at South Carolina Emergency Management Division's emergency kit check list so you can plan ahead and be prepared: http://www.scemd.org/planandprepare/preparedness/emergencykit","photo","https://www.facebook.com/RepRalphNorman/photos/a.325588211228317.1073741829.315402818913523/345677785886026/?type=3",NA,20,1,15,0,0,0,0,0
"RepRalphNorman","315402818913523_346032149183923","Rep. Ralph Norman","2017-09-07","2017-09-07 20:39:57","Thank you President Donald J. Trump for approving Governor Henry McMaster's Emergency Declaration request for the state of South Carolina as #HurricaneIrma approaches.   This approval will provide assistance for all 46 counties and the Catawba Indian Nation and authorizes FEMA to provide emergency protective measures.","status",NA,NA,20,2,1,0,0,0,0,0
"RepRalphNorman","315402818913523_346042082516263","Rep. Ralph Norman","2017-09-07","2017-09-07 21:35:04","Today I testified in front of the US International Trade Commission. I spoke how I firmly believe that the government should only intervene in the market when there is a clear benefit to the American consumer. I am proud to be a strong advocate for the free market system and for competition which creates quality jobs all around the 5th district. Look forward to seeing more jobs here in the U.S. and promoting more free trade.  I spearheaded a bi-partisan letter with my colleagues to the ITC that protects competition in the washer industry and protects Americans consumers and workers.   View the letter here: https://norman.house.gov/sites/norman.house.gov/files/ITC%20201%20Letter%20-%20Final.pdf","link","https://norman.house.gov/sites/norman.house.gov/files/ITC%20201%20Letter%20-%20Final.pdf","norman.house.gov",41,6,4,4,0,0,0,0
"RepRalphNorman","315402818913523_346307425823062","Rep. Ralph Norman","2017-09-08","2017-09-08 14:58:29","A pro-growth tax code will increase jobs in our communities, grow wages, and put more money back in your pocket. Here’s how:","link","http://www.fairandsimple.gop/?utm_source=Rep+Ralph+Norman","fairandsimple.gop",14,9,3,0,2,0,0,0
"RepRalphNorman","315402818913523_346736582446813","Rep. Ralph Norman","2017-09-09","2017-09-09 17:28:21","Yesterday, I was proud to have joined 89 other conservatives in Congress to oppose H.R. 601 which packaged together aid for #HurricaneHarvey, and a debt ceiling limit suspension, federal flood insurance extension, and a CR to fund the federal government for the next three months.   Congress once again has chosen to take an easier road of delay and postponement and procrastination over biting the bullet and dealing with the tough issues upfront and forthright. Tactics like this are why federal spending continues to rise and why we find our country with a $20 trillion debt.  I support hurricane relief.  In fact, early in the week, I proudly joined the bi-partisan effort in the House (the bill passed 419 to 3) that would have provided the folks in Texas and Louisiana $7.9 billion in immediate assistance.  Those folks are suffering and need our help.  But they were used as pawns in a sick political game, and they were held hostage by a political argument over the debt ceiling. They deserved better.","status",NA,NA,19,13,4,1,0,0,0,5
"RepRalphNorman","315402818913523_347265109060627","Rep. Ralph Norman","2017-09-11","2017-09-11 01:09:56","SCHOOL CLOSINGS & DELAYS: Ahead of #HurricaneIrma's arrival, please be aware that some South Carolina school districts have announced closures and delays.   Be sure to see if your school district has announced any closures or delays.","status",NA,NA,4,0,1,0,0,0,0,0
"RepRalphNorman","315402818913523_347487862371685","Rep. Ralph Norman","2017-09-11","2017-09-11 16:02:12","Sixteen years ago, the United States of America was placed under attack at the hands of vicious and cowardly terrorists. Nearly 3,000 innocent people lost their lives.   On this day, we remember the many loved ones that were taken by the purely evil acts aimed at destroying this country. We honor all the brave first responders. And we continue to show immense gratitude for all servicemen and women who have sacrificed their lives in order for the United States to remain the land of the free.   We must all stand together and do whatever can be done to prevent another horrific tragedy like 9/11 from ever happening on American soil again. This tragic event is all the more reason to keep our military strong and well-funded, which I will always do while serving the 5th District of South Carolina.  #NeverForget","photo","https://www.facebook.com/RepRalphNorman/photos/a.331458170641321.1073741830.315402818913523/347487845705020/?type=3",NA,23,2,2,0,0,0,2,0
"RepRalphNorman","315402818913523_347511092369362","Rep. Ralph Norman","2017-09-11","2017-09-11 17:25:15","House Republicans vision for #taxreform → simple, competitive, and most of all AFFORDABLE.   Learn more about our plan here: https://fairandsimple.gop/?utm_source=Rep+Ralph+Norman","photo","https://www.facebook.com/RepRalphNorman/photos/a.325588211228317.1073741829.315402818913523/347511015702703/?type=3",NA,12,3,1,0,0,0,0,0
"RepRalphNorman","315402818913523_347879548999183","Rep. Ralph Norman","2017-09-12","2017-09-12 17:25:17","My staff and I were honored to help the USO put together care packages today for service members assisting with hurricane relief efforts in Texas and Florida! #BeTheForce","photo","https://www.facebook.com/RepRalphNorman/photos/a.325588211228317.1073741829.315402818913523/347878818999256/?type=3",NA,35,0,3,0,0,0,0,0
"RepRalphNorman","315402818913523_347922315661573","Rep. Ralph Norman","2017-09-12","2017-09-12 19:58:15","Last week, I inquired about the Dislocated Workers National Reserve to ensure it was fully funded in light of the  worker layoffs at the V.C. Summer facility. Getting people that have been laid off from their jobs back to work, as quickly as possible, is critically important for our communities and economy.","video","https://www.facebook.com/RepRalphNorman/videos/347922315661573/",NA,36,3,8,0,0,0,0,0
"RepRalphNorman","315402818913523_348321138955024","Rep. Ralph Norman","2017-09-13","2017-09-13 17:57:03","I joined  Shannon Bream on Fox News this morning and expressed how important it is for Congress to support President Donald J. Trump's tax agenda and move forward with a fair and simple #taxreform for the American people.","video","https://www.facebook.com/RepRalphNorman/videos/348321138955024/",NA,100,30,12,8,0,0,0,16
"RepRalphNorman","315402818913523_348764202244051","Rep. Ralph Norman","2017-09-14","2017-09-14 20:55:33","Today, I voted in favor to pass the Make America Secure and Prosperous Appropriations Act of 2018. For the first time since 2009, the House has passed all 12 appropriations bills on time. This legislation appropriately funds the government and contains numerous conservative victories that promote the House Republicans agenda.  American safety was the top priority of this bill. We have included pro-life protections, provided funding to strengthen our military so we can defeat ISIS, protected the Second Amendment, increased our border security, invested into our infrastructure and allocated money for important medical research.  This bill also fully funds Displaced Workers Assistance National Reserve, a program which can aid those affected by the #VCSummer facility layoffs. (see video of my remarks below)  I am happy to see that my amendment to this bill passed so that more money can be given to combat the opioid epidemic that is sweeping this nation.  I thank the Appropriations Committee for all the hard work they have done with this bill so that we were able to get this job done on time.","video","https://www.facebook.com/RepRalphNorman/videos/348764202244051/",NA,34,4,3,0,0,0,0,2
"RepRalphNorman","315402818913523_349044082216063","Rep. Ralph Norman","2017-09-15","2017-09-15 15:13:05","You deserve to keep more of your hard-earned paychecks!  House Republicans and I are working hard to ensure that we take advantage of this once in a lifetime opportunity to fix our broken tax system. It has been over 30 years since the last #taxreform!  The time is now to pass a comprehensive and pro-growth tax reform so that the tax system is fairer, simpler and less burdensome for the American people!","link","https://tinyurl.com/y8c2znoo","tinyurl.com",14,6,2,0,0,0,0,0
"RepRalphNorman","315402818913523_350198998767238","Rep. Ralph Norman","2017-09-18","2017-09-18 19:07:18","Happy 70th Birthday to the United States Air Force! Thank you for your dedicated service! #AFBday","photo","https://www.facebook.com/RepRalphNorman/photos/a.325588211228317.1073741829.315402818913523/350198755433929/?type=3",NA,19,0,0,0,0,0,0,0
"RepRalphNorman","315402818913523_350220382098433","Rep. Ralph Norman","2017-09-18","2017-09-18 20:47:30","Today, I met with Lancaster County Administrator Steve Willis and the U.S. Fish and Wildlife Service to view the Gills Creek work site. Great to see the federal government and local government come together in a fiscally responsible manner and help solve the flooding problem that was burdening so many residents in the area!","photo","https://www.facebook.com/RepRalphNorman/photos/a.325588211228317.1073741829.315402818913523/350218715431933/?type=3",NA,31,1,2,1,0,0,0,0
"RepRalphNorman","315402818913523_350504908736647","Rep. Ralph Norman","2017-09-19","2017-09-19 15:03:32","Can you believe it has been over 30 years since we have passed a #taxreform?!   Here are #31ReasonsForTaxReform--> tinyurl.com/y8c2znoo","photo","https://www.facebook.com/RepRalphNorman/photos/a.325588211228317.1073741829.315402818913523/350504765403328/?type=3",NA,13,3,1,0,0,0,0,0
"RepRalphNorman","315402818913523_350519392068532","Rep. Ralph Norman","2017-09-19","2017-09-19 15:51:41","Very pleased with President Donald J. Trump's speech to the UN today. We must keep a strong national defense and put America first! #UNGA","link","http://www.washingtonexaminer.com/article/2634862","washingtonexaminer.com",115,41,7,9,3,1,1,28
"RepRalphNorman","315402818913523_350966068690531","Rep. Ralph Norman","2017-09-20","2017-09-20 19:46:12","Thank you #UnionCountyRotaryClub for allowing me to come speak with you and provide an update of what is happening in Washington, D.C.  We must take advantage of this opportunity to pass a pro-growth #taxreform! It has been over 30 years since the last reform...: https://tinyurl.com/y8c2znoo","photo","https://www.facebook.com/RepRalphNorman/photos/a.325588211228317.1073741829.315402818913523/350965228690615/?type=3",NA,31,0,3,0,0,0,0,1
"RepRalphNorman","315402818913523_351715205282284","Rep. Ralph Norman","2017-09-22","2017-09-22 17:25:41","The government has no business in picking winners and losers...  Read my op-ed in the Washington Examiner: http://www.washingtonexaminer.com/heres-how-trade-protectionism-can-destroy-american-manufacturing-jobs/article/2635278","link","http://www.washingtonexaminer.com/heres-how-trade-protectionism-can-destroy-american-manufacturing-jobs/article/2635278","washingtonexaminer.com",8,0,1,1,0,0,0,0
"RepRalphNorman","315402818913523_352799575173847","Rep. Ralph Norman","2017-09-25","2017-09-25 14:36:50","It was truly an honor to attend Rock Hill's Hospice & Community Care ribbon cutting ceremony for the Veteran Garden. This garden dedicated to veterans is a wonderful way to honor and remember all the sacrifices made by our brave and dedicated servicemen and women.  http://www.heraldonline.com/news/local/article174887266.html","photo","https://www.facebook.com/RepRalphNorman/photos/a.325588211228317.1073741829.315402818913523/352795215174283/?type=3",NA,45,2,3,3,0,0,0,0
"RepRalphNorman","315402818913523_352870495166755","Rep. Ralph Norman","2017-09-25","2017-09-25 18:36:12","It was great to see State Representative Todd Atwater - SC House 87, my good friend and former colleague in the South Carolina State House, and his wife Beth in Washington, D.C. today! Thank you for stopping by.","photo","https://www.facebook.com/RepRalphNorman/photos/a.325588211228317.1073741829.315402818913523/352870101833461/?type=3",NA,15,0,1,0,0,0,0,0
"RepRalphNorman","315402818913523_354862334967571","Rep. Ralph Norman","2017-09-26","2017-09-26 13:09:58","Sign up for The Congressional App Challenge! My office is currently taking submissions for K-12 students who have app ideas.  Register here by Nov.1, 2017: http://www.congressionalappchallenge.us/2017-student-signup/","photo","https://www.facebook.com/RepRalphNorman/photos/a.325588211228317.1073741829.315402818913523/354859031634568/?type=3",NA,5,0,2,1,0,0,0,0
"RepRalphNorman","315402818913523_354915511628920","Rep. Ralph Norman","2017-09-26","2017-09-26 15:47:42","Looking forward to playing in the Congressional Charity Basketball Game this evening benefiting the youth!  http://www.rollcall.com/news/hoh/norman-makes-congressional-sports-debut-charity-basketball-game?utm_content=buffer5f026&utm_medium=social&utm_source=twitter.com&utm_campaign=buffer","link","http://www.rollcall.com/news/hoh/norman-makes-congressional-sports-debut-charity-basketball-game?utm_content=buffer5f026&utm_medium=social&utm_source=twitter.com&utm_campaign=buffer","rollcall.com",58,7,3,3,0,0,0,0
"RepRalphNorman","315402818913523_354977438289394","Rep. Ralph Norman","2017-09-26","2017-09-26 19:04:47","Today, I stood with members of the Republican Study Committee  as we remain committed to keep the promises made to the American people to repeal Obamacare, #taxreform, and secure the border. #RepealReformSecure","photo","https://www.facebook.com/RepRalphNorman/photos/a.325588211228317.1073741829.315402818913523/354976094956195/?type=3",NA,33,6,3,2,2,0,0,2
"RepRalphNorman","315402818913523_355243924929412","Rep. Ralph Norman","2017-09-27","2017-09-27 14:42:52","Had a great time last night joining my colleagues in the #CongressionalCharityBasketballGame! Thank you to everyone who came out to watch the game and support the local youth.","photo","https://www.facebook.com/RepRalphNorman/photos/a.331458170641321.1073741830.315402818913523/355243851596086/?type=3",NA,59,0,2,1,0,0,0,0
"RepRalphNorman","315402818913523_355288274924977","Rep. Ralph Norman","2017-09-27","2017-09-27 17:39:36","Today, President Donald J. Trump and  House Republicans released the rollout of framework for #taxreform.  It has been over 30 years since the last tax reform and it has resulted in a diminishing American middle class and a rise in income inequality.  This framework will make our tax code simple, fair, and easy for Americans to understand. American workers will be able to keep more of their hard-earned paychecks. America will be able to compete globally and create more Americans jobs.  Click below to learn more about how this will provide tax relief for the American middle class and businesses:","link","https://fairandsimple.gop/?utm_source=Rep+Ralph+Norman","fairandsimple.gop",7,5,0,0,0,0,0,1
"RepRalphNorman","315402818913523_355645388222599","Rep. Ralph Norman","2017-09-28","2017-09-28 17:58:31","The American flag and National Anthem is a reminder to us all of the brave men and women who have paid the ultimate price in protecting this great nation and our very way of life; and must always be honored.  http://www.breitbart.com/big-government/2017/09/28/rep-norman-nfl-underestimating-fans-say-player-protests/","link","http://www.breitbart.com/big-government/2017/09/28/rep-norman-nfl-underestimating-fans-say-player-protests/","breitbart.com",78,38,8,4,1,1,0,7
"RepRalphNorman","315402818913523_355685748218563","Rep. Ralph Norman","2017-09-28","2017-09-28 20:04:30","Today, America welcomed back Majority Whip Congressman Steve Scalise to the people's House. I have only been in Congress for two months, but, what transpired on the House floor was something truly inspiring and something I have never experienced before.  During a time when a lot of debate can leave us divided, members from across the aisle displayed a genuine sense of unity.  It is my sincere hope that Congress will continue to come and work together in the months ahead.  Please take the time to listen to Whip Scalise's return to the House floor.","video","https://www.youtube.com/embed/QZEYZwuWJdg",NA,50,3,3,0,0,0,0,0
"RepRalphNorman","315402818913523_356042784849526","Rep. Ralph Norman","2017-09-29","2017-09-29 17:24:32","Great to see the South Carolina National Guard, especially guardsmen from our district, going to Puerto Rico to lend a helping hand in a desperate time of need. #HurricaneMaria","link","http://www.heraldonline.com/news/local/article175931336.html","heraldonline.com",55,3,8,0,0,0,0,0
"RepRalphNorman","315402818913523_357187688068369","Rep. Ralph Norman","2017-10-02","2017-10-02 13:47:51","My thoughts and prayers are with all those affected by the tragedy in Las Vegas. Thank you to the brave first responders.","status",NA,NA,62,24,3,3,0,0,13,2
"RepRalphNorman","315402818913523_357312398055898","Rep. Ralph Norman","2017-10-02","2017-10-02 21:05:18","Had the great privilege to visit the Lockheed Martin's Fighter Demo Center today and learn about the amazing capabilities of the F-35 provided to our nation's military.   The F-35 suppliers located in South Carolina have a great economic impact and provide quality jobs for South Carolinians.","photo","https://www.facebook.com/RepRalphNorman/photos/a.325588211228317.1073741829.315402818913523/357303048056833/?type=3",NA,33,2,0,0,0,0,0,0
"RepRalphNorman","315402818913523_357631518023986","Rep. Ralph Norman","2017-10-03","2017-10-03 17:55:25","ICYMI: This morning I talked about the #LasVegas tragedy, response to #PuertoRico and the House Republicans' #taxreform plan.  https://soundcloud.com/breitbart/breitbart-news-daily-rep-ralph-norman-october-3-2017","link","https://soundcloud.com/breitbart/breitbart-news-daily-rep-ralph-norman-october-3-2017","soundcloud.com",11,19,2,0,0,0,0,0
"RepRalphNorman","315402818913523_357636321356839","Rep. Ralph Norman","2017-10-03","2017-10-03 22:02:51","Since the passage of Roe v. Wade in 1973, nearly 60 million abortions have been performed. This is a moral atrocity. I am a proud cosponsor of H.R. 36, the Pain Capable Unborn Child Protection Act, which will make it illegal to attempt or to perform an abortion if an unborn child is 20 weeks or older with exceptions.  Science has proven that babies are capable of feeling pain at the start of the third trimester. It is imperative we protect the lives of the unborn.  Our nation was built upon the idea of ‘life, liberty, and the pursuit of happiness.’ We guarantee that every American citizen has the right to pursue absolute happiness. Our Constitution guarantees that every American has the right to liberty and justice. Should we not then absolutely guarantee that every American has the right to life as well?  I am very encouraged to see H.R. 36 pass today. We are one step closer to protecting the sanctity of life for all Americans. #TheyFeelPain","video","https://www.facebook.com/RepRalphNorman/videos/357636321356839/",NA,145,94,42,22,1,1,3,43
"RepRalphNorman","315402818913523_357661878020950","Rep. Ralph Norman","2017-10-03","2017-10-03 20:02:45","The topic of today's House Committee on Science, Space, and Technology hearing was resiliency of our electric grid.  It is imperative that we work to promote policies and technology that improves electric grid resiliency while also protecting consumer rights’ to privacy.","video","https://youtu.be/6VqDyE2PUvc",NA,18,2,3,0,0,0,0,0
"RepRalphNorman","315402818913523_358076087979529","Rep. Ralph Norman","2017-10-04","2017-10-04 20:50:15","Our national debt is an astronomical $20 trillion! Time to take our debt seriously. It’s possible to reign in our out-of-control spending.   Here’s how-->  https://tinyurl.com/ycunmwz6 #RSCBudget","photo","https://www.facebook.com/RepRalphNorman/photos/a.325588211228317.1073741829.315402818913523/358075744646230/?type=3",NA,16,6,3,1,0,0,0,1
"RepRalphNorman","315402818913523_358385657948572","Rep. Ralph Norman","2017-10-05","2017-10-05 16:22:01","Our national debt now sits at over an astronomical $20 trillion and is projected to reach close to $30 trillion within ten years. I am pleased that the House passed a #budget that will provide the spending cuts that Washington needs and a pathway to reconciliation to for #taxreform.  Washington’s out-of-control spending hinders our economy. By kicking the can down the road, it puts the financial burden on the backs of our children and grandchildren.  This budget will reduce spending by $5.4 trillion over a 10- year window. It does not expand the size of federal government. It does not encroach on state or local authority. This is a conservative path forward and will help us accomplish what we came here to do: tax reform.  While l would like to see our government make even more wise choices with taxpayer dollars, this budget resolution puts us on the road to achieving that goal. With this resolution as the vehicle for updating our outdated tax code, we can accomplish something that hasn’t been done in over 30 years.","photo","https://www.facebook.com/RepRalphNorman/photos/a.325588211228317.1073741829.315402818913523/358385531281918/?type=3",NA,49,26,11,0,0,0,0,5
"RepRalphNorman","315402818913523_358820091238462","Rep. Ralph Norman","2017-10-06","2017-10-06 19:09:12","President Donald J. Trump declared today, October 6, #NationalManufacturingDay.  Manufacturers in #SC05 and across the U.S. drive innovation, create jobs and make America strong.  Happy #MFGDay17!","photo","https://www.facebook.com/RepRalphNorman/photos/a.325588211228317.1073741829.315402818913523/358819911238480/?type=3",NA,11,2,3,1,0,0,0,0
