"screen_name","id","from_name","date","datetime","message","type","link","domain","likes_count","comments_count","shares_count","love_count","haha_count","wow_count","sad_count","angry_count"
"RepRalphNorman","315402818913523_360696094384195","Rep. Ralph Norman","2017-10-11","2017-10-11 18:09:01","This great read in the The Wall Street Journal shows how the House Republicans #taxreform plan is pro-growth. The time is now to get this job done!","link","https://www.wsj.com/articles/tax-reform-will-give-workers-a-raise-1507675540","wsj.com",34,13,0,0,3,0,0,0
"RepRalphNorman","315402818913523_361070147680123","Rep. Ralph Norman","2017-10-12","2017-10-12 21:00:39","I support disaster relief efforts for the people afflicted by the recent natural disasters in our country. However, leaving the taxpayer on the hook for $16 billion without structural reform to the National Flood Insurance Program is irresponsible. Tying  this reckless measure to disaster relief for American citizens is callous and cruel.","status",NA,NA,38,15,2,0,0,0,0,1
"RepRalphNorman","315402818913523_361352140985257","Rep. Ralph Norman","2017-10-13","2017-10-13 15:28:32","ICYMI: I joined Neil Cavuto on FOXBusiness to talk about the House Republicans #taxreform plan.  Not having comprehensive tax reform in 31 years is unacceptable! Our tax system is broken. Hard-working Americans deserve a tax system that works for them.","video","https://www.facebook.com/RepRalphNorman/videos/361352140985257/",NA,72,30,7,1,0,0,0,2
"RepRalphNorman","315402818913523_361413477645790","Rep. Ralph Norman","2017-10-13","2017-10-13 18:53:35","Calling all #SC05 tech-savvy students! My office is now accepting submissions for The Congressional App Challenge. Find out more here: norman.house.gov/constituent-services/congressional-app-challenge.htm","photo","https://www.facebook.com/RepRalphNorman/photos/a.325588211228317.1073741829.315402818913523/361411687645969/?type=3",NA,14,17,4,0,0,0,0,0
"RepRalphNorman","315402818913523_362445460875925","Rep. Ralph Norman","2017-10-16","2017-10-16 13:17:05","Join me tonight for the #Gaffney District Office Open House! Hope to see you there.","photo","https://www.facebook.com/RepRalphNorman/photos/a.325588211228317.1073741829.315402818913523/362445304209274/?type=3",NA,9,2,2,0,0,0,0,0
"RepRalphNorman","315402818913523_362467110873760","Rep. Ralph Norman","2017-10-16","2017-10-16 14:21:16","This morning I joined Fox Business's Varney & Co. to talk about the #taxreform plan. The time is now for a fair and simple tax code!","video","https://www.facebook.com/RepRalphNorman/videos/362467110873760/",NA,61,23,9,4,0,1,0,6
"RepRalphNorman","315402818913523_363105404143264","Rep. Ralph Norman","2017-10-17","2017-10-17 17:46:10","Come join me tomorrow morning at The Peach Stand, Fort Mill, SC for ""Coffee with Your Congressman""! Look forward to meeting and listening to you.","photo","https://www.facebook.com/RepRalphNorman/photos/a.325588211228317.1073741829.315402818913523/363105240809947/?type=3",NA,24,5,9,1,0,0,0,1
"RepRalphNorman","315402818913523_363147267472411","Rep. Ralph Norman","2017-10-17","2017-10-17 20:51:46","Had the opportunity to participate in a F-16 familiarization flight at Shaw Air Force Base today.  Thank you to all our U.S. military members for their dedicated service to this nation.","photo","https://www.facebook.com/RepRalphNorman/photos/a.331458170641321.1073741830.315402818913523/363140940806377/?type=3",NA,68,6,0,2,0,0,0,0
"RepRalphNorman","315402818913523_363501870770284","Rep. Ralph Norman","2017-10-18","2017-10-18 19:32:21","Had a great time talking and listening to many of you at The Peach Stand, Fort Mill, SC this morning for ""Coffee With Your Congressman""!  http://www.heraldonline.com/news/local/article179542501.html","link","http://www.heraldonline.com/news/local/article179542501.html","heraldonline.com",45,6,1,0,0,0,0,3
"RepRalphNorman","315402818913523_363504020770069","Rep. Ralph Norman","2017-10-18","2017-10-18 19:44:14","Our tax code in America is broken. It’s been 31 years since any major overhaul. We need to ensure that paying taxes is simpler, easier and less time-consuming.  Imagine a new way to file your taxes... the House Republicans #taxreform plan allows taxpayers to file on nothing more complicated than a postcard!","photo","https://www.facebook.com/RepRalphNorman/photos/a.325588211228317.1073741829.315402818913523/363503954103409/?type=3",NA,88,27,17,6,0,1,0,7
"RepRalphNorman","315402818913523_364176570702814","Rep. Ralph Norman","2017-10-20","2017-10-20 14:15:50","#ObamaCare was sold on false promises that could never be kept. Recall what they told us in order to sell this bill: If you like your health care plan, you can keep it; if you like your doctors, you can keep them; premiums will go down – and for families they’ll go down by an average of $2,500; deductibles will go down; emergency room visits will go down.  Op-ed in Fox News with Rep. Mark Meadows here: http://www.foxnews.com/opinion/2017/10/19/gop-reps-democrats-outrage-over-trump-sabotage-obamacare-is-misdirected.html","link","http://www.foxnews.com/opinion/2017/10/19/gop-reps-democrats-outrage-over-trump-sabotage-obamacare-is-misdirected.html","foxnews.com",39,22,6,1,2,0,0,8
"RepRalphNorman","315402818913523_364250627362075","Rep. Ralph Norman","2017-10-20","2017-10-20 18:49:04","Yesterday, I testified before the US International Trade Commission (ITC) regarding a Section 201 “safeguards” case. In the case, Whirlpool alleges Samsung and LG have caused injury to domestic markets by importing high volumes of large residential washers and their parts. Whirlpool is seeking heavily restrictive tariffs and limitations on their own competition.   The government shouldn’t jump into markets to restrict competition. This is a textbook example of the government’s ability to pick winners and losers and why they shouldn’t be able to do so.   This could have a large impact on the developing Newberry Samsung facility, which is set to create nearly 1000 new jobs in South Carolina’s 5th district. Samsung has already demonstrated investment in the state by making large investments in the Charleston Fisher House, an organization supporting veterans and their families in our state.  Read my testimony: https://norman.house.gov/UploadedFiles/rep_norman_remedy_testimony_final_draft.pdf","link","https://norman.house.gov/UploadedFiles/rep_norman_remedy_testimony_final_draft.pdf","norman.house.gov",26,7,3,0,0,0,0,1
"RepRalphNorman","315402818913523_365665627220575","Rep. Ralph Norman","2017-10-24","2017-10-24 16:58:13","SAVE THE DATE: Please join me for an open house of my #RockHill District Office on Monday, October 30th from 5pm-7pm.  Hope to see you there!","photo","https://www.facebook.com/RepRalphNorman/photos/a.325588211228317.1073741829.315402818913523/365665067220631/?type=3",NA,27,1,17,0,0,0,0,0
"RepRalphNorman","315402818913523_365989543854850","Rep. Ralph Norman","2017-10-25","2017-10-25 15:38:39","7 days to go...!  Calling all #SC05 tech-savvy students! My office is now accepting submissions for The Congressional App Challenge Find out more here: norman.house.gov/constituent-services/congressional-app-challenge.htm","photo","https://www.facebook.com/RepRalphNorman/photos/a.325588211228317.1073741829.315402818913523/365989380521533/?type=3",NA,14,2,11,0,0,1,0,0
"RepRalphNorman","315402818913523_366346417152496","Rep. Ralph Norman","2017-10-26","2017-10-26 16:24:53","Today, I voted to pass the FY 2018 #Budget Resolution. This is a critical first step to achieving comprehensive #taxreform and making the American economy great again.   Our nation has not significantly reformed our tax code in more than three decades, allowing the tax code to explode in complexity and unnecessarily burden hardworking American families and businesses.  The unified framework unveiled earlier this year will simplify the tax code for everyone, eliminate wasteful tax loopholes, and reduce taxes on businesses.Under this plan, the average family will see an increase in income between $4,000 and $9,000 annually.  While I believe that this budget is necessary to spur economic growth and increase wages, I am disappointed that the Senate removed the $203 billion of mandatory spending cuts given the challenge the national debt poses to the United States.   However, we should not make the perfect the enemy of the good, and I understand that issues as complex as the budget and tax reform require compromise.","video","https://www.facebook.com/RepRalphNorman/videos/366346417152496/",NA,72,25,9,7,0,0,0,7
"RepRalphNorman","315402818913523_366400863813718","Rep. Ralph Norman","2017-10-26","2017-10-26 20:19:27","Was happy to join S.E. Cupp last night on HLN to talk about the House Republicans #taxreform plan.  After 31 years of no comprehensive tax reform, the time is now to give the American people a simple and fair tax system that works for them. It is what they deserve!","video","https://www.facebook.com/RepRalphNorman/videos/366400863813718/",NA,41,9,2,2,0,1,0,1
"RepRalphNorman","315402818913523_366754940444977","Rep. Ralph Norman","2017-10-27","2017-10-27 18:47:51","Thank you #Newberry Mayor Foster Senn for reinforcing the importance of trade to domestic industry, specifically in the 5th District.  https://www.fitsnews.com/2017/10/27/foster-senn-no-ralph-norman-wasnt-duped-on-trade-issue/","link","https://www.fitsnews.com/2017/10/27/foster-senn-no-ralph-norman-wasnt-duped-on-trade-issue/","fitsnews.com",28,1,3,0,0,0,0,0
"RepRalphNorman","315402818913523_366756053778199","Rep. Ralph Norman","2017-10-27","2017-10-27 18:54:22","Do you support or oppose a #taxreform plan that simplifies the tax code, reduces rates for businesses & families, and lowers taxes for job creators?","status",NA,NA,92,156,29,5,2,0,1,19
"RepRalphNorman","315402818913523_367810970339374","Rep. Ralph Norman","2017-10-30","2017-10-30 15:09:48","Today, I joined a bipartisan group of 38 other members to send the Committee on Ways and Means a letter urging for the reauthorization of GSP.  It is my sincerest hope that Chairman Brady and Ranking Member Neal make the reauthorization of GSP a priority. As a member of the House Small Business Committee and a small businessman myself, I understand just how important GSP is for a level playing field for companies to compete and the creation of jobs here at home.  The bipartisan letter can be found here: https://norman.house.gov/uploadedfiles/gspletter.pdf","photo","https://www.facebook.com/RepRalphNorman/photos/a.325588211228317.1073741829.315402818913523/367810810339390/?type=3",NA,29,4,3,1,0,0,0,0
"RepRalphNorman","315402818913523_368215440298927","Rep. Ralph Norman","2017-10-31","2017-10-31 16:11:01","Thank you to everyone who came out to the #RockHill District Office Open House last night! I had an awesome time meeting and talking with you all.  There was even a special appearance from a Ghost Buster!","photo","https://www.facebook.com/RepRalphNorman/photos/a.325588211228317.1073741829.315402818913523/368214970298974/?type=3",NA,30,5,2,0,0,0,0,0
"RepRalphNorman","315402818913523_368321800288291","Rep. Ralph Norman","2017-10-31","2017-10-31 23:16:19","Tonight was a win for South Carolina peanut farmers! The House passed the South Carolina Peanut Parity Act of 2017, which I co-sponsored.   South Carolina has experienced explosive growth in peanut farming in recent years, going from producing very few peanuts in the early 2000's to becoming the fourth largest peanut producing state today.   This legislation will finally give South Carolina peanut farmers the much deserved representation on the Peanuts Standard Board.","status",NA,NA,36,4,1,0,0,0,0,0
"RepRalphNorman","315402818913523_368636736923464","Rep. Ralph Norman","2017-11-01","2017-11-01 18:28:30","As we celebrate National #Veterans Small Business Week, I want to honor all the veteran entrepreneurship across the 5th District and nation. There are over 50,000 veterans and close to 50 veteran-owned small business in the 5th District alone. These businesses greatly impact the economic growth of our communities and create many jobs for South Carolinians.  I am forever grateful to these veteran small business owners for their service to this country. Empowering small businesses and our nation’s veterans will continue to be priorities of mine that I will strongly fight for in Washington. #MyVetBiz  Learn more about veteran entrepreneurship here: https://tinyurl.com/y7gpqshg","photo","https://www.facebook.com/RepRalphNorman/photos/a.325588211228317.1073741829.315402818913523/368636703590134/?type=3",NA,24,1,2,0,0,0,0,0
"RepRalphNorman","315402818913523_368941076893030","Rep. Ralph Norman","2017-11-02","2017-11-02 15:11:26","I am disappointed that my amendment to fully #repeal #Obamacare didn’t get a vote. Since I just got elected in June, I have not had the opportunity to vote on a repeal. I attached this amendment to a bill that repeals only a very small portion of the Affordable Care Act because I saw this as an opportunity to keep my word to my constituents and deliver on fully repealing Obamacare.  Congress cannot forget our promises to the American people. We have to find a way how to get this done. There are enough smart people in the room for us to come up with the plan to fully repeal and replace Obamacare.","photo","https://www.facebook.com/RepRalphNorman/photos/a.325588211228317.1073741829.315402818913523/368940963559708/?type=3",NA,115,98,16,0,4,1,9,27
"RepRalphNorman","315402818913523_369024180218053","Rep. Ralph Norman","2017-11-02","2017-11-02 20:04:41","Historic day today! House Republicans introduced bill for comprehensive #taxreform that is pro-family, pro-growth and pro-American. This hasn't happened in 31 years! Americans deserve a fair and simple tax code that works for them, not against them. This plan is pro-family, pro-growth and pro-American. It will benefit the middle class, allow for hard-working Americans to keep more of their paychecks, and for businesses to compete and grow to expand jobs. We will make the American economy great again! Learn more here: www.fairandsimple.gop","link","http://www.fairandsimple.gop/","fairandsimple.gop",55,31,9,4,0,0,1,6
"RepRalphNorman","315402818913523_369041293549675","Rep. Ralph Norman","2017-11-02","2017-11-02 21:31:26","Just introduced my first bill, the Better Evaluation of Science and Technology (BEST) Act, with Rep. Paul Gosar. This bill will no longer allow Federal agencies to make rules behind closed doors.   If we are a government of the people, we need to be as transparent as possible so that we’re also a government for the people.","video","https://www.facebook.com/RepRalphNorman/videos/369041293549675/",NA,97,31,9,6,0,0,3,1
"RepRalphNorman","315402818913523_369284946858643","Rep. Ralph Norman","2017-11-03","2017-11-03 12:41:52","ICYMI: My op-ed in The Hill- The #farmbill presents a chance to lighten the regulatory burden of farmers   http://thehill.com/blogs/congress-blog/energy-environment/358436-the-farm-bill-presents-a-chance-to-lighten-the#.Wft2Qucmtwo.twitter","link","http://thehill.com/blogs/congress-blog/energy-environment/358436-the-farm-bill-presents-a-chance-to-lighten-the#.Wft2Qucmtwo.twitter","thehill.com",15,2,2,0,0,0,0,0
"RepRalphNorman","315402818913523_371034480017023","Rep. Ralph Norman","2017-11-07","2017-11-07 23:25:52","It may be cliché to say that “small and local businesses are the backbone of our economy” but at the end of the day, there is no denying that statement. Small businesses truly are the gears that keep our economy moving, and when they suffer, our economy suffers.  Since 2015, when the National Labor Relations Board (NLRB) adopted an expanded definition of the “joint employer” standard – upending decades of precedent and redefining who an employer is – there has been much confusion and ambiguity. For example, since then, there have been over 65,000 letters sent to Congress expressing confusion and asking for clarity in the aftermath of this rule.  Locally owned franchises are America’s unseen small businesses, and in my district alone, there are roughly 2,000 establishments that provide over 15,000 jobs with an economic output of over 1 billion dollars. #Smallbusiness development, economic growth, and entrepreneurs will continue to be hurt by the NLRB’s excessively broad definition of “joint-employer” until Congress finds a concrete definition – which this piece of legislation will do.   The Save Local Business Act provides clarity for small and local businesses as to what it means to be a “joint employer,” restoring necessary clarity for employers and employees alike. I am proud to have voted for this bipartisan bill which helps small businesses all across the nation.","status",NA,NA,49,14,1,1,0,0,0,0
"RepRalphNorman","315402818913523_371316416655496","Rep. Ralph Norman","2017-11-08","2017-11-08 17:39:39","The Tax Foundation estimates that South Carolina will see 13,850 new full time jobs and middle-class South Carolinian families will have their income increased by $2,391 under the Tax Cuts and Jobs Act.  The House Republicans #taxreform bill will deliver more jobs, fairer taxes, and bigger paychecks.  Learn more on the Tax Foundation's analysis here: https://taxfoundation.org/tax-cuts-jobs-act-state-impact/","photo","https://www.facebook.com/RepRalphNorman/photos/a.325588211228317.1073741829.315402818913523/371316376655500/?type=3",NA,81,45,9,5,1,0,0,12
"RepRalphNorman","315402818913523_371372746649863","Rep. Ralph Norman","2017-11-08","2017-11-08 21:52:19","It was an honor to attend the emotional ceremony today to unveil the POW/MIA memorial placed in the United States Capitol.  Let this chair always be a reminder of the sacrifices made by so many courageous servicemen and women who have defended our great nation. They will never be forgotten.  Thank you to all military members, veterans, and my colleague and national hero Congressman Sam Johnson for their dedicated service. Our country owes you the sincerest gratitude.","photo","https://www.facebook.com/RepRalphNorman/photos/a.325588211228317.1073741829.315402818913523/371371049983366/?type=3",NA,62,1,3,9,0,0,0,0
"RepRalphNorman","315402818913523_371970933256711","Rep. Ralph Norman","2017-11-11","2017-11-11 15:00:00",NA,"video","https://www.facebook.com/RepRalphNorman/videos/371970933256711/",NA,88,8,11,6,0,0,0,0
"RepRalphNorman","315402818913523_372057063248098","Rep. Ralph Norman","2017-11-10","2017-11-10 19:34:36","Thank you Chester County Veterans for allowing me to speak to you as we honor #VeteransDay. Our country owes all veterans the sincerest gratitude for their service and sacrifice.","photo","https://www.facebook.com/RepRalphNorman/photos/a.331458170641321.1073741830.315402818913523/372057046581433/?type=3",NA,57,5,4,1,0,0,0,0
"RepRalphNorman","315402818913523_372405286546609","Rep. Ralph Norman","2017-11-11","2017-11-11 16:06:28","Grateful to have attended the #VeteransDay Breakfast this morning in Fort Mill. Thank you to all those who served and currently serving.","photo","https://www.facebook.com/RepRalphNorman/photos/a.331458170641321.1073741830.315402818913523/372405259879945/?type=3",NA,36,2,0,0,0,0,0,0
"RepRalphNorman","315402818913523_372452449875226","Rep. Ralph Norman","2017-11-11","2017-11-11 19:15:38","It was an honor to attend the Lancaster #VeteransDay Parade today. Today, we remember all the sacrifices made by the courageous men and women who put everything on the line for the freedoms that we have today. Thank you to all of our nation’s veterans!","photo","https://www.facebook.com/RepRalphNorman/photos/a.331458170641321.1073741830.315402818913523/372452376541900/?type=3",NA,45,2,1,1,0,0,0,0
"RepRalphNorman","315402818913523_373683503085454","Rep. Ralph Norman","2017-11-14","2017-11-14 22:14:29","Proud to have voted to pass the National Defense Authorization Act. Our military deserves our fullest support to ensure that they are adequately equipped with the resources and tools to maintain American readiness, and to keep Americans safe at home and abroad. This bill does just that.  Not only does the #FY18NDAA increase the size of our military so we can best prepare and provide much-needed and updated equipment, it also gives our troops the largest pay raise in eight years. Our servicemen and women, who make sacrifices for us every day, deserve this pay raise. We enjoy the freedoms we have today, and continue to have, because of our men and women in uniform.","photo","https://www.facebook.com/RepRalphNorman/photos/a.325588211228317.1073741829.315402818913523/373679446419193/?type=3",NA,47,3,8,1,0,0,0,3
"RepRalphNorman","315402818913523_374000899720381","Rep. Ralph Norman","2017-11-15","2017-11-15 17:34:56","Text ""TAX REFORM"" to 50589 to stay updated on the #TaxCutsAndJobsAct.  Learn more about House Republicans plan to make our tax code fairer and simpler --> www.fairandsimple.gop   #TaxReform","link","http://www.fairandsimple.gop/","fairandsimple.gop",11,6,0,0,0,0,1,7
"RepRalphNorman","315402818913523_374338786353259","Rep. Ralph Norman","2017-11-16","2017-11-16 15:31:50","Yesterday, Congressman Francis Rooney and I introduced the Pell for Performance Act.   The taxpayer-friendly Pell for Performance Act will encourage students who receive the Pell Grant - a federally funded grant program - to graduate college in a timely manner. Currently, the government provides over $30 billion a year in Pell Grant aid, and 46% of students who attend college receive the Pell Grant. In fact, nearly 40% of all students do not graduate on time.   This legislation will ultimately save taxpayer dollars by holding Pell Grant recipients accountable for not graduating on time, rather than leaving the taxpayer to foot the bill.","status",NA,NA,59,34,4,0,0,0,2,9
"RepRalphNorman","315402818913523_374402713013533","Rep. Ralph Norman","2017-11-16","2017-11-16 18:59:25","#TaxReform is good for the taxpayer, not the tax collector. Today, the House passed the #TaxCutsAndJobsAct. A historic victory for middle-class families and small businesses in the 5th District of South Carolina. It is no secret that our tax code is broken. For the first time in 31 years, we passed a bill that overhauls our complex tax code. We will deliver more jobs, a fairer and simpler tax code, and bigger paychecks for American workers.  Our plan is pro-growth and pro-family. Under this legislation, South Carolina will see an additional 13,850 jobs created. Hard-working middle-class families in South Carolina will see an income increase of $2,391. We have increased the Child Tax Credit from $1,000 per child to $1,600 to help parents with the cost of raising children. The inclusion of an immediate expensing of capital investment will allow a farmer to purchase a tractor to expand operations or allow a mechanic to add a new bay to the shop.  I look forward to President Donald J. Trump signing a tax reform bill into law. Let’s work together to create jobs, increase paychecks, grow our economy, and improve lives.","photo","https://www.facebook.com/RepRalphNorman/photos/a.325588211228317.1073741829.315402818913523/374402659680205/?type=3",NA,97,69,12,7,1,0,0,36
"RepRalphNorman","315402818913523_374806609639810","Rep. Ralph Norman","2017-11-17","2017-11-17 18:15:21","*Save the date!*  Please join me Monday, November 20th in Rock Hill at Knowledge Perk for #CoffeeWithYourCongressman.  Hope to see you there!","photo","https://www.facebook.com/RepRalphNorman/photos/a.325588211228317.1073741829.315402818913523/374806296306508/?type=3",NA,23,8,13,2,0,0,1,0
"RepRalphNorman","315402818913523_376034686183669","Rep. Ralph Norman","2017-11-20","2017-11-20 18:03:26","Wonderful time this morning at #CoffeeWithYourCongressman at Knowledge Perk in Rock Hill.   Thank you for taking time out of your morning to join me!","photo","https://www.facebook.com/RepRalphNorman/photos/a.331458170641321.1073741830.315402818913523/376034662850338/?type=3",NA,43,9,0,1,0,0,0,0
"RepRalphNorman","315402818913523_376410772812727","Rep. Ralph Norman","2017-11-21","2017-11-21 18:06:27","This morning, I hosted a Congressional Agricultural Roundtable in my Rock Hill District Office. My office worked with the South Carolina Department of Agriculture and SC Farm Bureau to bring together 22 farmers from all over the 5th District to talk about their needs and concerns.   It was beneficial to hear their priorities so I can better represent them in Washington as the House Agriculture Committee continues to draft the 2018 #FarmBill.","photo","https://www.facebook.com/RepRalphNorman/photos/a.325588211228317.1073741829.315402818913523/376405359479935/?type=3",NA,45,6,1,1,0,0,0,0
"RepRalphNorman","315402818913523_376834209437050","Rep. Ralph Norman","2017-11-22","2017-11-22 18:04:28","#Thankful to have spoken with our nation’s brave veterans who have sacrificed so much today at Wm. Jennings Bryan Dorn VA Medical Center today with Rep. Joe Wilson.","photo","https://www.facebook.com/RepRalphNorman/photos/a.331458170641321.1073741830.315402818913523/376834192770385/?type=3",NA,57,7,2,3,0,0,0,1
"RepRalphNorman","315402818913523_377201719400299","Rep. Ralph Norman","2017-11-23","2017-11-23 14:42:40","#HappyThanksgiving! Today, we surround ourselves with loved ones and remember how fortunate we are for what we have. I am sincerely thankful for being blessed to have been born to Christian parents, my great family, and living in a free country ordained by God.   I also would like to wish our brave men and women in uniform, home and abroad, a Happy Thanksgiving. Thank you for your service and the sacrifices you and your families have made to protect the United States of America.","photo","https://www.facebook.com/RepRalphNorman/photos/a.331458170641321.1073741830.315402818913523/377201709400300/?type=3",NA,98,18,2,3,0,0,0,1
