"screen_name","id","from_name","date","datetime","message","type","link","domain","likes_count","comments_count","shares_count","love_count","haha_count","wow_count","sad_count","angry_count"
"RepRalphNorman","315402818913523_378047772649027","Rep. Ralph Norman","2017-11-25","2017-11-25 17:29:26","Don’t forget to #shopsmallbiz today throughout the 5th District and South Carolina.   Happy #SmallBusinessSaturday!","photo","https://www.facebook.com/RepRalphNorman/photos/a.331458170641321.1073741830.315402818913523/378047745982363/?type=3",NA,16,0,1,0,0,0,0,0
"RepRalphNorman","315402818913523_378896379230833","Rep. Ralph Norman","2017-11-27","2017-11-27 21:11:21","Had a great time visiting the students of Newberry Academy today! Thanks for allowing me to talk with you all.","photo","https://www.facebook.com/RepRalphNorman/photos/a.331458170641321.1073741830.315402818913523/378896362564168/?type=3",NA,26,3,0,0,0,0,0,0
"RepRalphNorman","315402818913523_378920175895120","Rep. Ralph Norman","2017-11-27","2017-11-27 22:31:07","The recent actions conducted by a rogue #CFPB staffer highlights the fact that the out-of-control agency needs to be reined in. Federal agencies must operate by the law and be held accountable. The CFPB’s General Counsel confirmed that the President has the authority in appointing an acting director.  I applaud President Donald J Trump for appointing my good friend, Mick Mulvaney, to Acting CFPB Director. He has a great amount of experience in the financial services policy arena and has clearly demonstrated that he will do an effective job.   Right man. Right job. Right time.","status",NA,NA,213,75,5,10,8,0,3,17
"RepRalphNorman","315402818913523_379664352487369","Rep. Ralph Norman","2017-11-29","2017-11-29 19:09:17","Life is truly a precious and beautiful thing!  Welcome, Grant Warren McAlinden! Our 16th grandchild was born in the early hours this morning at 7lbs 10oz to our daughter, Mary Catherine, and her husband, Bryan.   Grant, you are already loved so much!","photo","https://www.facebook.com/RepRalphNorman/photos/a.331458170641321.1073741830.315402818913523/379664319154039/?type=3",NA,373,95,4,77,0,0,0,0
"RepRalphNorman","315402818913523_379984482455356","Rep. Ralph Norman","2017-11-30","2017-11-30 15:47:14","Still no action? It has been 77 days now since House sent all 12 #appropriations bills to fund the federal government to the Senate. Time to get this done, Senator Mitch McConnell! #WhatsTheSitchMitch","photo","https://www.facebook.com/RepRalphNorman/photos/a.325588211228317.1073741829.315402818913523/379984409122030/?type=3",NA,63,13,5,0,0,0,2,3
"RepRalphNorman","315402818913523_380354619085009","Rep. Ralph Norman","2017-12-01","2017-12-01 15:07:44","Thank you, FreedomWorks for naming me Member of the Month for December 2017. What an honor.  I am committed to have big government out of Americans' lives, help small businesses grow and expand, and give individuals the freedom to create, innovate, and succeed.  http://www.freedomworks.org/content/freedomworks-member-month-december-2017-rep-ralph-norman-r-sc","link","http://www.freedomworks.org/content/freedomworks-member-month-december-2017-rep-ralph-norman-r-sc","freedomworks.org",71,19,8,4,2,0,0,6
"RepRalphNorman","315402818913523_381858085601329","Rep. Ralph Norman","2017-12-04","2017-12-04 22:15:43","I am pleased to see that the Rule of Law was upheld today with the Supreme Court ruling on the Trump Administration’s travel ban.  President Donald J. Trump recognized his moral and constitutional obligation to protect our national security and keep Americans safe.   Excluding foreign nationals from mostly Muslim countries with a history of grooming terrorists is a common sense first step in the right direction.  http://thehill.com/regulation/court-battles/363183-supreme-court-allows-full-trump-travel-ban-to-take-effect","link","http://thehill.com/regulation/court-battles/363183-supreme-court-allows-full-trump-travel-ban-to-take-effect","thehill.com",145,45,12,17,0,1,2,31
"RepRalphNorman","315402818913523_382245132229291","Rep. Ralph Norman","2017-12-05","2017-12-05 21:14:44","In the 5th District of South Carolina, and across the nation as a whole, the solar industry is a major leader in creating economic growth and providing quality jobs.  The proposed tariffs would affect the entire industry and could have devastating effects on the solar industry as a whole and American families. It is predicted that these trade protections could cost South Carolina alone 7,000 jobs, with a nationwide impact of 88,000.  It is my hope that Ambassador Lightizer and the Trump Administration heavily consider what the proposed trade remedies could have on solar employers and workers nationwide. We need to focus on strengthening American competitiveness, increasing investments, and not risk tens of thousands of Americans their jobs.  View the entire letter I headed to Ambassador Lightizer here: https://norman.house.gov/uploadedfiles/solar_itc_remedy_letter.pdf","photo","https://www.facebook.com/RepRalphNorman/photos/a.325588211228317.1073741829.315402818913523/382245058895965/?type=3",NA,28,11,3,0,0,2,0,0
"RepRalphNorman","315402818913523_383057245481413","Rep. Ralph Norman","2017-12-07","2017-12-07 18:46:04","76 years later, we still honor and remember all the brave men and women of our armed services who paid the ultimate sacrifice. #PearlHarbor","video","https://www.facebook.com/RepRalphNorman/videos/383057245481413/",NA,78,5,25,2,0,0,0,0
"RepRalphNorman","315402818913523_385004025286735","Rep. Ralph Norman","2017-12-12","2017-12-12 14:09:06","Interested in a congressional internship!?  My office is seeking hardworking interns for the 2018 winter, spring, and summer semesters.  Ideal candidates must be detail-oriented, professional, hardworking, creative, and able to work in a fast-paced work environment. To apply please visit my website at: https://norman.house.gov/forms/internships/","link","https://norman.house.gov/forms/internships/","norman.house.gov",30,7,15,0,0,0,0,0
"RepRalphNorman","315402818913523_385017905285347","Rep. Ralph Norman","2017-12-12","2017-12-12 14:49:38","This much needed #taxreform has been 31 years in the making.   Here is a timeline of The Tax Cuts & Jobs Act:","photo","https://www.facebook.com/RepRalphNorman/photos/a.325588211228317.1073741829.315402818913523/385017831952021/?type=3",NA,58,31,2,1,0,0,2,19
"RepRalphNorman","315402818913523_385544591899345","Rep. Ralph Norman","2017-12-13","2017-12-13 21:04:32","My staff and I were honored to write holiday cards to our armed service members, veterans and their families.  These brave heroes have sacrificed so much to protect this nation, for which we are extremely grateful for.","photo","https://www.facebook.com/RepRalphNorman/photos/a.325588211228317.1073741829.315402818913523/385543048566166/?type=3",NA,53,5,3,6,0,0,0,0
"RepRalphNorman","315402818913523_385551155232022","Rep. Ralph Norman","2017-12-13","2017-12-13 21:52:29","We are confident that #taxreform will help this country. A tax code that creates jobs and increases paychecks means everyday, hard working Americans can finally get ahead. Need to hear more? Well, 137 economists just confirmed → https://fairandsimple.gop","video","https://www.facebook.com/RepRalphNorman/videos/385551155232022/",NA,55,30,3,1,1,0,0,10
"RepRalphNorman","315402818913523_385860791867725","Rep. Ralph Norman","2017-12-14","2017-12-14 16:21:58","Like I have said many times before... Tax Reform is good for the taxpayer, and bad for the tax collector.  From everyday American families to small business owners, #taxreform will positively impact your life and make a real difference in your community. Who wouldn’t want more money back in their pocket?","video","https://www.facebook.com/RepRalphNorman/videos/385860791867725/",NA,43,31,2,0,1,0,0,10
"RepRalphNorman","315402818913523_385937411860063","Rep. Ralph Norman","2017-12-14","2017-12-14 20:24:56","The Federal Communications Commission has voted to adopt the Restoring Internet Freedom Order. I applaud the leadership of Chairman Ajit Pai, who has led this effort in an open and transparent fashion. For the first time in FCC history, the text of an order was made available to the public for three weeks before the vote. This has resulted in the most well informed record ever compiled on #netneutrality.   The Internet was free and open before the heavy-handed Title II Internet regulations placed in 2015 by the Obama Administration, and it will be free and open after they are repealed.","video","https://www.facebook.com/RepRalphNorman/videos/385937411860063/",NA,121,134,29,2,2,6,1,75
"RepRalphNorman","315402818913523_385958985191239","Rep. Ralph Norman","2017-12-14","2017-12-14 21:30:02","South Carolina continues to encourage manufacturing companies to invest and grow here. This $31 million investment in South Carolina will result in over 500 new jobs in York County. Stanley Black & Decker’s decision to open a manufacturing operation in York County will drive innovation and make America strong.","status",NA,NA,50,14,3,3,0,0,0,0
"RepRalphNorman","315402818913523_386367301817074","Rep. Ralph Norman","2017-12-15","2017-12-15 20:18:50","Thank you to the Cherokee County Disability and Special Needs Board for bringing some holiday cheer by singing carols at my Gaffney District Office!","photo","https://www.facebook.com/RepRalphNorman/photos/a.325588211228317.1073741829.315402818913523/386365985150539/?type=3",NA,68,8,3,9,0,0,0,0
"RepRalphNorman","315402818913523_387186268401844","Rep. Ralph Norman","2017-12-17","2017-12-17 18:51:18","Had a wonderful time at the Lowrys Christmas Parade!","photo","https://www.facebook.com/RepRalphNorman/photos/a.331458170641321.1073741830.315402818913523/387186255068512/?type=3",NA,109,17,1,9,0,0,1,2
"RepRalphNorman","315402818913523_387451431708661","Rep. Ralph Norman","2017-12-18","2017-12-18 13:46:05","The Tax Cuts & Jobs Act overhauls America’s tax code to deliver historic tax relief to everyday Americans. Here’s how: https://fairandsimple.gop/   1. INCREASES the standard deduction for individuals and couples → this means MORE money back in your pocket.  2. Lowers tax rates so people can keep more of their hard earned money. 3. Delivers significant tax relief to Main Street job creators. 4. Means MORE jobs coming back to communities all around the country.","link","https://fairandsimple.gop/","fairandsimple.gop",76,53,1,3,0,1,0,19
"RepRalphNorman","315402818913523_387550285032109","Rep. Ralph Norman","2017-12-18","2017-12-18 19:07:00","Congratulations to Hannah and Emily, eighth graders from Pleasant Knoll Middle School, on winning The Congressional App Challenge for the 5th District of South Carolina!  I hope they, and other students across the 5th District, continue to be inspired by STEM, coding, and computer science education.","photo","https://www.facebook.com/RepRalphNorman/photos/a.325588211228317.1073741829.315402818913523/387547931699011/?type=3",NA,57,5,3,0,0,0,0,0
"RepRalphNorman","315402818913523_387857405001397","Rep. Ralph Norman","2017-12-19","2017-12-19 14:31:50","With the Tax Cuts & Jobs Act, an everyday family of four earning $73,000 will receive a tax CUT of $2,059. What will you do with the extra money back in your pocket? #TaxReform https://fairandsimple.gop","video","https://www.facebook.com/RepRalphNorman/videos/387857405001397/",NA,40,31,6,4,1,0,2,14
"RepRalphNorman","315402818913523_387960851657719","Rep. Ralph Norman","2017-12-19","2017-12-19 19:58:45","American families, workers, and job creators were given a much-deserved and much-needed tax relief today with the passage of The Tax Cuts & Jobs Act. This #taxreform bill is pro-family and pro-growth Here is what it does:   1. INCREASES the standard deduction for individuals and couples → this means MORE money back in your pocket. 2.Lowers tax rates so people can keep more of their hard earned money. 3.Delivers significant tax relief to Main Street job creators. 4.Means MORE jobs coming back to communities all around the country. 5. EXPANDS the Child Tax Credit from $1,000 to $2,0002.It preserves the Child and Dependent Care Tax Credit to help families care for their children and older dependents   For the first time in 31 years, the House passed a comprehensive tax reform bill that breaks the status quo. I look forward to sending this bill to President Trump’s desk before Christmas so that we can create jobs, increase paychecks, grow our economy, and improve lives. www.fairandsimple.gop","photo","https://www.facebook.com/RepRalphNorman/photos/a.325588211228317.1073741829.315402818913523/387960821657722/?type=3",NA,66,34,6,6,0,0,1,13
"RepRalphNorman","315402818913523_387993474987790","Rep. Ralph Norman","2017-12-19","2017-12-19 22:33:03","The Open Internet Preservation Act, which I co-sponsored, will codify important #netneutrality principles that prevent blocking and throttling. It also provides a light-touch regulatory framework that promotes investment in broadband infrastructure.","photo","https://www.facebook.com/RepRalphNorman/photos/a.325588211228317.1073741829.315402818913523/387993304987807/?type=3",NA,28,17,3,1,0,0,0,5
"RepRalphNorman","315402818913523_388354301618374","Rep. Ralph Norman","2017-12-20","2017-12-20 21:17:23","Just got out from the White House where I joined President Donald J. Trump and members of Congress to celebrate the passage of a pro-family and pro-growth #taxreform bill. Congress has sent it to President Trump’s desk to sign into law.   Finally, the much-needed tax relief is being given to the American people.","video","https://www.facebook.com/RepRalphNorman/videos/388354301618374/",NA,310,160,14,35,1,1,4,59
"RepRalphNorman","315402818913523_388691314918006","Rep. Ralph Norman","2017-12-21","2017-12-21 16:49:18","ICYMI: I talked #taxreform with S.E. Cupp on HLN last evening.  https://youtu.be/qoZg9z969ic","video","https://www.facebook.com/RepRalphNorman/videos/388691314918006/",NA,44,20,9,7,0,0,0,15
"RepRalphNorman","315402818913523_388779614909176","Rep. Ralph Norman","2017-12-21","2017-12-21 21:51:54","In South Carolina's 5th District, the median household income is $48,243. Under this #taxreform bill, these families- the true middle class- will receive a tax CUT of $1,331. That is 3% of their yearly earnings.   With this cut, these families will keep an extra $102 a month in their pockets. This gives the opportunity to: put away towards savings, pay off debts, have more family outings, purchase more school supplies and clothes for the kids, an extra night for a babysitter, etc. Ultimately, this tax cut let's YOU decide how to spend YOUR money.   Don't be fooled when some say this tax cut is not for the average middle class family.","status",NA,NA,108,44,15,10,3,0,0,18
"RepRalphNorman","315402818913523_389094608211010","Rep. Ralph Norman","2017-12-22","2017-12-22 16:28:11","It is official! President Donald J Trump just signed into law The Tax Cuts & Jobs Act. Historic day...this is the first overhaul of our country's tax code in 31 years. #taxreform #taxcuts","status",NA,NA,147,57,7,37,1,1,2,33
"RepRalphNorman","315402818913523_389205354866602","Rep. Ralph Norman","2017-12-22","2017-12-22 21:45:56","Free market principles should guide import levels, not businesses asking for a handout from the government. It is my hope that Secretary Ross seriously considers the ramifications this could have on paper producers and newspapers across the country. https://www.postandcourier.com/politics/u-s-rep-ralph-norman-warns-commerce-secretary-tariffs-on/article_f8ccf830-e745-11e7-866e-538337306354.html?utm_medium=social&utm_source=twitter&utm_campaign=user-share","link","https://www.postandcourier.com/politics/u-s-rep-ralph-norman-warns-commerce-secretary-tariffs-on/article_f8ccf830-e745-11e7-866e-538337306354.html?utm_medium=social&utm_source=twitter&utm_campaign=user-share","postandcourier.com",46,10,2,1,0,0,0,3
"RepRalphNorman","315402818913523_389215428198928","Rep. Ralph Norman","2017-12-22","2017-12-22 22:46:10","Today, President Donald J Trump signed The Tax Cuts & Jobs Act into law! I talked #taxreform on Fox Business tonight about how companies are continuing to reinvest into the American worker and ultimately our economy.","video","https://www.facebook.com/RepRalphNorman/videos/389215428198928/",NA,67,16,4,3,2,0,0,13
"RepRalphNorman","315402818913523_390320831421721","Rep. Ralph Norman","2017-12-25","2017-12-25 15:26:43","From my family to yours, we wish you all a very blessed and #MerryChristmas!","photo","https://www.facebook.com/RepRalphNorman/photos/a.331458170641321.1073741830.315402818913523/390320821421722/?type=3",NA,116,32,1,7,0,0,0,0
"RepRalphNorman","315402818913523_392064964580641","Rep. Ralph Norman","2017-12-29","2017-12-29 17:19:17","The House has been hard at work, and we’re guessing you probably haven’t heard about it.  Here’s how: 544 bills have PASSED out of committee → that’s 52 more than Obama’s first term and 132 more than average.  477 bills have PASSED the House → that’s 53 more than Obama’s first term and 86 more than average. http://didyouknow.gop","photo","https://www.facebook.com/RepRalphNorman/photos/a.325588211228317.1073741829.315402818913523/392064787913992/?type=3",NA,138,75,26,6,11,1,0,4
