"screen_name","id","from_name","date","datetime","message","type","link","domain","likes_count","comments_count","shares_count","love_count","haha_count","wow_count","sad_count","angry_count"
"RepScottTaylor","1831393353804848_1918997408377775","Congressman Scott Taylor","2017-04-27","2017-04-27 11:53:02","Productive meeting during our break, listening to representatives from Indivisible757 , MotherBoard 757 , Together We Will Hampton Roads , and a couple others. We certainly do not agree on most political things, but civil dialogue to find common ground is a good thing. Scott T.","photo","https://www.facebook.com/RepScottTaylor/photos/a.1893999430877573.1073741828.1831393353804848/1918997408377775/?type=3",NA,27,17,2,3,0,0,0,0
"RepScottTaylor","1831393353804848_1919219141688935","Congressman Scott Taylor","2017-04-27","2017-04-27 19:34:53","Congressman Scott Taylor Statement on Fannie and Freddie Open Records Act:","link","https://taylor.house.gov/media/press-releases/congressman-scott-taylor-statement-fannie-and-freddie-open-records-act","taylor.house.gov",13,7,3,0,0,0,0,0
"RepScottTaylor","1831393353804848_1920082188269297","Congressman Scott Taylor","2017-04-29","2017-04-29 15:07:37","Team Taylor is on hand to witness the christening of the new USS Indiana (SSN 789) in Newport News. We are proud of our ship builders, proud of our service members, and proud of our country.","photo","https://www.facebook.com/RepScottTaylor/photos/a.1900943126849870.1073741829.1831393353804848/1920082148269301/?type=3",NA,4,1,0,0,0,0,0,0
"RepScottTaylor","1831393353804848_1920085468268969","Congressman Scott Taylor","2017-04-29","2017-04-29 15:10:55","NEWS FROM THE 2nd DISTRICT  Dear Friends,  The 115th Congress is on pace to be one of the most productive Congresses in recent years. My first 100 days have been busy, but also filled with excitement about what we are going to accomplish in the months to come. The promise of a better tomorrow for our families, communities, and nation is a constant reminder that we still have much work to do. I am committed to finding solutions that benefit the American people by creating a stronger economy, supporting our military, and making sure that our government listens to the people it is supposed to help. I want to share with you some facts about our first 100 days so you know what we are doing in Washington and at home to help you.  I have personally held over 165 meetings with constituents to hear about the issues affecting Virginia’s Second Congressional District. I have co-sponsored over 26 pieces of legislation from improving access to veteran care to condemning the UN resolution that sought to undermine Israel to promoting STEM career opportunities for women. The bills I have introduced deal with a wide range of issues from cybersecurity to increased accountability at the VA, as well as promoting equal access to housing for LGBTQ citizens and strengthening homeland security protections by ensuring that uniforms for DHS personnel are made right here, at home. More information on these bills can be found here.   In the wake of the President’s budget proposal, I have written two letters – one to the President, and one to the Chairman and Ranking Member of the Appropriations Committee Subcommittee on Environment and the Interior – stressing the importance of funding for the Chesapeake Bay and the vital role it plays in our economy and our environment. At the end of last month, I submitted an appropriations request to fully restore the $73 million of funding that the President omitted from his budget.   My staff in Virginia has been busy advocating on your behalf to federal agencies, such as the Social Security Administration, the IRS, and the VA. We have helped over 300 constituents so far with issues related to compensation for service-connected disabilities for veterans, tax disputes, expediting passports, and much more. Please contact my office in Virginia Beach if you ever need assistance with a federal agency. We stand ready to assist.","photo","https://www.facebook.com/RepScottTaylor/photos/a.1893999430877573.1073741828.1831393353804848/1920085468268969/?type=3",NA,9,19,8,0,7,0,0,0
"RepScottTaylor","1831393353804848_1920278678249648","Congressman Scott Taylor","2017-04-30","2017-04-30 02:37:23","Powerful night at the Virginia International Tattoo in #Norfolk.","photo","https://www.facebook.com/RepScottTaylor/photos/a.1893999430877573.1073741828.1831393353804848/1920278678249648/?type=3",NA,9,3,0,0,1,0,0,0
"RepScottTaylor","1831393353804848_1920716234872559","Congressman Scott Taylor","2017-04-30","2017-04-30 21:05:46","Great culture, food, and fun again this year at Israel Fest 2017 as part of Israel Today!","photo","https://www.facebook.com/simonfamilyj/photos/a.138189646217732.13373.134241429945887/1504039259632757/?type=3",NA,4,3,0,0,0,0,0,0
"RepScottTaylor","1831393353804848_1921690308108485","Congressman Scott Taylor","2017-05-02","2017-05-02 21:08:58","April 30 - May 6 is #SmallBusinessWeek! Did you know that 99% of all businesses with employees in the United States are small businesses? To learn more visit https://www.sba.gov/","photo","https://www.facebook.com/RepScottTaylor/photos/a.1893999430877573.1073741828.1831393353804848/1921690308108485/?type=3",NA,1,9,1,0,0,0,0,0
"RepScottTaylor","1831393353804848_1922153748062141","Congressman Scott Taylor","2017-05-03","2017-05-03 21:16:35","Congressman Scott Taylor Votes to Support Bipartisan Consolidated Appropriations Act","link","https://taylor.house.gov/media/press-releases/congressman-scott-taylor-votes-support-bipartisan-consolidated-appropriations","taylor.house.gov",18,25,0,0,0,1,2,4
"RepScottTaylor","1831393353804848_1922471458030370","Congressman Scott Taylor","2017-05-04","2017-05-04 14:23:11","The same people who are telling you ""pre existing"" conditions won't be covered are the same people who said if you like your plan or doctor you can keep them.","status",NA,NA,45,120,13,1,7,1,2,50
"RepScottTaylor","1831393353804848_1922471578030358","Congressman Scott Taylor","2017-05-04","2017-05-04 14:23:42","By law, now and if new law is passed...no one is denied coverage for a ""Pre-existing"" condition. Do not be scared into believing this falsehood from the left. It is not true.","status",NA,NA,55,212,23,2,5,1,4,81
"RepScottTaylor","1831393353804848_1922567861354063","Congressman Scott Taylor","2017-05-04","2017-05-04 18:03:12","‪Just voted ""Yea"" to ensure members of Congress can't exempt themselves if healthcare law changes. ‬","status",NA,NA,55,80,4,2,1,0,0,21
"RepScottTaylor","1831393353804848_1922583094685873","Congressman Scott Taylor","2017-05-04","2017-05-04 18:48:31","Congressman Scott Taylor Statement on Passage of AHCA:","link","https://taylor.house.gov/media/press-releases/congressman-scott-taylor-statement-passage-ahca","taylor.house.gov",45,241,16,3,0,1,16,131
"RepScottTaylor","1831393353804848_1923067001304149","Congressman Scott Taylor","2017-05-05","2017-05-05 17:27:53","Pretty amazing things going on at small businesses in our district!","photo","https://www.facebook.com/RepScottTaylor/photos/a.1900943126849870.1073741829.1831393353804848/1923066921304157/?type=3",NA,8,10,0,0,0,0,0,1
"RepScottTaylor","1831393353804848_1923069174637265","Congressman Scott Taylor","2017-05-05","2017-05-05 17:29:03","Great to see how big business is positively affecting our communities, not only economically, but charitably as well!","photo","https://www.facebook.com/RepScottTaylor/photos/a.1900943126849870.1073741829.1831393353804848/1923069154637267/?type=3",NA,22,22,1,0,0,0,0,6
"RepScottTaylor","1831393353804848_1923082264635956","Congressman Scott Taylor","2017-05-05","2017-05-05 18:02:22","Congressman Taylor had a few of our summer interns knock out some push-ups in the office this morning.","video","https://www.facebook.com/RepScottTaylor/videos/1923082264635956/",NA,55,57,17,5,0,2,0,18
"RepScottTaylor","1831393353804848_1923450491265800","Congressman Scott Taylor","2017-05-06","2017-05-06 12:35:06","This, after 2 insurers announced they were leaving the Virginia individual market in the last two weeks.","link","http://www.washingtonexaminer.com/maryland-virginia-brace-for-huge-obamacare-rate-hikes/article/2622313","washingtonexaminer.com",4,83,4,0,6,2,0,18
"RepScottTaylor","1831393353804848_1923553134588869","Congressman Scott Taylor","2017-05-06","2017-05-06 16:29:25","Kyle was a great friend, family man, and teammate. He was brilliant, witty, and fiercely loyal. He will be missed by all those who had the pleasure of knowing him. LLTB.","link","http://pilotonline.com/news/military/local/virginia-beach-based-navy-seal-killed-in-somalia-pentagon-says/article_91a0c083-614f-5901-9846-6a7cc5809ef1.html","pilotonline.com",21,9,8,4,0,1,44,0
"RepScottTaylor","1831393353804848_1924443597833156","Congressman Scott Taylor","2017-05-08","2017-05-08 13:47:59",NA,"link","http://pilotonline.com/opinion/columnist/guest/cathy-mcmorris-rodgers-my-son-has-a-pre-existing-condition/article_f5a98175-7451-5866-b6da-444397febd21.html","pilotonline.com",15,61,7,0,0,0,5,35
"RepScottTaylor","1831393353804848_1924446684499514","Congressman Scott Taylor","2017-05-08","2017-05-08 13:58:26",NA,"link","https://www.nytimes.com/2017/05/05/opinion/what-the-republican-health-plan-gets-right.html?_r=0","nytimes.com",10,80,4,0,8,1,1,19
"RepScottTaylor","1831393353804848_1924971131113736","Congressman Scott Taylor","2017-05-09","2017-05-09 16:03:51","My team had a great time yesterday visiting the Port and seeing one of world's largest cargo ships.","link","http://wavy.com/2017/05/08/port-of-virginia-to-host-its-largest-container-ship-ever/","avy.com",19,29,1,0,0,1,0,1
"RepScottTaylor","1831393353804848_1925538971056952","Congressman Scott Taylor","2017-05-10","2017-05-10 16:52:42","Rep. Taylor's statement on Director Comey's dismissal.","link","https://taylor.house.gov/media/press-releases/congressman-taylor-statement-dismissal-fbi-director-james-comey","taylor.house.gov",43,110,12,1,1,0,4,27
"RepScottTaylor","1831393353804848_1925618307715685","Congressman Scott Taylor","2017-05-10","2017-05-10 20:53:49","Enlightening tour at the Judeo Christian Outreach Center in Virginia Beach today. They are giving a hand up to many people in need and kudos to the tremendous amount of volunteers who help them!","photo","https://www.facebook.com/RepScottTaylor/photos/a.1900943126849870.1073741829.1831393353804848/1925618277715688/?type=3",NA,18,11,6,1,0,0,0,0
"RepScottTaylor","1831393353804848_1926096457667870","Congressman Scott Taylor","2017-05-11","2017-05-11 16:41:35","Excellent meeting at NASA Langley Research Center today. They are doing amazing things and there is tremendous potential to help innovative small/big businesses with forward leaning technology.","photo","https://www.facebook.com/RepScottTaylor/photos/a.1900943126849870.1073741829.1831393353804848/1926096421001207/?type=3",NA,15,14,0,1,0,0,0,0
"RepScottTaylor","1831393353804848_1926206404323542","Congressman Scott Taylor","2017-05-11","2017-05-11 22:04:15","Congressional Art Competition","video","https://www.facebook.com/RepScottTaylor/videos/1926206404323542/",NA,9,12,2,1,0,0,0,2
"RepScottTaylor","1831393353804848_1926695264274656","Congressman Scott Taylor","2017-05-14","2017-05-14 13:00:01","To all the great moms and moms-to-be, Happy Mother's Day!","photo","https://www.facebook.com/RepScottTaylor/photos/a.1893999430877573.1073741828.1831393353804848/1926695264274656/?type=3",NA,3,10,0,0,0,0,0,0
"RepScottTaylor","1831393353804848_1927603304183852","Congressman Scott Taylor","2017-05-14","2017-05-14 15:00:27","Friday we had a productive meeting with our Chesapeake Bay Advisory Council. This bipartisan group of stakeholders advises the Congressman on  many things relating to the bay, such as clean up, water quality, aquaculture, etc.  They are a tremendous resource and very passionate! The Congressman is putting together a similarly structured group on sea level rise.","photo","https://www.facebook.com/RepScottTaylor/photos/a.1900943126849870.1073741829.1831393353804848/1927603270850522/?type=3",NA,9,22,0,0,0,0,0,0
"RepScottTaylor","1831393353804848_1928146704129512","Congressman Scott Taylor","2017-05-15","2017-05-15 19:06:07","Every day, federal, state, and local law enforcement officers around the country protect their fellow citizens from harm, keep the peace, and carry out justice. National Police Week is our chance to show our men and women in blue we appreciate all the work they do on our behalf #PoliceWeek","photo","https://www.facebook.com/RepScottTaylor/photos/a.1893999430877573.1073741828.1831393353804848/1928146704129512/?type=3",NA,15,4,3,0,0,0,0,0
"RepScottTaylor","1831393353804848_1928193767458139","Congressman Scott Taylor","2017-05-15","2017-05-15 21:20:51","Rep. Taylor Statement on AG Sessions Mandatory Minimum Enforcement:","link","https://taylor.house.gov/media/press-releases/rep-taylor-statement-ag-sessions-mandatory-minimum-enforcement","taylor.house.gov",125,61,13,11,0,2,0,0
"RepScottTaylor","1831393353804848_1928234050787444","Congressman Scott Taylor","2017-05-16","2017-05-16 00:02:14","Our team was at the public meeting tonight at London Bridge Baptist Church on the jet fuel spill at Naval Air Station Oceana. They had 5 tables set up with experts on health, air quality, water quality, wildlife monitoring, and clean up. They expect to be done with the vast majority of clean up by the end of the week. Any citizens who have questions or need help are asked to call 311 during the hours of 7AM-7PM.  As always, our office is standing by to assist as well.","photo","https://www.facebook.com/RepScottTaylor/photos/a.1900943126849870.1073741829.1831393353804848/1928234030787446/?type=3",NA,6,5,0,0,0,0,0,0
"RepScottTaylor","1831393353804848_1928656454078537","Congressman Scott Taylor","2017-05-16","2017-05-16 22:30:00","Congressman Taylor Votes in Support of Strengthening State and Local Crime Fighting Act","link","https://taylor.house.gov/media/press-releases/congressman-taylor-votes-support-strengthening-state-and-local-crime-fighting","taylor.house.gov",6,11,0,0,0,0,0,1
"RepScottTaylor","1831393353804848_1929084397369076","Congressman Scott Taylor","2017-05-17","2017-05-17 19:49:13","Bridging the Gap: Bringing Communities and Law Enforcement Together","video","https://www.facebook.com/RepScottTaylor/videos/1929084397369076/",NA,5,5,0,0,0,0,0,0
"RepScottTaylor","1831393353804848_1929114940699355","Congressman Scott Taylor","2017-05-17","2017-05-17 21:30:00","Congressman Taylor Votes in Support of Improving Fusion Centers' Access to Information Act","link","https://taylor.house.gov/media/press-releases/congressman-taylor-votes-support-improving-fusion-centers-access-information","taylor.house.gov",0,5,0,0,0,0,0,0
"RepScottTaylor","1831393353804848_1929155647361951","Congressman Scott Taylor","2017-05-17","2017-05-17 23:32:46","Rep Taylor Statement on Appointment of Robert Mueller as Special Counselor:","link","https://taylor.house.gov/media/press-releases/rep-taylor-statement-appointment-robert-mueller-special-prosecutor","taylor.house.gov",37,35,4,1,1,2,0,3
"RepScottTaylor","1831393353804848_1929427327334783","Congressman Scott Taylor","2017-05-18","2017-05-18 13:56:14","Appropriations sub committee on The Department of Homeland Security held a hearing today on the U.S. Coast Guard 's budget. Rep. Taylor believes strongly that they are an essential part of our national security apparatus.","photo","https://www.facebook.com/RepScottTaylor/photos/a.1900943126849870.1073741829.1831393353804848/1929427307334785/?type=3",NA,21,10,0,0,0,0,0,0
"RepScottTaylor","1831393353804848_1929562450654604","Congressman Scott Taylor","2017-05-18","2017-05-18 20:15:23","Mid-Atlantic Regional Spaceport  UAS ribbon cutting.","photo","https://www.facebook.com/RepScottTaylor/photos/a.1900943126849870.1073741829.1831393353804848/1929560677321448/?type=3",NA,7,0,0,0,0,0,0,0
"RepScottTaylor","1831393353804848_1929573427320173","Congressman Scott Taylor","2017-05-18","2017-05-18 21:07:00","Congressman Taylor Votes to Honor and Protect Law Enforcement","link","https://taylor.house.gov/media/press-releases/congressman-taylor-votes-honor-and-protect-law-enforcement","taylor.house.gov",8,3,0,0,1,0,0,0
"RepScottTaylor","1831393353804848_1929964483947734","Congressman Scott Taylor","2017-05-19","2017-05-19 17:41:31","Yesterday, I had the privilege of addressing the House floor to commemorate Police Week and the sacrifices made by the brave men and women in law enforcement.","video","https://www.facebook.com/RepScottTaylor/videos/1929964483947734/",NA,133,24,14,10,3,0,0,5
"RepScottTaylor","1831393353804848_1930422837235232","Congressman Scott Taylor","2017-05-20","2017-05-20 16:42:09",NA,"photo","https://www.facebook.com/RepScottTaylor/photos/a.1893999430877573.1073741828.1831393353804848/1930422837235232/?type=3",NA,10,1,0,0,0,0,0,0
"RepScottTaylor","1831393353804848_1930971310513718","Congressman Scott Taylor","2017-05-21","2017-05-21 16:26:48","After billions of dollars in deals benefiting American jobs signed during his trip, President Trump engaged in perhaps the best moment of his presidency. His speech to Middle Eastern leaders was strong, frank, and held out hope for the region where civilization began. His words, representation, and their potential impact should make Americans proud. Having spent years in the Middle East myself, this is the way Americans should be represented there. Scott T.","status",NA,NA,45,76,5,6,26,0,1,16
"RepScottTaylor","1831393353804848_1931859823758200","Congressman Scott Taylor","2017-05-23","2017-05-23 15:14:33","Congressman Scott Taylor Statement on Manchester Terror Attack:","link","https://taylor.house.gov/media/press-releases/congressman-scott-taylor-statement-manchester-terror-attack","taylor.house.gov",25,8,0,2,0,0,9,1
"RepScottTaylor","1831393353804848_1932312483712934","Congressman Scott Taylor","2017-05-24","2017-05-24 15:04:51","Rep Taylor Supports Streamlined Appeals Process and COLA Increase for Vets:","link","https://taylor.house.gov/media/press-releases/rep-taylor-supports-streamlined-appeals-process-and-cola-increase-vets","taylor.house.gov",7,11,2,1,0,0,0,1
"RepScottTaylor","1831393353804848_1932398823704300","Congressman Scott Taylor","2017-05-24","2017-05-24 19:13:42","About to start an Appropriations hearing on United States Department of Homeland Security with Sec. Kelly. What would you like asked?","status",NA,NA,3,16,0,0,0,0,0,0
"RepScottTaylor","1831393353804848_1932403067037209","Congressman Scott Taylor","2017-05-24","2017-05-24 19:26:09","Watch the Homeland Security subcommittee hearing with Secretary John Kelly:","link","https://appropriations.house.gov/calendar/eventsingle.aspx?EventID=394881","appropriations.house.gov",1,4,0,0,0,0,0,0
"RepScottTaylor","1831393353804848_1933335786943937","Congressman Scott Taylor","2017-05-26","2017-05-26 16:02:16","Great meeting with our hardworking farmers in Pungo, Virginia !","photo","https://www.facebook.com/RepScottTaylor/photos/a.1893999430877573.1073741828.1831393353804848/1933335786943937/?type=3",NA,10,4,0,0,0,0,0,0
"RepScottTaylor","1831393353804848_1934754230135426","Congressman Scott Taylor","2017-05-29","2017-05-29 14:22:00","I am not naïve to the fact that my words today don’t hold a candle to the witness or the words we can no longer hear of the valiant men and women who sacrificed it all for this nation. However, we must honor them. Not simply for them, but for us, for the very fabric of our land, and for our descendants for generations to come. There is nothing small about the big task it is to defend freedom, peace, and our way of life. We remember. #MemorialDay","photo","https://www.facebook.com/RepScottTaylor/photos/a.1893999430877573.1073741828.1831393353804848/1934754230135426/?type=3",NA,25,8,0,3,0,0,0,0
"RepScottTaylor","1831393353804848_1936638679946981","Congressman Scott Taylor","2017-06-01","2017-06-01 22:06:42",NA,"link","https://taylor.house.gov/media/press-releases/congressman-taylor-statement-paris-agreement","taylor.house.gov",36,119,12,6,2,0,6,91
"RepScottTaylor","1831393353804848_1936911779919671","Congressman Scott Taylor","2017-06-02","2017-06-02 12:04:02",NA,"photo","https://www.facebook.com/humanrightscampaign/photos/a.10150307206218281.358630.18813753280/10155413069768281/?type=3",NA,42,7,0,3,0,0,0,0
"RepScottTaylor","1831393353804848_1937141713230011","Congressman Scott Taylor","2017-06-02","2017-06-02 18:51:21",NA,"photo","https://www.facebook.com/GhentitePhotography/photos/a.1955764204711203.1073741894.1556258817995079/1955767364710887/?type=3",NA,3,1,0,0,0,0,0,1
"RepScottTaylor","1831393353804848_1937141956563320","Congressman Scott Taylor","2017-06-02","2017-06-02 18:55:11","Team Taylor was on hand to watch a U.S. Coast Guard rescue demonstration. #America","video","https://www.facebook.com/RepScottTaylor/videos/1937141956563320/",NA,11,3,0,1,0,0,0,1
"RepScottTaylor","1831393353804848_1937158146561701","Congressman Scott Taylor","2017-06-02","2017-06-02 19:32:58","Our team a great experience and even better weather touring the Chesapeake Bay Bridge-Tunnel and meeting with Eastern Shore healthcare providers.","photo","https://www.facebook.com/RepScottTaylor/photos/a.1900943126849870.1073741829.1831393353804848/1937157696561746/?type=3",NA,9,2,0,0,0,0,0,0
"RepScottTaylor","1831393353804848_1937168609893988","Congressman Scott Taylor","2017-06-02","2017-06-02 20:07:13","Fort Monroe National Historic Site in Hampton, Virginia is a real  treasure! 2019 will be the 400th anniversary of the arrival of the first African Americans enslaved. In 1861, a union General refused to return 3 run away slaves (the law of the time), claiming they were property and thus wartime contraband. He protected them. Eventually, word got out and there were close to 10k run away slaves protected at and around the fort prior to the end of the war.","photo","https://www.facebook.com/RepScottTaylor/photos/a.1900943126849870.1073741829.1831393353804848/1937168569893992/?type=3",NA,8,2,0,1,0,0,0,0
"RepScottTaylor","1831393353804848_1937181516559364","Congressman Scott Taylor","2017-06-02","2017-06-02 21:01:47","As a youngster I spent much time at the Boys & Girls Club Of America. I understand the community impact and the value. It was great to tour and chat with the wonderful kids at the Boys & Girls Clubs of the Virginia Peninsula today!","photo","https://www.facebook.com/RepScottTaylor/photos/a.1893999430877573.1073741828.1831393353804848/1937181516559364/?type=3",NA,12,6,0,0,0,0,0,0
"RepScottTaylor","1831393353804848_1939359899674859","Congressman Scott Taylor","2017-06-06","2017-06-06 15:32:51","""Soldiers, sailors and airmen of the Allied Expeditionary Force. You are about to embark upon the great crusade, toward which we have striven these many months. The eyes of the world are upon you. The hope and prayers of liberty-loving people everywhere march with you."" - Eisenhower","photo","https://www.facebook.com/RepScottTaylor/photos/a.1893999430877573.1073741828.1831393353804848/1939359899674859/?type=3",NA,6,3,0,0,0,0,0,0
"RepScottTaylor","1831393353804848_1939579452986237","Congressman Scott Taylor","2017-06-07","2017-06-07 01:51:55","Equality, discrimination, and love should not be a partisan thing.","link","https://www.washingtonpost.com/local/virginia-politics/two-house-republicans-favor-a-ban-on-lgbt-discrimination-one-is-from-virginia/2017/06/05/123249f0-4a08-11e7-bc1b-fddbd8359dee_story.html?utm_term=.165979e47d21","washingtonpost.com",149,33,16,17,0,3,0,4
"RepScottTaylor","1831393353804848_1940020739608775","Congressman Scott Taylor","2017-06-07","2017-06-07 21:12:52","Congressman Taylor Votes for Anti-Border Corruption Reauthorization Act","link","https://taylor.house.gov/media/press-releases/congressman-taylor-votes-anti-border-corruption-reauthorization-act","taylor.house.gov",8,7,1,0,0,0,0,0
"RepScottTaylor","1831393353804848_1940518862892296","Congressman Scott Taylor","2017-06-08","2017-06-08 20:23:47","Team Taylor was happy to attend the Valor Awards and present letters of commendation.","photo","https://www.facebook.com/RepScottTaylor/photos/a.1900943126849870.1073741829.1831393353804848/1940518816225634/?type=3",NA,10,1,0,0,0,0,0,0
"RepScottTaylor","1831393353804848_1940530159557833","Congressman Scott Taylor","2017-06-08","2017-06-08 20:57:24","About to speak on the house floor, tune in to watch.","link","https://www.c-span.org/video/?429507-2%2Fus-house-meets-legislative-business&live","c-span.org",3,11,0,0,0,0,0,5
"RepScottTaylor","1831393353804848_1941155846161931","Congressman Scott Taylor","2017-06-10","2017-06-10 02:13:47","Great to be with my colleague, Congressman Bobby Scott, Mayor Kenny Alexander, Mayor Fraim, Delegate Joe Lindsey and many more at Harborfest in Norfolk. Beautiful night!","photo","https://www.facebook.com/RepScottTaylor/photos/a.1900943126849870.1073741829.1831393353804848/1941155762828606/?type=3",NA,16,7,0,0,0,1,0,0
"RepScottTaylor","1831393353804848_1941575356119980","Congressman Scott Taylor","2017-06-10","2017-06-10 17:26:59","Honored to attend and speak with Mayor Will Sessoms at the dedication ceremony for the Fallen Heroes Tribute Memorial by Sam Welty in Virginia Beach today.","photo","https://www.facebook.com/RepScottTaylor/photos/a.1900943126849870.1073741829.1831393353804848/1941575282786654/?type=3",NA,7,0,0,0,0,0,0,0
"RepScottTaylor","1831393353804848_1942201349390714","Congressman Scott Taylor","2017-06-11","2017-06-11 21:15:39","Fantastic evening on Board the USS Bulkeley (DDG 84) last night at Norfolk Harborfest.","photo","https://www.facebook.com/RepScottTaylor/photos/a.1900943126849870.1073741829.1831393353804848/1942201276057388/?type=3",NA,10,1,0,0,0,0,0,0
