"screen_name","id","from_name","date","datetime","message","type","link","domain","likes_count","comments_count","shares_count","love_count","haha_count","wow_count","sad_count","angry_count"
"RepScottTaylor","1831393353804848_1863905887220261","Congressman Scott Taylor","2017-01-18","2017-01-18 21:39:10",NA,"photo","https://www.facebook.com/RepScottTaylor/photos/a.1831393880471462.1073741825.1831393353804848/1863905887220261/?type=3",NA,4,12,0,0,0,0,0,0
"RepScottTaylor","1831393353804848_1888977754713074","Congressman Scott Taylor","2017-03-06","2017-03-06 18:20:14",NA,"photo","https://www.facebook.com/RepScottTaylor/photos/a.1888977778046405.1073741827.1831393353804848/1888977754713074/?type=3",NA,7,6,0,1,0,0,0,0
"RepScottTaylor","1831393353804848_1889475997996583","Congressman Scott Taylor","2017-03-04","2017-03-04 23:00:00","I commend President Trump for signing into law the bill from my friend Congresswoman Barbara Comstock. I am proud to have cosponsored the INSPIRE Women Act that will help our girls and young women on the important goal of increasing the number of women who go into the fields of science, technology, engineering and math.","link","https://taylor.house.gov/media/press-releases/congressman-scott-taylor-statement-inspire-women-act-being-signed-law","taylor.house.gov",4,15,0,1,0,0,0,0
"RepScottTaylor","1831393353804848_1889477991329717","Congressman Scott Taylor","2017-03-01","2017-03-01 17:00:00","WASHINGTON D.C.- March 1, 2017—Congressman Scott Taylor announced his support for the Searching for and Cutting Regulations that are Unnecessarily Burdensome (SCRUB) Act, H.R. 998. The SCRUB Act creates a regulatory review commission that will review and provide recommendations as to which regulations to repeal. The SCRUB Act also provides that for each new regulation there must be an equal repeal of an existing regulation implemented. Congressman Taylor had this to say about the SCRUB Act: “All across our district I heard loud and clear that businesses, small and large, have been suffocating under crushing regulations. Creating more accountability with the voters in the implementation of regulations is the right step”","link","https://taylor.house.gov/media/press-releases/congressman-scott-taylor-supports-scrub-act","taylor.house.gov",2,10,0,0,0,0,1,4
"RepScottTaylor","1831393353804848_1889478267996356","Congressman Scott Taylor","2017-02-14","2017-02-14 17:00:00","Whether as a national security advisor or your close friend, trust is an important component of any relationship. In these chaotic times we need clarity and I look forward to working with General Flynn's successor. We all should appreciate the many years and deeds of service to our great nation by General Flynn and wish he and his family the best moving forward. The intelligence community and White House must quickly get on the same page. The stakes are too high.","link","https://taylor.house.gov/media/press-releases/congressman-scott-taylor-statement-general-flynn","taylor.house.gov",0,5,0,0,0,0,0,0
"RepScottTaylor","1831393353804848_1890101171267399","Congressman Scott Taylor","2017-03-08","2017-03-08 22:17:03",NA,"link","https://taylor.house.gov/media/press-releases/congressman-scott-taylor-supports-department-defense-appropriations-act-2017","taylor.house.gov",5,4,1,0,0,0,0,0
"RepScottTaylor","1831393353804848_1890119784598871","Congressman Scott Taylor","2017-03-08","2017-03-08 23:34:57","A military is mandated by our nation, yet our force and their families are volunteers.  We owe them the equipment, training, maintenance, and family support they need to get the job done for us. This bill is a step in the right direction to helping rebound our preparedness and readiness. Among other things, I am proud to announce my support of important investments in traumatic brain injury treatment, suicide prevention, assistance for victims of sexual assault, and a pay raise for our men and women in uniform","video","https://youtu.be/QcDMdsszwXU",NA,9,13,0,0,0,0,0,0
"RepScottTaylor","1831393353804848_1890760301201486","Congressman Scott Taylor","2017-03-09","2017-03-09 22:15:40","Congressman Scott Taylor Introduces Bipartisan Legislation Extending Housing Protections for LGBTQ Citizens","link","https://taylor.house.gov/media/press-releases/congressman-scott-taylor-introduces-bipartisan-legislation-extending-housing","taylor.house.gov",41,14,5,3,1,1,0,0
"RepScottTaylor","1831393353804848_1891278134483036","Congressman Scott Taylor","2017-03-10","2017-03-10 19:45:09",NA,"link","https://schneider.house.gov/media/press-releases/reps-brad-schneider-and-scott-taylor-introduce-bipartisan-legislation-extending","schneider.house.gov",26,13,0,6,0,0,0,0
"RepScottTaylor","1831393353804848_1891278201149696","Congressman Scott Taylor","2017-03-10","2017-03-10 19:45:28",NA,"photo","https://www.facebook.com/HouseAppropsGOP/photos/a.1206481619389483.1073741835.206998479337807/1242668442437467/?type=3",NA,5,7,0,0,0,0,0,1
"RepScottTaylor","1831393353804848_1892447554366094","Congressman Scott Taylor","2017-03-12","2017-03-12 22:41:10","Great article on Rep Taylor!","link","http://taskandpurpose.com/veterans-government-get-stuff-done-says-seal-turned-congressman/","taskandpurpose.com",12,11,2,0,1,0,0,1
"RepScottTaylor","1831393353804848_1893068254304024","Congressman Scott Taylor","2017-03-13","2017-03-13 23:50:50","Rep. Taylor on Fox News today discussing the rules of engagement.","video","http://video.foxnews.com/v/5357901519001/#sp=show-clips",NA,1,9,1,0,0,0,0,1
"RepScottTaylor","1831393353804848_1893999410877575","Congressman Scott Taylor","2017-03-15","2017-03-15 15:02:56","Rep. Taylor speaks to the National Ship Repair Assoc. about the need for regular Appropriations bills for predictability and stability in our national security apparatus.","photo","https://www.facebook.com/RepScottTaylor/photos/a.1893999430877573.1073741828.1831393353804848/1893999410877575/?type=3",NA,2,2,0,0,0,0,0,0
"RepScottTaylor","1831393353804848_1894525487491634","Congressman Scott Taylor","2017-03-16","2017-03-16 15:24:14","The United States must be a world leader on the issue of cybersecurity. The cyber world has been the wild west for too long. The potential cyber capabilities, for good or bad, that we possess now on our smartphones are greater than the most powerful computer just 20 years ago. Our nation must keep up with the ever-changing landscape to protect our citizens, our critical infrastructure, and our nation from being put at risk or attacked","link","https://taylor.house.gov/media/press-releases/congressmen-taylor-and-ruppersberger-introduce-resolution-develop-cybersecurity","taylor.house.gov",5,4,0,0,0,0,0,0
"RepScottTaylor","1831393353804848_1894687547475428","Congressman Scott Taylor","2017-03-16","2017-03-16 21:18:12","We must continually and consistently hold the VA accountable for underperformance. Our veterans are sacred and deserve the same commitment to high standards they upheld as service members. We should never defend mediocrity at the VA, rather strive for better service, care, and excellence.","link","https://taylor.house.gov/media/press-releases/congressman-taylor-supports-va-accountability-first-act","taylor.house.gov",10,8,0,0,0,0,0,0
"RepScottTaylor","1831393353804848_1895111090766407","Congressman Scott Taylor","2017-03-17","2017-03-17 13:42:46","President Trump’s budget proposal is just that, a proposal; Article 1 Section 9 of the Constitution reserves the power of the purse strings to Congress. While we only have top line numbers from the President, I am happy to see the defense sequester being pushed away, but unhappy to hear funding for the Chesapeake Bay cleanup has been cut in the budget. I look forward to working with my colleagues on the Appropriations Committee, the rest of Congress, and the President to ensure completion of our constitutional duty.","link","https://taylor.house.gov/media/press-releases/congressman-scott-taylor-statement-president-trumps-budget-proposal","taylor.house.gov",22,29,5,0,0,1,0,0
"RepScottTaylor","1831393353804848_1895159297428253","Congressman Scott Taylor","2017-03-17","2017-03-17 15:09:02","Yesterday I offered an amendment to the VA Accountability Act, that was adopted, to ensure that we know why senior executives are transferred and we can start to have true transparency at the VA. I also want to thank my colleague Rep. Walz for his support.","video","https://youtu.be/BeI-UVrCbaM",NA,3,7,0,1,0,0,0,1
"RepScottTaylor","1831393353804848_1896997527244430","Congressman Scott Taylor","2017-03-21","2017-03-21 00:40:20",NA,"link","http://wtkr.com/2017/03/20/rep-scott-taylor-talks-lgbt-rights-va-and-health-care/","tkr.com",4,12,3,1,0,1,0,0
"RepScottTaylor","1831393353804848_1897438143867035","Congressman Scott Taylor","2017-03-21","2017-03-21 20:51:02","Leaders must act. A lack of action leaves the failing status quo of Obamacare. Thursday, I will vote YEA, in support of the American Health Care Act. Dealing with healthcare is a complicated and formidable task. However, it is one issue I knew I would face as a freshman Member of Congress. I was quite clear during my campaign for Congress that I supported repealing and replacing Obamacare.  It is failing. It is hurting more people than it’s helping. The law’s mandates, tax hikes, and regulations have led to skyrocketing premiums, fewer choices, and less access to quality care. The government should not require citizens to engage in commerce they do not want to engage in. Millions of people lost healthcare plans they wanted to keep. Healthcare premiums have skyrocketed as have deductibles for too many families. People are making tough decisions with some premiums costing as much as mortgage payments. Others are walking around with insurance cards with deductibles they cannot afford. Insurers are pulling out of markets, leaving monopolies behind. The government is taking in more tax revenue than at any time in our nation’s history –  regulations are crushingly burdensome on individuals and businesses and will only increase moving forward under Obamacare. The list of reasons for repeal goes on.   The AHCA vote this Thursday is the first step toward patient-centered healthcare. After all, NO ONE cares more about your healthcare than you or your family. The AHCA is the start of three phases: the budget reconciliation process to repeal Obamacare taxes, executive action to provide waivers to the States and other rule changes, and more legislation to fully enact our improvements, including allowing people to buy insurance across state lines.  This is sure to be an ongoing process and not a simplistic one.  Under the AHCA, those who cannot help themselves are still protected. The bill provides states with $100 billion to design programs that meet the unique needs of their patient populations and help low-income Americans access affordable health care. States would also have the ability to add work requirements for able-bodied, working age adults. The bill repeals Obamacare taxes and the forced mandate, it increases the limits of tax-free Health Savings Accounts, and it keeps the ACA requirement for insurance policies to cover maternity care and contraception, and cancer screening. Those with pre-existing conditions are covered and parents can still keep their adult children on their plans until age 26. Finally, this legislation reduces the federal deficit by $337 billion by reducing spending by $1.2 trillion and providing nearly $900 billion in tax relief, including for middle-income Americans and small business owners.  This reconciliation bill is a step in the right direction.  There will be more changes by way of executive action and further legislation that cannot be enacted as part of the AHCA because of arcane Senate rules.   I am supporting this legislation that, when combined with the other actions we will take, provides a meaningful positive difference for American families. There are those who say this bill doesn’t do 100 percent of what they want it to do; I believe 85 percent of something in the right direction is much better than nothing.","link","https://taylor.house.gov/media/press-releases/congressman-scott-taylor-statement-ahca","taylor.house.gov",21,141,8,1,1,0,17,87
"RepScottTaylor","1831393353804848_1897883553822494","Congressman Scott Taylor","2017-03-22","2017-03-22 14:10:48","In my first Veterans Affairs hearing with the Inspector General. What questions do you have?","status",NA,NA,4,18,0,1,1,0,0,0
"RepScottTaylor","1831393353804848_1898079190469597","Congressman Scott Taylor","2017-03-22","2017-03-22 21:12:00","I have and will continue to work to lower the cost of healthcare and to offer more access to the care people need. These two pieces of legislation do exactly that. I am proud to support these bills.","link","https://taylor.house.gov/media/press-releases/congressman-taylor-supports-health-insurance-reforms","taylor.house.gov",14,98,15,1,0,0,1,46
"RepScottTaylor","1831393353804848_1900943120183204","Congressman Scott Taylor","2017-03-27","2017-03-27 17:01:15","Excellent meeting today with stakeholders from the  maritime industry. Virginia is number one in the nation for ship building and ship repair jobs! We can do even better, and I'm ready to do my part!","photo","https://www.facebook.com/RepScottTaylor/photos/a.1900943126849870.1073741829.1831393353804848/1900943090183207/?type=3",NA,8,6,0,0,0,0,0,0
"RepScottTaylor","1831393353804848_1901624646781718","Congressman Scott Taylor","2017-03-28","2017-03-28 20:54:17",NA,"link","https://taylor.house.gov/media/press-releases/scott-taylor-statement-chesapeake-bay-funds","taylor.house.gov",72,36,4,8,0,0,0,0
"RepScottTaylor","1831393353804848_1902130760064440","Congressman Scott Taylor","2017-03-29","2017-03-29 16:20:02","Congressman Scott Taylor Statement on Internet Privacy","link","https://taylor.house.gov/media/press-releases/congressman-scott-taylor-statement-internet-privacy","taylor.house.gov",15,62,15,0,0,0,1,43
"RepScottTaylor","1831393353804848_1902240923386757","Congressman Scott Taylor","2017-03-29","2017-03-29 21:06:22",NA,"link","https://www.facebook.com/NorthamptonCountyChamberofCommerce/posts/1452683491428812","facebook.com",1,0,0,0,0,0,0,0
"RepScottTaylor","1831393353804848_1902247920052724","Congressman Scott Taylor","2017-03-29","2017-03-29 21:32:13",NA,"link","https://taylor.house.gov/media/press-releases/scott-taylor-statement-chesapeake-bay-funds","taylor.house.gov",21,4,0,1,0,0,0,0
"RepScottTaylor","1831393353804848_1902668506677332","Congressman Scott Taylor","2017-03-30","2017-03-30 13:49:33","Congressman Scott Taylor Issues Request for Information from the VA on Veteran Suicide Procedure.","link","https://taylor.house.gov/media/press-releases/congressman-scott-taylor-issues-request-information-va-oig-veteran-suicide","taylor.house.gov",5,4,0,0,0,0,0,0
"RepScottTaylor","1831393353804848_1902797833331066","Congressman Scott Taylor","2017-03-30","2017-03-30 19:20:06","""FYI- ""But just to be clear, the net impact on your privacy of this action, assuming President Trump approves the resolution, will be absolutely zero. Congress’s disapproval does not authorize ISPs or anyone else to “sell” customer data or investigate your web browsing history.  It does not represent the “death of online privacy.”  ISPs will be given no “new powers” to “harvest your personal information in extraordinarily creepy ways.”""","link","https://www.forbes.com/sites/larrydownes/2017/03/30/why-congresss-rejection-of-proposed-fcc-data-rules-will-not-affect-your-privacy-in-the-slightest/#154589758b14","forbes.com",3,35,5,0,6,0,0,14
"RepScottTaylor","1831393353804848_1903825096561673","Congressman Scott Taylor","2017-04-01","2017-04-01 13:46:54","Thinking about everyone back home. Please contact us if we can be of assistance. https://taylor.house.gov/contact We are standing by.","link","http://pilotonline.com/news/local/weather/slideshow-severe-weather-strikes-hampton-roads-area/collection_21651409-8a58-588e-a561-52b1da3f25aa.html","pilotonline.com",9,7,4,0,0,1,3,0
"RepScottTaylor","1831393353804848_1903910889886427","Congressman Scott Taylor","2017-04-01","2017-04-01 17:20:13","It has been confirmed that a tornado touched down in Virginia Beach and Chesapeake last night. To those impacted by the storm my office stands by ready to help in any way that we can, and we have already been in touch with state and local officials to assist in any way.  A big thank you to the Virginia Beach city officials, Police Department, Fire Department, Sheriff's office, Port of Virginia, the Virginia Department of Emergency Management and all those who have helped for all of their dedication.","link","https://taylor.house.gov/contact","taylor.house.gov",7,4,0,0,0,0,0,0
"RepScottTaylor","1831393353804848_1903974266546756","Congressman Scott Taylor","2017-04-01","2017-04-01 20:15:59","On the Arizona border with Mexico today with the hard working people of U.S. Customs and Border Protection. They have a tough, endless, and many times thankless job. It's important they have the resources needed to do the job we as a nation expect of them.","video","https://www.facebook.com/RepScottTaylor/videos/1903973443213505/",NA,6,18,1,0,0,0,0,1
"RepScottTaylor","1831393353804848_1905723059705210","Congressman Scott Taylor","2017-04-04","2017-04-04 19:17:42","Congressmen Scott Taylor and Luis Correa Introduce the Homeland Production Security Act.","link","https://taylor.house.gov/media/press-releases/congressmen-scott-taylor-and-luis-correa-introduce-homeland-production-security","taylor.house.gov",18,11,4,1,1,1,0,0
"RepScottTaylor","1831393353804848_1906333289644187","Congressman Scott Taylor","2017-04-05","2017-04-05 20:23:35","We are expecting severe weather. Please see the link below to prepare. If my office can be of assistance in any way please call us (757)364-7650.","link","http://www.vaemergency.gov/severe-weather-expected-prepare-now/","vaemergency.gov",4,2,4,0,0,0,0,0
"RepScottTaylor","1831393353804848_1906494939628022","Congressman Scott Taylor","2017-04-06","2017-04-06 02:22:24",NA,"link","https://taylor.house.gov/media/press-releases/congressman-scott-taylor-statement-un-ambassador-nikki-haley-and-president","taylor.house.gov",7,6,0,0,0,0,0,0
"RepScottTaylor","1831393353804848_1907039082906941","Congressman Scott Taylor","2017-04-06","2017-04-06 20:07:39","Congressman Scott Taylor Submits Appropriations Language Directing VA to Further Protect Veterans’ Personal Data","link","https://taylor.house.gov/media/press-releases/congressman-scott-taylor-submits-appropriations-language-directing-va-further","taylor.house.gov",8,5,2,0,1,0,0,0
"RepScottTaylor","1831393353804848_1907538932856956","Congressman Scott Taylor","2017-04-07","2017-04-07 16:21:23","Congressman Taylor Statement on Syrian Airstrikes:","link","https://taylor.house.gov/media/press-releases/congressman-taylor-statement-syrian-airstrikes","taylor.house.gov",20,20,1,0,0,0,4,0
"RepScottTaylor","1831393353804848_1910193339258182","Congressman Scott Taylor","2017-04-11","2017-04-11 19:30:08","Our office was proud to meet with great Americans at the Veterans of Foreign Wars of the United States Post 392. Honored to be part of this post!","photo","https://www.facebook.com/RepScottTaylor/photos/a.1893999430877573.1073741828.1831393353804848/1910193339258182/?type=3",NA,3,2,0,0,0,0,0,0
"RepScottTaylor","1831393353804848_1910214929256023","Congressman Scott Taylor","2017-04-11","2017-04-11 20:31:43","Team Taylor was on hand to see the groundbreaking for the new NASA - National Aeronautics and Space Administration lab in Hampton, Virginia.","photo","https://www.facebook.com/RepScottTaylor/photos/a.1900943126849870.1073741829.1831393353804848/1910214809256035/?type=3",NA,8,3,0,0,0,0,0,0
"RepScottTaylor","1831393353804848_1912184649059051","Congressman Scott Taylor","2017-04-14","2017-04-14 18:57:19","Please pray for sound decisions by our leaders, for Christians targeted around the world simply for their faith, and for those who remain in harms way for us. #GoodFriday","photo","https://www.facebook.com/RepScottTaylor/photos/a.1893999430877573.1073741828.1831393353804848/1912184649059051/?type=3",NA,3,9,1,0,0,0,0,0
"RepScottTaylor","1831393353804848_1913157548961761","Congressman Scott Taylor","2017-04-16","2017-04-16 13:56:11","Happy Easter everyone!","status",NA,NA,20,6,1,0,0,0,0,0
"RepScottTaylor","1831393353804848_1913929388884577","Congressman Scott Taylor","2017-04-17","2017-04-17 18:19:33","We are honored! Thank you for being a part of the team. We will continue to kick butt for the 2nd district, Virginia, and America!","link","http://www.rollcall.com/news/rising-stars-2017-members-of-congress","rollcall.com",20,13,5,0,4,0,0,3
"RepScottTaylor","1831393353804848_1914501745494008","Congressman Scott Taylor","2017-04-18","2017-04-18 19:21:18","Congressional Art Competition submissions are due this Friday.","link","https://taylor.house.gov/services/art-competition","taylor.house.gov",2,4,2,0,0,0,0,0
"RepScottTaylor","1831393353804848_1914619092148940","Congressman Scott Taylor","2017-04-19","2017-04-19 02:04:38","Team Taylor visited an innovative company in the district today. Their technology shoots a tracking device into a car running from law enforcement. Starchase, LLC","video","https://www.facebook.com/RepScottTaylor/videos/1914618708815645/",NA,9,6,3,2,0,0,0,2
"RepScottTaylor","1831393353804848_1915030802107769","Congressman Scott Taylor","2017-04-19","2017-04-19 18:45:22","Some great meetings in the district today!","photo","https://www.facebook.com/RepScottTaylor/photos/a.1900943126849870.1073741829.1831393353804848/1915029195441263/?type=3",NA,14,3,0,0,0,0,0,0
"RepScottTaylor","1831393353804848_1915161575428025","Congressman Scott Taylor","2017-04-20","2017-04-20 01:33:29","Congressman Taylor on Fox Business with Neil Cavuto earlier today, talking tax reform.","video","https://www.facebook.com/RepScottTaylor/videos/1915161575428025/",NA,6,13,5,0,2,0,0,6
"RepScottTaylor","1831393353804848_1915481292062720","Congressman Scott Taylor","2017-04-20","2017-04-20 13:49:19","Excellent group on the Eastern Shore this morning!  Eastern Shore Christian Businessmen's association.","photo","https://www.facebook.com/RepScottTaylor/photos/a.1900943126849870.1073741829.1831393353804848/1915481258729390/?type=3",NA,6,0,1,0,0,0,0,0
"RepScottTaylor","1831393353804848_1915645788712937","Congressman Scott Taylor","2017-04-20","2017-04-20 20:01:09","Had a very productive day on the Eastern Shore today.","photo","https://www.facebook.com/RepScottTaylor/photos/a.1900943126849870.1073741829.1831393353804848/1915645018713014/?type=3",NA,11,6,0,0,0,0,0,0
"RepScottTaylor","1831393353804848_1916201351990714","Congressman Scott Taylor","2017-04-21","2017-04-21 21:59:49","A great luncheon today with our Congressional delegation hosted by the Navy League.","photo","https://www.facebook.com/RepScottTaylor/photos/a.1893999430877573.1073741828.1831393353804848/1916201351990714/?type=3",NA,9,3,0,0,0,0,0,0
"RepScottTaylor","1831393353804848_1916623305281852","Congressman Scott Taylor","2017-04-22","2017-04-22 18:10:30","We had a great time again this year at Taste of India Hampton Roads (ToI-HR)  Old Dominion University.  Shukriya!","video","https://www.facebook.com/RepScottTaylor/videos/1916622065281976/",NA,5,2,0,1,0,0,0,0
"RepScottTaylor","1831393353804848_1916766468600869","Congressman Scott Taylor","2017-04-23","2017-04-23 01:19:04","Proud to speak on leadership, teamwork, and perseverance to the Independence Youth Leadership Conference in #Williamsburg tonight. Great questions!!","photo","https://www.facebook.com/RepScottTaylor/photos/a.1900943126849870.1073741829.1831393353804848/1916766428600873/?type=3",NA,13,5,1,0,0,0,0,0
"RepScottTaylor","1831393353804848_1917702448507271","Congressman Scott Taylor","2017-04-24","2017-04-24 18:31:30","Had an excellent time at William & Mary, lunch with President Reveley, grounds tour, and visit to the new science lab.","photo","https://www.facebook.com/RepScottTaylor/photos/a.1900943126849870.1073741829.1831393353804848/1917700525174130/?type=3",NA,18,3,1,0,0,0,0,2
"RepScottTaylor","1831393353804848_1917733961837453","Congressman Scott Taylor","2017-04-24","2017-04-24 20:14:50","Congressman Taylor had a wonderful and productive day on the Eastern Shore recently! ""To he whom much is given, much is required.""","link","http://www.delmarvanow.com/story/news/2017/04/24/scott-taylor-speaks-prayer-breakfast/100685030/","delmarvanow.com",7,5,1,0,0,0,0,0
"RepScottTaylor","1831393353804848_1918011755143007","Congressman Scott Taylor","2017-04-25","2017-04-25 11:32:49",NA,"photo","https://www.facebook.com/VersAbility1/photos/a.466569394622.251531.152335999622/10155319632749623/?type=3",NA,5,0,0,0,0,0,0,0
"RepScottTaylor","1831393353804848_1918240188453497","Congressman Scott Taylor","2017-04-25","2017-04-25 20:38:29","Congressman Scott Taylor Statement on FY17 Appropriations","link","https://taylor.house.gov/media/press-releases/congressman-scott-taylor-statement-fy17-appropriations","taylor.house.gov",13,7,2,0,0,0,0,0
"RepScottTaylor","1831393353804848_1918552635088919","Congressman Scott Taylor","2017-04-26","2017-04-26 12:57:30","My staff and I were happy to join VersAbility Resources in Hampton, Virginia to hear about their support of people with disabilities in employment, community living, early childhood programs and day support.","photo","https://www.facebook.com/RepScottTaylor/photos/a.1900943126849870.1073741829.1831393353804848/1918552548422261/?type=3",NA,18,5,3,0,0,0,0,0
