"screen_name","id","from_name","date","datetime","message","type","link","domain","likes_count","comments_count","shares_count","love_count","haha_count","wow_count","sad_count","angry_count"
"reptomrice","403403083083104_1437201476369921","Congressman Tom Rice","2017-07-17","2017-07-17 17:48:42","Need help breaking down bureaucratic walls within the Social Security Administration, VA, IRS, or another federal agency? My staff is here to help!","link","https://rice.house.gov/media-center/press-releases/rep-rice-announces-july-mobile-office-hours","rice.house.gov",26,16,2,1,0,0,0,0
"reptomrice","403403083083104_1437321549691247","Congressman Tom Rice","2017-07-17","2017-07-17 20:57:53","There’s been a lot of misleading information out there on Medicaid reform and health care, but the truth is, Medicaid is in desperate need of reform. Right now, the neediest Medicaid recipients in the poorest states are being penalized because the wealthier states have been able to receive the lion’s share of federal Medicaid funds.   As this article states, eligibility for Medicaid has been loosened, resulting in enormous disparities. For example, in 2015, Connecticut received $12,240 in federal Medicaid funds per resident under the poverty line, while Alabama was able to claim only $4,070.  The way the federal funding is administered now means Medicaid residents in states like South Carolina are at a disadvantage just because of where they live. We need to get to a place of equity so that Medicaid can be fairly administered and restored to its original intent: helping the poorest, most needy among us.","link","http://www.politico.com/agenda/story/2017/07/14/medicaid-inequality-fix-000474","politico.com",47,59,16,0,1,4,1,13
"reptomrice","403403083083104_1438390392917696","Congressman Tom Rice","2017-07-18","2017-07-18 22:08:24","Many commented on the article I posted yesterday about the need to reform Medicaid, saying the only reason it is broken is because South Carolina didn’t expand Medicaid under Obamacare. The expansion of Medicaid under Obamacare just increased the number of people covered; it had nothing to do with per capita federal spending caps.   The way the federal Medicaid funding works now is for every dollar a state puts in, the federal government contributes $1-$3. Wealthier states are able to front more money, therefore, (despite the funding formula) get more federal dollars and states like South Carolina are left at a disadvantage. As seen below in Medicaid spending per full-benefit enrollee, our state is dead last at 50th.","link","http://www.kff.org/medicaid/state-indicator/medicaid-spending-per-full-benefit-enrollee/?currentTimeframe=0&selectedRows=%7B%22states%22%3A%7B%22all%22%3A%7B%7D%7D%2C%22wrapups%22%3A%7B%22united-states%22%3A%7B%7D%7D%7D&sortModel=%7B%22colId%22%3A%22Total%22%2C%22sort%22%3A%22desc%22%7D","kff.org",42,45,12,1,0,0,2,1
"reptomrice","403403083083104_1438978966192172","Congressman Tom Rice","2017-07-19","2017-07-19 13:38:47","The House has already passed a bill to repeal and replace Obamacare. It's time for the Senate to get the job done and get us out from under this failing law.","video","https://www.facebook.com/reptomrice/videos/1438978966192172/",NA,159,80,11,10,1,0,1,36
"reptomrice","403403083083104_1440434099379992","Congressman Tom Rice","2017-07-21","2017-07-21 02:25:53","There is nothing more fundamental to our process of self government than the right to vote.   The voting process must be protected if the will of the people is to be carried out.  I think President Trump is exactly right to confirm that only legal American citizens are allowed to vote!","link","http://bit.ly/2vod7jv","bit.ly",157,80,22,10,1,1,0,14
"reptomrice","403403083083104_1440895579333844","Congressman Tom Rice","2017-07-21","2017-07-21 14:25:38","The Charleston Harbor supports 1 in 11 jobs in South Carolina and serves the entire Southeast. Deepening it will only make it more successful.","link","http://bit.ly/2vrhydb","bit.ly",41,8,4,0,0,0,0,0
"reptomrice","403403083083104_1443276552429080","Congressman Tom Rice","2017-07-23","2017-07-23 20:54:55","We are only holding ourselves back with over regulation. I'm proud of President Trump for working to cut back on regulations to make our country more competitive.","link","http://www.washingtonexaminer.com/trump-kills-16-regulations-for-every-new-one-crushing-2-for-1-goal/article/2629177","washingtonexaminer.com",45,28,0,11,0,1,1,15
"reptomrice","403403083083104_1445178645572204","Congressman Tom Rice","2017-07-25","2017-07-25 20:14:27","Wise words from an American hero...","video","https://www.facebook.com/reptomrice/videos/1445178645572204/",NA,140,79,28,7,3,0,2,15
"reptomrice","403403083083104_1445806992176036","Congressman Tom Rice","2017-07-26","2017-07-26 13:29:30","Having trouble with a federal issue but can't make it to one of my district offices? My staff can help you break down bureaucratic walls within the VA, Social Security, Medicare/Medicaid, the IRS and more this week at mobile office hours.My staff will be around the 7th District this week to help you, see below or here for more information: http://bit.ly/2t8xlwh.   We are also planning several Coffee with Your Congressman events for August where you can meet with me to discuss important issues and current events. We are working on the dates and times but I will announce them here and on my website as soon as they are finalized!","video","https://www.facebook.com/reptomrice/videos/1445806992176036/",NA,34,14,10,1,0,0,0,0
"reptomrice","403403083083104_1445901138833288","Congressman Tom Rice","2017-07-26","2017-07-26 15:35:45","A sick baby boy, desperate loving parents who wanted to try to give him hope, and an enormous government bureaucracy that decided that death is in the child's best interest.  Charlie Gard's case is a gut wrenching, cautionary tale on one of the many costs of socialized medicine.","link","http://www.telegraph.co.uk/news/2017/07/24/charlie-gard-mothers-full-statement-sorry-couldnt-save/","telegraph.co.uk",58,72,31,1,0,1,45,21
"reptomrice","403403083083104_1446817322075003","Congressman Tom Rice","2017-07-27","2017-07-27 15:06:37","The Russian investigation has been going on for months now with no evidence of illegal actions or activities from President Trump. I believe people back home are rightly concerned with more important issues like jobs, health care, and growing the economy and less concerned about the politics. I will continue to work with the administration to advance that agenda-- I believe that's why you all sent me here!","video","https://www.facebook.com/reptomrice/videos/1446817322075003/",NA,94,80,8,7,0,0,0,17
"reptomrice","403403083083104_1447113232045412","Congressman Tom Rice","2017-08-01","2017-08-01 16:30:00","I'm hosting Coffee with Your Congressman events in August so we can discuss legislation and current events that matter to you. Hope you can join me! http://bit.ly/2uGWQGl","photo","https://www.facebook.com/reptomrice/photos/a.403408313082581.96379.403403083083104/1447113232045412/?type=3",NA,21,6,7,1,0,0,0,0
"reptomrice","403403083083104_1447119305378138","Congressman Tom Rice","2017-07-30","2017-07-30 14:00:00","Despite what you may have heard, the House of Representatives is getting things done this Congress. We've sent 250 bills to the Senate so far this year and will continue working with them and President Trump to move our country forward.","link","http://www.nationalreview.com/article/449780/house-accomplishments-its-done-more-you-think-year","nationalreview.com",19,42,5,1,7,0,1,11
"reptomrice","403403083083104_1447130182043717","Congressman Tom Rice","2017-07-28","2017-07-28 12:00:00","Hope you can join me for a cup of coffee and conversation!","link","https://rice.house.gov/media-center/press-releases/rice-announces-august-coffee-with-your-congressman-events","rice.house.gov",45,15,19,2,0,0,0,0
"reptomrice","403403083083104_1447846058638796","Congressman Tom Rice","2017-08-03","2017-08-03 15:00:00","I'll be on WRNN Hot Talk Morning Show with Dave & Liz for a Radio Town Hall Tuesday, August 22 from 8:30 a.m. until 9:30 a.m. This will be a live event where we take questions from callers as well as those submitted beforehand. If you would like to submit a question before the show, email info@wrnn.net with your question and a note stating that it is for Congressman Rice's Radio Town Hall. Or, if you would like to ask a question on air, call (843) 839-9950 during the event. Hope you can tune in!","photo","https://www.facebook.com/reptomrice/photos/a.403408313082581.96379.403403083083104/1447846058638796/?type=3",NA,12,2,10,2,0,0,0,0
"reptomrice","403403083083104_1453972928026109","Congressman Tom Rice","2017-08-04","2017-08-04 12:16:17","We are blessed to work for the best boss with the biggest heart. From your staff, Happy Birthday Congressman Rice!!","photo","https://www.facebook.com/reptomrice/photos/a.561911750565569.1073741836.403403083083104/1453972914692777/?type=3",NA,47,8,2,1,0,0,0,0
"reptomrice","403403083083104_1456771427746259","Congressman Tom Rice","2017-08-07","2017-08-07 13:48:10","The House of Representatives has been getting things done this year, including passing major bills from health care reform to cutting harmful regulations.","link","http://dailysignal.com/2017/08/02/5-ways-house-working-improve-americans-lives/","dailysignal.com",25,37,5,1,9,0,0,4
"reptomrice","403403083083104_1458013190955416","Congressman Tom Rice","2017-08-08","2017-08-08 19:50:43","If we truly want to grow the middle class, if we want to give them a raise, if we want to reduce income inequality, we must make our tax code competitive in the world. That has got to be our number one goal.","video","https://www.facebook.com/HouseRepublicans/videos/10155219313328891/",NA,88,46,0,3,2,1,0,0
"reptomrice","403403083083104_1458873610869374","Congressman Tom Rice","2017-08-09","2017-08-09 20:33:55","My staff can help you break down bureaucratic walls at federal agencies. They will be around the Grand Strand and Pee Dee to help resolve issues you may be having with the VA, IRS, Social Security Administration or another federal agency.","link","http://bit.ly/2vne4J3","bit.ly",27,12,6,2,2,0,0,0
"reptomrice","403403083083104_1460348964055172","Congressman Tom Rice","2017-08-11","2017-08-11 15:11:17","I hope you can join me for a cup of coffee and conversation! Details:","link","https://rice.house.gov/media-center/press-releases/rice-announces-august-coffee-with-your-congressman-events","rice.house.gov",7,1,4,0,0,0,0,0
"reptomrice","403403083083104_1461265563963512","Congressman Tom Rice","2017-08-12","2017-08-12 16:35:26","I'll be sitting down with WMBF News on Tuesday, August 22 for a Facebook Live interview. See below for more info!","photo","https://www.facebook.com/reptomrice/photos/a.561911750565569.1073741836.403403083083104/1461265553963513/?type=3",NA,9,3,2,0,0,0,0,0
"reptomrice","403403083083104_1461593110597424","Congressman Tom Rice","2017-08-13","2017-08-13 01:41:20","White supremacists, racists, anti-Semitics, or domestic terrorists. Call them what they are. I also call them cowards. Cowards that try to hide behind the right to peacefully protest, but fail. We must remember that no race is greater than another. Any groups who incite hate and violence do not have a place in our country. At a time when our nation seems so divided, we must remember that what unites us is far greater than what divides us.","status",NA,NA,524,122,83,30,2,0,14,8
"reptomrice","403403083083104_1464036160353119","Congressman Tom Rice","2017-08-15","2017-08-15 19:44:46","Scandal after scandal after scandal has emerged from the IRS over the past few years. It seems to me the agency has completely undermined its own credibility, and worse, no one is being held accountable. American taxpayers need to know that the IRS is competent, honest, and ethical, but right now we don't have those assurances. To restore the American people's trust in this agency we need new leadership at the helm.","link","http://dailysignal.com/2017/08/14/another-irs-scandal-rehiring-employees-ousted-for-falsifying-documents-avoiding-taxes/?utm_source=twitter&utm_medium=social&utm_campaign=tds-tw","dailysignal.com",46,55,35,0,1,3,6,56
"reptomrice","403403083083104_1464889626934439","Congressman Tom Rice","2017-08-16","2017-08-16 19:07:59","If you suffered damages from Hurricane Matthew, you are now eligible to apply for disaster recovery funds through the South Carolina Disaster Recovery Office to help rebuild. An intake office has been set up at 1404 N. Main St. in Marion where applications will be accepted until November 10. To schedule an in-person appointment, call 844-410-8560 or see below, where you can find more information and also apply online. If you have any questions that aren’t addressed on the website, email ContactSCDR@scdr.sc.gov for assistance.","link","http://scstormrecovery.com/how-to-apply-matthew/","scstormrecovery.com",19,14,30,1,0,0,0,0
"reptomrice","403403083083104_1465780440178691","Congressman Tom Rice","2017-08-17","2017-08-17 20:02:39","Today I had a special visit to Cummins Inc in South Carolina with my incredible wife, Wrenzie. We got a tour of their facility and participated in a panel about the importance of women in STEM and manufacturing. While I participated as a member of Congress, Wrenzie participated as a woman in the STEM field. She graduated from Clemson with a degree in Engineering and Industrial Management and is a former Mechanical Engineer for Cummins. American competitiveness is my number one goal, and one way to achieve this goal is through focus in STEM fields and manufacturing. People like my wife, the employees at Cummins, and women in these fields all across the country are leading the way and are essential to making our country competitive in the world!","photo","https://www.facebook.com/reptomrice/photos/a.403408313082581.96379.403403083083104/1465778693512199/?type=3",NA,62,6,3,3,0,0,0,0
"reptomrice","403403083083104_1466490483441020","Congressman Tom Rice","2017-08-18","2017-08-18 16:35:12","Hope you can join me on air next week!","photo","https://www.facebook.com/reptomrice/photos/a.403408313082581.96379.403403083083104/1447846058638796/?type=3",NA,8,2,0,0,0,0,0,0
"reptomrice","403403083083104_1467405500016185","Congressman Tom Rice","2017-08-19","2017-08-19 19:12:32","I can't do my job unless I hear from you! Tune into WMBF News on Tuesday to get your questions answered and your opinions heard!","link","http://m.wmbfnews.com/wmbfnews/db_330822/contentdetail.htm?contentguid=D5zmUd4A","m.wmbfnews.com",49,44,7,0,0,0,0,2
"reptomrice","403403083083104_1468181306605271","Congressman Tom Rice","2017-08-20","2017-08-20 19:30:00","Did you see this week's newsletter? Lots of important information including where to meet me for coffee this week and safety information for tomorrow's solar eclipse!","link","https://tomriceforms.house.gov/news/email/show.aspx?ID=Y53BVMP6YU3SPYCMW5MKCIXO44","tomriceforms.house.gov",16,18,3,0,1,0,0,0
"reptomrice","403403083083104_1469000836523318","Congressman Tom Rice","2017-08-21","2017-08-21 16:30:16","Today is the day! Please see below for important information including travel info and how to safely view the eclipse.","photo","https://www.facebook.com/SCEMD/photos/a.10150115493369564.293362.238234279563/10155499143604564/?type=3",NA,5,0,0,0,0,0,0,0
"reptomrice","403403083083104_1469132399843495","Congressman Tom Rice","2017-08-21","2017-08-21 20:01:33","It was a wonderful afternoon seeing the solar eclipse with my beautiful wife, Wrenzie, from Front Street in Georgetown! Where did you watch?","photo","https://www.facebook.com/reptomrice/photos/a.561911750565569.1073741836.403403083083104/1469132376510164/?type=3",NA,80,14,6,6,0,0,0,0
"reptomrice","403403083083104_1469789219777813","Congressman Tom Rice","2017-08-22","2017-08-22 16:01:41","I'm live at WMBF News right now! Watch below or head over to their Facebook page to get all your questions answered!","video","https://www.facebook.com/wmbfnews/videos/10154753912901720/",NA,18,4,0,1,0,0,0,0
"reptomrice","403403083083104_1470073763082692","Congressman Tom Rice","2017-08-22","2017-08-22 23:49:15","After doing 3 Coffee with Your Congressman events in Myrtle Beach, Georgetown, and Nichols, a radio town hall on WRNN, and a Facebook Live with WMBF News, we've covered just about every topic from healthcare to infrastructure to offshore drilling to monuments and everything in between.   Sometimes we agreed and other times we didn't. Regardless, I truly enjoyed meeting and hearing from everyone despite our differences in viewpoints.   One thing I have to say after today's events is that I believe that our country is divinely inspired. You may not agree, but I firmly believe that.   Although our Founding Fathers were flawed, just as we all are, they created a country based on the premise that all men are created equal. To believe that one group or person is greater than another is abhorrent to the founding principles of this country.  This country is based on that principle and rooted in compromise. Because of these things, our country is now the greatest, most prosperous nation in the history of the world. Regardless of our differences everyone I heard from pretty much agreed on one thing: we have got to get back to putting country over party in order to get things done.   Friends, I'm working hard on the federal level and the local level to uplift everyone in the Grand Strand and the Pee Dee and promise I will continue to do so.   Thanks to all who took the time to voice their concerns and meet with me. It's an honor to serve you.","photo","https://www.facebook.com/reptomrice/photos/a.561911750565569.1073741836.403403083083104/1470072239749511/?type=3",NA,37,10,2,0,0,0,0,1
"reptomrice","403403083083104_1470991502990918","Congressman Tom Rice","2017-08-24","2017-08-24 03:35:14","Addiction affects everyone regardless of race, status, income, or religion. It truly knows no bounds and is devastating our communities. We've passed bills in Congress to provide funding and streamline programs to help combat addiction, but I believe the real work comes from within our communities.   I hosted an Anti-Drug Task Force Summit today where local leaders from law enforcement, the health care industry, treatment centers, and recovering addicts from around the Grand Strand and Pee Dee came together to share solutions to fighting addiction. Everyone has seen the effects of addiction and by working together we can help addicts recover and truly save lives.","photo","https://www.facebook.com/reptomrice/photos/a.561911750565569.1073741836.403403083083104/1470991489657586/?type=3",NA,25,8,3,4,0,0,0,0
"reptomrice","403403083083104_1472185476204854","Congressman Tom Rice","2017-08-26","2017-08-26 15:00:00","In addition to my coffee events this week, I also joined Hot Talk Morning Show with Dave & Liz on WRNN to take questions and talk current events with my friend and colleague Representative Mark Walker from the 6th District of North Carolina. We had a great discussion on current events and upcoming legislation in Congress. If you missed it give it a listen below!","link","https://www.dropbox.com/s/abru2hdyr1s5gi5/WRNN%20Interview%208.22.17.mp3?dl=0","dropbox.com",11,4,2,0,0,0,0,0
"reptomrice","403403083083104_1472203346203067","Congressman Tom Rice","2017-08-28","2017-08-28 14:00:00","If you need help breaking down walls at bureaucratic federal agencies, visit my staff this week at mobile office hours around the Grand Strand and Pee Dee!","link","https://rice.house.gov/media-center/press-releases/rep-rice-announces-august-mobile-office-hours","rice.house.gov",1,1,0,0,0,0,0,0
"reptomrice","403403083083104_1472214929535242","Congressman Tom Rice","2017-08-25","2017-08-25 15:36:20","This week we did another one of our regular tours throughout the district. We held 4 in-person Coffee with Your Congressman events, a live radio town hall with WRNN, a Facebook live town hall with WMBF News, an Anti-Drug Task Force Summit to bring local leaders together to combat addiction, individual meetings with constituents, and I joined the South Carolina Chamber of a Commerce to participate in their annual Washington Night. Thank you to everyone who came out to meet me and discuss current events! I can't do my job unless I hear from you and it truly is an honor to represent you in Congress!","photo","https://www.facebook.com/reptomrice/photos/a.561911750565569.1073741836.403403083083104/1472214842868584/?type=3",NA,98,15,2,0,1,0,2,5
"reptomrice","403403083083104_1472225306200871","Congressman Tom Rice","2017-08-31","2017-08-31 13:11:32","I have to recognize our law enforcement officers in the Grand Strand and the Pee Dee for their protection at all of our events during the district work week (and every other day)! Thank you for keeping us safe!!!","photo","https://www.facebook.com/reptomrice/photos/a.403408313082581.96379.403403083083104/1472225282867540/?type=3",NA,102,4,4,5,0,0,0,0
"reptomrice","403403083083104_1474453612644707","Congressman Tom Rice","2017-08-28","2017-08-28 12:46:59","Had a nice run on the Boulevard this morning.  We are so blessed to live in such a beautiful place!  Weather is beautiful so far....","photo","https://www.facebook.com/reptomrice/photos/a.561911750565569.1073741836.403403083083104/1474453599311375/?type=3",NA,24,5,0,1,0,0,0,0
"reptomrice","403403083083104_1474541272635941","Congressman Tom Rice","2017-08-28","2017-08-28 21:00:00","The Grand Strand and Pee Dee are no strangers to the damage caused by hurricanes. Just last year our area was devastated by Hurricane Matthew and subsequent flooding, leaving entire towns like Nichols underwater. Now, millions in Texas are in the same position due to Hurricane Harvey. Find out how you can help here:","link","https://www.usatoday.com/story/news/nation-now/2017/08/25/heres-how-help-victims-hurricane-harvey/603879001/","usatoday.com",22,6,3,2,0,0,0,0
"reptomrice","403403083083104_1475622455861156","Congressman Tom Rice","2017-08-29","2017-08-29 21:12:40","Did you know that the first African American to serve in the United States House of Representatives was from the Grand Strand? Joseph Rainey was born into slavery in Georgetown in 1832. His father was a barber and used his earnings to buy freedom for himself and his family, including Joseph. Joseph was conscripted into the Confederate Army during the Civil War.  He was elected to Congress as a Republican in 1870 where he served until 1879. What an amazing life!    Here are a few pictures of his house and memorial in Georgetown. Our area is rich in history and I encourage you to check it out!  Or visit Joseph Rainey's Wikipedia page to learn more about him: https://en.m.wikipedia.org/wiki/Joseph_Rainey","photo","https://www.facebook.com/reptomrice/photos/a.561911750565569.1073741836.403403083083104/1475622419194493/?type=3",NA,677,74,227,37,0,15,0,1
"reptomrice","403403083083104_1477388849017850","Congressman Tom Rice","2017-09-01","2017-09-01 00:29:50","Political correctness...UGH!  I agree with this insightful commentary from George Will.  I'd like to know YOUR opinion...","video","https://www.youtube.com/embed/hiU20QjKPCo",NA,60,55,16,6,2,1,1,2
"reptomrice","403403083083104_1479055302184538","Congressman Tom Rice","2017-09-02","2017-09-02 23:21:30","President Trump is right. We have completely surrendered our competitive edge. We need tax reform so American businesses are on a level playing field.","video","https://www.facebook.com/DonaldTrump/videos/10159766235000725/",NA,102,22,0,10,2,0,0,3
"reptomrice","403403083083104_1480758482014220","Congressman Tom Rice","2017-09-04","2017-09-04 22:19:13","Wishing everyone a safe and happy Labor Day and thank you to all the hard workers who make the Grand Strand and Pee Dee such great communities!","photo","https://www.facebook.com/reptomrice/photos/a.403408313082581.96379.403403083083104/1480756935347708/?type=3",NA,38,3,0,0,0,0,0,0
"reptomrice","403403083083104_1481415988615136","Congressman Tom Rice","2017-09-05","2017-09-05 21:00:00","This week I joined Trey Paul on Carolina This Week to talk tax reform, jobs, and the opioid epidemic. Check it out below!","video","https://www.facebook.com/reptomrice/videos/1481415988615136/",NA,29,24,2,0,1,0,0,3
"reptomrice","403403083083104_1482533391836729","Congressman Tom Rice","2017-09-06","2017-09-06 20:30:43","Although Governor McMaster declared a state of emergency, how Hurricane Irma will affect South Carolina is still unknown. In preparation, everyone should have an emergency plan in place. The South Carolina Emergency Management Division has provided a hurricane guide (below) with a plethora of information to keep you and your family safe and prepared.","link","http://www.scemd.org/component/content/article/26-guides-and-brochures/142-south-carolina-hurricane-guide","scemd.org",75,11,28,1,0,0,3,1
"reptomrice","403403083083104_1483106875112714","Congressman Tom Rice","2017-09-07","2017-09-07 15:21:44","Friends,  Irma is powerful, mean, and likely headed our way.  This is no joke.  Latest observations say it could be here Monday night. Make your preparations and particularly if you're on the coast or in low lying areas, be ready to get out of the way.","link","http://www.nhc.noaa.gov/storm_graphics/AT11/refresh/AL112017_5day_cone_no_line_and_wind+png/145924_5day_cone_no_line_and_wind.png","nhc.noaa.gov",47,18,14,0,0,2,5,0
"reptomrice","403403083083104_1484076195015782","Congressman Tom Rice","2017-09-08","2017-09-08 19:58:41","While some in our communities have already rebuilt from Hurricane Matthew and flooding last October, there are still many who have yet to fully recover. See below for how to apply for disaster recovery funds.","link","http://scstormrecovery.com/how-to-apply-matthew/","scstormrecovery.com",3,0,0,0,0,0,0,0
